[{"_id":"64298058a9d504ce92eb5fa9","aid":133544557037,"date":"2023-02-27T18:22:35","author":"Simon Angelo Meier","categoryName":"International","premium":false,"readingTime":180.0,"wordCount":552.0,"url":"https:\/\/www.tagesanzeiger.ch\/russisches-aufklaerungsflugzeug-von-belarussischer-opposition-zerstoert-133544557037","own":"Drohnenangriff in Belarus. Russisches Aufkl\u00e4rungsflugzeug von weissrussischer Opposition zerst\u00f6rt. In Belarus kommt es seit Beginn des Ukraine-Krieges immer wieder zu Sabotage-Akten gegen das russische Milit\u00e4r. Zum j\u00fcngsten Angriff auf ein Flugzeug des Typs Berijew A-50 hat sich die regierungskritische weissrussische Organisation Bypol bekannt. Am Sonntag ist auf einem weissrussischen Armeeflugplatz ein russisches Aufkl\u00e4rungsflugzeug zerst\u00f6rt worden. Die regierungskritische weissrussische Organisation Bypol hat sich zum Angriff bekannt. Das Flugzeug sei seit dem 3. Ein milit\u00e4rstrategisch wichtiges Werkzeug: Ein russisches Aufkl\u00e4rungsflugzeug vom Typ Berijew A-50 w\u00e4hrend einer Flugshow. Ausgangspunkt f\u00fcr russische Eins\u00e4tze in der Ukraine: Satellitenaufnahme des weissrussischen Luftwaffenst\u00fctzpunktes Machulischchi, von dem aus das russische Milit\u00e4r mit seinem Aufkl\u00e4rungsflugzeug Berijew A-50 Erkundungsfl\u00fcge unternahm. Belarus immer wieder Ausgangspunkt f\u00fcr russische Luftwaffeneins\u00e4tze in der Ukraine. ","lexrank_sumy":"In Belarus kommt es seit Beginn des Ukraine-Krieges immer wieder zu Sabotage-Akten gegen das russische Milit\u00e4r. Am Sonntag ist auf einem weissrussischen Armeeflugplatz ein russisches Aufkl\u00e4rungsflugzeug zerst\u00f6rt worden. Obwohl das weissrussische Verteidigungsministerium den Vorfall bis jetzt kommentiert hat, gehen internationale Medien wie die BBC davon aus, dass die Milit\u00e4roperation stattgefunden hat. Der Drohnenangriff der Antiregierungsorganisation Bypol auf ein russisches Aufkl\u00e4rungsflugzeug fand auf dem Luftwaffenst\u00fctzpunkt Machulischchi ausserhalb der weissrussischen Hauptstadt Minsk statt. Das \u00abHajun Project\u00bb analysiert die Bewegungen von russischen Waffen und Einheiten in Belarus seit dem Beginn des Ukraine-Kriegs vor einem Jahr. Franak Viacorka, ein Berater der im Exil lebenden Oppositionsf\u00fchrerin Tichanowskaja, sagte gegen\u00fcber der BBC, die Angreifer seien beim Anschlag von Einheimischen und von dissidenten Milit\u00e4rs unterst\u00fctzt worden. Der Milit\u00e4rflugplatz Machulischchi, der rund zw\u00f6lf Kilometer von der weissrussischen Hauptstadt Minsk entfernt liegt, werde aktiv von der russischen Armee f\u00fcr Luftangriffe auf die Ukraine genutzt. Ausgangspunkt f\u00fcr russische Eins\u00e4tze in der Ukraine: Satellitenaufnahme des weissrussischen Luftwaffenst\u00fctzpunktes Machulischchi, von dem aus das russische Milit\u00e4r mit seinem Aufkl\u00e4rungsflugzeug Berijew A-50 Erkundungsfl\u00fcge unternahm. Belarus immer wieder Ausgangspunkt f\u00fcr russische Luftwaffeneins\u00e4tze in der Ukraine. Zudem wird dies getan, um die Beteiligung des Lukaschenko-Regimes am Krieg gegen die Ukraine zu rechtfertigen.\u00bb Seit Beginn des Krieges gab es in Weissrussland mindestens 80 Sabotageakte gegen das russische Milit\u00e4r, die sich gegen die Eisenbahn als wichtige Nachschublinie f\u00fcr die russischen Truppen richteten. ","text_api_simple_words_07_512":"Eine regierungskritische Organisation in Belarus namens Bypol hat zugegeben, ein russisches Aufkl\u00e4rungsflugzeug vom Typ Berijew A-50 auf einem weissrussischen Armeeflugplatz zerst\u00f6rt zu haben. Die Organisation besteht aus ehemaligen Sicherheitskr\u00e4ften, die Oppositionsf\u00fchrerin Swetlana Tichanowskaja als rechtm\u00e4ssige Pr\u00e4sidentin von Weissrussland ansehen. Das Flugzeug war seit Anfang Januar in Weissrussland stationiert und hatte 12 Aufkl\u00e4rungsfl\u00fcge in 54 Tagen durchgef\u00fchrt. Der Angriff hat den vorderen und mittleren Teil des Flugzeugs sowie seine Radaranlage zerst\u00f6rt. Die russische Armee nutzt den weissrussischen Milit\u00e4rflugplatz Machulischchi f\u00fcr Luftangriffe auf die Ukraine. Belarus ist ein enger Verb\u00fcndeter Russlands und hat russischen Truppen erlaubt, weissrussisches Territorium als Ausgangspunkt f\u00fcr Eins\u00e4tze in der Ukraine zu nutzen. Seit Beginn des Ukraine-Kriegs gab es in Weissrussland mindestens 80 Sabotageakte gegen das russische Milit\u00e4r.","text_api_normal_words_05_512":"Eine regierungskritische wei\u00dfrussische Organisation namens Bypol hat sich zu einem Drohnenangriff auf ein russisches Aufkl\u00e4rungsflugzeug vom Typ Berijew A-50 auf einem wei\u00dfrussischen Armeeflugplatz bekannt. Das Flugzeug wurde zerst\u00f6rt und die Radaranlage sowie der vordere und mittlere Teil des Flugzeugs wurden besch\u00e4digt. Das Flugzeug war seit dem 3. Januar in Wei\u00dfrussland stationiert und hatte zw\u00f6lf Aufkl\u00e4rungsfl\u00fcge in 54 Tagen durchgef\u00fchrt. Der Angriff wurde von Einheimischen und von dissidenten Milit\u00e4rs unterst\u00fctzt. Belarus ist ein enger Verb\u00fcndeter von Russland und nimmt nicht direkt an der russischen Offensive in der Ukraine teil, erlaubt jedoch den russischen Truppen, wei\u00dfrussisches Territorium als Ausgangspunkt f\u00fcr Eins\u00e4tze in der Ukraine zu nutzen.","text_api_child_09_350":"In Belarus wurde ein russisches Flugzeug von einer oppositionellen Gruppierung namens Bypol zerst\u00f6rt. Das Flugzeug war ein Fr\u00fchwarnflugzeug namens Berijew A-50 und war wichtig f\u00fcr den russischen Milit\u00e4reinsatz in der Ukraine. Der Angriff fand auf einem weissrussischen Armeeflugplatz statt und durch den Anschlag wurden der vordere und mittlere Teil des Flugzeugs sowie seine Radaranlage zerst\u00f6rt. Belarus ist ein enger Verb\u00fcndeter Russlands und erlaubt russischen Truppen, weissrussisches Territorium als Ausgangspunkt f\u00fcr Eins\u00e4tze in der Ukraine zu nutzen. Seit Beginn des Ukraine-Krieges gab es in Belarus viele Sabotageakte gegen das russische Milit\u00e4r.","text_api_keynotes_07_350":"1. Das neue Erbrecht f\u00fchrt zu einer deutlichen Zunahme an Anfragen bei Z\u00fcrcher Notariaten.\n2. Die gesetzlichen Pflichtteile wurden neu geregelt, wodurch der Pflichtteil der Nachkommen reduziert und der Pflichtteil der Eltern abgeschafft wurde.\n3. Erblasserinnen und Erblasser erhalten dadurch deutlich mehr Gestaltungsspielraum beim Verteilen ihres Nachlasses.\n4. Wer bereits ein Testament oder einen Erbvertrag hat, muss nicht zwingend handeln, sollte aber die eigene Nachlassplanung \u00fcberdenken.\n5. Es ist empfehlenswert, die Erbnachfolge zu pr\u00fcfen und gegebenenfalls eine letztwillige Verf\u00fcgung zu erstellen, um den eigenen Nachlass zu regeln.","text_davinci_api_key_07_256":"1. Drohnenangriff auf ein russisches Aufkl\u00e4rungsflugzeug des Typs Berijew A-50 durch die regierungskritische weissrussische Organisation Bypol; \n2. Weissrussland als Ausgangspunkt f\u00fcr russische Luftangriffe in der Ukraine; \n3. 80 Sabotageakte gegen das russische Milit\u00e4r seit Beginn des Ukraine-Krieges.","five_letter_word_list":["kommt","immer","gegen","bypol","einem","jetzt","gehen","davon","zeigt","durch","tyler","minsk","statt","sowie","seine","wurde","eines","liess","hajun","tagen","einer","sagte","seien","zw\u00f6lf","liegt","werde","aktiv","armee","nicht","enger","putin","nimmt","haben","seite","wirft","licht","boden","hanna","zudem","getan","krieg"],"qa_list":["Was f\u00fcr ein Flugzeug wurde bei dem Drohnenangriff in Belarus zerst\u00f6rt?","Ein russisches Kampfflugzeug","Ein Transportflugzeug","Ein russisches Aufkl\u00e4rungsflugzeug vom Typ Berijew A-50"],"lead":"In Belarus kommt es seit Beginn des Ukraine-Krieges immer wieder zu Sabotage-Akten gegen das russische Milit\u00e4r. Zum j\u00fcngsten Angriff auf ein Flugzeug des Typs Berijew A-50 hat sich\u00a0die regierungskritische weissrussische Organisation Bypol bekannt. ","originaltext":"Drohnenangriff in Belarus Russisches Aufkl\u00e4rungsflugzeug von weissrussischer Opposition zerst\u00f6rt In Belarus kommt es seit Beginn des Ukraine-Krieges immer wieder zu Sabotage-Akten gegen das russische Milit\u00e4r. Zum j\u00fcngsten Angriff auf ein Flugzeug des Typs Berijew A-50 hat sich die regierungskritische weissrussische Organisation Bypol bekannt. Am Sonntag ist auf einem weissrussischen Armeeflugplatz ein russisches Aufkl\u00e4rungsflugzeug zerst\u00f6rt worden. Die regierungskritische weissrussische Organisation Bypol hat sich zum Angriff bekannt. Bypol besteht aus ehemaligen Sicherheitskr\u00e4ften, die nach den Pr\u00e4sidentschaftswahlen 2020 Oppositionsf\u00fchrerin Swetlana Tichanowskaja als rechtm\u00e4ssige Pr\u00e4sidentin von Weissrussland ansehen. Obwohl das weissrussische Verteidigungsministerium den Vorfall bis jetzt kommentiert hat, gehen internationale Medien wie die BBC davon aus, dass die Milit\u00e4roperation stattgefunden hat. Ein Bild des auf Satellitenaufnahmen spezialisierten Unternehmens Planet Labs PBC zeigt das russische Aufkl\u00e4rungsflugzeug vor seiner Zerst\u00f6rung durch oppositionelle weissrussische Truppen, wie der US-Milit\u00e4rjournalist Tyler Rogoway berichtete. Der Drohnenangriff der Antiregierungsorganisation Bypol auf ein russisches Aufkl\u00e4rungsflugzeug fand auf dem Luftwaffenst\u00fctzpunkt Machulischchi ausserhalb der weissrussischen Hauptstadt Minsk statt. Durch den Anschlag sind der vordere und mittlere Teil des Flugzeugs sowie seine Radaranlage zerst\u00f6rt worden. Es handelt sich um ein Fr\u00fchwarnflugzeug des Typs Berijew A-50, das zu Sowjetzeiten entwickelt wurde. Es sei eines von neun Aufkl\u00e4rungsflugzeugen dieser Art in der Flotte der russischen Luftwaffe und rund 330 Millionen Dollar wert, liess das weissrussische \u00abHajun Project\u00bb verlauten. Das \u00abHajun Project\u00bb analysiert die Bewegungen von russischen Waffen und Einheiten in Belarus seit dem Beginn des Ukraine-Kriegs vor einem Jahr. Das Flugzeug sei seit dem 3. Januar in Weissrussland stationiert gewesen und habe 12 Aufkl\u00e4rungsfl\u00fcge in 54 Tagen get\u00e4tigt.  Ein milit\u00e4rstrategisch wichtiges Werkzeug: Ein russisches Aufkl\u00e4rungsflugzeug vom Typ Berijew A-50 w\u00e4hrend einer Flugshow. Franak Viacorka, ein Berater der im Exil lebenden Oppositionsf\u00fchrerin Tichanowskaja, sagte gegen\u00fcber der BBC, die Angreifer seien beim Anschlag von Einheimischen und von dissidenten Milit\u00e4rs unterst\u00fctzt worden. Der Milit\u00e4rflugplatz Machulischchi, der rund zw\u00f6lf Kilometer von der weissrussischen Hauptstadt Minsk entfernt liegt, werde aktiv von der russischen Armee f\u00fcr Luftangriffe auf die Ukraine genutzt. Die Zerst\u00f6rung des Flugzeuges konnte bis jetzt nicht von unabh\u00e4ngigen Quellen best\u00e4tigt werden. Ausgangspunkt f\u00fcr russische Eins\u00e4tze in der Ukraine: Satellitenaufnahme des weissrussischen Luftwaffenst\u00fctzpunktes Machulischchi, von dem aus das russische Milit\u00e4r mit seinem Aufkl\u00e4rungsflugzeug Berijew A-50 Erkundungsfl\u00fcge unternahm. Belarus immer wieder Ausgangspunkt f\u00fcr russische Luftwaffeneins\u00e4tze in der Ukraine Der weissrussische Pr\u00e4sident Alexander Lukaschenko ist ein enger Verb\u00fcndeter des russischen Staatschefs Wladimir Putin. Belarus nimmt zwar nicht direkt an der russischen Offensive in der Ukraine teil. Lukaschenko hat den russischen Truppen aber erlaubt, weissrussisches Territorium als Ausgangspunkt f\u00fcr Eins\u00e4tze in der Ukraine zu nutzen. Nach ukrainischen Angaben soll die russische Armee auch weissrussische Flugfelder genutzt haben, um von diesen aus Luftangriffe in der Ukraine zu fliegen. In der Ukraine haben zuletzt die Bef\u00fcrchtungen zugenommen, dass Belarus direkt an der Seite Russlands in den Konflikt eintreten k\u00f6nnte. Sollte die Zerst\u00f6rung des Aufkl\u00e4rungsflugzeuges durch weissrussische Oppositionelle best\u00e4tigt werden, wirft das ein schlechtes Licht auf Lukaschenkos F\u00e4higkeit, russisches Milit\u00e4rger\u00e4t auf weissrussischem Boden ausreichend zu sch\u00fctzen. Derweil haben russische Blogger den Anschlag auf das Flugzeug als ukrainische Milit\u00e4roperation beschrieben, wie \u00abNewsweek\u00bb berichtete. Die weissrussische Journalistin Hanna Liubakova sagte dazu gegen\u00fcber der Zeitung: \u00abDas ist bequemer, als zuzugeben, dass Gruppen von Weissrussen gegen die Anwesenheit russischer Truppen und Angriffe aus Belarus sind. Zudem wird dies getan, um die Beteiligung des Lukaschenko-Regimes am Krieg gegen die Ukraine zu rechtfertigen.\u00bb Seit Beginn des Krieges gab es in Weissrussland mindestens 80 Sabotageakte gegen das russische Milit\u00e4r, die sich gegen die Eisenbahn als wichtige Nachschublinie f\u00fcr die russischen Truppen richteten. ","title":"Russisches Aufkl\u00e4rungsflugzeug von weissrussischer Opposition zerst\u00f6rt ","titleheader":"Drohnenangriff in Belarus\u00a0","text_gpt4_api_keynotes_07_256":"- Drohnenangriff in Belarus: Russisches Aufkl\u00e4rungsflugzeug Berijew A-50 von wei\u00dfrussischer Oppositionsgruppe Bypol zerst\u00f6rt\n- Angriff ereignete sich auf Luftwaffenst\u00fctzpunkt Machulischchi nahe Minsk; Flugzeug f\u00fcr russische Eins\u00e4tze in der Ukraine genutzt\n- Seit Kriegsbeginn in der Ukraine mindestens 80 Sabotageakte gegen russisches Milit\u00e4r in Belarus","text_api_keynotes_07_256":"- Regierungskritische weissrussische Organisation Bypol bekennt sich zum Drohnenangriff auf russisches Aufkl\u00e4rungsflugzeug Berijew A-50 auf dem Luftwaffenst\u00fctzpunkt Machulischchi.\n- Das Flugzeug war seit dem 3. Januar in Belarus stationiert und wurde f\u00fcr Aufkl\u00e4rungsfl\u00fcge genutzt.\n- Belarus ist Ausgangspunkt f\u00fcr russische Luftwaffeneins\u00e4tze in der Ukraine, was zu Sabotageakten gegen russische Milit\u00e4rinfrastruktur in Belarus f\u00fchrt.","qa_list_gpt4":["Welche Organisation hat sich zum Drohnenangriff auf das russische Aufkl\u00e4rungsflugzeug in Belarus bekannt?\n","Die ukrainische Regierung","Die russische Luftwaffe","Die regierungskritische weissrussische Organisation Bypol"],"flesch":[25.85,27.6,25.05,28.35,39.85,39.15],"text_gpt4_api_normal_words_05_512":"In Belarus wurde ein russisches Aufkl\u00e4rungsflugzeug vom Typ Berijew A-50 durch einen Drohnenangriff zerst\u00f6rt. Die regierungskritische wei\u00dfrussische Organisation Bypol hat sich zum Angriff bekannt. Das Flugzeug war auf dem Luftwaffenst\u00fctzpunkt Machulischchi bei Minsk stationiert und wurde f\u00fcr Aufkl\u00e4rungsfl\u00fcge im Ukraine-Krieg eingesetzt. Belarus ist ein enger Verb\u00fcndeter Russlands und erlaubt russischen Truppen, ihr Territorium f\u00fcr Eins\u00e4tze in der Ukraine zu nutzen. Seit Beginn des Krieges gab es in Belarus mindestens 80 Sabotageakte gegen das russische Milit\u00e4r.","frage_antwort":[]},{"_id":"64298058a9d504ce92eb5fb9","aid":946404623667,"date":"2023-02-27T17:17:21","author":"Peter Nonnenmacher","categoryName":"International","premium":false,"readingTime":180.0,"wordCount":648.0,"url":"https:\/\/www.tagesanzeiger.ch\/endspiel-um-den-brexit-worum-geht-es-beim-nordirland-protokoll-946404623667","own":"Von der Leyen in Grossbritannien. Endspiel um den Brexit: Worum geht es beim Nordirland-Protokoll? Ein neuer Deal zwischen London und Br\u00fcssel soll Probleme beheben, die mit dem Brexit in Nordirland entstanden sind. Fragen und Antworten zum alten und zum neuen Nordirland-Protokoll. \u00abAbschliessendes\u00bb Gespr\u00e4ch zum Nordirland-Protokoll: EU-Kommissionspr\u00e4sidentin Ursula von der Leyen und der britische Premier Rishi Sunak in Windsor. Ursula von der Leyen trifft in einem Hotel in Windsor Rishi Sunak zu \u00ababschliessenden\u00bb Gespr\u00e4chen zum Nordirland-Protokoll. Drohte der Brexit diese Freiheit zu beenden? Der Brexit in seiner harten Form machte die bis dahin unsichtbare Grenze zwischen Nordirland und der irischen Republik erstmals zu einer EU-Aussengrenze. Was verf\u00fcgte das Nordirland-Protokoll von 2020? Im Nordirland-Protokoll, wie es Ex-Premier Boris Johnson mit der EU aushandelte, wurde festgelegt, dass Grenzkontrollen f\u00fcr alle Waren, die aus England, Schottland und Wales nach Nordirland flossen, bereits bei der Ankunft in Nordirland, und nicht erst an den Nahtstellen zum S\u00fcden, vorgenommen w\u00fcrden. Was h\u00e4lt man in Nordirland von dieser Praxis? Worum ging es bei den j\u00fcngsten Verhandlungen? Dar\u00fcber hinaus hat London Mitsprache des nordirischen Parlaments beim Erlass neuer EU-Bestimmungen f\u00fcr Nordirland verlangt. ","lexrank_sumy":"Von der Leyen in Grossbritannien. Ein neuer Deal zwischen London und Br\u00fcssel soll Probleme beheben, die mit dem Brexit in Nordirland entstanden sind. Der Brexit in seiner harten Form machte die bis dahin unsichtbare Grenze zwischen Nordirland und der irischen Republik erstmals zu einer EU-Aussengrenze. Was verf\u00fcgte das Nordirland-Protokoll von 2020? Im Nordirland-Protokoll, wie es Ex-Premier Boris Johnson mit der EU aushandelte, wurde festgelegt, dass Grenzkontrollen f\u00fcr alle Waren, die aus England, Schottland und Wales nach Nordirland flossen, bereits bei der Ankunft in Nordirland, und nicht erst an den Nahtstellen zum S\u00fcden, vorgenommen w\u00fcrden. Aber wie sich herausstellte, f\u00fchrte das zu einer sp\u00fcrbaren Verz\u00f6gerung im Warenverkehr und zu vereinzelten Versorgungsengp\u00e4ssen, zum Beispiel in nordirischen Superm\u00e4rkten. \u00dcber den \u00abgr\u00fcnen Kanal\u00bb sollen Waren aus dem Rest des Vereinigten K\u00f6nigreichs, die in Nordirland verbleiben sollen, fast oder ganz ohne Kontrollen in die Provinz bef\u00f6rdert werden. \u00abRote Kan\u00e4le\u00bb, die von der EU genauer inspiziert werden k\u00f6nnen, sollen dagegen f\u00fcr Waren gelten, die via Nordirland in die Republik Irland und so in die EU weiterlaufen. F\u00fcr die meisten Menschen in der Provinz war der stockende Warenverkehr das gr\u00f6sste Problem. Die DUP aber, die die Vertragsdetails jetzt im Einzelnen pr\u00fcfen will, hatte es von Anfang an auf mehr abgesehen. Mit roten und gr\u00fcnen Kan\u00e4len war es f\u00fcr sie nicht getan. Worum ging es bei den j\u00fcngsten Verhandlungen? Und was ist mit dem Europ\u00e4ischen Gerichtshof? ","text_api_simple_words_07_512":"Es geht um den Brexit in Nordirland. Vorher gab es keine Grenzkontrollen zwischen Nordirland und der Republik Irland, aber der Brexit hat das ge\u00e4ndert und es gab Probleme mit dem Warenverkehr. Ein neues Nordirland-Protokoll soll diese Probleme l\u00f6sen. Es gibt nun einen \"gr\u00fcnen Kanal\" f\u00fcr Waren aus dem Rest des Vereinigten K\u00f6nigreichs, die in Nordirland verbleiben sollen, und einen \"roten Kanal\" f\u00fcr Waren, die via Nordirland in die Republik Irland und so in die EU weiterlaufen. Die nordirische Partei der Demokratischen Unionisten (DUP) ist gegen das Protokoll und verlangte ein nordirisches Veto f\u00fcr alle Nordirland betreffenden EU-Gesetze und wollte die Zust\u00e4ndigkeit des Europ\u00e4ischen Gerichtshofs \"nirgendwo auf den Britischen Inseln\" mehr akzeptieren. Es gab Verhandlungen um Rechte und Mitsprache des nordirischen Parlaments beim Erlass neuer EU-Bestimmungen f\u00fcr Nordirland und den Europ\u00e4ischen Gerichtshof.","text_api_normal_words_05_512":"Die EU-Kommissionspr\u00e4sidentin Ursula von der Leyen und der britische Premierminister Rishi Sunak haben sich in Windsor getroffen, um das Nordirland-Protokoll zu besprechen. Das Protokoll wurde als Teil des Brexit-Abkommens vereinbart, um Probleme im Zusammenhang mit dem Brexit in Nordirland zu l\u00f6sen. Vor dem Brexit waren Grenzkontrollen zwischen Nordirland und der Republik Irland nicht erforderlich, da beide der EU angeh\u00f6rten. Das Nordirland-Protokoll von 2020 legte fest, dass Grenzkontrollen f\u00fcr alle Waren, die aus England, Schottland und Wales nach Nordirland flossen, bereits bei der Ankunft in Nordirland vorgenommen w\u00fcrden. Dies f\u00fchrte jedoch zu Verz\u00f6gerungen im Warenverkehr und vereinzelten Versorgungsengp\u00e4ssen. Eine neue Vereinbarung zwischen London und Br\u00fcssel sieht nun vor, einen \"gr\u00fcnen Kanal\" und einen separaten \"roten Kanal\" einzuf\u00fchren, \u00fcber den Waren fast oder ganz ohne Kontrollen in die Provinz bef\u00f6rdert werden k\u00f6nnen. Die DUP, Nordirlands gr\u00f6\u00dfte protestantische Partei, hatte jedoch von Anfang an mehr gefordert und verlangte ein nordirisches Veto f\u00fcr alle Nordirland betreffenden EU-Gesetze und die Ablehnung der Zust\u00e4ndigkeit des Europ\u00e4ischen Gerichtshofs.","text_api_child_09_350":"In dem Artikel geht es um den Brexit und das Nordirland-Protokoll, das verhindern soll, dass es auf der irischen Insel Grenzkontrollen geben muss. Wegen dem Brexit ist die Grenze zwischen Nordirland und der Republik Irland eine EU-Au\u00dfengrenze geworden. Das Nordirland-Protokoll, das 2020 vereinbart wurde, sollte verhindern, dass Kontrollen n\u00f6tig werden. Allerdings gab es Probleme beim Warenverkehr nach Nordirland. Deshalb wurde das Protokoll \u00fcberarbeitet und ein \"gr\u00fcner Kanal\" f\u00fcr Waren aus dem Rest des Vereinigten K\u00f6nigreichs eingef\u00fchrt, die ohne Kontrollen nach Nordirland kommen sollen. Ein \"roter Kanal\" soll f\u00fcr Waren gelten, die weiter in die EU m\u00fcssen. Das Nordirland-Parlament soll Mitsprache bei neuen EU-Bestimmungen f\u00fcr Nordirland bekommen. Die DUP hatte auf mehr gehofft und verlangte ein nordirisches Veto f\u00fcr alle Nordirland betreffenden EU-Gesetze und wollte die Zust\u00e4ndigkeit des Europ\u00e4ischen Gerichtshofs nicht mehr akzeptieren.","text_api_keynotes_07_350":"1. Ein neuer Deal zwischen London und Br\u00fcssel soll Probleme mit dem Brexit in Nordirland beheben.\n2. Das Nordirland-Protokoll von 2020 wurde \u00fcberarbeitet, um das Verh\u00e4ltnis zwischen Grossbritannien und der EU zu entkrampfen.\n3. EU-Kommissionspr\u00e4sidentin Ursula von der Leyen und der britische Premier Rishi Sunak treffen sich zu abschliessenden Gespr\u00e4chen zum Nordirland-Protokoll.\n4. Ziel des Protokolls ist es, eine Grenze zwischen Nordirland und der Republik Irland ohne Kontrollen zu erhalten, um den dauerhaften Frieden in Nordirland zu sichern.\n5. Das neue Protokoll sieht einen \"gr\u00fcnen Kanal\" f\u00fcr Waren vor, die in Nordirland verbleiben sollen, sowie \"rote Kan\u00e4le\" f\u00fcr Waren, die in die EU weiterlaufen. Viele Protestanten in Nordirland halten dies f\u00fcr eine vern\u00fcnftige L\u00f6sung, w\u00e4hrend die DUP, Nordirlands gr\u00f6sste Protestanten-Partei, mehr fordert.","text_davinci_api_key_07_256":"1. Der Brexit in Nordirland f\u00fchrte zu Problemen, die mit dem Nordirland-Protokoll gel\u00f6st werden sollen: Ein neuer Deal zwischen London und Br\u00fcssel, ein \"gr\u00fcner Kanal\" und ein \"roter\" sowie das \"Stormont Lock\". \n2. EU-Kommissionspr\u00e4sidentin Ursula von der Leyen und der britische Premier Rishi Sunak trafen sich in Windsor, um das Nordirland-Protokoll \"abschliessend\" zu verhandeln. \n3. Das Nordirland-Protokoll soll das angespannte Verh\u00e4ltnis zwischen Grossbritannien und der EU entkrampfen sowie die Freiheit ohne Grenzkontrollen auf der irischen Insel erhalten: Einfuhren in die EU ohne Kontrollen, ein nordirisches Veto f\u00fcr EU-Gesetze und der Europ\u00e4ische Gerichtshof mit eingeschr\u00e4n","five_letter_word_list":["leyen","worum","neuer","alten","neuen","rishi","sunak","einem","hotel","ber\u00e4t","warum","wurde","n\u00f6tig","insel","schuf","waren","nicht","beide","diese","dahin","einer","h\u00e4tte","blieb","boris","wales","s\u00fcden","folge","ihrer","jetzt","einen","kanal","roten","viele","hatte","getan","unter","haben","m\u00fcsse","darum","zudem","w\u00fcrde","rolle"],"qa_list":["Was ist das Nordirland-Protokoll und warum wurde es notwendig?","Das Nordirland-Protokoll ist ein Abkommen zwischen Nordirland und der Republik Irland, um eine Grenze ohne Kontrollen zu schaffen.","Das Nordirland-Protokoll ist ein Abkommen zwischen Nordirland und der EU, um eine Grenze ohne Kontrollen zu schaffen.","Das Nordirland-Protokoll ist ein Abkommen zwischen Gro\u00dfbritannien und der EU, um Probleme mit dem Brexit in Nordirland zu l\u00f6sen."],"lead":"Ein neuer Deal zwischen London und Br\u00fcssel soll Probleme beheben, die mit dem Brexit in Nordirland entstanden sind. Fragen und Antworten zum alten und zum neuen Nordirland-Protokoll.","originaltext":"Von der Leyen in Grossbritannien. Endspiel um den Brexit: Worum geht es beim Nordirland-Protokoll? Ein neuer Deal zwischen London und Br\u00fcssel soll Probleme beheben, die mit dem Brexit in Nordirland entstanden sind. Fragen und Antworten zum alten und zum neuen Nordirland-Protokoll. \u00abAbschliessendes\u00bb Gespr\u00e4ch zum Nordirland-Protokoll: EU-Kommissionspr\u00e4sidentin Ursula von der Leyen und der britische Premier Rishi Sunak in Windsor. Das 2020 als Teil des Brexit-Abkommens vereinbarte sogenannte Nordirland-Protokoll ist in wichtigen Punkten \u00fcberarbeitet worden \u2013 was den Nordiren helfen und das angespannte Verh\u00e4ltnis zwischen Grossbritannien und der EU entkrampfen soll. Ursula von der Leyen trifft in einem Hotel in Windsor Rishi Sunak zu \u00ababschliessenden\u00bb Gespr\u00e4chen zum Nordirland-Protokoll. Danach ber\u00e4t sich Sunak mit seinem Kabinett. Warum wurde ein \u00abProtokoll\u00bb \u00fcberhaupt n\u00f6tig? Weil Londons \u00abharter Brexit\u00bb, also der Ausstieg der Briten aus dem Binnenmarkt und der Zollunion Europas, eine problematische Situation auf der irischen Insel schuf. Vorher waren Grenzkontrollen zwischen Nordirland und der Republik Irland nicht erforderlich, da beide der EU angeh\u00f6rten. Und eine Grenze frei von Kontrollen wurde als Voraussetzung betrachtet f\u00fcr dauerhaften Frieden in Nordirland \u2013 ohne Wachposten, Uniformen, \u00dcberwachungskameras. Drohte der Brexit diese Freiheit zu beenden? Der Brexit in seiner harten Form machte die bis dahin unsichtbare Grenze zwischen Nordirland und der irischen Republik erstmals zu einer EU-Aussengrenze. F\u00fcr eine solche Grenze aber h\u00e4tte es Grenzkontrollen, insbesondere Importkontrollen f\u00fcr Einfuhren in die EU, gebraucht. Mit einer Sonderregelung im Brexit-Abkommen sollte das vermieden werden. W\u00e4hrend Nordirland britisches Hoheitsgebiet blieb, sollte es als einziger Teil des Vereinigten K\u00f6nigreichs zugleich weiter den Regeln des EU-Binnenmarkts folgen, sodass eine \u00abinnerirische\u00bb Grenze nicht n\u00f6tig war. Was verf\u00fcgte das Nordirland-Protokoll von 2020? Im Nordirland-Protokoll, wie es Ex-Premier Boris Johnson mit der EU aushandelte, wurde festgelegt, dass Grenzkontrollen f\u00fcr alle Waren, die aus England, Schottland und Wales nach Nordirland flossen, bereits bei der Ankunft in Nordirland, und nicht erst an den Nahtstellen zum S\u00fcden, vorgenommen w\u00fcrden. Aber wie sich herausstellte, f\u00fchrte das zu einer sp\u00fcrbaren Verz\u00f6gerung im Warenverkehr und zu vereinzelten Versorgungsengp\u00e4ssen, zum Beispiel in nordirischen Superm\u00e4rkten. Als \u00abSpaltung des UK\u00bb emp\u00f6rte das Arrangement ausserdem die Partei der Demokratischen Unionisten (DUP), Nordirlands gr\u00f6sste Protestanten-Partei. Welche Schl\u00fcsse wurden daraus gezogen? Verhandlungswillige Politiker beider Seiten fassten in der Folge \u00abpraktikablere\u00bb L\u00f6sungen ins Auge. Bereits voriges Jahr milderte die EU einige ihrer Kontrollen ab. Und jetzt stimmte sie offenbar dem britischen Vorschlag zu, einen \u00abgr\u00fcnen Kanal\u00bb und einen separaten \u00abroten\u00bb einzuf\u00fchren. \u00dcber den \u00abgr\u00fcnen Kanal\u00bb sollen Waren aus dem Rest des Vereinigten K\u00f6nigreichs, die in Nordirland verbleiben sollen, fast oder ganz ohne Kontrollen in die Provinz bef\u00f6rdert werden. \u00abRote Kan\u00e4le\u00bb, die von der EU genauer inspiziert werden k\u00f6nnen, sollen dagegen f\u00fcr Waren gelten, die via Nordirland in die Republik Irland und so in die EU weiterlaufen. Was h\u00e4lt man in Nordirland von dieser Praxis? Viele Protestanten in Nordirland halten das, wie praktisch alle Katholiken, f\u00fcr eine vern\u00fcnftige L\u00f6sung. F\u00fcr die meisten Menschen in der Provinz war der stockende Warenverkehr das gr\u00f6sste Problem. Die DUP aber, die die Vertragsdetails jetzt im Einzelnen pr\u00fcfen will, hatte es von Anfang an auf mehr abgesehen. Sie verlangte ein nordirisches Veto f\u00fcr alle Nordirland betreffenden EU-Gesetze und wollte die Zust\u00e4ndigkeit des Europ\u00e4ischen Gerichtshofs \u00abnirgendwo auf den Britischen Inseln\u00bb mehr akzeptieren. Mit roten und gr\u00fcnen Kan\u00e4len war es f\u00fcr sie nicht getan. Worum ging es bei den j\u00fcngsten Verhandlungen? Unter anderem war man in Grossbritannien darauf bedacht, sich wieder Rechte wie die Festsetzung der H\u00f6he der Mehrwertsteuer in Nordirland und der erlaubten staatlichen Subventionen in der Provinz anzueignen. Dar\u00fcber hinaus hat London Mitsprache des nordirischen Parlaments beim Erlass neuer EU-Bestimmungen f\u00fcr Nordirland verlangt. Ein entsprechendes \u00abStormont Lock\u00bb, das dem nominellen \u2013 aber nie genutzten \u2013 Einspruchsrecht in Norwegen gleichk\u00e4me, w\u00e4re freilich nur ein begrenztes Vetorecht. Und was ist mit dem Europ\u00e4ischen Gerichtshof? Die EU hat von Anfang an zu erkennen gegeben, dass der Europ\u00e4ische Gerichtshof im gesamten Binnenmarktbereich das letzte Wort haben m\u00fcsse. Bei den Verhandlungen mit London ging es aber darum, die nordirische Justiz \u00abvorzuschalten\u00bb, Nordirlands Gerichten also ersten Zugriff auf Streitf\u00e4lle einzur\u00e4umen. Zudem w\u00fcrde die Einf\u00fchrung gr\u00fcner Kan\u00e4le die Zahl der Streitf\u00e4lle selbst und so die Rolle des Europ\u00e4ischen Gerichtshofs deutlich reduzieren, hat man in Br\u00fcssel argumentiert. ","title":"Endspiel um den Brexit: Worum geht es beim Nordirland-Protokoll?","titleheader":"Von der Leyen in Grossbritannien","text_gpt4_api_keynotes_07_256":"- Neuer Deal zwischen London und Br\u00fcssel zur \u00dcberarbeitung des Nordirland-Protokolls soll Probleme l\u00f6sen und das Verh\u00e4ltnis zwischen Gro\u00dfbritannien und der EU verbessern.\n- Ursula von der Leyen und Rishi Sunak treffen sich in Windsor zu abschlie\u00dfenden Gespr\u00e4chen zum Nordirland-Protokoll.\n- Einf\u00fchrung von \"gr\u00fcnen Kan\u00e4len\" und separaten \"roten Kan\u00e4len\" f\u00fcr Warenverkehr zwischen dem Vereinigten K\u00f6nigreich und Nordirland als m\u00f6gliche L\u00f6sung.","text_api_keynotes_07_256":"1. Ein neuer Deal zwischen London und Br\u00fcssel soll Probleme beheben, die mit dem Brexit in Nordirland entstanden sind.\n2. Das Nordirland-Protokoll von 2020 wurde in wichtigen Punkten \u00fcberarbeitet, um das Verh\u00e4ltnis zwischen Grossbritannien und der EU zu entkrampfen.\n3. Eine m\u00f6gliche L\u00f6sung sind gr\u00fcne und rote Kan\u00e4le f\u00fcr den Warenverkehr, die von den Nordiren und der DUP unterschiedlich bewertet werden.","qa_list_gpt4":["Warum wurde das Nordirland-Protokoll im Brexit-Abkommen eingef\u00fchrt und welche \u00c4nderungen wurden k\u00fcrzlich vorgeschlagen, um den Warenverkehr zu verbessern?\n","Das Nordirland-Protokoll wurde eingef\u00fchrt, um Grenzkontrollen zwischen Nordirland und Schottland zu vermeiden, und die vorgeschlagenen \u00c4nderungen beinhalten die Einf\u00fchrung von gelben und blauen Kan\u00e4len f\u00fcr den Warenverkehr.\n","Das Nordirland-Protokoll wurde eingef\u00fchrt, um eine gemeinsame W\u00e4hrung zwischen Nordirland und der Republik Irland beizubehalten, und die vorgeschlagenen \u00c4nderungen beinhalten die Einf\u00fchrung von digitalen Kontrollen f\u00fcr den Warenverkehr.\n","Das Nordirland-Protokoll wurde eingef\u00fchrt, um Grenzkontrollen zwischen Nordirland und der Republik Irland zu vermeiden, und die vorgeschlagenen \u00c4nderungen beinhalten die Einf\u00fchrung von gr\u00fcnen und roten Kan\u00e4len f\u00fcr den Warenverkehr."],"flesch":[40.55,48.9,57.2,41.2,34.15,46.5],"text_gpt4_api_normal_words_05_512":"Das Nordirland-Protokoll von 2020, das als Teil des Brexit-Abkommens vereinbart wurde, wurde in wichtigen Punkten \u00fcberarbeitet, um Nordirland zu unterst\u00fctzen und das angespannte Verh\u00e4ltnis zwischen Gro\u00dfbritannien und der EU zu entspannen. EU-Kommissionspr\u00e4sidentin Ursula von der Leyen traf sich in Windsor mit dem britischen Premier Rishi Sunak zu abschlie\u00dfenden Gespr\u00e4chen. Das Protokoll war notwendig geworden, da der harte Brexit eine problematische Situation auf der irischen Insel geschaffen hatte.\n\nDas urspr\u00fcngliche Nordirland-Protokoll f\u00fchrte zu Verz\u00f6gerungen im Warenverkehr und vereinzelten Versorgungsengp\u00e4ssen. Die EU milderte daraufhin einige ihrer Kontrollen und stimmte dem britischen Vorschlag zu, einen \"gr\u00fcnen Kanal\" und einen separaten \"roten\" einzuf\u00fchren. Der gr\u00fcne Kanal soll Waren aus dem Rest des Vereinigten K\u00f6nigreichs fast oder ganz ohne Kontrollen in die Provinz bef\u00f6rdern, w\u00e4hrend rote Kan\u00e4le f\u00fcr Waren gelten, die \u00fcber Nordirland in die Republik Irland und in die EU weiterlaufen.\n\nDie j\u00fcngsten Verhandlungen zielten unter anderem darauf ab, Gro\u00dfbritannien wieder Rechte wie die Festsetzung der H\u00f6he der Mehrwertsteuer in Nordirland und der erlaubten staatlichen Subventionen in der Provinz zu gew\u00e4hren. London forderte auch Mitsprache des nordirischen Parlaments bei der Einf\u00fchrung neuer EU-Bestimmungen f\u00fcr Nordirland. In Bezug auf den Europ\u00e4ischen Gerichtshof ging es darum, die nordirische Justiz \"vorzuschalten\" und Nordirlands Gerichten den ersten Zugriff auf Streitf\u00e4lle einzur\u00e4umen.","frage_antwort":[]},{"_id":"64298058a9d504ce92eb6003","aid":908372323357,"date":"2023-02-28T17:33:10","author":"Beatrice B\u00f6siger","categoryName":"Wirtschaft","premium":false,"readingTime":240.0,"wordCount":937.0,"url":"https:\/\/www.tagesanzeiger.ch\/finma-stellt-bei-cs-schwerwiegende-maengel-fest-908372323357","own":"Bericht zu Greensill. Was die Finma der Credit Suisse vorwirft. Nach zweij\u00e4hriger Untersuchung schliesst die Finanzmarktaufsicht ihr Verfahren gegen die Grossbank im Zusammenhang mit den Greensill-Lieferkettenfonds ab. Nun nimmt sie vier ehemalige CS-Manager unter die Lupe. Nun reagiert die Finma. Der Kollaps des Finanzunternehmers Lex Greensill im M\u00e4rz 2021 zog auch die Credit Suisse mit in den Strudel. Wie sch\u00e4tzt die Finma den Greensill-Skandal ein? Zwei Jahre hat die Finanzmarktaufsicht Finma ermittelt, nun schliesst sie ihr Enforcementverfahren ab. Was f\u00fcr Gesch\u00e4fte hat Greensill eigentlich betrieben? Ab 2017 begann die CS, Gesch\u00e4fte mit Greensill zu machen. Die Grossbank habe das Ausmass dieser \u00c4nderungen zuerst nicht erkannt, schreibt die Finma. Der Finanzunternehmer hatte mehr oder weniger freie Hand: Was genau in den Fonds zu liegen kam, habe de facto nicht die Credit Suisse bestimmt, sondern Greensill selbst. Ohne Versicherung musste die CS die vier Fonds schliessen. Gab es Warnhinweise?  Warnungen oder Kritik von Medienschaffenden im Bezug auf Greensill verhallten bei der CS laut der Finma jedoch ungeh\u00f6rt. Welche Konsequenzen hat dies f\u00fcr die Credit Suisse? Greensill war 2021 nicht der einzige CS-Skandal. Offenbar zu wenig f\u00fcr die Finma. Werden auch einzelne Manager zur Verantwortung gezogen? Die Finma er\u00f6ffnet Verfahren gegen vier ehemalige Manager der Grossbank. Gibt es f\u00fcr die CS auch finanzielle Konsequenzen? Seitens der Finma drohen ihr in der Causa keine finanziellen Konsequenzen. Wie die Credit Suisse schreibt, wird die Umsetzung der zus\u00e4tzlichen Massnahmen voraussichtlich keine erheblichen Kosten zur Folge haben. ","lexrank_sumy":"Bericht zu Greensill. Was die Finma der Credit Suisse vorwirft. Er stolperte unter anderem \u00fcber den Greensill-Skandal. Nun reagiert die Finma. Der Kollaps des Finanzunternehmers Lex Greensill im M\u00e4rz 2021 zog auch die Credit Suisse mit in den Strudel. Die zweitgr\u00f6sste Schweizer Bank musste vier Fonds des auf Lieferkettenfinanzierung spezialisierten Australiers im Umfang von insgesamt 10 Milliarden Dollar einfrieren. Seit damals ist die CS mit Schadensminimierung besch\u00e4ftigt, auch auf dem Rechtsweg. Zwei Jahre hat die Finanzmarktaufsicht Finma ermittelt, nun schliesst sie ihr Enforcementverfahren ab. Was f\u00fcr Gesch\u00e4fte hat Greensill eigentlich betrieben? Diese wurden in Fonds geb\u00fcndelt und mit Versicherungen gegen einen m\u00f6glichen Zahlungsausfall abgesichert. Der Finanzunternehmer hatte mehr oder weniger freie Hand: Was genau in den Fonds zu liegen kam, habe de facto nicht die Credit Suisse bestimmt, sondern Greensill selbst. Auch beim zentralen Versicherungsschutz hat die CS auf Greensill vertraut. Das Problem: Ein Grossteil dieser Absicherungen stammte von nur zwei Gesellschaften \u2013 ein Klumpenrisiko. Sie ist nicht das erste Finanzunternehmen, das durch den australischen Finanzunternehmer in Schwierigkeiten ger\u00e4t. Dem Vernehmen nach soll es sich dabei um die ehemalige Risikochefin der Grossbank, Lara Warner, gehandelt haben. Welche Konsequenzen hat dies f\u00fcr die Credit Suisse? Auch hier wurden Risiken systematisch ignoriert, und die Verantwortlichkeiten innerhalb der CS waren unklar. Und: \u00abDie Verantwortlichkeitsbereiche der (rund 600) h\u00f6chsten Manager der Bank m\u00fcssen k\u00fcnftig in einem Verantwortlichkeitsdokument festgehalten werden\u00bb, schreibt die Finma weiter. Das betrifft weit mehr als nur das Topmanagement der Bank, sondern umfasst auch tiefere Hierarchiestufen. Die Finma er\u00f6ffnet Verfahren gegen vier ehemalige Manager der Grossbank. Gibt es f\u00fcr die CS auch finanzielle Konsequenzen? Momentan betr\u00e4gt das Loch in den Fonds rund 2 Milliarden Dollar. Eine Gewinneinziehung hat sie im aktuellen Fall nicht verf\u00fcgt, auch wenn sie dies bei einer schweren Verletzung der aufsichtsrechtlichen Bestimmungen tun kann. ","text_api_simple_words_07_512":"Die Finanzmarktaufsicht (Finma) hat ihre Untersuchung gegen die Credit Suisse im Zusammenhang mit den Greensill-Lieferkettenfonds abgeschlossen. Die Bank musste vier Fonds des Finanzunternehmens Lex Greensill einfrieren, was zu einem Schaden von 2 Milliarden Dollar f\u00fchrte. Die Finma wirft der Credit Suisse vor, dass sie in schwerer Weise gegen aufsichtsrechtliche Pflichten verstossen hat. Vier ehemalige Manager der Bank werden nun individuell untersucht. Die Finma fordert von der Credit Suisse, dass sie k\u00fcnftig ihre Verantwortlichkeiten klar darlegt und die Gegenparteirisiken ihrer Gesch\u00e4ftsbeziehungen \u00fcberpr\u00fcft. Es gibt auch Zivilklagen gegen die Bank.","text_api_normal_words_05_512":"Die Schweizer Finanzmarktaufsicht FINMA hat nach einer zweij\u00e4hrigen Untersuchung ihr Verfahren gegen die Credit Suisse in Bezug auf die Greensill-Lieferkettenfonds abgeschlossen und er\u00f6ffnet nun Verfahren gegen vier ehemalige CS-Manager. Die FINMA wirft der Bank vor, in schwerwiegender Weise gegen aufsichtsrechtliche Pflichten versto\u00dfen zu haben und Risiken nicht angemessen erfasst zu haben. Die CS hatte vier Fonds des auf Lieferkettenfinanzierung spezialisierten Unternehmens Greensill im Umfang von insgesamt 10 Milliarden Dollar eingefroren, nachdem dieses im M\u00e4rz 2021 kollabiert war. Die FINMA kritisiert die damalige Risikokultur der Bank und dass sie Warnungen und Kritik in Bezug auf Greensill ignoriert habe. Die CS muss nun ihre Verantwortlichkeiten klar darlegen und regelm\u00e4\u00dfig ihre Gesch\u00e4ftsbeziehungen auf Gegenparteirisiken \u00fcberpr\u00fcfen. Die Verantwortlichkeitsbereiche der h\u00f6chsten Manager der Bank m\u00fcssen k\u00fcnftig in einem Verantwortlichkeitsdokument festgehalten werden. Die CS hat bislang rund 7,4 Milliarden Dollar an betroffene Anleger zur\u00fcckgezahlt. Es drohen ihr keine finanziellen Konsequenzen seitens der FINMA, aber Zivilklagen sind bereits h\u00e4ngig und die Aktion\u00e4re haben der CS-F\u00fchrung in Bezug auf Greensill die Entlastung verweigert.","text_api_child_09_350":"Die Credit Suisse wurde von der Finanzmarktaufsicht untersucht, weil sie mit einem Finanzunternehmen namens Greensill zusammengearbeitet hat. Dieses Unternehmen hat mit Lieferketten gearbeitet und die Credit Suisse hat seinen Kunden empfohlen, in seine Fonds zu investieren. Aber das Unternehmen ist 2021 zusammengebrochen und die Credit Suisse musste 4 Fonds im Wert von 10 Milliarden Dollar schlie\u00dfen. Die Finanzmarktaufsicht hat herausgefunden, dass die Credit Suisse nicht genug auf die Risiken geachtet hat und dass es zu Verst\u00f6\u00dfen gegen die Regeln gekommen ist. Vier ehemalige Manager der Credit Suisse werden jetzt untersucht. Die Credit Suisse muss nun zus\u00e4tzliche Regeln befolgen und regelm\u00e4\u00dfig \u00fcberpr\u00fcfen, welche Risiken sie eingeht. Es gibt auch zivilrechtliche Klagen gegen die Credit Suisse.","text_api_keynotes_07_350":"Keynotes mit Aufz\u00e4hlungszeichen zum Artikel \"Bericht zu Greensill. Was die Finma der Credit Suisse vorwirft\":\n\n- Die Finma schlie\u00dft nach zweij\u00e4hriger Untersuchung ihr Verfahren gegen die Credit Suisse im Zusammenhang mit den Greensill-Lieferkettenfonds ab.\n- Vier ehemalige CS-Manager werden nun von der Finma untersucht.\n- Die CS hat in schwerwiegender Weise gegen aufsichtsrechtliche Pflichten versto\u00dfen und \u00fcber Jahre hinweg Risiken nicht angemessen erfasst.\n- Greensill hat sich auf die Finanzierung von Lieferketten spezialisiert und die CS hat Fonds mit Forderungen von Unternehmen mit dubioser Kreditw\u00fcrdigkeit verpackt.\n- Die Finma er\u00f6ffnet Verfahren gegen einzelne Manager der Grossbank und fordert eine klarere Darlegung der Verantwortlichkeiten.","text_davinci_api_key_07_256":"1. Die Finma schliesst ihr Verfahren gegen die Credit Suisse im Zusammenhang mit dem Greensill-Skandal ab und nimmt vier ehemalige Manager unter die Lupe.\n2. Die Grossbank hatte ihre Risikokultur \u00fcber Jahre hinweg nicht angemessen erfasst, was zu einer \"schweren Verletzung von Schweizer Aufsichtsrecht\" f\u00fchrte. \n3. Die Finma fordert von der Credit Suisse, regelm\u00e4ssig die wichtigsten Gesch\u00e4ftsbeziehungen auf Gegenparteirisiken zu \u00fcberpr\u00fcfen und die Verantwortlichkeiten der Manager in einem Verantwortlichkeitsdokument festzuhalten.","five_letter_word_list":["finma","gegen","nimmt","unter","fonds","jahre","f\u00e4llt","sache","weise","dabei","einer","lange","diese","einen","legte","ihren","immer","gupta","nicht","hatte","freie","genau","facto","tokio","h\u00e4tte","erste","durch","ger\u00e4t","einem","zogen","folge","heute","bezug","ihrem","zudem","wurde","hohen","haben","waren","teilt","seien","wenig","stufe","enden","neben","asset","sowie","degen","causa","keine","offen","rasch","legen"],"qa_list":["Was war das Hauptgesch\u00e4ft von Greensill und wie hat die Credit Suisse mit ihm zusammengearbeitet?","Greensill hat in den Fonds der Credit Suisse ausschlie\u00dflich Forderungen von Unternehmen mit guter Kreditw\u00fcrdigkeit verpackt.","Die Credit Suisse hat ausschlie\u00dflich in die Fonds von Greensill investiert, die mit Versicherungen gegen m\u00f6gliche Zahlungsausf\u00e4lle abgesichert waren.","Greensill hat sich auf die Finanzierung von Lieferketten spezialisiert und die Credit Suisse hat Gesch\u00e4fte mit ihm gemacht, wobei die Fonds immer risikoreicher wurden."],"lead":"Nach zweij\u00e4hriger Untersuchung schliesst die Finanzmarktaufsicht ihr Verfahren gegen die Grossbank im Zusammenhang mit den Greensill-Lieferkettenfonds ab. Nun nimmt sie vier ehemalige CS-Manager unter die Lupe.\u00a0","originaltext":"Bericht zu Greensill. Was die Finma der Credit Suisse vorwirft. Nach zweij\u00e4hriger Untersuchung schliesst die Finanzmarktaufsicht ihr Verfahren gegen die Grossbank im Zusammenhang mit den Greensill-Lieferkettenfonds ab. Nun nimmt sie vier ehemalige CS-Manager unter die Lupe. Der fr\u00fchere Credit-Suisse-Chef Thomas Gottstein. Er stolperte unter anderem \u00fcber den Greensill-Skandal. Nun reagiert die Finma. Der Kollaps des Finanzunternehmers Lex Greensill im M\u00e4rz 2021 zog auch die Credit Suisse mit in den Strudel. Die zweitgr\u00f6sste Schweizer Bank musste vier Fonds des auf Lieferkettenfinanzierung spezialisierten Australiers im Umfang von insgesamt 10 Milliarden Dollar einfrieren. Seit damals ist die CS mit Schadensminimierung besch\u00e4ftigt, auch auf dem Rechtsweg. Betroffene Anleger sollen das investierte Geld zur\u00fcckerhalten. Eigenen Angaben zufolge hat sie bislang rund 7,4 Milliarden Dollar retour \u00fcberwiesen. Wie sch\u00e4tzt die Finma den Greensill-Skandal ein? Zwei Jahre hat die Finanzmarktaufsicht Finma ermittelt, nun schliesst sie ihr Enforcementverfahren ab. Der Greensill-Skandal f\u00e4llt haupts\u00e4chlich in die \u00c4ra des ehemaligen CS-Chefs Thomas Gottstein und des Pr\u00e4sidenten Urs Rohner. In der dazu ver\u00f6ffentlichten Meldung zeichnet die Beh\u00f6rde ein verheerendes Bild von der damaligen Risikokultur der Grossbank. Die CS habe in der Sache in \u00abschwerer Weise gegen aufsichtsrechtliche Pflichten\u00bb verstossen und es \u00fcber Jahre hinweg vers\u00e4umt, Risiken angemessen zu erfassen. Dabei kam es zu einer \u00abschweren Verletzung von Schweizer Aufsichtsrecht\u00bb. Was f\u00fcr Gesch\u00e4fte hat Greensill eigentlich betrieben? Lex Greensill, der Gr\u00fcnder der Finanzfirma, galt lange als wahres Finanzwunderkind. Mit seinen Fonds hat sich der Bauernsohn aus Australien auf die Finanzierung von Lieferketten spezialisiert. Diese wurden in Fonds geb\u00fcndelt und mit Versicherungen gegen einen m\u00f6glichen Zahlungsausfall abgesichert. Diese legte die CS ihren Kunden dann als sichere Anlagen mit geringem Risiko in ihr Portfolio. Ab 2017 begann die CS, Gesch\u00e4fte mit Greensill zu machen. Mit der Zeit wurden diese immer risikoreicher, unter anderem weil der Financier immer mehr Forderungen von Unternehmen mit dubioser Kreditw\u00fcrdigkeit wie dem britisch-indischen Stahl- und Rohstoffunternehmer Sanjeev Gupta in die Fonds verpackte. Die Grossbank habe das Ausmass dieser \u00c4nderungen zuerst nicht erkannt, schreibt die Finma. Der Finanzunternehmer hatte mehr oder weniger freie Hand: Was genau in den Fonds zu liegen kam, habe de facto nicht die Credit Suisse bestimmt, sondern Greensill selbst. Auch beim zentralen Versicherungsschutz hat die CS auf Greensill vertraut. Das Problem: Ein Grossteil dieser Absicherungen stammte von nur zwei Gesellschaften \u2013 ein Klumpenrisiko. Eine der beiden, Tokio Marine, hatte Greensill bereits 2020 informiert, die Police im M\u00e4rz 2021 auslaufen zu lassen. Ohne Versicherung musste die CS die vier Fonds schliessen. Gab es Warnhinweise? Ja. Die CS h\u00e4tte fr\u00fcher reagieren k\u00f6nnen. Sie ist nicht das erste Finanzunternehmen, das durch den australischen Finanzunternehmer in Schwierigkeiten ger\u00e4t. Der Schweizer Verm\u00f6gensverwalter GAM erlitt 2018 ebenfalls mit einem Fonds des Finanzunternehmers Schiffbruch. Investoren zogen in der Folge massiv Gelder ab; GAM hat sich von dem Vertrauensverlust bis heute nicht mehr erholt.  Warnungen oder Kritik von Medienschaffenden im Bezug auf Greensill verhallten bei der CS laut der Finma jedoch ungeh\u00f6rt. Auch ihre Fragen wurden nicht unabh\u00e4ngig beantwortet. Gegen\u00fcber der Aufsichtsbeh\u00f6rde machte die Grossbank deswegen \u00abteilweise falsche oder zu positive Angaben\u00bb zu den Fonds, wie diese in ihrem Bericht festh\u00e4lt. Ein verheerendes Bild bietet sich zudem, weil die CS Greensill wenige Monate vor dem Kollaps noch einen Kredit von 140 Millionen Dollar vergeben hat. Dies, obschon der zust\u00e4ndige Risikomanager die Vergabe eigentlich ablehnte. Er wurde \u00abvon einem hohen Kadermitglied\u00bb \u00fcberstimmt. Dem Vernehmen nach soll es sich dabei um die ehemalige Risikochefin der Grossbank, Lara Warner, gehandelt haben. Welche Konsequenzen hat dies f\u00fcr die Credit Suisse? Greensill war 2021 nicht der einzige CS-Skandal. Wenige Monate sp\u00e4ter musste sie nach dem Zusammenbruch des Hedgefonds Archegos einen Verlust in H\u00f6he von 5,5 Milliarden Dollar einr\u00e4umen. Der Fall zeigte ebenfalls eklatante Defizite im Risikomanagement. Auch hier wurden Risiken systematisch ignoriert, und die Verantwortlichkeiten innerhalb der CS waren unklar. Seit damals hat die Grossbank nahezu ihre komplette F\u00fchrungsriege ausgetauscht. Die CS teilt mit, dass zus\u00e4tzlich weitere Massnahmen ergriffen worden seien, etwa \u00abbedeutende Investitionen bei Risk und Compliance\u00bb, und in Weiterbildungen betreffend Risikokultur innerhalb der gesamten Organisation investiert habe. Offenbar zu wenig f\u00fcr die Finma. Sie reagiert scharf. CS muss k\u00fcnftig ihre Verantwortlichkeiten klar darlegen. Konkret: Auf Stufe Gesch\u00e4ftsleitung m\u00fcssen regelm\u00e4ssig die wichtigsten rund 500 Gesch\u00e4ftsbeziehungen der Bank namentlich auf Gegenparteirisiken \u00fcberpr\u00fcft werden. Und: \u00abDie Verantwortlichkeitsbereiche der (rund 600) h\u00f6chsten Manager der Bank m\u00fcssen k\u00fcnftig in einem Verantwortlichkeitsdokument festgehalten werden\u00bb, schreibt die Finma weiter. Das betrifft weit mehr als nur das Topmanagement der Bank, sondern umfasst auch tiefere Hierarchiestufen. Zur Kontrolle schickt sie der Grossbank erneut einen Aufpasser ins Haus. Werden auch einzelne Manager zur Verantwortung gezogen? Ja. Die Finma er\u00f6ffnet Verfahren gegen vier ehemalige Manager der Grossbank. Ein solches Enforcementverfahren kann maximal mit einem Berufsverbot von bis zu f\u00fcnf Jahren enden. Um wen es sich im konkreten Fall handelt, gibt die Aufsicht nicht bekannt. Greensill wie Archegos hatten \u00c4nderungen im CS-Management zur Folge. Neben den eigentlichen Fondsmanagern mussten auch Eric Varvel, der Chef des Asset Management, und die Risikochefin Lara Warner sowie Michael Degen, Chef Schweiz und Europa im Asset Management, die Bank verlassen. Gibt es f\u00fcr die CS auch finanzielle Konsequenzen? Momentan betr\u00e4gt das Loch in den Fonds rund 2 Milliarden Dollar. Der Betrag kann sich noch vermindern, je nachdem, wie viel die CS von den ausstehenden Forderungen noch eintreiben kann. Seitens der Finma drohen ihr in der Causa keine finanziellen Konsequenzen. Diese kann keine Bussen gegen fehlbare Manager oder Finanzinstitute verh\u00e4ngen. Eine Gewinneinziehung hat sie im aktuellen Fall nicht verf\u00fcgt, auch wenn sie dies bei einer schweren Verletzung der aufsichtsrechtlichen Bestimmungen tun kann. Wie die Credit Suisse schreibt, wird die Umsetzung der zus\u00e4tzlichen Massnahmen voraussichtlich keine erheblichen Kosten zur Folge haben. Offen ist, wie es mit Zivilklagen weitergeht. Einige sind bereits h\u00e4ngig. Auch haben die Aktion\u00e4re dem Verwaltungsrat an der Generalversammlung 2022 die Entlastung in Bezug auf Greensill verweigert. Die CS-F\u00fchrung wird die Altlast nicht so rasch wie gew\u00fcnscht ad acta legen k\u00f6nnen. ","title":"Was die Finma der Credit Suisse vorwirft","titleheader":"Bericht zu Greensill","text_gpt4_api_keynotes_07_256":"- Finma schlie\u00dft zweij\u00e4hrige Untersuchung im Greensill-Skandal ab und wirft Credit Suisse schwere Verst\u00f6\u00dfe gegen aufsichtsrechtliche Pflichten vor\n- Credit Suisse hat Risiken \u00fcber Jahre hinweg nicht angemessen erfasst, was zu einer schweren Verletzung von Schweizer Aufsichtsrecht f\u00fchrte\n- Finma er\u00f6ffnet Verfahren gegen vier ehemalige CS-Manager, m\u00f6gliche Konsequenzen sind Berufsverbote von bis zu f\u00fcnf Jahren","text_api_keynotes_07_256":"- Die Finanzmarktaufsicht Finma schlie\u00dft nach zweij\u00e4hriger Untersuchung ihr Verfahren gegen die Credit Suisse im Zusammenhang mit den Greensill-Lieferkettenfonds ab.\n- Die CS hat in der Sache in \"schwerer Weise gegen aufsichtsrechtliche Pflichten\" versto\u00dfen und es \u00fcber Jahre hinweg vers\u00e4umt, Risiken angemessen zu erfassen.\n- Die Finma er\u00f6ffnet Verfahren gegen vier ehemalige Manager der Grossbank und kritisiert die CS f\u00fcr ihre mangelhafte Risikokultur.","qa_list_gpt4":["Was verlangt die Finma von der Credit Suisse im Zusammenhang mit dem Greensill-Skandal?\n","Die Finma verlangt von der Credit Suisse, ihre Gesch\u00e4ftsbeziehungen zu Lex Greensill wieder aufzunehmen.","Die Finma verlangt von der Credit Suisse, die Verantwortlichen f\u00fcr den Greensill-Skandal zu entlassen.","Die Finma verlangt von der Credit Suisse, die Verantwortlichkeitsbereiche ihrer h\u00f6chsten Manager schriftlich festzuhalten und regelm\u00e4\u00dfig ihre wichtigsten Gesch\u00e4ftsbeziehungen auf Gegenparteirisiken zu \u00fcberpr\u00fcfen."],"flesch":[50.0,58.45,50.2,48.3,30.7,46.7],"text_gpt4_api_normal_words_05_512":"Nach einer zweij\u00e4hrigen Untersuchung hat die Finanzmarktaufsicht Finma ihr Verfahren gegen die Credit Suisse im Zusammenhang mit den Greensill-Lieferkettenfonds abgeschlossen. Die Beh\u00f6rde wirft der Bank vor, in \"schwerer Weise gegen aufsichtsrechtliche Pflichten\" versto\u00dfen und Risiken \u00fcber Jahre hinweg nicht angemessen erfasst zu haben. Die Finma hat nun Verfahren gegen vier ehemalige CS-Manager er\u00f6ffnet. Die Credit Suisse musste vier Greensill-Fonds im Umfang von insgesamt 10 Milliarden Dollar einfrieren und ist seitdem bem\u00fcht, den Schaden zu minimieren. Bisher hat die Bank rund 7,4 Milliarden Dollar an betroffene Anleger zur\u00fcckgezahlt. Die Finma fordert nun, dass die Verantwortlichkeiten der rund 600 h\u00f6chsten Manager der Bank in einem Verantwortlichkeitsdokument festgehalten werden und die wichtigsten Gesch\u00e4ftsbeziehungen regelm\u00e4\u00dfig auf Gegenparteirisiken \u00fcberpr\u00fcft werden. Finanzielle Konsequenzen seitens der Finma sind derzeit nicht zu erwarten, jedoch sind Zivilklagen gegen die Bank offen.","frage_antwort":["Wer war 2021 nicht der einzige CS-Skandal?","Greensill","Greensill Thomas Gottstein","Urs Rohner"]},{"_id":"64298058a9d504ce92eb6025","aid":573214212510,"date":"2023-03-01T10:43:32","author":"Markus Brotschi","categoryName":"Schweiz","premium":false,"readingTime":180.0,"wordCount":655.0,"url":"https:\/\/www.tagesanzeiger.ch\/flucht-zu-einer-anderen-krankenkasse-ist-mitten-im-jahr-moeglich-573214212510","own":"Verg\u00fctung von Psychotherapie. Flucht zu einer anderen Krankenkasse ist mitten im Jahr m\u00f6glich. Viele Patientinnen und Patienten haben seit Anfang Jahr ihren Psychotherapieplatz verloren, da ihre Versicherung nicht mehr bezahlt. Ein Ausweg bietet sich auf den 1. Juli an \u2013 allerdings nicht f\u00fcr alle. Was die meisten nicht wissen: Wer mit seiner Krankenkasse unzufrieden ist, muss nicht bis Ende Jahr warten. Unter bestimmten Bedingungen ist auf Mitte Jahr ein Versicherungswechsel m\u00f6glich. Dies k\u00f6nnte insbesondere f\u00fcr jene attraktiv sein, denen seit Anfang Jahr die Psychotherapie von ihrer Kasse nicht mehr bezahlt wird. Juli m\u00f6glich ist.\u00bb Denn nur ein Teil der Versicherten kann unter dem Jahr wechseln. Der Wechsel auf Mitte Jahr ist wie jener auf Anfang Jahr ohne Begr\u00fcndung m\u00f6glich. Kassen werben nur f\u00fcr Wechsel auf Ende Jahr. Juli klappt. Gutachten widerspricht Sant\u00e9suisse. ","lexrank_sumy":"Flucht zu einer anderen Krankenkasse ist mitten im Jahr m\u00f6glich. Unter bestimmten Bedingungen ist auf Mitte Jahr ein Versicherungswechsel m\u00f6glich. Dies k\u00f6nnte insbesondere f\u00fcr jene attraktiv sein, denen seit Anfang Jahr die Psychotherapie von ihrer Kasse nicht mehr bezahlt wird. F\u00fcr sie w\u00e4re ein Wechsel zu Helsana, Sanitas oder KPT die Rettung. Denn diese Kassen geh\u00f6ren dem Verband Curafutura an, der im Gegensatz zum Konkurrenzverband Sant\u00e9suisse einen Tarifvertrag mit den Psychologinnen und Psychologen abgeschlossen hat. Der Wechsel auf Mitte Jahr ist wie jener auf Anfang Jahr ohne Begr\u00fcndung m\u00f6glich. Kassen werben nur f\u00fcr Wechsel auf Ende Jahr. Diese Abkl\u00e4rung dr\u00e4ngt sich vor allem bei jenen Sant\u00e9suisse-Kassen auf, die entgegen der Empfehlung ihres Verbandes die Therapie trotzdem bezahlen wollen. Der Streit um die Verg\u00fctung der Therapien von Psychologinnen und Psychologen, die sich in der klinischen Weiterbildung befinden, g\u00e4rt seit Anfang Jahr. Bis Ende letzten Jahres wurden die Leistungen von Personen mit abgeschlossener Therapieausbildung und jenen in Weiterbildung immer von einem Arzt abgerechnet und von allen Kassen bezahlt. Sant\u00e9suisse begr\u00fcndet die Zahlungsweigerung damit, dass es seit Anfang Jahr keine gesetzliche Grundlage mehr gebe, um die Therapieleistungen von Personen in Weiterbildung zu verg\u00fcten. Sant\u00e9suisse stellt sich auf den Standpunkt, dass die Personen in Weiterbildung nicht unter diese gesetzliche Regelung fallen. Bis Ende 2022 seien Leistungen von Personen in Weiterbildung immer von den Krankenversicherern verg\u00fctet worden. Ganz im Gegenteil h\u00e4tten der Bundesrat und das BAG in letzter Zeit sogar explizit best\u00e4tigt, dass Leistungen von Personen in Weiterbildung Pflichtleistungen der obligatorischen Krankenpflegeversicherung seien. ","text_api_simple_words_07_512":"Manche Patienten haben seit Anfang des Jahres ihren Psychotherapieplatz verloren, weil ihre Versicherung nicht mehr bezahlt. Aber es gibt eine M\u00f6glichkeit, zu einer anderen Krankenkasse zu wechseln, die die Psychotherapie von Fachkr\u00e4ften in Weiterbildung verg\u00fctet. Vor allem die Kassen Helsana, Sanitas und KPT bieten das an. Allerdings k\u00f6nnen nur Versicherte mit Standardmodell und ordentlicher Franchise im Juni wechseln. Es ist auch m\u00f6glich, in ein alternatives Versicherungsmodell zu wechseln. Die Kassen werben normalerweise nur f\u00fcr den Wechsel zum Ende des Jahres, aber der Wechsel zum Juni ist m\u00f6glich, wenn die aktuelle Versicherung bis Ende M\u00e4rz gek\u00fcndigt wird. Es wird empfohlen, vorher bei der neuen Kasse abzukl\u00e4ren, ob die Therapie bei Psychologen in Weiterbildung wirklich bezahlt wird. Ein Gutachten widerlegt die Argumentation der Sant\u00e9suisse, dass die Verg\u00fctung von Therapien von Personen in Weiterbildung gesetzlich nicht mehr geregelt sei. Das Bundesamt f\u00fcr Gesundheit geht davon aus, dass die Verg\u00fctung weiterhin m\u00f6glich ist.","text_api_normal_words_05_512":"Patienten, die seit Anfang des Jahres ihre Psychotherapiepl\u00e4tze verloren haben, da ihre Krankenkassen die Kosten nicht mehr \u00fcbernehmen, haben die M\u00f6glichkeit, zum 1. Juli zu einer anderen Krankenkasse zu wechseln. Insbesondere f\u00fcr diejenigen, die von Helsana, Sanitas oder KPT versichert sind, k\u00f6nnte ein Wechsel zur Rettung werden, da diese Kassen dem Verband Curafutura angeh\u00f6ren, der einen Tarifvertrag mit Psychologen abgeschlossen hat, der auch die Verg\u00fctung von Fachkr\u00e4ften in Weiterbildung umfasst. Ein Wechsel zur CSS ist jedoch nicht empfehlenswert, da sie den Tarifvertrag nicht unterschrieben hat, aber unter Vorbehalt zahlt. Der Wechsel ist nur f\u00fcr Versicherte im Standardmodell mit ordentlicher Franchise m\u00f6glich. Es gibt keine Einschr\u00e4nkungen f\u00fcr andere Versicherte. Der Wechsel auf Mitte Jahr ist wie der Wechsel auf Anfang Jahr ohne Begr\u00fcndung m\u00f6glich. Der Kassenwechsel mitten im Jahr wird jedoch kaum beworben, da die Versicherten mit Standardmodell und Mindestfranchise in der Regel nicht auf die Pr\u00e4mienh\u00f6he achten und selten die Kasse wechseln. Vor einem Wechsel empfiehlt es sich, bei der neuen Kasse abzukl\u00e4ren, ob die Therapie bei Psychologen in Weiterbildung wirklich \u00fcbernommen wird. Der Streit um die Verg\u00fctung von Therapien von Psychologen in Weiterbildung, der seit Anfang des Jahres schwelt, k\u00f6nnte mit einem neuen Rechtsgutachten von Anwalt Gregori Werder und Professor Thomas G\u00e4chter gekl\u00e4rt werden, das besagt, dass die Personen in Weiterbildung unter die gesetzliche Regelung fallen und dass ihre Leistungen von den Krankenkassen verg\u00fctet werden sollten.","text_api_child_09_350":"Dieser Artikel handelt davon, dass man mitten im Jahr die Krankenkasse wechseln kann, wenn man mit der aktuellen nicht zufrieden ist. Das kann besonders wichtig sein, wenn man Psychotherapie bekommt und die Versicherung diese nicht mehr bezahlen will. Es gibt einige Krankenkassen, die Psychotherapie bezahlen, auch von Fachkr\u00e4ften in Weiterbildung. Es ist wichtig, sich vor einem Wechsel zu erkundigen, ob die neue Krankenkasse die Therapie auch bezahlt. Man kann bis Ende M\u00e4rz k\u00fcndigen und am 1. Juli in eine neue Krankenkasse wechseln. Die Krankenkassen machen allerdings keine Werbung daf\u00fcr, da viele Versicherte nicht oft wechseln. Es gibt auch einen Streit dar\u00fcber, ob Personen in klinischer Weiterbildung f\u00fcr Psychotherapie von den Krankenkassen bezahlt werden m\u00fcssen oder nicht. Ein neues Rechtsgutachten sagt, dass es eine gesetzliche Grundlage gibt, um die Therapieleistungen von Personen in Weiterbildung weiterhin zu verg\u00fcten.","text_api_keynotes_07_350":"Keynotes zu dem Artikel \"Verg\u00fctung von Psychotherapie\":\n\n1. Patienten haben seit Anfang Jahr ihren Psychotherapieplatz verloren, da ihre Versicherung nicht mehr bezahlt.\n2. Ein Ausweg bietet sich auf den 1. Juli an - allerdings nicht f\u00fcr alle.\n3. Ein Wechsel zu gewissen Krankenkassen, die dem Verband Curafutura angeh\u00f6ren, kann f\u00fcr Betroffene attraktiv sein.\n4. Ein Kassenwechsel mitten im Jahr ist m\u00f6glich, aber wird kaum propagiert.\n5. Der Streit um die Verg\u00fctung der Therapien von Psychologinnen und Psychologen, die sich in der klinischen Weiterbildung befinden, g\u00e4rt seit Anfang Jahr.","text_davinci_api_key_07_256":"1. Patientinnen und Patienten k\u00f6nnen unter bestimmten Bedingungen mitten im Jahr zu einer anderen Krankenkasse wechseln. \n2. Dies bietet eine M\u00f6glichkeit f\u00fcr jene, die seit Anfang des Jahres keine Psychotherapie mehr von ihrer Kasse bezahlt bekommen. \n3. Interessierte sollten bis Ende M\u00e4rz k\u00fcndigen und sich vorher bei der neuen Kasse \u00fcber die Verg\u00fctung informieren.","five_letter_word_list":["einer","viele","haben","ihren","nicht","unter","mitte","denen","ihrer","kasse","diese","einen","zahlt","allen","cathy","maret","keine","jener","einem","damit","zuvor","neuen","allem","jenen","ihres","deren","daf\u00fcr","gross","felix","immer","wurde","davon","neues","seien","schon","sogar"],"qa_list":["Ist ein Versicherungswechsel auf Mitte Jahr m\u00f6glich, wenn man im Standardmodell mit ordentlicher Franchise versichert ist?","Ja, aber nur mit Begr\u00fcndung.","Nein, ein Versicherungswechsel ist nur auf Anfang Jahr m\u00f6glich.","Ja, ein Versicherungswechsel auf Mitte Jahr ist ohne Begr\u00fcndung m\u00f6glich."],"lead":"Viele Patientinnen und Patienten haben seit Anfang Jahr ihren Psychotherapie\u00adplatz verloren, da ihre Versicherung nicht mehr bezahlt. Ein Ausweg bietet sich auf den 1. Juli an \u2013 allerdings nicht f\u00fcr alle.","originaltext":"Verg\u00fctung von Psychotherapie. Flucht zu einer anderen Krankenkasse ist mitten im Jahr m\u00f6glich. Viele Patientinnen und Patienten haben seit Anfang Jahr ihren Psychotherapieplatz verloren, da ihre Versicherung nicht mehr bezahlt. Ein Ausweg bietet sich auf den 1. Juli an \u2013 allerdings nicht f\u00fcr alle. Ein Psychotherapeut im Gespr\u00e4ch mit einer Klientin (gestellte Aufnahme). Was die meisten nicht wissen: Wer mit seiner Krankenkasse unzufrieden ist, muss nicht bis Ende Jahr warten. Unter bestimmten Bedingungen ist auf Mitte Jahr ein Versicherungswechsel m\u00f6glich. Dies k\u00f6nnte insbesondere f\u00fcr jene attraktiv sein, denen seit Anfang Jahr die Psychotherapie von ihrer Kasse nicht mehr bezahlt wird. F\u00fcr sie w\u00e4re ein Wechsel zu Helsana, Sanitas oder KPT die Rettung. Denn diese Kassen geh\u00f6ren dem Verband Curafutura an, der im Gegensatz zum Konkurrenzverband Sant\u00e9suisse einen Tarifvertrag mit den Psychologinnen und Psychologen abgeschlossen hat. Gem\u00e4ss diesem Vertrag werden auch die Therapien von Fachkr\u00e4ften in Weiterbildung verg\u00fctet. Die CSS, das vierte Curafutura-Mitglied, hat den Tarifvertrag nicht unterschrieben. Sie zahlt diese Therapien aber unter Vorbehalt. \u00abWir empfehlen allen Betroffenen, zu \u00fcberpr\u00fcfen, ob f\u00fcr sie ein Kassenwechsel auf 1. Juli m\u00f6glich ist.\u00bb \u00abWir empfehlen allen Betroffenen, zu \u00fcberpr\u00fcfen, ob f\u00fcr sie ein Kassenwechsel auf 1. Juli m\u00f6glich ist\u00bb, sagt Cathy Maret, Sprecherin der F\u00f6deration der Schweizer Psychologinnen und Psychologen (FSP). Denn nur ein Teil der Versicherten kann unter dem Jahr wechseln. Es sind jene, die im Standardmodell mit ordentlicher Franchise versichert sind: Erwachsene mit Franchise 300 Franken\/Kinder 0 Franken. Ansonsten gibt es aber keine Einschr\u00e4nkungen. Der Wechsel auf Mitte Jahr ist wie jener auf Anfang Jahr ohne Begr\u00fcndung m\u00f6glich. Mittlerweile sind drei Viertel der Erwachsenen im Hausarzt- oder einem anderen alternativen Versicherungsmodell angeschlossen, ein Viertel hat das Standardmodell. Wer auf Mitte Jahr wechseln darf, der kann auf Wunsch auch gleich in ein alternatives Versicherungsmodell wechseln. Kassen werben nur f\u00fcr Wechsel auf Ende Jahr. Interessierte m\u00fcssen ihre aktuelle Versicherung bis Ende M\u00e4rz k\u00fcndigen, damit der Wechsel auf 1. Juli klappt. Zuvor empfiehlt es sich, bei der neuen Kasse abzukl\u00e4ren, ob die Therapie bei Psychologen in Weiterbildung wirklich \u00fcbernommen wird. Diese Abkl\u00e4rung dr\u00e4ngt sich vor allem bei jenen Sant\u00e9suisse-Kassen auf, die entgegen der Empfehlung ihres Verbandes die Therapie trotzdem bezahlen wollen. Der FSP hat eine Umfrage bei den Sant\u00e9suisse-Kassen gemacht und deren Zahlungsbereitschaft auf seiner Website auflistet. Allerdings \u00fcbernimmt der FSP daf\u00fcr keine Gew\u00e4hr, da die Situation jederzeit \u00e4ndern kann. Der Kassenwechsel mitten im Jahr wird kaum propagiert, die Krankenversicherer machen daf\u00fcr keine Werbung. Dies d\u00fcrfte damit zusammenh\u00e4ngen, dass die Versicherten mit Standardmodell und Mindestfranchise nicht gross auf die Pr\u00e4mienh\u00f6he schauten und die Kasse kaum je wechselten, sagt Felix Schneuwly, Krankenkassenexperte des Vergleichsdienstes Comparis. Gutachten widerspricht Sant\u00e9suisse. Der Streit um die Verg\u00fctung der Therapien von Psychologinnen und Psychologen, die sich in der klinischen Weiterbildung befinden, g\u00e4rt seit Anfang Jahr. Bis Ende letzten Jahres wurden die Leistungen von Personen mit abgeschlossener Therapieausbildung und jenen in Weiterbildung immer von einem Arzt abgerechnet und von allen Kassen bezahlt. Sant\u00e9suisse begr\u00fcndet die Zahlungsweigerung damit, dass es seit Anfang Jahr keine gesetzliche Grundlage mehr gebe, um die Therapieleistungen von Personen in Weiterbildung zu verg\u00fcten. Psychologen und Psychologinnen mit anerkannter Therapieausbildung k\u00f6nnen seit Anfang 2023 hingegen selbstst\u00e4ndig mit den Kassen abrechnen, sofern die Therapie \u00e4rztlich angeordnet wurde (Anordnungsmodell). Sant\u00e9suisse stellt sich auf den Standpunkt, dass die Personen in Weiterbildung nicht unter diese gesetzliche Regelung fallen. Das Bundesamt f\u00fcr Gesundheit (BAG) geht hingegen davon aus, dass die rechtliche Grundlage ausreichend ist, um Therapien bei Personen in Weiterbildung weiterhin zu verg\u00fcten. Diese Haltung st\u00fctzt auch ein neues Rechtsgutachten von Anwalt Gregori Werder und Professor Thomas G\u00e4chter. Gem\u00e4ss Rechtsprechung des Bundesgerichts seien \u00e4rztliche Leistungen schon immer an nicht \u00e4rztliche Hilfspersonen delegiert und den Krankenkassen in Rechnung gestellt worden. Andernfalls w\u00e4re gem\u00e4ss Bundesgericht die \u00e4rztliche Praxist\u00e4tigkeit kaum mehr m\u00f6glich. Bis Ende 2022 seien Leistungen von Personen in Weiterbildung immer von den Krankenversicherern verg\u00fctet worden. Es gebe keine Hinweise darauf, dass der Gesetzgeber oder der Bundesrat davon abweichen wollte, so die Juristen. Ganz im Gegenteil h\u00e4tten der Bundesrat und das BAG in letzter Zeit sogar explizit best\u00e4tigt, dass Leistungen von Personen in Weiterbildung Pflichtleistungen der obligatorischen Krankenpflegeversicherung seien. ","title":"Flucht zu einer anderen Krankenkasse ist mitten im Jahr m\u00f6glich","titleheader":"Verg\u00fctung von Psychotherapie","text_gpt4_api_keynotes_07_256":"- Versicherungswechsel zur Mitte des Jahres m\u00f6glich, insbesondere f\u00fcr Patienten, deren Psychotherapie nicht mehr von ihrer aktuellen Krankenkasse bezahlt wird\n- Helsana, Sanitas und KPT geh\u00f6ren zum Verband Curafutura, der einen Tarifvertrag mit Psychologen abgeschlossen hat, der auch Therapien von Fachkr\u00e4ften in Weiterbildung verg\u00fctet\n- Betroffene sollten pr\u00fcfen, ob ein Kassenwechsel zum 1. Juli m\u00f6glich ist und ihre aktuelle Versicherung bis Ende M\u00e4rz k\u00fcndigen","text_api_keynotes_07_256":"- Ein Versicherungswechsel auf Mitte Jahr kann f\u00fcr Patienten, deren Psychotherapie nicht mehr von ihrer aktuellen Versicherung bezahlt wird, eine L\u00f6sung sein.\n- Versicherte im Standardmodell mit ordentlicher Franchise k\u00f6nnen unter bestimmten Bedingungen ohne Begr\u00fcndung auf Mitte Jahr die Krankenkasse wechseln.\n- Es ist empfehlenswert, vor einem Kassenwechsel abzukl\u00e4ren, ob die neue Kasse auch die Therapie bei Psychologen in Weiterbildung verg\u00fctet.","qa_list_gpt4":["Unter welchen Bedingungen ist ein Wechsel der Krankenkasse auf Mitte des Jahres m\u00f6glich und welche Krankenkassen bieten weiterhin eine Verg\u00fctung von Psychotherapie an?\n","Ein Wechsel der Krankenkasse ist nur am Ende des Jahres m\u00f6glich und nur die CSS Krankenkasse bietet weiterhin eine Verg\u00fctung von Psychotherapie an.","Ein Wechsel der Krankenkasse ist nur f\u00fcr Personen mit einer ordentlichen Franchise von 500 Franken m\u00f6glich, und nur Sanitas und KPT bieten weiterhin eine Verg\u00fctung von Psychotherapie an.","Ein Wechsel der Krankenkasse ist f\u00fcr Personen im Standardmodell mit ordentlicher Franchise (Erwachsene 300 Franken\/Kinder 0 Franken) auf Mitte des Jahres m\u00f6glich, und die Krankenkassen Helsana, Sanitas und KPT bieten weiterhin eine Verg\u00fctung von Psychotherapie an."],"flesch":[42.25,64.6,45.3,46.4,40.3,53.75],"text_gpt4_api_normal_words_05_512":"Seit Anfang des Jahres haben viele Patienten ihren Psychotherapieplatz verloren, da ihre Versicherung die Kosten nicht mehr \u00fcbernimmt. Ein m\u00f6glicher Ausweg ist der Wechsel der Krankenkasse zum 1. Juli, allerdings nicht f\u00fcr alle Betroffenen. Unter bestimmten Bedingungen ist ein Wechsel der Versicherung zur Jahresmitte m\u00f6glich, insbesondere f\u00fcr diejenigen, deren Psychotherapie nicht mehr von ihrer Kasse bezahlt wird. Ein Wechsel zu Helsana, Sanitas oder KPT k\u00f6nnte die L\u00f6sung sein, da diese Kassen dem Verband Curafutura angeh\u00f6ren, der im Gegensatz zum Konkurrenzverband Sant\u00e9suisse einen Tarifvertrag mit den Psychologen abgeschlossen hat.\n\nDie F\u00f6deration der Schweizer Psychologinnen und Psychologen (FSP) empfiehlt allen Betroffenen, zu pr\u00fcfen, ob f\u00fcr sie ein Wechsel der Kasse zum 1. Juli m\u00f6glich ist. Nur ein Teil der Versicherten kann jedoch w\u00e4hrend des Jahres wechseln, n\u00e4mlich diejenigen, die im Standardmodell mit ordentlicher Franchise versichert sind. Interessierte m\u00fcssen ihre aktuelle Versicherung bis Ende M\u00e4rz k\u00fcndigen, damit der Wechsel zum 1. Juli funktioniert.\n\nDer Streit um die Verg\u00fctung der Therapien von Psychologen in Weiterbildung besteht seit Anfang des Jahres. Sant\u00e9suisse begr\u00fcndet die Zahlungsverweigerung damit, dass es seit Anfang des Jahres keine gesetzliche Grundlage mehr gebe, um die Therapieleistungen von Personen in Weiterbildung zu verg\u00fcten. Das Bundesamt f\u00fcr Gesundheit (BAG) hingegen geht davon aus, dass die rechtliche Grundlage ausreichend ist, um Therapien bei Personen in Weiterbildung weiterhin zu verg\u00fcten. Ein neues Rechtsgutachten st\u00fctzt diese Haltung.","frage_antwort":[]},{"_id":"64298059a9d504ce92eb607b","aid":753962781802,"date":"2023-03-02T14:43:52","author":"Dominique Eigenmann","categoryName":"International","premium":false,"readingTime":180.0,"wordCount":567.0,"url":"https:\/\/www.tagesanzeiger.ch\/die-spd-wechselt-abrupt-die-seite-753962781802","own":"Neue Regierung in Berlin. Die SPD wechselt abrupt die Seite. \u00dcberraschung in der Hauptstadt: Statt ein Linksb\u00fcndnis anzuf\u00fchren, ordnet sich die SPD lieber dem Wahlsieger CDU unter. Franziska Giffey opfert daf\u00fcr sogar ihr Amt als B\u00fcrgermeisterin. Bald ein Gespann: Franziska Giffey, noch Regierende B\u00fcrgermeisterin von Berlin (SPD), mit ihrem wahrscheinlichen Nachfolger und neuen Koalitionspartner, Kai Wegner von der CDU. Die meisten Menschen in der Hauptstadt erwarteten wohl, dass das Linksb\u00fcndnis ungeachtet seiner Wahlniederlage einfach weitermachen w\u00fcrde \u2013 mit der Berliner SPD-Chefin Franziska Giffey als B\u00fcrgermeisterin. Giffey stand der CDU immer n\u00e4her als der Linkspartei. Doch dann bekam die SPD auf einmal Angst vor dem Sieg. Insgeheim bereitete die 44-J\u00e4hrige bereits den Seitenwechsel zur CDU vor, auch wenn dies hiess, dass sie daf\u00fcr ihr Amt opfern m\u00fcsste. Giffey, eine konservative Genossin in einem sehr linken Landesverband, stand der CDU seit je politisch n\u00e4her als der radikalen Linkspartei und holte f\u00fcr die SPD entsprechend vor allem Stimmen in der Mitte. Signalwirkung f\u00fcr ganz Deutschland. ","lexrank_sumy":"Die SPD wechselt abrupt die Seite. Bald ein Gespann: Franziska Giffey, noch Regierende B\u00fcrgermeisterin von Berlin (SPD), mit ihrem wahrscheinlichen Nachfolger und neuen Koalitionspartner, Kai Wegner von der CDU. Die SPD, die die Hauptstadt seit 2001 regiert, rettete immerhin Platz 2: Nach einigem Nachz\u00e4hlen lag sie in der 3,9-Millionen-Metropole winzige 53 Stimmen vor den Gr\u00fcnen. Die meisten Menschen in der Hauptstadt erwarteten wohl, dass das Linksb\u00fcndnis ungeachtet seiner Wahlniederlage einfach weitermachen w\u00fcrde \u2013 mit der Berliner SPD-Chefin Franziska Giffey als B\u00fcrgermeisterin. Insgeheim bereitete die 44-J\u00e4hrige bereits den Seitenwechsel zur CDU vor, auch wenn dies hiess, dass sie daf\u00fcr ihr Amt opfern m\u00fcsste. Giffey, eine konservative Genossin in einem sehr linken Landesverband, stand der CDU seit je politisch n\u00e4her als der radikalen Linkspartei und holte f\u00fcr die SPD entsprechend vor allem Stimmen in der Mitte. Schon nach der Wahl 2021 h\u00e4tte sie lieber in einer Ampel mit Gr\u00fcnen und FDP regiert als mit der Linken \u2013 und war erst auf Druck ihrer Partei links abgebogen. Aus Schwarz-Gr\u00fcn wird in der Hauptstadt nichts: CDU-Landeschef Kai Wegner mit der bisherigen gr\u00fcnen Vize-B\u00fcrgermeisterin Bettina Jarasch. Die Berliner Gr\u00fcnen machten Giffey den Seitenwechsel diesmal aber auch leicht: Statt auf die CDU zuzugehen, blieben sie ihrer linken Klientelpolitik treu und stiessen die SPD in den Sondierungsgespr\u00e4chen mit immer neuen roten Linien vor den Kopf. Die Gr\u00fcnen w\u00fcrden nur noch f\u00fcr sich selbst schauen, nicht f\u00fcr die Stadt, so der Vorwurf. Die CDU schliesslich erh\u00e4lt in Berlin endlich wieder einmal die Chance, zu beweisen, dass sie auch Grossstadt kann \u2013 zumindest, wenn die Linken dort zuvor gr\u00fcndlich abgewirtschaftet haben. ","text_api_simple_words_07_512":"Die SPD hat bei der Wahl in Berlin verloren und die CDU hat gewonnen. Die meisten Menschen dachten, dass die SPD trotzdem weiterregieren w\u00fcrde, aber die Partei entschied sich \u00fcberraschend, mit der CDU zusammenzuarbeiten. Die bisherige B\u00fcrgermeisterin Franziska Giffey opferte daf\u00fcr sogar ihr Amt. Die Gr\u00fcnen waren entt\u00e4uscht, dass die SPD nicht mit ihnen zusammenarbeiten wollte und werfen der SPD Verrat an ihren Idealen vor. Die CDU wird nun wahrscheinlich den neuen B\u00fcrgermeister stellen und die SPD wird in der Regierung bleiben. Die Entscheidung in Berlin hat Auswirkungen auf die politische Landschaft im ganzen Land.","text_api_normal_words_05_512":"In Berlin hat die SPD \u00fcberraschend beschlossen, sich der CDU anzuschlie\u00dfen, anstatt ein Linksb\u00fcndnis anzuf\u00fchren, nachdem die Christdemokraten bei den Wahlen spektakul\u00e4r gewonnen hatten. Die bisherige Regierende B\u00fcrgermeisterin Franziska Giffey opferte daf\u00fcr sogar ihr Amt. Giffey hatte politisch der CDU immer n\u00e4her gestanden als der Linkspartei und holte f\u00fcr die SPD entsprechend vor allem Stimmen in der Mitte. Die Berliner Gr\u00fcnen blieben ihrer linken Klientelpolitik treu und stie\u00dfen die SPD in den Sondierungsgespr\u00e4chen mit immer neuen roten Linien vor den Kopf, was den Seitenwechsel erleichterte. Die \u00fcberraschende Rochade in Berlin sendet bereits politische Signale ins ganze Land.","text_api_child_09_350":"Die SPD hat in Berlin \u00fcberraschend beschlossen, mit der CDU zusammenzuarbeiten, anstatt eine Koalition mit den Linken und Gr\u00fcnen zu bilden, obwohl die Christdemokraten die Wahl gewonnen haben. Die bisherige B\u00fcrgermeisterin, Franziska Giffey, wird ihr Amt aufgeben, um den Wechsel zu erm\u00f6glichen. Giffey passt politisch besser zur CDU als zur Linken und hat das Ergebnis der Wahl als Signal daf\u00fcr gesehen. Die Gr\u00fcnen haben sich durch ihre Ablehnung einer Zusammenarbeit mit der CDU in die Enge getrieben und die SPD hat das Vertrauen von Gr\u00fcnen und Linken verloren. Die Rochade in Berlin sendet politische Signale an ganz Deutschland und zeigt, dass die SPD und die Gr\u00fcnen zunehmend als Rivalen wahrgenommen werden. Die CDU erh\u00e4lt die Chance, zu beweisen, dass sie auch in einer Gro\u00dfstadt regieren kann, wenn die Linken zuvor schlecht regiert haben.","text_api_keynotes_07_350":"1. Die SPD wechselt in Berlin abrupt die Seite und ordnet sich lieber dem Wahlsieger CDU unter.\n2. Franziska Giffey opfert daf\u00fcr sogar ihr Amt als B\u00fcrgermeisterin.\n3. Die SPD wird nun mit der CDU zusammenarbeiten, anstatt ein Linksb\u00fcndnis anzuf\u00fchren.\n4. Die Berliner Gr\u00fcnen blieben ihrer linken Klientelpolitik treu und stie\u00dfen die SPD in den Sondierungsgespr\u00e4chen mit immer neuen roten Linien vor den Kopf.\n5. Die \u00fcberraschende Rochade in Berlin sendet bereits politische Signale ins ganze Land.","text_davinci_api_key_07_256":"1. Die Berliner SPD wechselt unerwartet die Seite und will sich dem Wahlsieger CDU unterordnen. \n2. Die Regierungsbildung wird auch anderen Parteien in Deutschland Signalwirkung haben. \n3. Kai Wegner, der neue Regierende B\u00fcrgermeister, muss nun beweisen, dass die CDU auch Grossstadt kann.","five_letter_word_list":["seite","statt","unter","daf\u00fcr","sogar","ihrem","neuen","knapp","liess","\u00fcbrig","platz","w\u00fcrde","schon","roten","stand","immer","n\u00e4her","bekam","angst","sagte","ankam","stehe","alles","demut","hiess","hatte","wohin","stadt","wehte","einem","holte","allem","mitte","h\u00e4tte","einer","ampel","druck","ihrer","links","damit","nicht","erste","werde","sahra","gr\u00fcne","linke","jusos","basis","tickt","neuer","jahre","abgab","fehlt","senat","ganze","einst","sehen","lager","diese","zuvor","haben"],"qa_list":["Wer wird voraussichtlich der neue Regierende B\u00fcrgermeister von Berlin?","Franziska Giffey","Bettina Jarasch","Kai Wegner"],"lead":"\u00dcberraschung in der Hauptstadt: Statt ein Linksb\u00fcndnis anzuf\u00fchren, ordnet sich die SPD lieber dem Wahlsieger CDU unter. Franziska Giffey opfert daf\u00fcr sogar ihr Amt als B\u00fcrgermeisterin.","originaltext":"Neue Regierung in Berlin Die SPD wechselt abrupt die Seite. \u00dcberraschung in der Hauptstadt: Statt ein Linksb\u00fcndnis anzuf\u00fchren, ordnet sich die SPD lieber dem Wahlsieger CDU unter. Franziska Giffey opfert daf\u00fcr sogar ihr Amt als B\u00fcrgermeisterin. Bald ein Gespann: Franziska Giffey, noch Regierende B\u00fcrgermeisterin von Berlin (SPD), mit ihrem wahrscheinlichen Nachfolger und neuen Koalitionspartner, Kai Wegner von der CDU. Die Wiederholungswahl in Berlin vor knapp drei Wochen liess an Klarheit eigentlich nichts zu w\u00fcnschen \u00fcbrig: Die regierenden Sozialdemokraten, Gr\u00fcnen und Linken verloren, die Christdemokraten gewannen spektakul\u00e4r. Die SPD, die die Hauptstadt seit 2001 regiert, rettete immerhin Platz 2: Nach einigem Nachz\u00e4hlen lag sie in der 3,9-Millionen-Metropole winzige 53 Stimmen vor den Gr\u00fcnen. So klar das Verdikt im Ganzen ausfiel, so schwer war festzustellen, wer Berlin denn k\u00fcnftig regieren sollte. Die meisten Menschen in der Hauptstadt erwarteten wohl, dass das Linksb\u00fcndnis ungeachtet seiner Wahlniederlage einfach weitermachen w\u00fcrde \u2013 mit der Berliner SPD-Chefin Franziska Giffey als B\u00fcrgermeisterin. Schliesslich regierte Rot-Gr\u00fcn-Rot schon seit 2016 zusammen, seit 14 Monaten mit Giffey im Roten Rathaus. Giffey stand der CDU immer n\u00e4her als der Linkspartei. Doch dann bekam die SPD auf einmal Angst vor dem Sieg. Giffey sagte schon kurz nach der Wahl, die bei ihr pers\u00f6nlich als Schock ankam, nun stehe alles infrage \u2013 schon aus \u00abDemut\u00bb gegen\u00fcber dem Urteil der W\u00e4hlerinnen und W\u00e4hler. Insgeheim bereitete die 44-J\u00e4hrige bereits den Seitenwechsel zur CDU vor, auch wenn dies hiess, dass sie daf\u00fcr ihr Amt opfern m\u00fcsste. Fr\u00fcher als andere hatte die Stimmungspolitikerin gemerkt, wohin der Wind in der Stadt wehte. Giffey, eine konservative Genossin in einem sehr linken Landesverband, stand der CDU seit je politisch n\u00e4her als der radikalen Linkspartei und holte f\u00fcr die SPD entsprechend vor allem Stimmen in der Mitte. Schon nach der Wahl 2021 h\u00e4tte sie lieber in einer Ampel mit Gr\u00fcnen und FDP regiert als mit der Linken \u2013 und war erst auf Druck ihrer Partei links abgebogen. Aus Schwarz-Gr\u00fcn wird in der Hauptstadt nichts: CDU-Landeschef Kai Wegner mit der bisherigen gr\u00fcnen Vize-B\u00fcrgermeisterin Bettina Jarasch. Die Berliner Gr\u00fcnen machten Giffey den Seitenwechsel diesmal aber auch leicht: Statt auf die CDU zuzugehen, blieben sie ihrer linken Klientelpolitik treu und stiessen die SPD in den Sondierungsgespr\u00e4chen mit immer neuen roten Linien vor den Kopf. Sie verrieten damit nicht nur die neue B\u00fcndnispolitik der Bundes-Gr\u00fcnen um Robert Habeck und Annalena Baerbock, sondern vergaben auch die Chance, mit einer weiteren schwarz-gr\u00fcnen Koalition Druck auf die Ampel-Partner SPD und FDP im Bund auszu\u00fcben. Die SPD wiederum kam zur Einsicht, dass das Vertrauen zu Gr\u00fcnen und Linken f\u00fcrs Erste aufgebraucht ist, wenigstens in Berlin. Die Gr\u00fcnen w\u00fcrden nur noch f\u00fcr sich selbst schauen, nicht f\u00fcr die Stadt, so der Vorwurf. Und die Linkspartei werde sich ja im Bund sowieso gleich spalten, wenn Sahra Wagenknecht endlich eine Partei f\u00fcr sich selbst gr\u00fcnde. Gr\u00fcne und Linke ihrerseits reagierten entsetzt auf den Seitenwechsel der SPD und warfen ihr Verrat an \u00abprogressiven\u00bb Idealen vor. Signalwirkung f\u00fcr ganz Deutschland. Giffey muss nun nur noch ihre Partei von dem schmerzhaften Schritt in die Grosse Koalition \u00fcberzeugen. Im Landesvorstand erhielt sie am Mittwoch daf\u00fcr eine komfortable 2:1-Mehrheit, die aufschreienden Jusos und anderen Linken in der Partei glaubt sie, mit einem Mitgliederentscheid zum Koalitionsvertrag \u00fcberstimmen zu k\u00f6nnen: Die Basis tickt auch in Berlin pragmatischer als die mittlere Funktion\u00e4rsriege. Neuer Regierender B\u00fcrgermeister d\u00fcrfte also der 50-j\u00e4hrige Kai Wegner werden \u2013 21 Jahre nachdem der letzte CDU-Stadtobere Eberhard Diepgen sein Amt abgab. Da Wegner jede Regierungserfahrung fehlt, wird die gewiefte Giffey im Senat aber auch ohne B\u00fcrgermeisterinnenw\u00fcrde die starke Frau bleiben. Die \u00fcberraschende Rochade in Berlin sendet bereits politische Signale ins ganze Land. SPD und Gr\u00fcne, einst \u00abnat\u00fcrliche Partner\u00bb, sehen sich immer h\u00e4ufiger als Rivalen um die Vorherrschaft im linken Lager und belauern sich, statt vertraulich zusammenzuarbeiten. L\u00e4ngst hat diese Entwicklung auch die Bundesregierung erfasst. Die Gr\u00fcnen tun sich weiterhin schwer, sobald sie betont ideologisch auftreten. Die CDU schliesslich erh\u00e4lt in Berlin endlich wieder einmal die Chance, zu beweisen, dass sie auch Grossstadt kann \u2013 zumindest, wenn die Linken dort zuvor gr\u00fcndlich abgewirtschaftet haben. ","title":"Die SPD wechselt abrupt die Seite","titleheader":"Neue Regierung in Berlin\u00a0","text_gpt4_api_keynotes_07_256":"- \u00dcberraschender Seitenwechsel der SPD: Statt Linksb\u00fcndnis nun Koalition mit CDU in Berlin\n- Franziska Giffey opfert B\u00fcrgermeisterinnen-Amt f\u00fcr neue Koalition; wahrscheinlicher Nachfolger ist Kai Wegner (CDU)\n- Signalwirkung f\u00fcr ganz Deutschland: SPD und Gr\u00fcne als Rivalen statt \"nat\u00fcrliche Partner\", CDU erh\u00e4lt Chance in Gro\u00dfstadtregierung","text_api_keynotes_07_256":"1. Die SPD \u00fcberrascht und wechselt in Berlin die Seite und ordnet sich dem Wahlsieger CDU unter.\n2. Franziska Giffey opfert ihr Amt als B\u00fcrgermeisterin, um diesen Schritt zu erm\u00f6glichen.\n3. Die politische Entwicklung in Berlin sendet politische Signale ins ganze Land und zeigt, dass SPD und Gr\u00fcne sich immer h\u00e4ufiger als Rivalen um die Vorherrschaft im linken Lager sehen.","qa_list_gpt4":["Warum wechselt die SPD in Berlin die Seite und geht eine Koalition mit der CDU ein?\n","Weil die SPD mit den Gr\u00fcnen und Linken uneinig \u00fcber politische Ziele war.","Weil Franziska Giffey pers\u00f6nliche politische Ambitionen verfolgt.","Weil die SPD das Vertrauen zu Gr\u00fcnen und Linken f\u00fcrs Erste aufgebraucht sieht, die Gr\u00fcnen sich zu sehr auf ihre eigene Klientelpolitik konzentrieren und die Linkspartei wom\u00f6glich eine Spaltung bevorsteht."],"flesch":[48.85,54.25,51.2,58.9,43.6,52.5],"text_gpt4_api_normal_words_05_512":"\u00dcberraschung in Berlin: Die SPD wechselt die Seite und geht eine Koalition mit der CDU ein, anstatt das erwartete Linksb\u00fcndnis fortzusetzen. Franziska Giffey, bisherige B\u00fcrgermeisterin von Berlin, opfert daf\u00fcr ihr Amt. Die Entscheidung folgt auf die Wiederholungswahl in Berlin, bei der die regierenden Sozialdemokraten, Gr\u00fcnen und Linken verloren, w\u00e4hrend die CDU spektakul\u00e4r gewann. Giffey stand der CDU politisch n\u00e4her als der Linkspartei und bereitete insgeheim den Seitenwechsel zur CDU vor. Die Berliner Gr\u00fcnen machten es Giffey leicht, indem sie ihrer linken Klientelpolitik treu blieben und die SPD in Sondierungsgespr\u00e4chen vor den Kopf stie\u00dfen. Die SPD erkannte, dass das Vertrauen zu Gr\u00fcnen und Linken in Berlin aufgebraucht ist. Gr\u00fcne und Linke reagierten entsetzt auf den Seitenwechsel der SPD. Giffey muss nun ihre Partei von dem Schritt in die Gro\u00dfe Koalition \u00fcberzeugen. Der neue Regierende B\u00fcrgermeister wird voraussichtlich der 50-j\u00e4hrige Kai Wegner von der CDU sein. Die \u00fcberraschende Rochade in Berlin sendet politische Signale ins ganze Land und zeigt zunehmende Rivalit\u00e4t zwischen SPD und Gr\u00fcnen.","frage_antwort":["Wer stand der CDU immer n\u00e4her als der Linkspartei?","Giffey","Kai Wegner","Franziska Giffey"]},{"_id":"64298059a9d504ce92eb6080","aid":453571675982,"date":"2023-03-02T17:39:47","author":"Jon Mettler","categoryName":"Wirtschaft","premium":false,"readingTime":240.0,"wordCount":840.0,"url":"https:\/\/www.tagesanzeiger.ch\/glamour-und-grauzonen-saubers-neuer-sponsor-sorgt-fuer-kontroversen-453571675982","own":"Online-Casino-Betreiber Stake. Glamour und Grauzonen: Saubers neuer Sponsor sorgt f\u00fcr Kontroversen. Am Wochenende beginnt die Formel-1-Saison. Ein besonderes Augenmerk gilt dem Geldgeber des Schweizer Rennstalls. Vor dem Start der Formel-1-Saison am Wochenende sorgt der Rennstall Alfa Romeo (ehemals Sauber) aus Hinwil ZH mit seinem neuen Titelsponsor Stake f\u00fcr ungewollte Aufmerksamkeit: Bei der Pr\u00e4sentation des neuen Boliden Anfang Februar in Z\u00fcrich prangte das Stake-Firmenlogo prominent auf dem Wagen \u2013 was ein m\u00f6glicher Verstoss gegen das hiesige Werbeverbot f\u00fcr Gl\u00fccksspiele sein k\u00f6nnte. Die Zusammenarbeit von Stake mit Alfa-Sauber ist f\u00fcr drei Jahre vorgesehen. Im Gegenzug wird Stake werbewirksam im Namen des Rennstalls erw\u00e4hnt, der ab diesem Jahr als \u00abAlfa Romeo F1 Team Stake\u00bb auftritt. Es ist nicht der erste grosse Werbedeal von Stake: Das Unternehmen unterst\u00fctzt den englischen Erstliga-Fussballclub Everton FC finanziell. Und warum holt Alfa-Sauber einen Sponsor an Bord, der bei einigen Grand Prix gar nicht werben darf? Alfa-Sauber liess Fragen der Redaktion zum neuen Sponsor unbeantwortet. Jedoch entwickelt ein Jungunternehmen mit Sitz in Melbourne Casinospiele f\u00fcr Stake. Stake nutzt auch andere Grauzonen: Clevere Spielerinnen und Spieler k\u00f6nnen Verbote mit sogenannten virtuellen privaten Netzwerken (VPN) umgehen. Millionenhaus in Australien, Millionenklage in New York. Eingereicht hat sie Christopher Freeman vor einem Gericht in New York. Er sieht sich als Investor einer Vorg\u00e4ngerfirma von Stake. Dann stellt sich n\u00e4mlich die Frage, inwiefern Stake seinen finanziellen Verpflichtungen dem Rennstall gegen\u00fcber noch nachkommen kann. ","lexrank_sumy":"Online-Casino-Betreiber Stake. Vor dem Start der Formel-1-Saison am Wochenende sorgt der Rennstall Alfa Romeo (ehemals Sauber) aus Hinwil ZH mit seinem neuen Titelsponsor Stake f\u00fcr ungewollte Aufmerksamkeit: Bei der Pr\u00e4sentation des neuen Boliden Anfang Februar in Z\u00fcrich prangte das Stake-Firmenlogo prominent auf dem Wagen \u2013 was ein m\u00f6glicher Verstoss gegen das hiesige Werbeverbot f\u00fcr Gl\u00fccksspiele sein k\u00f6nnte. Der neue Partner aus dem Ausland bietet n\u00e4mlich im Internet Sportwetten an und betreibt unter stake.com Onlinecasinos, bei denen die Eins\u00e4tze in Kryptow\u00e4hrungen erfolgen. Im Gegenzug wird Stake werbewirksam im Namen des Rennstalls erw\u00e4hnt, der ab diesem Jahr als \u00abAlfa Romeo F1 Team Stake\u00bb auftritt. Bei einer Live-Roulettepartie im vergangenen Mai, die \u00fcber stake.com im Internet \u00fcbertragen wurde, gewann der Musiker mit einem einzigen Einsatz umgerechnet 16 Millionen Franken. Warum arbeitet Alfa-Sauber nach dem Krypto-Crash bei FTX ausgerechnet mit einem Kryptocasino zusammen? Die Rennen in diesen beiden L\u00e4ndern geh\u00f6ren zu den prestigetr\u00e4chtigsten im Formel-1-Kalender. Bei der Bekanntgabe der Zusammenarbeit mit Stake Ende Januar machte der Rennstall indes deutlich, was er sich nebst dem finanziellen Zustupf erhofft. Demnach ist es zul\u00e4ssig, ein Onlinecasino von Australien aus zu betreiben, solange es keine Menschen in diesem Land bedient oder in \u00abDown Under\u00bb Werbung macht. Millionenhaus in Australien, Millionenklage in New York. Die Recherchen des \u00abSydney Morning Herald\u00bb brachten auch die Namen der Firmengr\u00fcnder ans Tageslicht. F\u00fcr das herrschaftliche Haus in Toorak, einem Stadtteil im Osten von Melbourne, bl\u00e4tterte der 28-J\u00e4hrige umgerechnet 50,5 Millionen Franken hin. Dem Vernehmen nach hat Craven vor, das Geb\u00e4ude abzureissen und ein neues Anwesen zu bauen. Er sieht sich als Investor einer Vorg\u00e4ngerfirma von Stake. Er fordert deshalb Schadenersatz in der H\u00f6he von umgerechnet 366,1 Millionen Franken. Sollte das Gericht der Klage stattgeben, k\u00f6nnte sich das f\u00fcr Alfa-Sauber als risikoreich erweisen. ","text_api_simple_words_07_512":"Der Formel-1-Rennstall Alfa Romeo hat mit seinem neuen Titelsponsor Stake f\u00fcr Aufregung gesorgt, da Stake ein Online-Casino-Betreiber ist und in der Schweiz das Werbeverbot f\u00fcr Gl\u00fccksspiele gilt. Stake bietet Sportwetten an und betreibt Onlinecasinos, bei denen Eins\u00e4tze in Kryptow\u00e4hrungen erfolgen. Die Zusammenarbeit von Stake mit Alfa-Sauber ist f\u00fcr drei Jahre geplant und wird auf rund 75,5 Millionen Franken gesch\u00e4tzt. Andere Formel-1-Teams haben ihre Zusammenarbeit mit Kryptow\u00e4hrungsunternehmen beendet, nachdem es zu einem spektakul\u00e4ren Zusammenbruch der Kryptob\u00f6rse FTX kam. Stake nutzt auch Grauzonen, wie virtuelle private Netzwerke (VPN), um Gl\u00fccksspielverbote zu umgehen. Der Hauptsitz des Stake-Mutterkonzerns befindet sich auf Cura\u00e7ao. Die Firmengr\u00fcnder von Stake sind der Australier Edward \"Ed\" Craven und der US-Staatsb\u00fcrger Bijan Tehrani. Craven kaufte im August 2022 die teuerste Immobilie des australischen Bundesstaats Victoria. Eine zivilrechtliche Klage in den USA gegen Stake k\u00f6nnte sich als risikoreich f\u00fcr Alfa-Sauber erweisen.","text_api_normal_words_05_512":"Der neue Titelsponsor des Formel-1-Teams Alfa Romeo, das Online-Casino-Unternehmen Stake, sorgt f\u00fcr Kontroversen, da es m\u00f6glicherweise gegen das Werbeverbot f\u00fcr Gl\u00fccksspiele in der Schweiz und anderen L\u00e4ndern verst\u00f6\u00dft. Stake bietet Sportwetten und Onlinecasinos an, bei denen Eins\u00e4tze in Kryptow\u00e4hrungen erfolgen. Andere Formel-1-Teams haben ihre Kooperationen mit \u00e4hnlichen Unternehmen aufgrund von Skandalen beendet. Stake hat auch mit Grauzonen und VPNs gearbeitet, um Verbote zu umgehen. Der Hauptsitz des Mutterkonzerns von Stake befindet sich auf Cura\u00e7ao, und die Firmengr\u00fcnder haben in Australien und den USA f\u00fcr Schlagzeilen gesorgt. Eine zivilrechtliche Klage in den USA gegen Stake k\u00f6nnte auch Auswirkungen auf das Sponsoring von Alfa Romeo haben.","text_api_child_09_350":"Ein Rennstall namens Alfa Romeo, der an Autorennen teilnimmt, hat einen neuen Sponsor namens \"Stake\". Dieser Sponsor stammt aus dem Ausland und betreibt im Internet Sportwetten und Online-Casinos, bei denen man mit Kryptow\u00e4hrungen spielt. In der Schweiz darf jedoch nur werben, wer hier zugelassen ist. Stake darf in Grossbritannien und Belgien auch nicht werben. Andere Formel-1-Teams haben ihre Zusammenarbeit mit \u00e4hnlichen Unternehmen bereits beendet. Der Hauptsitz von Stake befindet sich auf Cura\u00e7ao, aber es gibt auch ein Unternehmen in Australien, das Spiele f\u00fcr sie entwickelt. Trotzdem darf Stake in Australien keine Online-Casinos betreiben. Ein Mann namens Christopher Freeman hat bei einem Gericht in New York eine Klage gegen Stake eingereicht. Er war ein Investor und sagt, Stake habe ihn davon abgehalten, in das Unternehmen zu investieren. Wenn das Gericht ihm Recht gibt, k\u00f6nnte es sein, dass Stake Alfa Romeo kein Geld mehr geben kann.","text_api_keynotes_07_350":"- Der Rennstall Alfa Romeo sorgt mit seinem neuen Titelsponsor Stake f\u00fcr Aufmerksamkeit, da das Unternehmen im Internet Sportwetten anbietet und Onlinecasinos mit Kryptow\u00e4hrungen betreibt.\n- Das Stake-Logo ist auf dem Heckfl\u00fcgel und der Nase des neuen Rennautos zu sehen, was m\u00f6glicherweise gegen das hiesige Werbeverbot f\u00fcr Gl\u00fccksspiele verst\u00f6\u00dft.\n- Die Zusammenarbeit von Stake und Alfa-Sauber ist f\u00fcr drei Jahre vorgesehen und wird auf rund 75,5 Millionen Franken gesch\u00e4tzt.\n- Andere Formel-1-Teams haben ihre Kooperationen mit Gl\u00fccksspiel-Unternehmen beendet, nachdem es zu Krypto-Crashes und Insolvenzen gekommen war.\n- Stake nutzt Grauzonen wie die Nutzung von virtuellen privaten Netzwerken und hat auch rechtliche Auseinandersetzungen zu bew\u00e4ltigen.","text_davinci_api_key_07_256":"1. Der neue Sponsor des Schweizer Rennstalls Alfa Romeo (ehemals Sauber): Stake sorgt f\u00fcr Kontroversen und wirft Fragen auf. \n2. Stake betreibt unter stake.com Online-Casinos mit Eins\u00e4tzen in Kryptow\u00e4hrungen, in der Schweiz jedoch ist dies verboten. \n3. Der kanadische Rapstar Drake ist ein Werbebotschafter von Stake und gewann bei einer Live-Roulettepartie im Mai mit einem einzigen Einsatz umgerechnet 16 Millionen Franken.","five_letter_word_list":["stake","neuer","sorgt","romeo","start","neuen","wagen","gegen","unter","denen","jahre","namen","tr\u00e4gt","sagte","frage","darin","einem","k\u00f6nne","indes","keine","nicht","erste","drake","einer","wurde","warum","haben","zuger","velas","tezos","einen","grand","liess","nebst","diese","weise","macht","under","nutzt","l\u00e4sst","legal","bijan","k\u00f6pfe","osten","neues","bauen","traum","durch","klage","sieht","davon"],"qa_list":["Warum sorgt der neue Sponsor von Alfa-Sauber, Stake, f\u00fcr Kontroversen?","Stake betreibt Online-Casinos, die in der Schweiz nicht zugelassen sind.","Stake hat Millionen in den Kauf einer Immobilie in Australien investiert.","Stake hat Verbindungen zu Kryptow\u00e4hrungen und Grauzonen im Gl\u00fccksspielbereich."],"lead":"Am Wochenende beginnt die Formel-1-Saison. Ein besonderes Augenmerk gilt dem Geldgeber des Schweizer Rennstalls.","originaltext":"Online-Casino-Betreiber Stake Glamour und Grauzonen: Saubers neuer Sponsor sorgt f\u00fcr Kontroversen. Am Wochenende beginnt die Formel-1-Saison. Ein besonderes Augenmerk gilt dem Geldgeber des Schweizer Rennstalls. Stake-Logo auf dem Heckfl\u00fcgel und der Nase: Der finnische Fahrer Valtteri Bottas testet in Bahrain das neue Rennauto von Alfa Romeo. Vor dem Start der Formel-1-Saison am Wochenende sorgt der Rennstall Alfa Romeo (ehemals Sauber) aus Hinwil ZH mit seinem neuen Titelsponsor Stake f\u00fcr ungewollte Aufmerksamkeit: Bei der Pr\u00e4sentation des neuen Boliden Anfang Februar in Z\u00fcrich prangte das Stake-Firmenlogo prominent auf dem Wagen \u2013 was ein m\u00f6glicher Verstoss gegen das hiesige Werbeverbot f\u00fcr Gl\u00fccksspiele sein k\u00f6nnte. Der neue Partner aus dem Ausland bietet n\u00e4mlich im Internet Sportwetten an und betreibt unter stake.com Onlinecasinos, bei denen die Eins\u00e4tze in Kryptow\u00e4hrungen erfolgen. Hierzulande d\u00fcrfen aber nur Casinos werben, die in der Schweiz zugelassen sind. Die Zusammenarbeit von Stake mit Alfa-Sauber ist f\u00fcr drei Jahre vorgesehen. Insider sch\u00e4tzen das Engagement auf umgerechnet 75,5 Millionen Franken. Im Gegenzug wird Stake werbewirksam im Namen des Rennstalls erw\u00e4hnt, der ab diesem Jahr als \u00abAlfa Romeo F1 Team Stake\u00bb auftritt. Das erlaubt eine weltweite Sichtbarkeit, denn die Formel 1 tr\u00e4gt ihre Rennen rund um den Globus aus. Die zust\u00e4ndige Eidgen\u00f6ssische Spielbankenkommission habe Kenntnis von der Kooperation, sagte eine Beh\u00f6rdensprecherin auf Anfrage: \u00abDie Frage, ob darin ein Verstoss gegen das Werbeverbot f\u00fcr Gl\u00fccksspiele vorliegt, muss gegebenenfalls in einem Untersuchungsverfahren gepr\u00fcft werden.\u00bb Zu allf\u00e4llig laufenden Verfahren k\u00f6nne die Kommission indes keine Auskunft erteilen. Es ist nicht der erste grosse Werbedeal von Stake: Das Unternehmen unterst\u00fctzt den englischen Erstliga-Fussballclub Everton FC finanziell. Dar\u00fcber hinaus ist der kanadische Rapstar Drake ein Werbebotschafter. Drake ist bekannt als Hochrisikospieler. Bei einer Live-Roulettepartie im vergangenen Mai, die \u00fcber stake.com im Internet \u00fcbertragen wurde, gewann der Musiker mit einem einzigen Einsatz umgerechnet 16 Millionen Franken. Warum arbeitet Alfa-Sauber nach dem Krypto-Crash bei FTX ausgerechnet mit einem Kryptocasino zusammen? Die Motorsportpresse wundert sich deshalb: Warum arbeitet Alfa-Sauber nach dem spektakul\u00e4ren Zusammenbruch der Kryptob\u00f6rse FTX ausgerechnet mit einem Kryptocasino zusammen? Andere Formel-1-Teams haben ihre Lehren gezogen und auf die kommende Saison hin entsprechende Kooperationen beendet. Mercedes warf FTX raus, nachdem das Unternehmen f\u00fcr insolvent erkl\u00e4rt worden war. Ferrari hat sich von der Zuger Blockchain-Firma Velas getrennt. Red Bull und die Blockchain Tezos haben ihre langj\u00e4hrige Partnerschaft ebenfalls aufgegeben. Und warum holt Alfa-Sauber einen Sponsor an Bord, der bei einigen Grand Prix gar nicht werben darf? So ist es in Grossbritannien illegal, f\u00fcr Gl\u00fccksspiele zu werben und in Onlinecasinos mit Kryptow\u00e4hrungen zu zocken. Belgien wird voraussichtlich im kommenden Juni ein Werbeverbot f\u00fcr Gl\u00fccksspiele einf\u00fchren. Die Rennen in diesen beiden L\u00e4ndern geh\u00f6ren zu den prestigetr\u00e4chtigsten im Formel-1-Kalender. Alfa-Sauber liess Fragen der Redaktion zum neuen Sponsor unbeantwortet. Bei der Bekanntgabe der Zusammenarbeit mit Stake Ende Januar machte der Rennstall indes deutlich, was er sich nebst dem finanziellen Zustupf erhofft. Stake soll neue digitale Erlebnisse und Anl\u00e4sse schaffen, mit denen der Rennstall die Fangemeinde st\u00e4rker an sich binden kann. In Australien \u2013 ein weiterer Halt w\u00e4hrend der anstehenden Saison \u2013 sind Onlinecasinos seit dem Jahr 2001 ganz verboten. Umso \u00fcberraschender sind deshalb Enth\u00fcllungen des \u00abSydney Morning Herald\u00bb: Wie die australische Zeitung herausgefunden hat, befindet sich der Hauptsitz des Stake-Mutterkonzerns Medium Rare NV zwar auf Cura\u00e7ao in der Karibik. Auf diese Weise kann sich das Unternehmen den Geldw\u00e4schereigesetzen anderer L\u00e4nder entziehen, die \u00fcblicherweise das Gl\u00fccksspiel mit Kryptow\u00e4hrungen regeln. Jedoch entwickelt ein Jungunternehmen mit Sitz in Melbourne Casinospiele f\u00fcr Stake. M\u00f6glich macht das ein Schlupfloch in der australischen Gesetzgebung. Demnach ist es zul\u00e4ssig, ein Onlinecasino von Australien aus zu betreiben, solange es keine Menschen in diesem Land bedient oder in \u00abDown Under\u00bb Werbung macht. Stake nutzt auch andere Grauzonen: Clevere Spielerinnen und Spieler k\u00f6nnen Verbote mit sogenannten virtuellen privaten Netzwerken (VPN) umgehen. Mit diesen Programmen l\u00e4sst sich der Zugang zum Internet frei w\u00e4hlen, von dem aus auf ein Onlinecasino zugegriffen wird \u2013 beispielsweise ein Land, in dem diese Art von Gl\u00fccksspiel legal ist. Gem\u00e4ss der britischen Nachrichtenagentur \u00abReporter London\u00bb hat Stake im Juli 2022 mindestens 14 Websites bezahlt, die f\u00fcr die Nutzung von VPN f\u00fcr den Zugang zu den Gl\u00fccksspielangeboten warben. Millionenhaus in Australien, Millionenklage in New York. Die Recherchen des \u00abSydney Morning Herald\u00bb brachten auch die Namen der Firmengr\u00fcnder ans Tageslicht. Der Australier Edward \u00abEd\u00bb Craven und der US-Staatsb\u00fcrger Bijan Tehrani sind die K\u00f6pfe hinter dem neuen Titelsponsor von Alfa-Sauber. Craven sorgte im August 2022 f\u00fcr Schlagzeilen, weil er die teuerste Immobilie des australischen Bundesstaats Victoria kaufte. F\u00fcr das herrschaftliche Haus in Toorak, einem Stadtteil im Osten von Melbourne, bl\u00e4tterte der 28-J\u00e4hrige umgerechnet 50,5 Millionen Franken hin. Das Anwesen umfasst 7187 Quadratmeter. Dem Vernehmen nach hat Craven vor, das Geb\u00e4ude abzureissen und ein neues Anwesen zu bauen. Der Traum vom neuen Eigenheim k\u00f6nnte aber durch eine zivilrechtliche Klage in den USA getr\u00fcbt werden. Eingereicht hat sie Christopher Freeman vor einem Gericht in New York. Er sieht sich als Investor einer Vorg\u00e4ngerfirma von Stake. Freeman behauptet, er sei von den beiden Casinobetreibern davon abgehalten worden, in stake.com zu investieren. Er fordert deshalb Schadenersatz in der H\u00f6he von umgerechnet 366,1 Millionen Franken. Sollte das Gericht der Klage stattgeben, k\u00f6nnte sich das f\u00fcr Alfa-Sauber als risikoreich erweisen. Dann stellt sich n\u00e4mlich die Frage, inwiefern Stake seinen finanziellen Verpflichtungen dem Rennstall gegen\u00fcber noch nachkommen kann. ","title":"Glamour und Grauzonen: Saubers neuer Sponsor sorgt f\u00fcr Kontroversen","titleheader":"Online-Casino-Betreiber\u00a0Stake ","text_gpt4_api_keynotes_07_256":"- Neuer Titelsponsor Stake sorgt f\u00fcr Kontroversen bei Alfa Romeo (ehemals Sauber) in der Formel-1-Saison\n- M\u00f6glicher Versto\u00df gegen das Schweizer Werbeverbot f\u00fcr Gl\u00fccksspiele durch Stake-Logo auf dem Rennwagen\n- Zusammenarbeit zwischen Stake und Alfa-Sauber f\u00fcr drei Jahre geplant, Engagement auf etwa 75,5 Millionen Franken gesch\u00e4tzt","text_api_keynotes_07_256":"- Alfa-Sauber sorgt mit neuem Sponsor Stake f\u00fcr Kontroversen und m\u00f6gliche Verst\u00f6\u00dfe gegen das Werbeverbot f\u00fcr Gl\u00fccksspiele\n- Die Zusammenarbeit mit Stake ist f\u00fcr drei Jahre geplant und soll dem Rennstall finanziell helfen sowie neue digitale Erlebnisse schaffen\n- Stake nutzt Grauzonen wie VPNs und hat auch au\u00dferhalb des Motorsports negative Schlagzeilen gemacht, darunter eine Millionenklage in New York","qa_list_gpt4":["Welche m\u00f6glichen Auswirkungen hat die zivilrechtliche Klage in den USA auf die Zusammenarbeit zwischen Alfa-Sauber und Stake?\n","Die Klage f\u00fchrt dazu, dass Alfa-Sauber sofort die Zusammenarbeit mit Stake beendet.","Die Klage hat keine Auswirkungen auf die Zusammenarbeit zwischen Alfa-Sauber und Stake.","Sollte das Gericht der Klage stattgeben, k\u00f6nnte sich das f\u00fcr Alfa-Sauber als risikoreich erweisen, da Stake m\u00f6glicherweise seinen finanziellen Verpflichtungen dem Rennstall gegen\u00fcber nicht mehr nachkommen kann."],"flesch":[41.75,41.95,40.25,35.7,39.85,60.3],"text_gpt4_api_normal_words_05_512":"\u00dcberraschung in Berlin: Die SPD wechselt die Seite und geht eine Koalition mit der CDU ein, anstatt das erwartete Linksb\u00fcndnis fortzusetzen. Franziska Giffey, bisherige B\u00fcrgermeisterin von Berlin, opfert daf\u00fcr ihr Amt. Die Entscheidung folgt auf die Wiederholungswahl in Berlin, bei der die regierenden Sozialdemokraten, Gr\u00fcnen und Linken verloren, w\u00e4hrend die CDU spektakul\u00e4r gewann. Giffey stand der CDU politisch n\u00e4her als der Linkspartei und bereitete insgeheim den Seitenwechsel zur CDU vor. Die Berliner Gr\u00fcnen machten es Giffey leicht, indem sie ihrer linken Klientelpolitik treu blieben und die SPD in Sondierungsgespr\u00e4chen vor den Kopf stie\u00dfen. Die SPD erkannte, dass das Vertrauen zu Gr\u00fcnen und Linken in Berlin aufgebraucht ist. Gr\u00fcne und Linke reagierten entsetzt auf den Seitenwechsel der SPD. Giffey muss nun ihre Partei von dem Schritt in die Gro\u00dfe Koalition \u00fcberzeugen. Der neue Regierende B\u00fcrgermeister wird voraussichtlich der 50-j\u00e4hrige Kai Wegner von der CDU sein. Die \u00fcberraschende Rochade in Berlin sendet politische Signale ins ganze Land und zeigt zunehmende Rivalit\u00e4t zwischen SPD und Gr\u00fcnen.","frage_antwort":["Wer sorgt f\u00fcr Kontroversen?","Saubers","Edward","Bijan Tehrani"]},{"_id":"6429805aa9d504ce92eb613d","aid":578694082816,"date":"2023-03-06T10:42:48","author":"Beatrice B\u00f6siger","categoryName":"Wirtschaft","premium":false,"readingTime":180.0,"wordCount":549.0,"url":"https:\/\/www.tagesanzeiger.ch\/langjaehriger-aktionaer-laesst-kein-gutes-haar-am-fuehrungsduo-der-credit-suisse-578694082816","own":"CS verliert langj\u00e4hrigen Grossaktion\u00e4r. Er l\u00e4sst kein gutes Haar am F\u00fchrungsduo der Credit Suisse. Paukenschlag bei der taumelnden Bank: Finanzinvestor Harris Associates verkauft s\u00e4mtliche Aktien. Das ist kein gutes Zeugnis f\u00fcr Ulrich K\u00f6rner und Axel Lehmann. David Herro, Anlagechef beim Finanzinvestor Harris Associates, sieht wenig Chancen f\u00fcr die Strategie von Credit-Suisse-Chef Ulrich K\u00f6rner und Pr\u00e4sident Axel Lehmann. Neuer Paukenschlag bei der Credit Suisse: Einer der wichtigsten Aktion\u00e4re verliert die Geduld mit der Bank. Der US-Finanzinvestor Harris Associates hat s\u00e4mtliche Aktien der Grossbank verkauft. Investmentbank sorgt f\u00fcr Frust. Dass Harris Associates aussteigt, ist ein schwerer Schlag f\u00fcr die Credit Suisse und kein gutes Zeugnis f\u00fcr die Umbaupl\u00e4ne, die das Management im Oktober vorgestellt hat. Jetzt dominieren Aktion\u00e4re aus dem Nahen Osten. Harris Associates hat zum ersten Mal im Jahr 2002 Aktien der Credit Suisse gekauft. Das Aktionariat der Credit Suisse wird nun von Investoren aus dem Nahen Osten dominiert. ","lexrank_sumy":"Paukenschlag bei der taumelnden Bank: Finanzinvestor Harris Associates verkauft s\u00e4mtliche Aktien. Das ist kein gutes Zeugnis f\u00fcr Ulrich K\u00f6rner und Axel Lehmann. Neuer Paukenschlag bei der Credit Suisse: Einer der wichtigsten Aktion\u00e4re verliert die Geduld mit der Bank. Nach dem drastischen Abfluss von Kundengeldern im vergangenen Jahr sei die Zukunft der Bank fraglich, sagte David Herro, Anlagechef von Harris Associates, zur \u00abFinancial Times\u00bb. W\u00f6rtlich: \u00abWir halten den Plan zur Restrukturierung der Investmentbank zwar f\u00fcr ein hehres Ziel, aber f\u00fcr schwerf\u00e4llig und \u2013 wenn man die Geldverbrennung anschaut \u2013 f\u00fcr weitaus teurer als erwartet.\u00bb (Mehr dazu: Horrorjahr der Schweizer Bank: CS-Aktie st\u00fcrzt um 15 Prozent ab). Dass Harris Associates aussteigt, ist ein schwerer Schlag f\u00fcr die Credit Suisse und kein gutes Zeugnis f\u00fcr die Umbaupl\u00e4ne, die das Management im Oktober vorgestellt hat. Harris Associates hat zum ersten Mal im Jahr 2002 Aktien der Credit Suisse gekauft. Damals lag der Aktienkurs bei weniger als 30 Franken. Damals lag der Kurs bei rund 23 Franken. Anfang dieses Jahres kostete eine Aktie der Grossbank noch rekordtiefe 2,57 Franken, derzeit steht sie bei 2,76 Franken. Das Aktionariat der Credit Suisse wird nun von Investoren aus dem Nahen Osten dominiert. Die Saudi National Bank ist im Zug einer Kapitalerh\u00f6hung im vergangenen Jahr mit rund 10 Prozent eingestiegen. ","text_api_simple_words_07_512":"Ein wichtiger Aktion\u00e4r der Credit Suisse, Harris Associates, hat alle seine Aktien verkauft, da er wenig Vertrauen in die Strategie des F\u00fchrungsteams hat. Harris Associates kritisiert besonders die Investmentbank und die hohen Kosten der Abspaltung. Die Credit Suisse steckt in einer gro\u00dfen Krise, da Kunden im letzten Jahr Milliarden von der Bank abgezogen haben und es auch dieses Jahr einen Verlust geben wird. Investoren aus dem Nahen Osten dominieren nun das Aktionariat der Bank.","text_api_normal_words_05_512":"Der US-Finanzinvestor Harris Associates hat s\u00e4mtliche Aktien der Credit Suisse verkauft und damit seine Geduld mit der Bank verloren. Der Anlagechef von Harris Associates, David Herro, sieht wenig Chancen f\u00fcr die Strategie von Credit-Suisse-Chef Ulrich K\u00f6rner und Pr\u00e4sident Axel Lehmann. Besonders die Investmentbank sorgt f\u00fcr Frustration bei Herro, da sie in seinen Augen zu wenig transparent und zu teuer ist. Das Ausscheiden von Harris Associates ist ein schwerer Schlag f\u00fcr die Credit Suisse und kein gutes Zeugnis f\u00fcr die Umbaupl\u00e4ne, die das Management im Oktober vorgestellt hat. Das Aktionariat der Credit Suisse wird nun von Investoren aus dem Nahen Osten dominiert.","text_api_child_09_350":"Die Credit Suisse (eine Bank) hat einen wichtigen Aktion\u00e4r verloren. Das bedeutet, dass jemand, der viele Aktien der Bank hatte, diese verkauft hat. Der Aktion\u00e4r hie\u00df Harris Associates und hat gesagt, dass er nicht glaubt, dass die Chefs der Bank gute Entscheidungen treffen. Vor allem die Abteilung Investmentbank findet er schlecht und teuer. Viele Kunden haben im letzten Jahr ihr Geld von der Bank weggenommen. Deswegen steckt die Bank in Schwierigkeiten und macht Verluste. Andere Investoren aus dem Nahen Osten haben jetzt mehr Aktien von der Credit Suisse.","text_api_keynotes_07_350":"1. Der Finanzinvestor Harris Associates hat s\u00e4mtliche Aktien der Credit Suisse verkauft und damit seinen langj\u00e4hrigen Status als Grossaktion\u00e4r verloren.\n2. David Herro, Anlagechef bei Harris Associates, hat \u00f6ffentlich Kritik an der Strategie von Credit-Suisse-Chef Ulrich K\u00f6rner und Pr\u00e4sident Axel Lehmann ge\u00e4u\u00dfert und sieht wenig Chancen f\u00fcr die Zukunft der Bank.\n3. Insbesondere die Investmentbank sorgt f\u00fcr Frustration bei Harris Associates, da sie als schwerf\u00e4llig und zu teuer angesehen wird.\n4. Der Ausstieg von Harris Associates ist ein schwerer Schlag f\u00fcr die Credit Suisse und ein schlechtes Zeugnis f\u00fcr die Umbaupl\u00e4ne des Managements.\n5. Das Aktionariat der Credit Suisse wird nun von Investoren aus dem Nahen Osten dominiert, wobei die Saudi National Bank, der Staatsfonds aus dem Emirat Katar und die Olayan-Gruppe aus Saudiarabien die gr\u00f6ssten Anteile halten.","text_davinci_api_key_07_256":"1. Der US-Finanzinvestor Harris Associates hat s\u00e4mtliche Aktien der Credit Suisse verkauft, was einen schweren Schlag f\u00fcr die Bank darstellt. \n2. David Herro, Anlagechef von Harris Associates, ist nicht vom Erfolg der neuen Strategie von Bankchef Ulrich K\u00f6rner und Verwaltungsratspr\u00e4sident Axel Lehmann \u00fcberzeugt. \n3. Jetzt dominieren Investoren aus dem Nahen Osten das Aktionariat der Credit Suisse: Saudi National Bank, Staatsfonds aus Katar und Olayan-Gruppe aus Saudiarabien.","five_letter_word_list":["l\u00e4sst","gutes","david","herro","sieht","wenig","neuer","einer","sagte","times","darum","frage","warum","etwas","sorgt","frust","nicht","neuen","sorge","einen","davon","first","einem","firma","ihres","klein","hohen","zudem","punkt","waren","ihren","hielt","jahre","unter","krise","haben","lesen","getan","jetzt","nahen","osten","seine","aktie","steht","saudi","katar"],"qa_list":["Wer hat s\u00e4mtliche Aktien der Credit Suisse verkauft?","Die Saudi National Bank","Der Staatsfonds aus dem Emirat Katar","Der Finanzinvestor Harris Associates"],"lead":"Paukenschlag bei der taumelnden Bank: Finanzinvestor Harris Associates verkauft s\u00e4mtliche Aktien. Das ist kein gutes Zeugnis f\u00fcr Ulrich K\u00f6rner und Axel Lehmann.","originaltext":"CS verliert langj\u00e4hrigen Grossaktion\u00e4r Er l\u00e4sst kein gutes Haar am F\u00fchrungsduo der Credit Suisse. Paukenschlag bei der taumelnden Bank: Finanzinvestor Harris Associates verkauft s\u00e4mtliche Aktien. Das ist kein gutes Zeugnis f\u00fcr Ulrich K\u00f6rner und Axel Lehmann. David Herro, Anlagechef beim Finanzinvestor Harris Associates, sieht wenig Chancen f\u00fcr die Strategie von Credit-Suisse-Chef Ulrich K\u00f6rner und Pr\u00e4sident Axel Lehmann. Neuer Paukenschlag bei der Credit Suisse: Einer der wichtigsten Aktion\u00e4re verliert die Geduld mit der Bank. Der US-Finanzinvestor Harris Associates hat s\u00e4mtliche Aktien der Grossbank verkauft. Nach dem drastischen Abfluss von Kundengeldern im vergangenen Jahr sei die Zukunft der Bank fraglich, sagte David Herro, Anlagechef von Harris Associates, zur \u00abFinancial Times\u00bb. Banken in Europa w\u00fcrden von den steigenden Zinsen profitieren, darum stelle er sich die Frage: \u00abWarum sollte man in etwas investieren, das Kapital verbrennt, wenn der Rest des Sektors es erzeugt?\u00bb Investmentbank sorgt f\u00fcr Frust. Herro ist nicht vom Erfolg der neuen Strategie von Bankchef Ulrich K\u00f6rner und Verwaltungsratspr\u00e4sident Axel Lehmann \u00fcberzeugt. F\u00fcr Frustration sorge besonders die Investmentbank. Einen grossen Teil davon lagert die Grossbank in die neue CS First Boston aus. Dazu hat sie in einem umstrittenen Kauf f\u00fcr 175 Millionen Dollar die Firma ihres ehemaligen Verwaltungsratsmitglieds Michael Klein erworben und ihn an die Spitze des Gebildes gesetzt. Herro kritisiert die fehlende Transparenz und die hohen Kosten der Abspaltung. W\u00f6rtlich: \u00abWir halten den Plan zur Restrukturierung der Investmentbank zwar f\u00fcr ein hehres Ziel, aber f\u00fcr schwerf\u00e4llig und \u2013 wenn man die Geldverbrennung anschaut \u2013 f\u00fcr weitaus teurer als erwartet.\u00bb (Mehr dazu: Horrorjahr der Schweizer Bank: CS-Aktie st\u00fcrzt um 15 Prozent ab). Zudem habe der als zweiter Punkt des Umbaus eingeleitete Verkauf der Verbriefungsplattform an den Finanzinvestor Apollo weniger als erwartet eingebracht. \u00abWir waren auch nicht zufrieden mit dem, was wir an Erl\u00f6sen aus dem Verkauf von verbrieften Produkten erhielten.\u00bb Die Grossbank selbst sagte gegen\u00fcber der \u00abFinancial Times\u00bb, dass sie bei ihren Umbaupl\u00e4nen rascher vorankommt als geplant. Zu Spitzenzeiten hielt die Anlagegesellschaft rund 10 Prozent der CS-Aktien. Dass Harris Associates aussteigt, ist ein schwerer Schlag f\u00fcr die Credit Suisse und kein gutes Zeugnis f\u00fcr die Umbaupl\u00e4ne, die das Management im Oktober vorgestellt hat. \u00dcber Jahre hinweg geh\u00f6rte die Anlagegesellschaft zu ihren wichtigsten Aktion\u00e4ren. Zu Spitzenzeiten im vergangenen Jahr hielt sie rund 10 Prozent der Aktien, Ende Jahr senkte sie den Anteil auf 5 Prozent und danach auf etwa 3 Prozent. Anfang dieses Jahres fiel der Aktienanteil gem\u00e4ss der B\u00f6rsenbetreiberin SIX unter die Schwelle von drei Prozent. Nach Verlusten und verschiedenen Skandalen steckt die Bank in einer grossen Krise. Alleine im vierten Quartal des vergangenen Jahres haben Kundinnen und Kunden Gelder im Umfang von 110,5 Milliarden Franken von der Grossbank abgezogen. Im laufenden Jahr soll ebenfalls ein \u00aberheblicher\u00bb Verlust resultieren, wie Ulrich K\u00f6rner bei Bekanntgabe des Jahresergebnisses sagte. (Lesen Sie unseren Kommentar: Was haben die CS-Chefs in den letzten zwei Jahren eigentlich getan?). Jetzt dominieren Aktion\u00e4re aus dem Nahen Osten Harris Associates hat zum ersten Mal im Jahr 2002 Aktien der Credit Suisse gekauft. Damals lag der Aktienkurs bei weniger als 30 Franken. Vor der Finanzkrise 2008 verkaufte der Finanzinvestor alle seine Anteile bei einem Aktienkurs zwischen 60 und 70 Franken mit Gewinn. Beim zweiten Mal strich er allerdings einen grossen Verlust ein. 2009 kaufte Harris Associates erneut Credit-Suisse-Aktien. Damals lag der Kurs bei rund 23 Franken. Seit damals hat Harris verschiedentlich Aktien der Grossbank gekauft und verkauft. Anfang dieses Jahres kostete eine Aktie der Grossbank noch rekordtiefe 2,57 Franken, derzeit steht sie bei 2,76 Franken. Das Aktionariat der Credit Suisse wird nun von Investoren aus dem Nahen Osten dominiert. Die Saudi National Bank ist im Zug einer Kapitalerh\u00f6hung im vergangenen Jahr mit rund 10 Prozent eingestiegen. Der Staatsfonds aus dem Emirat Katar h\u00e4lt 7 Prozent, die Olayan-Gruppe aus Saudiarabien h\u00e4lt 5 Prozent. ","title":"Er l\u00e4sst kein gutes Haar am F\u00fchrungsduo der Credit Suisse","titleheader":"CS verliert langj\u00e4hrigen Grossaktion\u00e4r\u00a0","text_gpt4_api_keynotes_07_256":"- US-Finanzinvestor Harris Associates verkauft s\u00e4mtliche Aktien der Credit Suisse\n- Anlagechef David Herro sieht wenig Chancen f\u00fcr die Strategie von Credit-Suisse-Chef Ulrich K\u00f6rner und Pr\u00e4sident Axel Lehmann\n- Die Zukunft der Bank ist fraglich, da Kundengelder abflie\u00dfen und die neue Strategie nicht \u00fcberzeugt","text_api_keynotes_07_256":"- Der Finanzinvestor Harris Associates verkauft s\u00e4mtliche Aktien der Credit Suisse und l\u00e4sst kein gutes Haar am F\u00fchrungsduo Ulrich K\u00f6rner und Axel Lehmann.\n- Harris Associates sieht wenig Chancen f\u00fcr die Strategie der Grossbank und kritisiert vor allem die fehlende Transparenz und hohen Kosten der Abspaltung der Investmentbank.\n- Nach dem drastischen Abfluss von Kundengeldern im vergangenen Jahr und verschiedenen Skandalen steckt die Bank in einer grossen Krise und wird nun von Investoren aus dem Nahen Osten dominiert.","qa_list_gpt4":["Was ist der Hauptgrund, warum Harris Associates seine Aktien der Credit Suisse verkauft hat?","Sie waren mit der Dividendenpolitik unzufrieden.","Sie glauben, dass die Bank zu schnell w\u00e4chst.","Sie sind nicht von der Strategie von Bankchef Ulrich K\u00f6rner und Verwaltungsratspr\u00e4sident Axel Lehmann \u00fcberzeugt."],"flesch":[53.05,56.55,58.6,50.35,48.65,67.95],"text_gpt4_api_normal_words_05_512":"Der US-Finanzinvestor Harris Associates hat seine gesamten Aktien der Credit Suisse verkauft und damit seine Geduld mit der Bank verloren. David Herro, Anlagechef von Harris Associates, \u00e4u\u00dferte Zweifel an der Strategie von Credit-Suisse-Chef Ulrich K\u00f6rner und Pr\u00e4sident Axel Lehmann. Er kritisierte insbesondere die fehlende Transparenz und die hohen Kosten der Abspaltung der Investmentbank. Harris Associates war \u00fcber Jahre hinweg einer der wichtigsten Aktion\u00e4re der Credit Suisse. Die Bank steckt nach Verlusten und verschiedenen Skandalen in einer gro\u00dfen Krise. Das Aktionariat der Credit Suisse wird nun von Investoren aus dem Nahen Osten dominiert, darunter die Saudi National Bank, der Staatsfonds aus dem Emirat Katar und die Olayan-Gruppe aus Saudi-Arabien.","frage_antwort":["Wer kritisiert die fehlende Transparenz und die hohen Kosten der Abspaltung?","Herro","David Herro","Axel Lehmann Michael Klein"]},{"_id":"6429805aa9d504ce92eb6148","aid":516028445112,"date":"2023-03-06T04:51:48","author":"Pietro Supino","categoryName":"Schweiz","premium":false,"readingTime":240.0,"wordCount":807.0,"url":"https:\/\/www.tagesanzeiger.ch\/sehr-geehrte-leserinnen-und-leser-516028445112","own":"In eigener Sache. Sehr geehrte Leserinnen und Leser. Heute \u00fcbernimmt mit Raphaela Birrer eine Vertreterin der n\u00e4chsten Generation die Geschicke des \u00abTages-Anzeigers\u00bb. Generationenwechsel in der F\u00fchrungsetage: Raphaela Birrer, die ehemalige Chefin des Inlandressorts, l\u00f6st Arthur Rutishauser ab. Gleichzeitig \u00fcbernimmt unter der neuen Chefredaktorin Raphaela Birrer die n\u00e4chste Generation die Verantwortung f\u00fcr den \u00abTages-Anzeiger\u00bb, bei dem die \u00fcberregionalen Kompetenzen geb\u00fcndelt werden. So haben wir vor acht Jahren die Redaktionen des \u00abTages-Anzeigers\u00bb und der \u00abSonntagsZeitung\u00bb zusammengef\u00fchrt. Von der Zeitung zum digitalen Medienangebot. Mit Raphaela Birrer \u00fcbernimmt eine ausgezeichnete F\u00fchrungskraft der n\u00e4chsten Generation die Leitung der neu aufgestellten Redaktion. Nun \u00fcbernimmt der \u00abTages-Anzeiger\u00bb diese \u00fcberregionalen Aufgaben. Mit Raphaela Birrer \u00fcbernimmt eine ausgezeichnete F\u00fchrungskraft der n\u00e4chsten Generation die Leitung der neu aufgestellten Redaktion des \u00abTages-Anzeigers\u00bb. Arthur Rutishauser pr\u00e4gte die letzten zehn Jahre. Als Chefredaktor hat Arthur Rutishauser die positive Entwicklung des publizistischen Angebots von Tamedia in den letzten zehn Jahren gepr\u00e4gt. Der journalistische Anspruch bleibt derselbe. Vor allem hoffe ich, dass alle unsere Journalistinnen und Journalisten gemeinsam Ihnen, liebe Leserinnen und Leser, ein Lesevergn\u00fcgen bieten k\u00f6nnen, das Ihre Erwartungen t\u00e4glich erf\u00fcllt und immer wieder mit positiven \u00dcberraschungen \u00fcbertrifft. ","lexrank_sumy":"Heute \u00fcbernimmt mit Raphaela Birrer eine Vertreterin der n\u00e4chsten Generation die Geschicke des \u00abTages-Anzeigers\u00bb. Generationenwechsel in der F\u00fchrungsetage: Raphaela Birrer, die ehemalige Chefin des Inlandressorts, l\u00f6st Arthur Rutishauser ab. Gleichzeitig \u00fcbernimmt unter der neuen Chefredaktorin Raphaela Birrer die n\u00e4chste Generation die Verantwortung f\u00fcr den \u00abTages-Anzeiger\u00bb, bei dem die \u00fcberregionalen Kompetenzen geb\u00fcndelt werden. Sie folgt auf Arthur Rutishauser, der sich in Zukunft auf die \u00abSonntagsZeitung\u00bb und auf seine Autorent\u00e4tigkeit konzentriert. Priska Amstutz und Mario St\u00e4uble geben die F\u00fchrung im regionalen Bereich ab und \u00fcbernehmen neue Aufgaben. In der \u00fcberregionalen Berichterstattung und f\u00fcr die Schaffung von Mehrwerten zu den Themen des Lebens sowie bei der digitalen Entwicklung ist eine B\u00fcndelung der Kr\u00e4fte notwendig. Neue Formen der Publizistik und neue technologische M\u00f6glichkeiten gewinnen an Bedeutung; sie bieten Chancen in der Transformation der traditionellen Zeitung zu einem digitalen Medienangebot. Mit Raphaela Birrer \u00fcbernimmt eine ausgezeichnete F\u00fchrungskraft der n\u00e4chsten Generation die Leitung der neu aufgestellten Redaktion. Auf der einen Seite bietet sich die Weiterentwicklung der Organisation an, weil der \u00abTages-Anzeiger\u00bb sich \u00fcber den Z\u00fcrcher Heimmarkt hinaus als nationales Leitmedium etabliert hat. Neben dem Verbund der \u00abBerner Zeitung\u00bb und der \u00abBasler Zeitung\u00bb bildet dieser unter der Leitung von Benjamin Geiger eine der drei Regionalredaktionen von Tamedia in der Deutschschweiz. Als Chefredaktor hat Arthur Rutishauser die positive Entwicklung des publizistischen Angebots von Tamedia in den letzten zehn Jahren gepr\u00e4gt. F\u00fcr seine bemerkenswerten Leistungen danke ich Arthur Rutishauser an dieser Stelle im Namen des Verwaltungsrats und der Gesch\u00e4ftsleitung von Tamedia sowie im Namen meiner Familie als Hauptaktion\u00e4rin der TX Group, zu deren Herz Tamedia geh\u00f6rt. Wir freuen uns auf sein fortw\u00e4hrendes Wirken als Vollblutjournalist und als Chefredaktor der \u00abSonntagsZeitung\u00bb, die sich unter seiner F\u00fchrung erfolgreich entwickelt hat und weiter gest\u00e4rkt werden soll. Vor allem hoffe ich, dass alle unsere Journalistinnen und Journalisten gemeinsam Ihnen, liebe Leserinnen und Leser, ein Lesevergn\u00fcgen bieten k\u00f6nnen, das Ihre Erwartungen t\u00e4glich erf\u00fcllt und immer wieder mit positiven \u00dcberraschungen \u00fcbertrifft. ","text_api_simple_words_07_512":"Eine neue Generation \u00fcbernimmt die Leitung des \"Tages-Anzeigers\". Raphaela Birrer ersetzt Arthur Rutishauser als Chefredakteurin. Die Redaktionen von Tamedia in der deutschen Schweiz werden neu strukturiert, um sich besser an die Digitalisierung anzupassen. Die \"SonntagsZeitung\" bleibt bestehen, aber der Fokus liegt nun auf einem digitalen Medienangebot. Die Redaktion des \"Tages-Anzeigers\" wird ebenfalls weiterentwickelt. Der Z\u00fcrcher Lokal- und Regionalteil wird vom Z\u00fcrcher Zeitungsverbund verantwortet. Arthur Rutishauser, der in den letzten zehn Jahren als Chefredakteur t\u00e4tig war, wird sich nun auf die \"SonntagsZeitung\" und seine Autorent\u00e4tigkeit konzentrieren. Der journalistische Anspruch bleibt derselbe.","text_api_normal_words_05_512":"Raphaela Birrer \u00fcbernimmt als neue Chefredakteurin des \"Tages-Anzeigers\" die Verantwortung f\u00fcr die \u00fcberregionalen Kompetenzen, w\u00e4hrend Arthur Rutishauser sich auf die \"SonntagsZeitung\" und seine Autorent\u00e4tigkeit konzentriert. Die neue Struktur der Redaktionen von Tamedia in der deutschen Schweiz tritt ebenfalls in Kraft. Die \u00fcbernommenen Zeitungen mit starker regionaler Verankerung in Basel, im Kanton Bern und in der Z\u00fcrcher Landschaft profitieren von der St\u00e4rke der Gesamtorganisation. Die Redaktion des \"Tages-Anzeigers\" wird klarer ausgerichtet und die Marke gest\u00e4rkt. Der journalistische Anspruch bleibt derselbe.","text_api_child_09_350":"Liebe Kinder, der \"Tages-Anzeiger\" hat eine neue Chefredakteurin bekommen. Ihr Name ist Raphaela Birrer. Sie ist von der n\u00e4chsten Generation und \u00fcbernimmt jetzt die Verantwortung f\u00fcr die Zeitung. Das bedeutet, dass sie jetzt das Sagen hat. Arthur Rutishauser, der Chefredakteur vorher, wird sich nun auf seine Arbeit f\u00fcr die \"SonntagsZeitung\" konzentrieren. Es gibt auch andere Ver\u00e4nderungen in der Zeitung, weil sich die Art und Weise, wie wir Nachrichten lesen, ver\u00e4ndert hat. Viele Leute lesen heute Nachrichten auf ihren Handys oder Computern. Deshalb m\u00fcssen sich auch Zeitungen anpassen und mehr Inhalte online ver\u00f6ffentlichen. Das ist eine gro\u00dfe Ver\u00e4nderung. Aber trotzdem bleiben bestimmte Bereiche der Zeitung wichtig, zum Beispiel die lokale Nachrichten. Die \"Tages-Anzeiger\" arbeitet jetzt auch mit anderen Zeitungen zusammen, um die Berichterstattung zu verbessern. Wir hoffen, dass ihr weiterhin viel Spa\u00df beim Lesen der Zeitung habt und wir euch jeden Tag mit interessanten Nachrichten \u00fcberraschen k\u00f6nnen.","text_api_keynotes_07_350":"1. Mit Raphaela Birrer \u00fcbernimmt eine Vertreterin der n\u00e4chsten Generation die Geschicke des \u00abTages-Anzeigers\u00bb.\n2. Die neue Redaktionsstruktur von Tamedia in der deutschen Schweiz tritt heute in Kraft.\n3. Die \u00fcberregionalen Kompetenzen werden beim \u00abTages-Anzeiger\u00bb geb\u00fcndelt und von der n\u00e4chsten Generation unter der neuen Chefredaktorin Raphaela Birrer \u00fcbernommen.\n4. Arthur Rutishauser konzentriert sich k\u00fcnftig auf die \u00abSonntagsZeitung\u00bb und seine Autorent\u00e4tigkeit.\n5. Trotz Ver\u00e4nderungen in der Medienwelt bleibt der journalistische Anspruch derselbe.","text_davinci_api_key_07_256":"1. Mit Raphaela Birrer \u00fcbernimmt die n\u00e4chste Generation die Verantwortung f\u00fcr den \u00abTages-Anzeiger\u00bb: Arthur Rutishauser, Priska Amstutz und Mario St\u00e4uble \u00fcbernehmen neue Aufgaben. \n2. Der \u00abTages-Anzeiger\u00bb bietet die Weiterentwicklung der Organisation, um sich als nationales Leitmedium zu etablieren. \n3. Arthur Rutishauser hat Tamedia in den letzten 10 Jahren gepr\u00e4gt und seine Schaffenskraft als Vorbild hinterlassen.","five_letter_word_list":["sache","leser","heute","tritt","kraft","unter","neuen","folgt","seine","mario","geben","haben","tagen","woche","ihren","platz","ihrem","sowie","einem","einer","darum","basel","daf\u00fcr","wurde","daten","sport","leben","diese","einen","seite","blick","ihres","damit","marke","neben","jahre","stets","danke","namen","group","deren","teils","hause","allem","hoffe","ihnen","liebe","immer"],"qa_list":["Wer \u00fcbernimmt die Leitung der neu aufgestellten Redaktion des \"Tages-Anzeigers\"? ","Arthur Rutishauser ","Priska Amstutz ","Raphaela Birrer"],"lead":"Heute \u00fcbernimmt mit Raphaela Birrer eine Vertreterin der n\u00e4chsten Generation die Geschicke des \u00abTages-Anzeigers\u00bb.","originaltext":"In eigener Sache. Sehr geehrte Leserinnen und Leser Heute \u00fcbernimmt mit Raphaela Birrer eine Vertreterin der n\u00e4chsten Generation die Geschicke des \u00abTages-Anzeigers\u00bb. Generationenwechsel in der F\u00fchrungsetage: Raphaela Birrer, die ehemalige Chefin des Inlandressorts, l\u00f6st Arthur Rutishauser ab.  Mit dem heutigen Tag tritt die angek\u00fcndigte neue Struktur der Redaktionen von Tamedia in der deutschen Schweiz in Kraft. Gleichzeitig \u00fcbernimmt unter der neuen Chefredaktorin Raphaela Birrer die n\u00e4chste Generation die Verantwortung f\u00fcr den \u00abTages-Anzeiger\u00bb, bei dem die \u00fcberregionalen Kompetenzen geb\u00fcndelt werden. Sie folgt auf Arthur Rutishauser, der sich in Zukunft auf die \u00abSonntagsZeitung\u00bb und auf seine Autorent\u00e4tigkeit konzentriert. Priska Amstutz und Mario St\u00e4uble geben die F\u00fchrung im regionalen Bereich ab und \u00fcbernehmen neue Aufgaben. Die grossen Ver\u00e4nderungen in der Medienwelt stellen bew\u00e4hrte Strukturen infrage und erfordern von Zeit zu Zeit organisatorische Anpassungen. So haben wir vor acht Jahren die Redaktionen des \u00abTages-Anzeigers\u00bb und der \u00abSonntagsZeitung\u00bb zusammengef\u00fchrt. Mit der absehbaren Verlagerung des Medienkonsums auf die digitalen Kan\u00e4le geht die Erwartung einher, das Zeitgeschehen an sieben Tagen in der Woche rund um die Uhr abzudecken. Trotzdem hat die \u00abSonntagsZeitung\u00bb ihren besonderen Platz erhalten k\u00f6nnen. In gedruckter Form erfreut sie sich mit ihrem eigenen Charakter und ihrem reichen Angebot weiterhin grosser Beliebtheit. Von der Zeitung zum digitalen Medienangebot. In der \u00fcberregionalen Berichterstattung und f\u00fcr die Schaffung von Mehrwerten zu den Themen des Lebens sowie bei der digitalen Entwicklung ist eine B\u00fcndelung der Kr\u00e4fte notwendig. Neue Formen der Publizistik und neue technologische M\u00f6glichkeiten gewinnen an Bedeutung; sie bieten Chancen in der Transformation der traditionellen Zeitung zu einem digitalen Medienangebot. Es braucht eine kritische Gr\u00f6sse, um den vielf\u00e4ltigen Anforderungen der Leserschaft gerecht zu werden und in einer globalisierten Medienwelt mit den international f\u00fchrenden Marken mitzuhalten. Ausgehend vom \u00abTages-Anzeiger\u00bb hat Tamedia darum in den letzten 15 Jahren massiv in den Ausbau des Portefeuilles und in die journalistische Wertsch\u00f6pfung investiert. Die \u00fcbernommenen Zeitungen mit starker regionaler Verankerung in Basel, im Kanton Bern und in der Z\u00fcrcher Landschaft profitieren von der St\u00e4rke der Gesamtorganisation. Daf\u00fcr wurde die zentrale Redaktion Tamedia mit den Ressorts Schweiz, Wirtschaft, International, Recherchedesk, Daten &amp; Interaktiv, Sport, Leben, Gesellschaft, Kultur, Service und Wissen geschaffen. Das \u00abMagazin\u00bb und die \u00abSonntagsZeitung\u00bb als nationale Angebote geh\u00f6rten ebenfalls dazu. Mit Raphaela Birrer \u00fcbernimmt eine ausgezeichnete F\u00fchrungskraft der n\u00e4chsten Generation die Leitung der neu aufgestellten Redaktion. Nun \u00fcbernimmt der \u00abTages-Anzeiger\u00bb diese \u00fcberregionalen Aufgaben. Auf der einen Seite bietet sich die Weiterentwicklung der Organisation an, weil der \u00abTages-Anzeiger\u00bb sich \u00fcber den Z\u00fcrcher Heimmarkt hinaus als nationales Leitmedium etabliert hat. Auf der anderen Seite ist mit Blick auf eine zunehmend digitale Zukunft eine Vereinfachung und Neuausrichtung der Organisation notwendig. Im letzten Jahr hat die Redaktion wichtige Grundlagen f\u00fcr die Weiterentwicklung ihres Angebots erarbeitet, die nun schrittweise eingef\u00fchrt werden. Damit wird die Ausrichtung der Redaktion klarer und die Marke \u00abTages-Anzeiger\u00bb gest\u00e4rkt. Mit Raphaela Birrer \u00fcbernimmt eine ausgezeichnete F\u00fchrungskraft der n\u00e4chsten Generation die Leitung der neu aufgestellten Redaktion des \u00abTages-Anzeigers\u00bb. Der Z\u00fcrcher Lokal- und Regionalteil im Blauen Bund wird weiterhin zusammen mit der \u00abZ\u00fcrichsee-Zeitung\u00bb, dem Winterthurer \u00abLandboten\u00bb und dem \u00abZ\u00fcrcher Unterl\u00e4nder\u00bb vom Z\u00fcrcher Zeitungsverbund verantwortet. Neben dem Verbund der \u00abBerner Zeitung\u00bb und der \u00abBasler Zeitung\u00bb bildet dieser unter der Leitung von Benjamin Geiger eine der drei Regionalredaktionen von Tamedia in der Deutschschweiz. Arthur Rutishauser pr\u00e4gte die letzten zehn Jahre. Als Chefredaktor hat Arthur Rutishauser die positive Entwicklung des publizistischen Angebots von Tamedia in den letzten zehn Jahren gepr\u00e4gt. Das R\u00fcstzeug f\u00fcr diese strategische Aufgabe hat er sich mit einer mehrmonatigen Ausbildung auf dem Gebiet Datenanalyse und Programmieren an der Columbia School of Journalism in New York geholt. Mit seiner Neugier sowie seinem Mut hat er Tamedia auf einen zukunftstr\u00e4chtigen Weg gebracht. Mit seiner Schaffenskraft ist er neben der Erf\u00fcllung einer sehr anspruchsvollen F\u00fchrungsaufgabe stets ein grosses journalistisches Vorbild geblieben. F\u00fcr seine bemerkenswerten Leistungen danke ich Arthur Rutishauser an dieser Stelle im Namen des Verwaltungsrats und der Gesch\u00e4ftsleitung von Tamedia sowie im Namen meiner Familie als Hauptaktion\u00e4rin der TX Group, zu deren Herz Tamedia geh\u00f6rt. Wir freuen uns auf sein fortw\u00e4hrendes Wirken als Vollblutjournalist und als Chefredaktor der \u00abSonntagsZeitung\u00bb, die sich unter seiner F\u00fchrung erfolgreich entwickelt hat und weiter gest\u00e4rkt werden soll. Der journalistische Anspruch bleibt derselbe. Dank geb\u00fchrt auch Priska Amstutz und Mario St\u00e4uble f\u00fcr die F\u00fchrung des Z\u00fcrcher Teils des \u00abTages-Anzeigers\u00bb, der gerade in den vergangenen Monaten Massst\u00e4be f\u00fcr gut gemachten Regionaljournalismus gesetzt hat. Priska Amstutz wird ein strategisches Projekt im Hause leiten, w\u00e4hrend Mario St\u00e4uble die F\u00fchrung des zentralen Inlandressorts \u00fcbernimmt. Den genannten F\u00fchrungskr\u00e4ften w\u00fcnsche ich weiterhin viel Erfolg. Vor allem hoffe ich, dass alle unsere Journalistinnen und Journalisten gemeinsam Ihnen, liebe Leserinnen und Leser, ein Lesevergn\u00fcgen bieten k\u00f6nnen, das Ihre Erwartungen t\u00e4glich erf\u00fcllt und immer wieder mit positiven \u00dcberraschungen \u00fcbertrifft. Das ist unsere Ambition. Ich danke Ihnen f\u00fcr Ihre Verbundenheit und f\u00fcr Ihr Interesse. ","title":"Sehr geehrte Leserinnen und Leser\u00a0","titleheader":"In eigener Sache","text_gpt4_api_keynotes_07_256":"- Raphaela Birrer \u00fcbernimmt als Vertreterin der n\u00e4chsten Generation die Geschicke des \"Tages-Anzeigers\" und l\u00f6st Arthur Rutishauser ab.\n- Die neue Struktur der Redaktionen von Tamedia in der deutschen Schweiz tritt in Kraft, mit Fokus auf digitale Entwicklung und B\u00fcndelung der Kr\u00e4fte.\n- Arthur Rutishauser konzentriert sich zuk\u00fcnftig auf die \"SonntagsZeitung\" und seine Autorent\u00e4tigkeit; Priska Amstutz und Mario St\u00e4uble \u00fcbernehmen neue Aufgaben.","text_api_keynotes_07_256":"- Mit Raphaela Birrer \u00fcbernimmt eine Vertreterin der n\u00e4chsten Generation die Leitung des \u00abTages-Anzeigers\u00bb und l\u00f6st Arthur Rutishauser ab.\n- Die neue Struktur der Redaktionen von Tamedia in der deutschen Schweiz tritt heute in Kraft, wodurch die \u00fcberregionalen Kompetenzen beim \u00abTages-Anzeiger\u00bb geb\u00fcndelt werden.\n- Die Ver\u00e4nderungen in der Medienwelt erfordern organisatorische Anpassungen und eine B\u00fcndelung der Kr\u00e4fte, um den Anforderungen der Leserschaft gerecht zu werden und im digitalen Zeitalter mit international f\u00fchrenden Marken mithalten zu k\u00f6nnen.","qa_list_gpt4":["Wer \u00fcbernimmt die Leitung des neu aufgestellten Redaktion des \"Tages-Anzeigers\" und welche Rolle hat sie zuvor innegehabt?","Priska Amstutz, ehemalige Leiterin des Z\u00fcrcher Teils des \"Tages-Anzeigers\"","Mario St\u00e4uble, ehemaliger Leiter des zentralen Inlandressorts","Raphaela Birrer, ehemalige Chefin des Inlandressorts"],"flesch":[33.1,26.5,28.7,40.0,35.5,56.65],"text_gpt4_api_normal_words_05_512":"Raphaela Birrer \u00fcbernimmt als Vertreterin der n\u00e4chsten Generation die Leitung des \"Tages-Anzeigers\" und l\u00f6st damit Arthur Rutishauser ab, der sich zuk\u00fcnftig auf die \"SonntagsZeitung\" und seine Autorent\u00e4tigkeit konzentriert. Die angek\u00fcndigte neue Struktur der Redaktionen von Tamedia tritt in Kraft, um den Anforderungen der Leserschaft gerecht zu werden und in einer globalisierten Medienwelt mitzuhalten. Die Transformation der traditionellen Zeitung zu einem digitalen Medienangebot erfordert eine B\u00fcndelung der Kr\u00e4fte und neue Formen der Publizistik. Priska Amstutz und Mario St\u00e4uble geben ihre F\u00fchrungspositionen im regionalen Bereich ab und \u00fcbernehmen neue Aufgaben. Die journalistische Qualit\u00e4t und der Anspruch bleiben dabei unver\u00e4ndert.","frage_antwort":[]},{"_id":"6429805aa9d504ce92eb6161","aid":445261178251,"date":"2023-03-06T20:26:40","author":"Eva Novak","categoryName":"Wirtschaft","premium":false,"readingTime":240.0,"wordCount":771.0,"url":"https:\/\/www.tagesanzeiger.ch\/hoehere-berufsabschluesse-muessen-ohne-bachelor-und-master-titel-auskommen-445261178251","own":"Fachkr\u00e4ftemangel versch\u00e4rft sich. H\u00f6here Berufsabschl\u00fcsse m\u00fcssen ohne Bachelor- und Master-Titel auskommen. Der St\u00e4nderat hat den \u00abProfessional Bachelor\u00bb und \u00abProfessional Master\u00bb vorl\u00e4ufig beerdigt. Universit\u00e4ten und Fachhochschulen leisteten erfolgreich Widerstand. Einen \u00abProfessional Master\u00bb soll es f\u00fcr sie nicht geben: Studierende der H\u00f6heren Fachschule Pflege am Zentrum f\u00fcr Ausbildung im Gesundheitswesen des Kantons Z\u00fcrich. Mit einer Motion forderte der Berner Sozialdemokrat deshalb, dass auch in der Schweiz die Titel \u00abProfessional Bachelor\u00bb und \u00abProfessional Master\u00bb vergeben werden. Auch im eigenen Land gibt es Probleme. Unis und Fachhochschulen warnen vor Titelmix. Doch dann meldeten sich die Universit\u00e4ten und Fachhochschulen mit vehementem Widerstand zu Wort. Das sei insbesondere f\u00fcr die Fachhochschulen ein Problem, denn deren Bachelor- und Masterabschl\u00fcsse seien \u00abnur durch eine forschungsbasierte Ausbildung mit hoher Praxisn\u00e4he\u00bb zu erreichen. Nach \u00abachterbahnm\u00e4ssiger\u00bb Redeschlacht folgte der Absturz. Zur Freude von Bundesrat Guy Parmelin, der eine Vorlage zum Thema ank\u00fcndigte, bei der auch die Einf\u00fchrung des \u00abProfessional Bachelor\u00bb gepr\u00fcft werde. \u00abStandespolitischer Neid\u00bb f\u00fchrt zu absurder Situation. F\u00fcr Strahm ist deshalb klar: \u00abDer Entscheid des St\u00e4nderats, den \u2039Professional Bachelor\u203a nicht einzuf\u00fchren, wertet diese Berufe ab und versch\u00e4rft darum den Fachkr\u00e4ftemangel.\u00bb ","lexrank_sumy":"H\u00f6here Berufsabschl\u00fcsse m\u00fcssen ohne Bachelor- und Master-Titel auskommen. Doch wenn sie sich f\u00fcr eine Stelle im Ausland bewerben, kommen sie oft gar nicht erst in die engere Wahl \u2013 oder m\u00fcssen sich mit weniger Lohn begn\u00fcgen. Oder sich mit der Bezeichnung \u00abAdvanced Federal Diploma of Higher Education\u00bb behelfen, welche das Staatssekretariat f\u00fcr Bildung, Forschung und Migration geschaffen hat. Nur wird diese im Ausland ebenfalls nicht verstanden, wie Aebischer sagt. Mit einer Motion forderte der Berner Sozialdemokrat deshalb, dass auch in der Schweiz die Titel \u00abProfessional Bachelor\u00bb und \u00abProfessional Master\u00bb vergeben werden. \u00d6sterreich ist inzwischen gefolgt. Selbst im eigenen Land h\u00e4tten Schweizer Absolventinnen und Absolventen der h\u00f6heren Berufsbildung einen Nachteil, hat Aebischer beobachtet. Doch dann meldeten sich die Universit\u00e4ten und Fachhochschulen mit vehementem Widerstand zu Wort. Bachelor und Master seien akademische Titel, heisst es in einem Schreiben, das die Dachorganisation der Schweizer Hochschulen Swissuniversities den Mitgliedern des St\u00e4nderats rechtzeitig zur Beratung der Motion am Montag zukommen liess. W\u00fcrden sie auch f\u00fcr Abschl\u00fcsse der H\u00f6heren Fachschulen verliehen, \u00abg\u00e4be es eine Vermischung der Titelstrukturen der Berufsbildung und der Hochschulbildung\u00bb. Nach einer \u00abachterbahnm\u00e4ssigen\u00bb Redeschlacht, wie es die Basler Sozialdemokratin Eva Herzog nannte, bei der die Gr\u00e4ben mitten durch die Fraktionen verliefen, versenkte der St\u00e4nderat die Motion mit 19 zu 16 Stimmen bei 6 Enthaltungen. \u00abDass der St\u00e4nderat als Chambre de R\u00e9flexion den Nachteil f\u00fcr die Schweizer Berufsleute nicht aufheben will, ist mir ein R\u00e4tsel\u00bb, sagte er nach verlorener Schlacht. Das seien die Fachkr\u00e4fte, die in den Spit\u00e4lern fehlten oder wenn es darum gehe, Anlagen mit Solarpanels und W\u00e4rmepumpen zu berechnen und dann zu installieren. F\u00fcr Strahm ist deshalb klar: \u00abDer Entscheid des St\u00e4nderats, den \u2039Professional Bachelor\u203a nicht einzuf\u00fchren, wertet diese Berufe ab und versch\u00e4rft darum den Fachkr\u00e4ftemangel.\u00bb ","text_api_simple_words_07_512":"Es gibt in der Schweiz einen Fachkr\u00e4ftemangel und Berufsleute haben Probleme, im Ausland einen Job zu finden, da ihre Abschl\u00fcsse anders benannt werden als in anderen L\u00e4ndern. Ein Politiker schlug vor, dass auch in der Schweiz die Titel \"Professional Bachelor\" und \"Professional Master\" vergeben werden sollten, um die Abschl\u00fcsse international vergleichbarer zu machen. Dies stie\u00df jedoch auf Widerstand von Universit\u00e4ten und Fachhochschulen, da Bachelor- und Masterabschl\u00fcsse akademische Titel seien und eine Vermischung mit Berufsbildungsabschl\u00fcssen problematisch sei. Der St\u00e4nderat lehnte die Motion ab. Experten kritisieren diesen Entscheid und bef\u00fcrchten, dass dadurch der Fachkr\u00e4ftemangel versch\u00e4rft wird.","text_api_normal_words_05_512":"Der Schweizer St\u00e4nderat hat vorl\u00e4ufig die Einf\u00fchrung von \"Professional Bachelor\" und \"Professional Master\" abgelehnt, die f\u00fcr h\u00f6here Berufsabschl\u00fcsse vergeben werden sollten. Die Dachorganisation der Schweizer Hochschulen Swissuniversities hatte vehementen Widerstand gegen die Titel eingelegt, da sie der Ansicht ist, dass dies zu einer Vermischung der Titelstrukturen der Berufsbildung und der Hochschulbildung f\u00fchren w\u00fcrde. Der Berner SP-Nationalrat Matthias Aebischer hatte die Motion eingereicht, da er der Meinung ist, dass Schweizer Berufsleute im Ausland benachteiligt werden, da sie keinen Bachelor- oder Master-Titel erhalten, wenn sie sich nach der Lehre weiterbilden. Die Bezeichnungen \"Advanced Federal Diploma of Higher Education\" oder \"diplomierte Pflegefachfrau HF\" seien im Ausland nicht verstanden. Die Universit\u00e4ten und Fachhochschulen warnen vor einem Titelmix, w\u00e4hrend der Gewerbeverbandsdirektor Hans-Ulrich Bigler den Entscheid des St\u00e4nderats als \"standespolitischer Neid\" bezeichnet.","text_api_child_09_350":"Es gibt in der Schweiz eine Ausbildung nach der Lehre, die man ohne Uni-Abschluss machen kann. Aber wenn man einen Job im Ausland will, kann das schwierig sein, weil man keinen Bachelor- oder Master-Titel hat. Deshalb wollte ein Politiker, dass es auch f\u00fcr diese Ausbildung diese Titel gibt. Aber die Universit\u00e4ten und Fachhochschulen waren dagegen, weil Bachelor und Master nur f\u00fcr akademische Titel sind. Deshalb hat der St\u00e4nderat die Motion abgelehnt. Das ist f\u00fcr manche Leute ein Problem, weil sie im Ausland Nachteile haben k\u00f6nnen, wenn sie keinen Bachelor- oder Master-Titel haben.","text_api_keynotes_07_350":"1. Der Fachkr\u00e4ftemangel versch\u00e4rft sich und h\u00f6here Berufsabschl\u00fcsse m\u00fcssen oft ohne Bachelor- und Master-Titel auskommen.\n2. Die Schweizer Berufsleute haben im Ausland oft einen Nachteil, da sie keinen Bachelor oder Master erhalten, wenn sie sich nach der Lehre weiterbilden.\n3. Der Berner SP-Nationalrat Matthias Aebischer fordert mit einer Motion, dass auch in der Schweiz die Titel \u00abProfessional Bachelor\u00bb und \u00abProfessional Master\u00bb vergeben werden.\n4. Universit\u00e4ten und Fachhochschulen waren gegen den Vorschlag, da dies zu einer Vermischung der Titelstrukturen der Berufsbildung und der Hochschulbildung f\u00fchren w\u00fcrde.\n5. Der St\u00e4nderat hat die Motion mit 19 zu 16 Stimmen bei 6 Enthaltungen abgelehnt, was von einigen als standespolitischer Neid und als Versch\u00e4rfung des Fachkr\u00e4ftemangels kritisiert wird.","text_davinci_api_key_07_256":"1. Fachkr\u00e4ftemangel versch\u00e4rft sich: Schweizer Berufsleute erhalten keinen Bachelor oder Master-Titel, nach ihrer Lehre weitergebildet. \n2. Der St\u00e4nderat hat den \u00abProfessional Bachelor\u00bb und \u00abProfessional Master\u00bb vorl\u00e4ufig mit 19 zu 16 Stimmen abgelehnt. \n3. Der Entscheid des St\u00e4nderats wertet Berufe ab und versch\u00e4rft den Fachkr\u00e4ftemangel.","five_letter_word_list":["einen","nicht","geben","liege","titel","lehre","haben","ihren","diese","einer","laden","seine","durch","sache","hatte","daf\u00fcr","seien","einem","liess","deren","hoher","faden","wurde","unter","heute","hielt","w\u00fcrth","namen","taten","sonst","thema","werde","sagte","viele","f\u00fchrt","leute","darum"],"qa_list":["Was war der Grund, warum die Titel \"Professional Bachelor\" und \"Professional Master\" in der Schweiz vorl\u00e4ufig nicht eingef\u00fchrt werden?","Unis und Fachhochschulen hatten erfolgreich Widerstand geleistet.","Die Motion konnte nicht die Mehrheit im Nationalrat \u00fcberzeugen.","Die St\u00e4nderatskommission hatte sich mit 12 zu 0 Stimmen daf\u00fcr ausgesprochen, die Titel nicht zu vergeben."],"lead":"Der St\u00e4nderat hat den \u00abProfessional Bachelor\u00bb und \u00abProfessional Master\u00bb vorl\u00e4ufig beerdigt. Universit\u00e4ten und Fachhochschulen leisteten erfolgreich Widerstand.","originaltext":"Fachkr\u00e4ftemangel versch\u00e4rft sich. H\u00f6here Berufsabschl\u00fcsse m\u00fcssen ohne Bachelor- und Master-Titel auskommen. Der St\u00e4nderat hat den \u00abProfessional Bachelor\u00bb und \u00abProfessional Master\u00bb vorl\u00e4ufig beerdigt. Universit\u00e4ten und Fachhochschulen leisteten erfolgreich Widerstand. Einen \u00abProfessional Master\u00bb soll es f\u00fcr sie nicht geben: Studierende der H\u00f6heren Fachschule Pflege am Zentrum f\u00fcr Ausbildung im Gesundheitswesen des Kantons Z\u00fcrich. Schweizer Berufsleute gelten zwar als \u00fcberdurchschnittlich gut ausgebildet. Doch wenn sie sich f\u00fcr eine Stelle im Ausland bewerben, kommen sie oft gar nicht erst in die engere Wahl \u2013 oder m\u00fcssen sich mit weniger Lohn begn\u00fcgen. Das liege am Titel, ist der Berner SP-Nationalrat Matthias Aebischer \u00fcberzeugt: Anders als die Konkurrenz aus dem Ausland erhalten hiesige Berufsleute n\u00e4mlich keinen Bachelor oder Master, wenn sie sich nach der Lehre weitergebildet haben. F\u00fcr ihren terti\u00e4ren Abschluss m\u00fcssen sie sich mit Ausdr\u00fccken wie diplomierte Pflegefachfrau HF, diplomierter Hotelier-Gastronom HF oder diplomierte Maschinenbauingenieurin HF begn\u00fcgen. Oder sich mit der Bezeichnung \u00abAdvanced Federal Diploma of Higher Education\u00bb behelfen, welche das Staatssekretariat f\u00fcr Bildung, Forschung und Migration geschaffen hat. Nur wird diese im Ausland ebenfalls nicht verstanden, wie Aebischer sagt. Mit einer Motion forderte der Berner Sozialdemokrat deshalb, dass auch in der Schweiz die Titel \u00abProfessional Bachelor\u00bb und \u00abProfessional Master\u00bb vergeben werden. Deutschland hat das vor drei Jahren eingef\u00fchrt f\u00fcr berufliche Abschl\u00fcsse, die in etwa den Schweizer Diplomen der H\u00f6heren Fachschulen entsprechen. \u00d6sterreich ist inzwischen gefolgt. Auch im eigenen Land gibt es Probleme. Selbst im eigenen Land h\u00e4tten Schweizer Absolventinnen und Absolventen der h\u00f6heren Berufsbildung einen Nachteil, hat Aebischer beobachtet. Der Arbeitsmarkt sei internationalisiert, die HR-Abteilungen grosser Konzerne und Ketten w\u00fcrden oft von Ausl\u00e4ndern gef\u00fchrt: \u00abOhne den entsprechenden Abschluss laden die ausl\u00e4ndischen HR-Chefs die Bewerberinnen gar nicht erst zum Vorstellungsgespr\u00e4ch ein.\u00bb Im Nationalrat vermochte seine Motion die Mehrheit zu \u00fcberzeugen, sie flutschte mit 129:54 Stimmen selten klar durch. Im St\u00e4nderat schien die Sache ebenfalls gelaufen: Schliesslich hatte sich die vorberatende Kommission mit 12 zu 0 Stimmen bei einer Enthaltung daf\u00fcr ausgesprochen. Unis und Fachhochschulen warnen vor Titelmix. Doch dann meldeten sich die Universit\u00e4ten und Fachhochschulen mit vehementem Widerstand zu Wort. Bachelor und Master seien akademische Titel, heisst es in einem Schreiben, das die Dachorganisation der Schweizer Hochschulen Swissuniversities den Mitgliedern des St\u00e4nderats rechtzeitig zur Beratung der Motion am Montag zukommen liess. W\u00fcrden sie auch f\u00fcr Abschl\u00fcsse der H\u00f6heren Fachschulen verliehen, \u00abg\u00e4be es eine Vermischung der Titelstrukturen der Berufsbildung und der Hochschulbildung\u00bb. Das sei insbesondere f\u00fcr die Fachhochschulen ein Problem, denn deren Bachelor- und Masterabschl\u00fcsse seien \u00abnur durch eine forschungsbasierte Ausbildung mit hoher Praxisn\u00e4he\u00bb zu erreichen. Im St\u00e4nderat nahm der Waadtl\u00e4nder Freisinnige Olivier Fran\u00e7ais diesen Faden auf und beantragte, die Motion abzulehnen. Sekundiert wurde er unter anderem von der Luzerner Mitte-St\u00e4nder\u00e4tin Andrea Gm\u00fcr, die vor einem \u00abEinheitsbrei\u00bb und einem \u00abTitelwirrwarr\u00bb warnte. \u00abDer Arbeitsmarkt ist heute internationalisiert\u00bb, hielt dem ihr St. Galler Parteikollege Benedikt W\u00fcrth im Namen der Kommission entgegen. Die geltenden Bezeichnungen seien nicht mehr zeitgem\u00e4ss und w\u00fcrden nicht verstanden. Es sei eine schleichende Diskriminierung der Schweizer Absolventinnen und Absolventen h\u00f6herer Fachschulen. Der Schaffhauser SVP-Vertreter Hannes Germann erinnerte an die Loblieder, welche jeweils \u00fcber die Schweizer Berufsbildung angestimmt w\u00fcrden, und rief seine Kolleginnen und Kollegen dazu auf, den Worten Taten folgen zu lassen: \u00abSonst lassen wir besser die Sonntagsreden \u00fcber den Wert der dualen Berufsbildung.\u00bb Nach \u00abachterbahnm\u00e4ssiger\u00bb Redeschlacht folgte der Absturz. Nach einer \u00abachterbahnm\u00e4ssigen\u00bb Redeschlacht, wie es die Basler Sozialdemokratin Eva Herzog nannte, bei der die Gr\u00e4ben mitten durch die Fraktionen verliefen, versenkte der St\u00e4nderat die Motion mit 19 zu 16 Stimmen bei 6 Enthaltungen. Zur Freude von Bundesrat Guy Parmelin, der eine Vorlage zum Thema ank\u00fcndigte, bei der auch die Einf\u00fchrung des \u00abProfessional Bachelor\u00bb gepr\u00fcft werde. Gar nicht erfreut war Aebischer. \u00abDass der St\u00e4nderat als Chambre de R\u00e9flexion den Nachteil f\u00fcr die Schweizer Berufsleute nicht aufheben will, ist mir ein R\u00e4tsel\u00bb, sagte er nach verlorener Schlacht. \u00abSehr bedauerlich\u00bb nannte Gewerbeverbandsdirektor Hans-Ulrich Bigler den Entscheid. Der St\u00e4nderat habe die Chance verpasst, zu zeigen, dass auch im Berufsbereich eine Karriere m\u00f6glich sei. \u00abOffensichtlich wurden die Kantone eingeseift\u00bb, so Bigler. Viele St\u00e4nder\u00e4te seien nun mal weit weg von der beruflichen Weiterbildung. \u00abStandespolitischer Neid\u00bb f\u00fchrt zu absurder Situation. \u00abDas ist nichts anderes als standespolitischer Neid\u00bb, lautet der Kommentar von SP-Doyen und Bildungsexperte Rudolf Strahm. Die heutige Situation sei teilweise absurd: \u00abHotelfachschulen schliessen sich mit drittklassigen privaten Unis in England zusammen und k\u00f6nnen dann den Titel Bachelor anbieten, w\u00e4hrend eine Meisterpr\u00fcfung nicht als \u2039Professional Bachelor\u203a bezeichnet werden darf.\u00bb Die Wirtschaft brauche Leute mit einer Weiterbildung an einer h\u00f6heren Fachschule. Das seien die Fachkr\u00e4fte, die in den Spit\u00e4lern fehlten oder wenn es darum gehe, Anlagen mit Solarpanels und W\u00e4rmepumpen zu berechnen und dann zu installieren. F\u00fcr Strahm ist deshalb klar: \u00abDer Entscheid des St\u00e4nderats, den \u2039Professional Bachelor\u203a nicht einzuf\u00fchren, wertet diese Berufe ab und versch\u00e4rft darum den Fachkr\u00e4ftemangel.\u00bb ","title":"H\u00f6here Berufsabschl\u00fcsse m\u00fcssen ohne Bachelor- und Master-Titel auskommen","titleheader":"Fachkr\u00e4ftemangel versch\u00e4rft sich","text_gpt4_api_keynotes_07_256":"- Fachkr\u00e4ftemangel in der Schweiz versch\u00e4rft sich aufgrund fehlender Bachelor- und Master-Titel in h\u00f6herer Berufsbildung\n- St\u00e4nderat lehnt Einf\u00fchrung von \"Professional Bachelor\" und \"Professional Master\" ab, trotz erfolgreicher Motion im Nationalrat\n- Entscheidung k\u00f6nnte Fachkr\u00e4ftemangel weiter versch\u00e4rfen, da Absolventen h\u00f6herer Fachschulen im In- und Ausland benachteiligt sind","text_api_keynotes_07_256":"- Schweizer Berufsleute haben im Ausland oft Nachteile bei der Jobsuche aufgrund fehlender Bachelor- und Master-Titel.\n- Eine Motion im Nationalrat zur Einf\u00fchrung von \"Professional Bachelor\" und \"Professional Master\" f\u00fcr h\u00f6here Berufsabschl\u00fcsse wurde im St\u00e4nderat abgelehnt.\n- Universit\u00e4ten und Fachhochschulen argumentierten gegen die Motion, da Bachelor- und Masterabschl\u00fcsse akademische Titel seien und eine Vermischung der Titelstrukturen vermieden werden solle.","qa_list_gpt4":["Warum gibt es Bedenken gegen die Einf\u00fchrung von \"Professional Bachelor\" und \"Professional Master\" Titeln in der Schweiz?","Es gibt keine Bedenken, alle sind daf\u00fcr.","Man bef\u00fcrchtet, dass dadurch die Qualit\u00e4t der Ausbildung sinkt.","Universit\u00e4ten und Fachhochschulen warnen vor einer Vermischung der Titelstrukturen der Berufsbildung und der Hochschulbildung, was insbesondere f\u00fcr Fachhochschulen problematisch w\u00e4re."],"flesch":[40.25,38.4,42.9,38.35,20.25,65.25],"text_gpt4_api_normal_words_05_512":"Der Fachkr\u00e4ftemangel in der Schweiz versch\u00e4rft sich, da h\u00f6here Berufsabschl\u00fcsse ohne Bachelor- und Master-Titel auskommen m\u00fcssen. Der St\u00e4nderat hat die Einf\u00fchrung von \"Professional Bachelor\" und \"Professional Master\" vorl\u00e4ufig gestoppt, nachdem Universit\u00e4ten und Fachhochschulen erfolgreich Widerstand geleistet haben. Schweizer Berufsleute gelten zwar als gut ausgebildet, haben jedoch im internationalen Arbeitsmarkt Nachteile, da ihre Abschl\u00fcsse oft nicht verstanden oder anerkannt werden. Eine Motion, die die Einf\u00fchrung der Titel \"Professional Bachelor\" und \"Professional Master\" forderte, wurde im St\u00e4nderat abgelehnt, obwohl sie im Nationalrat eine Mehrheit fand. Kritiker argumentieren, dass der St\u00e4nderatsentscheid die Berufe abwertet und den Fachkr\u00e4ftemangel weiter versch\u00e4rft.","frage_antwort":[]},{"_id":"6429805ba9d504ce92eb6210","aid":838067186690,"date":"2023-03-09T19:02:08","author":"Markus Brotschi","categoryName":"Schweiz","premium":false,"readingTime":180.0,"wordCount":504.0,"url":"https:\/\/www.tagesanzeiger.ch\/jetzt-kommt-der-aufstand-der-buergerlichen-838067186690","own":"Reform der zweiten S\u00e4ule. Jetzt kommt der Aufstand der B\u00fcrgerlichen. Der Bauernverband lehnt die Rentenreform ab, auch die Gastrobranche ist skeptisch. Gewerkschaften und Linke sind ohnehin dagegen. Droht dem Projekt der Absturz? Markus Ritter, Mitte-Nationalrat und Pr\u00e4sident des Schweizer Bauernverbands, h\u00e4lt die Kosten der Reform der zweiten S\u00e4ule f\u00fcr zu hoch. Diese hat zum Ziel, dass Arbeitnehmende mit tiefen Einkommen und Teilzeitangestellte k\u00fcnftig in der zweiten S\u00e4ule besser versichert sind. 250 Millionen Mehrkosten f\u00fcr Gastrobranche. Im St\u00e4nderat d\u00fcrfte die Reform eine Mehrheit erhalten. Dort wird die Linke wohl geschlossen gegen die Reform stimmen, FDP, Mitte und GLP hingegen daf\u00fcr. Denn nach der nur knappen Annahme der AHV-Reform mit Erh\u00f6hung des Frauenrentenalters auf 65 Jahre versprachen die b\u00fcrgerlichen Bef\u00fcrworter, die Rentensituation der Frauen in der zweiten S\u00e4ule zu verbessern. ","lexrank_sumy":"Reform der zweiten S\u00e4ule. Gewerkschaften und Linke sind ohnehin dagegen. Droht dem Projekt der Absturz? Markus Ritter, Mitte-Nationalrat und Pr\u00e4sident des Schweizer Bauernverbands, h\u00e4lt die Kosten der Reform der zweiten S\u00e4ule f\u00fcr zu hoch. Nachdem bereits die Gewerkschaften das Referendum angek\u00fcndigt haben, formiert sich auch bei den Bauern und im Gastgewerbe der Widerstand gegen die Reform der beruflichen Vorsorge (BVG). Der Schweizer Bauernverband (SBV) hat am Donnerstag in einer Vorstandssitzung entschieden, die Vorlage wegen der hohen Zusatzbelastungen abzulehnen. Vor allem in Branchen mit einem hohen Anteil an Teilzeitangestellten und Geringverdienern ist die Skepsis gegen die Reform gross. 250 Millionen Mehrkosten f\u00fcr Gastrobranche. Offen ist, ob der Widerstand von Gewerbe und Bauern zu vielen Nein-Stimmen in der SVP f\u00fchrt. Laut Fraktionschef Thomas Aeschi wird die SVP der Vorlage zustimmen. Denn nach der nur knappen Annahme der AHV-Reform mit Erh\u00f6hung des Frauenrentenalters auf 65 Jahre versprachen die b\u00fcrgerlichen Bef\u00fcrworter, die Rentensituation der Frauen in der zweiten S\u00e4ule zu verbessern. ","text_api_simple_words_07_512":"Die Regierung plant eine Reform der beruflichen Vorsorge, um Arbeitnehmer mit niedrigem Einkommen und Teilzeitbesch\u00e4ftigte besser abzusichern. Die Senkung des Koordinationsabzugs w\u00fcrde jedoch zu h\u00f6heren Beitr\u00e4gen f\u00fcr Arbeitnehmer und Arbeitgeber f\u00fchren. Der Schweizer Bauernverband und die Gastrobranche lehnen die Reform ab, da sie zu hohen Zusatzkosten f\u00fchren w\u00fcrde. Die Gewerkschaften sind ebenfalls dagegen, da die Versicherten h\u00f6here Beitr\u00e4ge leisten m\u00fcssten und Rentenk\u00fcrzungen hinnehmen m\u00fcssten. In der Volksabstimmung k\u00f6nnte die Reform scheitern.","text_api_normal_words_05_512":"Die Schweizer Reform der beruflichen Vorsorge, auch bekannt als Reform der zweiten S\u00e4ule, st\u00f6\u00dft auf Widerstand von verschiedenen Branchen. Der Schweizer Bauernverband (SBV) hat sich entschieden, die Vorlage wegen der hohen Zusatzbelastungen f\u00fcr die Landwirtschaft abzulehnen. Auch die Verb\u00e4nde von Gastgewerbe und Hotellerie d\u00fcrften die Reform aus dem gleichen Grund ablehnen. Vor allem in Branchen mit einem hohen Anteil an Teilzeitangestellten und Geringverdienern ist die Skepsis gegen die Reform gro\u00df. Die Reform hat zum Ziel, dass Arbeitnehmende mit tiefen Einkommen und Teilzeitangestellte k\u00fcnftig in der zweiten S\u00e4ule besser versichert sind. Diese hat jedoch zur Folge, dass Arbeitnehmer und Arbeitgeber h\u00f6here Pensionskassenbeitr\u00e4ge zahlen m\u00fcssen. Die Reform befindet sich im parlamentarischen Prozess auf der Zielgeraden, jedoch wird sie in der Volksabstimmung einen schweren Stand haben.","text_api_child_09_350":"Die Schweiz will eine Reform der beruflichen Vorsorge durchf\u00fchren. Das bedeutet, dass Menschen, die wenig Geld verdienen oder Teilzeit arbeiten, in Zukunft besser abgesichert sein sollen. Doch es gibt Widerstand gegen diese Reform. Zum Beispiel der Bauernverband und die Gastrobranche lehnen sie ab, weil sie zu teuer ist. Auch Gewerkschaften und Linke sind dagegen. Die Reform muss noch von National- und St\u00e4nderat beschlossen werden. Danach wird es eine Abstimmung geben.","text_api_keynotes_07_350":"1. Der Widerstand gegen die Reform der zweiten S\u00e4ule w\u00e4chst, auch der Bauernverband und die Gastrobranche lehnen die Vorlage ab.\n2. Die Reform soll Arbeitnehmende mit tiefen Einkommen und Teilzeitangestellte besser versichern, was zu h\u00f6heren Pensionskassenbeitr\u00e4gen f\u00fchrt.\n3. Der Schweizer Bauernverband lehnt die Reform wegen hoher Zusatzbelastungen ab, Gastro-Suisse warnt vor Kosten von bis zu 256 Millionen Franken.\n4. Gewerkschaften und Linke sind ohnehin gegen die Reform, obwohl FDP, Mitte und GLP daf\u00fcr stimmen werden.\n5. Obwohl die Reform im Parlament eine Mehrheit erhalten wird, wird sie in der Volksabstimmung wohl auf Widerstand sto\u00dfen, da viele Versicherte h\u00f6here Beitr\u00e4ge leisten m\u00fcssen und Rentenk\u00fcrzungen hinnehmen m\u00fcssen.","text_davinci_api_key_07_256":"1. Die Reform der zweiten S\u00e4ule wird von Gewerkschaften, Bauern und Gastrobranche kritisiert: SBV lehnt sie ab, Gastro Suisse und Hotelleriesuisse sind skeptisch und Gewerkschaften k\u00fcndigen Referendum an. \n2. Die Reform sieht vor, dass Arbeitnehmende mit tiefen Einkommen und Teilzeitangestellte k\u00fcnftig besser versichert sind - jedoch zu Lasten hoher Mehrkosten f\u00fcr Gastrobranche und Bauern.\n3. Obwohl die b\u00fcrgerlichen Parteien die Reform unterst\u00fctzen, droht ihr im Volksentscheid der Absturz, da sie vor allem Geringverdiener nicht zu einem Nutzen f\u00fchrt.","five_letter_word_list":["s\u00e4ule","jetzt","kommt","lehnt","linke","droht","haben","gegen","einer","wegen","hohen","r\u00e4ten","w\u00fcrde","nicht","grund","indes","allem","einem","gross","diese","durch","womit","damit","warnt","seine","mitte","daf\u00fcr","offen","f\u00fchrt","lager","seite","keine","jahre","einen","stand","viele","trotz","alter","seien"],"qa_list":["Wer lehnt die Reform der zweiten S\u00e4ule ab und warum?","Gewerkschaften und Linke, weil sie keine Verbesserung f\u00fcr Teilzeitangestellte sehen.","Der Schweizerische Gewerbeverband, weil er die Kosten der Reform zu hoch findet.","Der Schweizer Bauernverband, weil er die hohen Zusatzbelastungen nicht tragen kann."],"lead":"Der Bauernverband lehnt die Rentenreform ab, auch die Gastrobranche ist skeptisch. Gewerkschaften und Linke sind ohnehin dagegen. Droht dem Projekt der Absturz?","originaltext":"Reform der zweiten S\u00e4ule. Jetzt kommt der Aufstand der B\u00fcrgerlichen. Der Bauernverband lehnt die Rentenreform ab, auch die Gastrobranche ist skeptisch. Gewerkschaften und Linke sind ohnehin dagegen. Droht dem Projekt der Absturz? Markus Ritter, Mitte-Nationalrat und Pr\u00e4sident des Schweizer Bauernverbands, h\u00e4lt die Kosten der Reform der zweiten S\u00e4ule f\u00fcr zu hoch. Nachdem bereits die Gewerkschaften das Referendum angek\u00fcndigt haben, formiert sich auch bei den Bauern und im Gastgewerbe der Widerstand gegen die Reform der beruflichen Vorsorge (BVG). Der Schweizer Bauernverband (SBV) hat am Donnerstag in einer Vorstandssitzung entschieden, die Vorlage wegen der hohen Zusatzbelastungen abzulehnen. Die von den R\u00e4ten beschlossene Reform w\u00fcrde in der Landwirtschaft zu Mehrkosten f\u00fcr die berufliche Vorsorge von fast 70 Prozent oder j\u00e4hrlich 30 Millionen Franken f\u00fchren. Das  sei in der bereits angespannten wirtschaftlichen Situation der Bauernbetriebe nicht tragbar, sagt SBV-Pr\u00e4sident und Mitte-Nationalrat Markus Ritter. Auch die Verb\u00e4nde von Gastgewerbe und Hotellerie d\u00fcrften die Reform aus dem gleichen Grund ablehnen, offiziell Stellung bezogen haben Gastro Suisse und Hotelleriesuisse indes noch nicht. Vor allem in Branchen mit einem hohen Anteil an Teilzeitangestellten und Geringverdienern ist die Skepsis gegen die Reform gross. Diese hat zum Ziel, dass Arbeitnehmende mit tiefen Einkommen und Teilzeitangestellte k\u00fcnftig in der zweiten S\u00e4ule besser versichert sind. Dies wird erreicht durch die Senkung des sogenannten Koordinationsabzugs, womit ein h\u00f6herer Anteil des Lohnes versichert ist. 250 Millionen Mehrkosten f\u00fcr Gastrobranche. Damit steigen aber auch die Pensionskassenbeitr\u00e4ge von Arbeitnehmenden und Arbeitgebern. Gastro-Suisse-Pr\u00e4sident Casimir Platzer warnt denn auch in einem Schreiben an Parlamentarier vor hohen Zusatzkosten f\u00fcr seine Branche. Laut Berechnungen des Gastgewerbeverbandes, die dieser Redaktion vorliegen, entstehen der Branche Zusatzkosten zwischen 230 und 256 Millionen Franken pro Jahr. Diesen Betrag m\u00fcssten sich Arbeitgeber und Arbeitnehmende je h\u00e4lftig teilen. Auch andere Branchen bef\u00fcrchten hohe Zusatzbelastungen. Am n\u00e4chsten Donnerstag wird der Schweizerische Gewerbeverband Position zur BVG-Reform beziehen. Diese befindet sich im parlamentarischen Prozess auf der Zielgeraden. Am Montag und Dienstag werden National- und St\u00e4nderat voraussichtlich die letzten Differenzen bereinigen. Dann muss die Vorlage am Freitag, 17. M\u00e4rz, noch die Schlussabstimmung in beiden Kammern \u00fcberstehen. Im St\u00e4nderat d\u00fcrfte die Reform eine Mehrheit erhalten. Offener ist der Ausgang im Nationalrat. Dort wird die Linke wohl geschlossen gegen die Reform stimmen, FDP, Mitte und GLP hingegen daf\u00fcr. Offen ist, ob der Widerstand von Gewerbe und Bauern zu vielen Nein-Stimmen in der SVP f\u00fchrt. Laut Fraktionschef Thomas Aeschi wird die SVP der Vorlage zustimmen. Die Fraktion habe diesen Dienstag einstimmig bei 8 Enthaltungen f\u00fcr die Reform votiert. Obwohl Gewerbe- und Bauernverband im b\u00fcrgerlichen Lager verankert sind, will sich auf b\u00fcrgerlicher Seite wohl keine Partei dem Vorwurf aussetzen, Verbesserungen f\u00fcr Teilzeitangestellte und damit vor allem f\u00fcr Frauen zu verhindern. Denn nach der nur knappen Annahme der AHV-Reform mit Erh\u00f6hung des Frauenrentenalters auf 65 Jahre versprachen die b\u00fcrgerlichen Bef\u00fcrworter, die Rentensituation der Frauen in der zweiten S\u00e4ule zu verbessern. Doch selbst wenn das Parlament die Vorlage verabschiedet, wird sie in der Volksabstimmung einen schweren Stand haben. Die Gewerkschaften kritisieren an der Reform, dass viele Versicherte h\u00f6here Beitr\u00e4ge leisten m\u00fcssten und trotz Kompensationszahlungen Rentenk\u00fcrzungen hinnehmen m\u00fcssten. F\u00fcr Geringverdiener wiederum habe die Versicherungspflicht keinen Nutzen, da sie im Alter trotzdem auf Erg\u00e4nzungsleistungen angewiesen seien. ","title":"Jetzt kommt der Aufstand der B\u00fcrgerlichen","titleheader":"Reform der zweiten S\u00e4ule","text_gpt4_api_keynotes_07_256":"- Der Schweizer Bauernverband lehnt die Reform der beruflichen Vorsorge ab und bef\u00fcrchtet hohe Zusatzkosten f\u00fcr Landwirtschaftsbetriebe. \n- Auch Gastgewerbe und Hotellerie zeigen sich skeptisch, bef\u00fcrchten Mehrkosten von 230-256 Millionen Franken pro Jahr.\n- Gewerkschaften und Linke kritisieren h\u00f6here Beitr\u00e4ge und m\u00f6gliche Rentenk\u00fcrzungen bei der Reform der zweiten S\u00e4ule.","text_api_keynotes_07_256":"1. Die Reform der zweiten S\u00e4ule st\u00f6\u00dft auf Widerstand bei b\u00fcrgerlichen Verb\u00e4nden wie dem Bauernverband und der Gastrobranche.\n2. Die Kosten der Reform werden von vielen als zu hoch empfunden und bef\u00fcrchtet werden hohe Zusatzbelastungen.\n3. Trotzdem wird die Vorlage voraussichtlich in beiden Kammern verabschiedet werden, aber in der Volksabstimmung wird sie einen schweren Stand haben.","qa_list_gpt4":["Welche Folgen h\u00e4tte die Reform der zweiten S\u00e4ule f\u00fcr die Landwirtschaft?\n","Die Reform w\u00fcrde zu einer Verringerung der Kosten f\u00fcr die berufliche Vorsorge von 70 Prozent oder j\u00e4hrlich 30 Millionen Franken f\u00fchren.","Die Reform h\u00e4tte keine Auswirkungen auf die Kosten der beruflichen Vorsorge in der Landwirtschaft.","Die Reform w\u00fcrde in der Landwirtschaft zu Mehrkosten f\u00fcr die berufliche Vorsorge von fast 70 Prozent oder j\u00e4hrlich 30 Millionen Franken f\u00fchren."],"flesch":[42.75,51.4,48.7,31.25,45.4,64.7],"text_gpt4_api_normal_words_05_512":"Die Reform der zweiten S\u00e4ule, der beruflichen Vorsorge (BVG), in der Schweiz st\u00f6\u00dft auf Widerstand von Bauernverband, Gastrobranche, Gewerkschaften und Linken. Der Schweizer Bauernverband lehnt die Reform aufgrund hoher Zusatzbelastungen ab, die in der Landwirtschaft zu Mehrkosten von fast 70% oder j\u00e4hrlich 30 Millionen Franken f\u00fchren w\u00fcrden. Auch Gastro Suisse und Hotelleriesuisse sind skeptisch, da die Reform f\u00fcr die Gastrobranche Mehrkosten von 230 bis 256 Millionen Franken pro Jahr bedeuten w\u00fcrde. Die Reform zielt darauf ab, Arbeitnehmer mit niedrigen Einkommen und Teilzeitbesch\u00e4ftigte besser abzusichern, was jedoch auch h\u00f6here Pensionskassenbeitr\u00e4ge f\u00fcr Arbeitnehmer und Arbeitgeber mit sich bringt. Die endg\u00fcltige Abstimmung \u00fcber die Reform findet am 17. M\u00e4rz statt, wobei der Ausgang im Nationalrat noch ungewiss ist.","frage_antwort":["Wer warnt denn auch in einem Schreiben an Parlamentarier vor hohen Zusatzkosten f\u00fcr seine Branche?","Casimir","Markus Ritter","Markus Ritter"]},{"_id":"6429805ba9d504ce92eb626a","aid":836402569360,"date":"2023-03-11T17:27:39","author":"Walter Niederberger","categoryName":"Wirtschaft","premium":false,"readingTime":240.0,"wordCount":794.0,"url":"https:\/\/www.tagesanzeiger.ch\/wie-es-zur-zweitgroessten-bankenpleite-in-der-us-geschichte-kam-836402569360","own":"Schliessung der Silicon Valley Bank. Wie es zur zweitgr\u00f6ssten Bankenpleite in der US-Geschichte kam. Die US-Aufsichtsbeh\u00f6rden haben in Windeseile die Silicon Valley Bank geschlossen, um eine landesweite Bankenkrise zu verhindern. Die Hintergr\u00fcnde und m\u00f6glichen Auswirkungen. Leute stehen vor dem geschlossenen Hauptsitz der Silicon Valley Bank in Santa Clara, Kalifornien. Die Silicon Valley Bank (SVB), die sechzehntgr\u00f6sste Bank des Landes, wurde am Freitag zwangsweise geschlossen, nachdem ihre Kunden \u2013 haupts\u00e4chlich Angestellte der Techindustrie und Risikokapitalgeber \u2013 ihre Einlagen panikartig abgezogen hatten und ein Run auf weitere Banken gedroht hatte. Die Schliessung der Bank ist die zweitgr\u00f6sste Bankenpleite in der Geschichte des Landes und die gr\u00f6sste Pleite seit dem H\u00f6hepunkt der Finanzkrise vor 14 Jahren. Die hastige Schliessung der Bank, die am Freitagmorgen noch neue Kapitalgeber finden wollte, f\u00fchrte zur deutlichen Abwertung auch der grossen, als sicher betrachteten Banken. Zu diesem Zeitpunkt versuchte die Bank noch, die Kunden zu beruhigen. Die Flut der R\u00fcckz\u00fcge zerst\u00f6rte die Finanzen der Bank. Angst vor Panik. Die Schwierigkeiten der Bank sind relativ einzigartig, da sie auf die Finanzierung von Start-ups im Technologiesektor spezialisiert war. Weil das Silicon Valley in dieser Hinsicht atypisch und isoliert ist, besteht kaum die Gefahr einer Ansteckung des Bankensektors, wie das in der Finanzkrise 2009 der Fall gewesen war. Stimmung im Silicon Valley kippt. Bemerkenswert ist, dass die Finanzaufseher nicht bis zum Gesch\u00e4ftsschluss warteten, um die Bank zu beschlagnahmen. Zum Zeitpunkt des Zusammenbruchs hatte die Bank ein Verm\u00f6gen von 209 Milliarden Dollar. ","lexrank_sumy":"Schliessung der Silicon Valley Bank. Die US-Aufsichtsbeh\u00f6rden haben in Windeseile die Silicon Valley Bank geschlossen, um eine landesweite Bankenkrise zu verhindern. Die Silicon Valley Bank (SVB), die sechzehntgr\u00f6sste Bank des Landes, wurde am Freitag zwangsweise geschlossen, nachdem ihre Kunden \u2013 haupts\u00e4chlich Angestellte der Techindustrie und Risikokapitalgeber \u2013 ihre Einlagen panikartig abgezogen hatten und ein Run auf weitere Banken gedroht hatte. Die Schliessung der Bank ist die zweitgr\u00f6sste Bankenpleite in der Geschichte des Landes und die gr\u00f6sste Pleite seit dem H\u00f6hepunkt der Finanzkrise vor 14 Jahren. Ausgel\u00f6st wurde der Sturm durch den Plan der Bank, mit der Ausgabe neuer Aktien ein Loch von fast zwei Milliarden Dollar in ihren Finanzen zu stopfen. Die Bank war in finanzielle R\u00fccklage geraten, weil sie als Reaktion auf den R\u00fcckgang der Kundeneinlagen ein B\u00fcndel von Anleihen verkaufen musste. Zu diesem Zeitpunkt versuchte die Bank noch, die Kunden zu beruhigen. Die Kunden hatten allein am Donnerstag 42 Milliarden Dollar abheben wollen \u2013 ein Viertel der gesamten Einlagen der Bank. Bei Gesch\u00e4ftsschluss am Donnerstag hatte sie einen negativen Bargeldbestand von einer Milliarde Dollar und konnte ihre Zahlungen an die Fed nicht mehr decken. Angst vor Panik. An sich w\u00e4ren solche Verluste kein Problem, es sei denn, eine Bank sei wie im Fall der SVB gezwungen, Anleihen zu verkaufen, um den R\u00fcckzug von Einlagen zu kompensieren. Banken tun das in der Regel nicht, auch wenn Kunden ihre Einlagen in h\u00f6her rentierende Papiere umschichten. Weil das Silicon Valley in dieser Hinsicht atypisch und isoliert ist, besteht kaum die Gefahr einer Ansteckung des Bankensektors, wie das in der Finanzkrise 2009 der Fall gewesen war. Weil die Kunden ihre Gelder so rasch abgezogen hatten, konnte kein K\u00e4ufer f\u00fcr die Verm\u00f6genswerte gefunden werden und die Aufseher mussten handeln, um die verbliebenen Verm\u00f6genswerte in Sicherheit zu bringen. Staatlich versichert sind aber nur Einlagen unter 250\u2019000 Dollar. Auch wenn der Zusammenbruch der SVB ausserhalb der Techbranche kaum gr\u00f6ssere Folgen haben d\u00fcrfte, so werde er doch f\u00fcr Start-ups und das Klima im Silicon Valley \u00abkatastrophal\u00bb sein, meint Columbia-Professorin Lee. ","text_api_simple_words_07_512":"Die Silicon Valley Bank, eine Bank, die sich auf die Finanzierung von Start-up-Unternehmen spezialisiert hat, wurde aufgrund von massiven Kundenauszahlungen und dem Verkauf von Anleihen zur Finanzierung geschlossen. Die Schlie\u00dfung hatte Auswirkungen auf das Vertrauen in andere Banken, da bef\u00fcrchtet wurde, dass die Turbulenzen zu einer weiteren Panik im Finanzsystem f\u00fchren k\u00f6nnten. Die Verluste waren eine Folge der aggressiven Inflationsbek\u00e4mpfung durch die US-Notenbank, die zu einem starken Wertverlust der bestehenden Anleihen f\u00fchrte. Die Schlie\u00dfung der Bank hat Auswirkungen auf Start-ups und das Klima im Silicon Valley.","text_api_normal_words_05_512":"Die Silicon Valley Bank (SVB), die sechzehntgr\u00f6\u00dfte Bank der USA, wurde aufgrund massiver Abhebungen ihrer Kunden geschlossen. Die Kunden, haupts\u00e4chlich aus der Techindustrie und Risikokapitalgebern, hatten ihre Einlagen panikartig abgezogen und ein Run auf weitere Banken drohte. Die Schlie\u00dfung der Bank ist die zweitgr\u00f6\u00dfte Bankenpleite in der Geschichte des Landes und die gr\u00f6\u00dfte Pleite seit dem H\u00f6hepunkt der Finanzkrise vor 14 Jahren. Die hastige Schlie\u00dfung der Bank f\u00fchrte zur deutlichen Abwertung auch der gro\u00dfen, als sicher betrachteten Banken. Die Probleme weckten die Bef\u00fcrchtung, dass die j\u00fcngsten und noch geplanten Zinserh\u00f6hungen in den USA auch den Wert der Anleiheportfolios anderer Banken entwerten und das Risiko f\u00fcr die Finanzpl\u00e4tze weltweit steigt. Die Schwierigkeiten der Bank sind relativ einzigartig, da sie auf die Finanzierung von Start-ups im Technologiesektor spezialisiert war. Unternehmen konnten deshalb nicht wie \u00fcblich am Freitag ihre Gehaltsabrechnung machen und ihre Mitarbeiter bezahlen. Der Zusammenbruch der SVB wird f\u00fcr Start-ups und das Klima im Silicon Valley \"katastrophal\" sein.","text_api_child_09_350":"Die Silicon Valley Bank (SVB) wurde geschlossen, weil viele ihrer Kunden ihr Geld abgehoben haben und es eine Bankenkrise geben k\u00f6nnte. Die SVB war auf die Finanzierung von Technologie-Start-ups spezialisiert und hatte ein grosses Loch in ihren Finanzen. Die Bankenkrise hat Auswirkungen auf Start-ups und die Stimmung im Silicon Valley. Da die Einlagen in der SVB nicht alle versichert waren, k\u00f6nnten viele Leute ihr Geld verlieren. Die Schliessung der Bank ist die zweitgr\u00f6sste Bankenpleite in der US-Geschichte.","text_api_keynotes_07_350":"Die Silicon Valley Bank, die sechzehntgr\u00f6sste Bank des Landes, wurde zwangsweise geschlossen, nachdem Kunden ihre Einlagen panikartig abgezogen hatten und ein Run auf weitere Banken drohte. Die Aufsichtsbeh\u00f6rden beschlagnahmten die Verm\u00f6genswerte und brachten sie in einer Auffangbank in Sicherheit. Die Schliessung der Bank ist die zweitgr\u00f6sste Bankenpleite in der Geschichte des Landes und die gr\u00f6sste Pleite seit dem H\u00f6hepunkt der Finanzkrise vor 14 Jahren. Die hastige Schliessung der Bank f\u00fchrte zur Abwertung auch der grossen, als sicher betrachteten Banken. Die Probleme weckten die Bef\u00fcrchtung, dass die j\u00fcngsten und noch geplanten Zinserh\u00f6hungen in den USA auch den Wert der Anleiheportfolios anderer Banken entwerten und das Risiko f\u00fcr die Finanzpl\u00e4tze weltweit steigt.","text_davinci_api_key_07_256":"1. Die US-Aufsichtsbeh\u00f6rden mussten eingreifen, um eine landesweite Bankenkrise zu verhindern: Die Silicon Valley Bank wurde zwangsweise geschlossen und die Verm\u00f6genswerte in einer Auffangbank in Sicherheit gebracht. \n2. Der Zusammenbruch der SVB f\u00fchrte zu weiteren Turbulenzen im Finanzsystem, da steigende Zinsen den Wert der bestehenden Anleihen entwerteten. \n3. Der Kollaps der SVB hat katastrophale Folgen f\u00fcr Start-ups und das Klima im Silicon Valley, da Unternehmen gezwungen sind, ihre Gesch\u00e4ftsaufgabe zu machen und Zugang zu ihren Geldern verwehrt bleibt.","five_letter_word_list":["haben","leute","santa","clara","wurde","hatte","einer","nicht","genau","panik","lesen","sturm","durch","neuer","ihren","diese","wegen","stark","einem","einen","angst","sagte","mache","folge","w\u00e4ren","regel","h\u00f6her","waren","kippt","rasch","unter","davon","\u00fcbrig","ihrer","viele","werde","klima","meint"],"qa_list":["Was war der Ausl\u00f6ser f\u00fcr die Schliessung der Silicon Valley Bank? ","Ein erfolgreicher B\u00f6rsengang ","Eine \u00dcbernahme durch eine andere Bank ","Der R\u00fcckzug von Kunden-Einlagen"],"lead":"Die US-Aufsichtsbeh\u00f6rden haben in Windeseile die Silicon Valley Bank geschlossen, um eine landesweite Bankenkrise zu verhindern. Die Hintergr\u00fcnde und m\u00f6glichen Auswirkungen.","originaltext":"Schliessung der Silicon Valley Bank. Wie es zur zweitgr\u00f6ssten Bankenpleite in der US-Geschichte kam. Die US-Aufsichtsbeh\u00f6rden haben in Windeseile die Silicon Valley Bank geschlossen, um eine landesweite Bankenkrise zu verhindern. Die Hintergr\u00fcnde und m\u00f6glichen Auswirkungen. Leute stehen vor dem geschlossenen Hauptsitz der Silicon Valley Bank in Santa Clara, Kalifornien. (10. M\u00e4rz 2023). Die Silicon Valley Bank (SVB), die sechzehntgr\u00f6sste Bank des Landes, wurde am Freitag zwangsweise geschlossen, nachdem ihre Kunden \u2013 haupts\u00e4chlich Angestellte der Techindustrie und Risikokapitalgeber \u2013 ihre Einlagen panikartig abgezogen hatten und ein Run auf weitere Banken gedroht hatte. Die Aufsichtsbeh\u00f6rden beschlagnahmten die Verm\u00f6genswerte und brachten sie in einer Auffangbank in Sicherheit. Der gr\u00f6sste Teil der Einlagen allerdings ist nicht versichert. Die Schliessung der Bank ist die zweitgr\u00f6sste Bankenpleite in der Geschichte des Landes und die gr\u00f6sste Pleite seit dem H\u00f6hepunkt der Finanzkrise vor 14 Jahren. Die hastige Schliessung der Bank, die am Freitagmorgen noch neue Kapitalgeber finden wollte, f\u00fchrte zur deutlichen Abwertung auch der grossen, als sicher betrachteten Banken. Globale Finanzinstitute beobachten die Situation genau, da sie bef\u00fcrchten, dass die Turbulenzen zu einer weiteren Panik im Finanzsystem f\u00fchren k\u00f6nnten. (Lesen Sie dazu: Schockwellen auf den Finanzm\u00e4rkten: Was ist da los?). Ausgel\u00f6st wurde der Sturm durch den Plan der Bank, mit der Ausgabe neuer Aktien ein Loch von fast zwei Milliarden Dollar in ihren Finanzen zu stopfen. Die Bank war in finanzielle R\u00fccklage geraten, weil sie als Reaktion auf den R\u00fcckgang der Kundeneinlagen ein B\u00fcndel von Anleihen verkaufen musste. Allerdings hatten diese wegen der steigenden Zinsen stark an Wert verloren und ein tiefes Loch in die Bilanz gerissen. Die Aktien brachen am Donnerstag zun\u00e4chst um 60 Prozent ein und wurden am Freitag nach einem Kurssturz von 66 Prozent im vorb\u00f6rslichen Handel gestoppt. Zu diesem Zeitpunkt versuchte die Bank noch, die Kunden zu beruhigen. Zu sp\u00e4t. Das Vertrauen war verspielt. Die Kunden hatten allein am Donnerstag 42 Milliarden Dollar abheben wollen \u2013 ein Viertel der gesamten Einlagen der Bank. Die Flut der R\u00fcckz\u00fcge zerst\u00f6rte die Finanzen der Bank. Bei Gesch\u00e4ftsschluss am Donnerstag hatte sie einen negativen Bargeldbestand von einer Milliarde Dollar und konnte ihre Zahlungen an die Fed nicht mehr decken. Angst vor Panik. Die Probleme weckten die Bef\u00fcrchtung, dass die j\u00fcngsten und noch geplanten Zinserh\u00f6hungen in den USA auch den Wert der Anleiheportfolios anderer Banken entwerten und das Risiko f\u00fcr die Finanzpl\u00e4tze weltweit steigt. \u00abAngst ist ansteckend\u00bb, sagte Angela Lee, eine Professorin f\u00fcr Risikokapitalismus an der Columbia Business School, dem \u00abGuardian\u00bb. \u00abEin Ger\u00fccht kann einen Sturm auf die Banken ausl\u00f6sen, und das hier ist viel mehr als ein Ger\u00fccht.\u00bb Sie mache sich Sorgen, dass die Leute \u00fcberreagieren und \u00fcberkorrigieren k\u00f6nnten. Die Verluste querbeet durch die Banken sind eine Folge der aggressiven Inflationsbek\u00e4mpfung durch die US-Notenbank. Steigende Zinss\u00e4tze f\u00fchrten dazu, dass der Wert der bestehenden Anleihen mit niedrigeren Zinszahlungen stark gesunken ist. Die Banken sitzen auf B\u00fcndeln dieser Anleihen, darunter US-Staatsanleihen, und f\u00fchren nun riesige, nicht realisierte Verluste in ihren B\u00fcchern. An sich w\u00e4ren solche Verluste kein Problem, es sei denn, eine Bank sei wie im Fall der SVB gezwungen, Anleihen zu verkaufen, um den R\u00fcckzug von Einlagen zu kompensieren. Banken tun das in der Regel nicht, auch wenn Kunden ihre Einlagen in h\u00f6her rentierende Papiere umschichten. Die Schwierigkeiten der Bank sind relativ einzigartig, da sie auf die Finanzierung von Start-ups im Technologiesektor spezialisiert war. Diese Mittel waren seit letztem Herbst parallel zur massiven Tieferbewertung etablierter Konzerne wie Meta oder Google zunehmend versiegt. Die hohe Risikobereitschaft w\u00e4hrend der Tiefzinsphase war der Angst um Arbeitspl\u00e4tze, schwindende Gewinne und sanierungsbed\u00fcrftige Gesch\u00e4ftsmodelle gewichen. Weil das Silicon Valley in dieser Hinsicht atypisch und isoliert ist, besteht kaum die Gefahr einer Ansteckung des Bankensektors, wie das in der Finanzkrise 2009 der Fall gewesen war. Die grossen Banken des Landes haben gem\u00e4ss den j\u00e4hrlichen Stresstests gesunde Bilanzen und reichlich Kapital. Stimmung im Silicon Valley kippt. Das Scheitern der SVB kam mit unglaublicher Geschwindigkeit, obwohl einige Analysten noch am Freitagmorgen von einem gesunden Unternehmen sprachen, das eine Investition wert sei. Bemerkenswert ist, dass die Finanzaufseher nicht bis zum Gesch\u00e4ftsschluss warteten, um die Bank zu beschlagnahmen. Weil die Kunden ihre Gelder so rasch abgezogen hatten, konnte kein K\u00e4ufer f\u00fcr die Verm\u00f6genswerte gefunden werden und die Aufseher mussten handeln, um die verbliebenen Verm\u00f6genswerte in Sicherheit zu bringen. Zum Zeitpunkt des Zusammenbruchs hatte die Bank ein Verm\u00f6gen von 209 Milliarden Dollar. Staatlich versichert sind aber nur Einlagen unter 250\u2019000 Dollar. Der Rest wurde unter Zwangsverwaltung gestellt. Ob und wie viel davon \u00fcbrig bleiben wird, ist unklar. Fr\u00fchere Berichte der Aufsichtsbeh\u00f6rden zeigten, dass ein Grossteil der Einlagen, \u00fcber 150 Milliarden Dollar, nicht versichert ist. Risikokapitalgeber reagierten best\u00fcrzt \u00fcber den Kollaps ihrer Hausbank. Viele hatten versucht, ihre Gelder noch abzuheben, was jedoch nicht rechtzeitig gelang. Unternehmen konnten deshalb nicht wie \u00fcblich am Freitag ihre Gehaltsabrechnung machen und ihre Mitarbeiter bezahlen. Auch wenn der Zusammenbruch der SVB ausserhalb der Techbranche kaum gr\u00f6ssere Folgen haben d\u00fcrfte, so werde er doch f\u00fcr Start-ups und das Klima im Silicon Valley \u00abkatastrophal\u00bb sein, meint Columbia-Professorin Lee. \u00abStart-ups haben keinen Zugang zu ihren Geldern, und Unternehmen werden zur Gesch\u00e4ftsaufgabe gezwungen sein\u00bb, sagte sie. \u00abDie daraus entstehende Stimmung wird weltweit verheerend sein.\u00bb ","title":"Wie es zur zweit\u00adgr\u00f6ssten Banken\u00adpleite in der US-Geschichte kam","titleheader":"Schliessung der Silicon Valley Bank","text_gpt4_api_keynotes_07_256":"- Schlie\u00dfung der Silicon Valley Bank verhindert landesweite Bankenkrise\n- Zweitgr\u00f6\u00dfte Bankenpleite in der US-Geschichte\n- Auswirkungen auf globale Finanzinstitute und Start-ups im Silicon Valley","text_api_keynotes_07_256":"- Die Silicon Valley Bank wurde aufgrund von massivem Einlagenabzug geschlossen, um eine landesweite Bankenkrise zu verhindern.\n- Die Schlie\u00dfung der Bank ist die zweitgr\u00f6\u00dfte Bankenpleite in der US-Geschichte und die gr\u00f6\u00dfte Pleite seit dem H\u00f6hepunkt der Finanzkrise vor 14 Jahren.\n- Die Probleme der Bank sind auf den Plan zur\u00fcckzuf\u00fchren, mit der Ausgabe neuer Aktien ein Loch von fast zwei Milliarden Dollar in ihren Finanzen zu stopfen, was zu einem Zusammenbruch der Bank f\u00fchrte.","qa_list_gpt4":["Was war der Hauptgrund f\u00fcr die Schlie\u00dfung der Silicon Valley Bank?\n","Die Bank wurde aufgrund von Betrugsvorw\u00fcrfen geschlossen.","Die Schlie\u00dfung erfolgte wegen mangelnder Liquidit\u00e4t durch zu hohe Risikobereitschaft.","Die Schlie\u00dfung wurde durch panikartige Abhebungen der Kunden und den daraus resultierenden negativen Bargeldbestand verursacht."],"flesch":[46.5,48.1,48.15,35.65,43.4,53.45],"text_gpt4_api_normal_words_05_512":"Die US-Aufsichtsbeh\u00f6rden haben die Silicon Valley Bank (SVB) geschlossen, um eine landesweite Bankenkrise zu verhindern. Kunden hatten panikartig ihre Einlagen abgezogen, was zu einer drohenden Krise bei weiteren Banken f\u00fchrte. Die Schlie\u00dfung der SVB ist die zweitgr\u00f6\u00dfte Bankenpleite in der US-Geschichte. Die Bank geriet in finanzielle Schwierigkeiten, nachdem sie Anleihen verkaufen musste, um den R\u00fcckgang der Kundeneinlagen auszugleichen. Die Aktien der Bank brachen ein, und Kunden zogen massiv Gelder ab. Die Situation weckt Bef\u00fcrchtungen, dass die j\u00fcngsten und geplanten Zinserh\u00f6hungen in den USA den Wert der Anleiheportfolios anderer Banken entwerten k\u00f6nnten. Die Schwierigkeiten der SVB sind jedoch relativ einzigartig, da sie auf die Finanzierung von Start-ups im Technologiesektor spezialisiert war. Die gro\u00dfen US-Banken haben laut j\u00e4hrlichen Stresstests gesunde Bilanzen und ausreichend Kapital. Dennoch wird der Zusammenbruch der SVB f\u00fcr Start-ups und das Klima im Silicon Valley schwere Folgen haben.","frage_antwort":[]},{"_id":"6429805da9d504ce92eb6345","aid":394798262762,"date":"2023-03-15T17:10:46","author":"Simon Angelo Meier","categoryName":"International","premium":false,"readingTime":300.0,"wordCount":1181.0,"url":"https:\/\/www.tagesanzeiger.ch\/neue-spekulationen-zur-sprengung-der-pipelines-394798262762","own":"Debatte um Nord-Stream-Sabotage. Neue Spekulationen zur Sprengung der Pipelines. In den vergangenen Tagen wurden zahlreiche neue Szenarien und Indizien zur Sabotage der Nord-Stream-Pipelines pr\u00e4sentiert. Die Faktenlage bleibt dabei aber weiterhin sehr d\u00fcnn, und vieles bleibt hypothetisch. Ein neuer Erkl\u00e4rungsansatz sieht die Segeljacht Andromeda als zentralen Akteur in der Sprengung der Nord-Stream-Pipelines. Ein Container in Lubmin, Deutschland, zeigt die an die Nordsee und die Nord-Stream-Pipelines angrenzenden L\u00e4nder. In den letzten Tagen und Wochen wurden mehrere Szenarien pr\u00e4sentiert, wer hinter den Anschl\u00e4gen auf die Nord-Stream-Pipelines stehen k\u00f6nnte. Wir zeichnen die verschiedenen Szenarien hier nach und ordnen sie ein. Geheimoperation mit Segeljacht. M\u00e4rz ver\u00f6ffentlichte der \u00abSpiegel\u00bb eine ausf\u00fchrliche Reportage von nicht weniger als zw\u00f6lf Journalisten, in der ein detailliertes Szenario f\u00fcr die Sprengung der Nord-Stream-Pipelines pr\u00e4sentiert wurde. Dabei habe die in R\u00fcgen gemietete Segeljacht Andromeda eine entscheidende Rolle gespielt. September soll es sich dann in der N\u00e4he der Orte befunden haben, an denen die Explosionen an den Pipelines stattfanden. Die Segeljacht sei dann vom 18. bis zum 20. Jacht zu klein f\u00fcr eine Operation solcher Gr\u00f6sse. Das Tankschiff Minerva Julie. Eine weitere, nicht best\u00e4tigte Theorie sieht das unter griechischer Flagge verkehrende Tankschiff Minerva Julie als zentralen Akteur in der Sabotage der Nord-Stream Pipelines. Wird mit dem Sabotageakt auf die Nord-Stream-Pipelines in Verbindung gebracht: Das Tankerschiff Minerva Julie, hier beim Hafen von Rotterdam. Alexander ver\u00f6ffentlichte zu seiner These Daten der Marine-Traffic-Positionsdatenbank, welche das Kreuzen der Minerva Julie vom 6. bis zum 13. Die politische Dimension. Die Faktenlage, wer hinter dem Anschlag auf die Nord-Stream-Pipelines steckt, ist nach wie vor sehr d\u00fcnn. Gleich nach der Sabotage der Pipelines am 26. Wirkliche Fakten wurden dabei aber keine pr\u00e4sentiert. Die Indizien und Motive weisen allerdings in diese Richtung, wie diese Zeitung in einer Analyse aufgezeigt hat. ","lexrank_sumy":"In den vergangenen Tagen wurden zahlreiche neue Szenarien und Indizien zur Sabotage der Nord-Stream-Pipelines pr\u00e4sentiert. Ein neuer Erkl\u00e4rungsansatz sieht die Segeljacht Andromeda als zentralen Akteur in der Sprengung der Nord-Stream-Pipelines. Ein Container in Lubmin, Deutschland, zeigt die an die Nordsee und die Nord-Stream-Pipelines angrenzenden L\u00e4nder. In den letzten Tagen und Wochen wurden mehrere Szenarien pr\u00e4sentiert, wer hinter den Anschl\u00e4gen auf die Nord-Stream-Pipelines stehen k\u00f6nnte. Am 10. M\u00e4rz ver\u00f6ffentlichte der \u00abSpiegel\u00bb eine ausf\u00fchrliche Reportage von nicht weniger als zw\u00f6lf Journalisten, in der ein detailliertes Szenario f\u00fcr die Sprengung der Nord-Stream-Pipelines pr\u00e4sentiert wurde. Am 26. September soll es sich dann in der N\u00e4he der Orte befunden haben, an denen die Explosionen an den Pipelines stattfanden. In Wiek auf R\u00fcgen habe die Mannschaft haltgemacht, um Proviant zu laden. Die Segeljacht sei dann vom 18. bis zum 20. Januar des aktuellen Jahres von der deutschen Bundesanwaltschaft durchsucht worden. Jacht zu klein f\u00fcr eine Operation solcher Gr\u00f6sse. Einige Experten gingen von bis zu 2000 Kilogramm Z\u00fcndstoff aus. Auch h\u00e4tten die Taucher f\u00fcr mehrere Tauchg\u00e4nge in 80 Meter Tiefe eine Dekompressionskammer ben\u00f6tigt. Auch habe ein hoher Offizieller der deutschen Regierung, der einen Bericht zur Untersuchung eingesehen habe, best\u00e4tigt, dass einige Mitglieder der fraglichen Mannschaft ukrainische P\u00e4sse pr\u00e4sentiert h\u00e4tten. Unbekannte T\u00e4terschaft: Eines von vier Gaslecks nach dem Sabotageakt an den Nord-Stream-Gaspipelines in der Nordsee. Das Schiff ist ab dem 5. September acht Tage lang n\u00f6rdlich von Bornholm hin- und hergekreuzt \u2013 genau an der Stelle, wo am 26. September die zwei R\u00f6hren von Nord Stream 1 gesprengt wurden \u2013, wie die finnische Zeitung \u00abVerkkouutiset\u00bb bereits Ende September berichtete. Der \u00d6ltanker lief auch nach Beginn des Ukraine-Kriegs wiederholt russische H\u00e4fen an, wof\u00fcr die griechische Betreibergesellschaft Minerva Marine Inc. Dieser h\u00e4lt die Darstellung, wonach eine kleine Gruppe von Saboteuren vom Segelschiff Andromeda aus die Sprengladungen angebracht haben soll, f\u00fcr sehr unwahrscheinlich: \u00abBereits die Vorstellung, dass rund zwei Tonnen Sprengstoff in handlichen Einzelpaketen ohne Kran an Bord verlastet h\u00e4tten werden m\u00fcssen, finde ich abenteuerlich. Auch der d\u00e4nische Investigativjournalist Oliver Alexander h\u00e4lt das Szenario, wonach die Installation der Sprengladungen mit dem Kreuzen des Tankerschiffs Minerva Julie zusammenh\u00e4ngen soll, f\u00fcr wahrscheinlicher. Die Segeljacht Andromeda sei vielleicht verwendet worden, um das f\u00fcr die Operation zust\u00e4ndige Team und Vorr\u00e4te zu transportieren. Die Faktenlage, wer hinter dem Anschlag auf die Nord-Stream-Pipelines steckt, ist nach wie vor sehr d\u00fcnn. Derweil mangelt es nicht an Schuldzuweisungen und Mutmassungen, wer hinter der Operation stehen k\u00f6nnte. Gleich nach der Sabotage der Pipelines am 26. September begannen die gegenseitigen Verd\u00e4chtigungen der involvierten Staaten. Am 7. M\u00e4rz folgte ein Artikel der \u00abNew York Times\u00bb, in dem mit Verweis auf Geheimdienstinformationen die These aufgestellt wurde, eine proukrainische Gruppe habe den Anschlag auf die Pipelines ver\u00fcbt, jedoch ohne Auftrag der ukrainischen Regierung. Dass eine proukrainische Gruppierung hinter dem Sabotageakt stehen k\u00f6nnte, wurde derweil aber auch wiederholt als politisches Motiv identifiziert, um die westliche Koalition, welche die Ukraine mit Waffenlieferungen unterst\u00fctzt, zu schw\u00e4chen. ","text_api_simple_words_07_512":"Es gibt viele Spekulationen dar\u00fcber, wer f\u00fcr die Sabotage der Nord-Stream-Pipelines verantwortlich ist. Ein neuer Ansatz sieht die Segeljacht Andromeda als zentralen Akteur, aber es fehlen stichhaltige Beweise. Ein weiteres Szenario sieht das Tankschiff Minerva Julie als zentralen Akteur. Es gibt jedoch sehr wenig Fakten dar\u00fcber, wer tats\u00e4chlich f\u00fcr den Anschlag verantwortlich ist. Es wird vermutet, dass es sich um einen staatlichen oder quasistaatlichen Akteur handelt, da es sehr anspruchsvoll ist, gro\u00dfe Mengen von Sprengstoff unerkannt an die richtige Stelle in der Ostsee zu transportieren. Der Anschlag hat die Energiepreise weiter in die H\u00f6he getrieben und k\u00f6nnte politische Motive haben.","text_api_normal_words_05_512":"In den letzten Tagen und Wochen wurden viele neue Theorien und Indizien zur Sabotage der Nord-Stream-Pipelines pr\u00e4sentiert. Ein neuer Erkl\u00e4rungsansatz sieht die Segeljacht Andromeda als zentralen Akteur in der Sprengung der Pipelines, aber es gibt keine stichhaltigen Beweise daf\u00fcr. Eine weitere Theorie sieht das Tankschiff Minerva Julie als zentralen Akteur. Die Faktenlage bleibt jedoch d\u00fcnn und vieles bleibt hypothetisch. Die politische Dimension des Anschlags ist jedoch unbestreitbar, da die gegenseitigen Schuldzuweisungen und Mutma\u00dfungen der involvierten Staaten zeigen, dass der Anschlag politisch motiviert war. Es wird vermutet, dass eine proukrainische Gruppierung hinter dem Sabotageakt stehen k\u00f6nnte, um die westliche Koalition zu schw\u00e4chen und die Energiepreise weiter in die H\u00f6he zu treiben. Es wird auch nicht ausgeschlossen, dass es sich um eine False-Flag-Operation handelt, bei der bewusst Indizien zur Beschuldigung eines anderen Akteurs ausgelegt wurden.","text_api_child_09_350":"Es geht um eine gro\u00dfe Gasleitung im Meer zwischen Russland und Europa, die sabotiert wurde. Das bedeutet, dass die Leitung absichtlich besch\u00e4digt wurde und kein Gas mehr durchkommen kann. Es gibt viele Vermutungen, wer das gemacht hat, aber es gibt noch keine klaren Beweise. Einige glauben, dass es eine Gruppe von Ukrainern war, die gegen Russland k\u00e4mpfen. Andere denken, dass es die USA oder Norwegen waren, die sich gegen Russland stellen wollen. Eine Segeljacht namens Andromeda und ein \u00d6ltanker namens Minerva Julie spielen auch eine wichtige Rolle bei den Vermutungen. Es ist wichtig zu verstehen, dass alle diese Ideen noch nicht bewiesen wurden und nur Vermutungen sind.","text_api_keynotes_07_350":"1. Neue Spekulationen zur Sabotage der Nord-Stream-Pipelines werden pr\u00e4sentiert, doch die Faktenlage bleibt d\u00fcnn und vieles bleibt hypothetisch.\n2. Ein neuer Erkl\u00e4rungsansatz sieht die Segeljacht Andromeda als m\u00f6glichen zentralen Akteur in der Sprengung der Nord-Stream-Pipelines, aber stichhaltige Beweise fehlen bis jetzt.\n3. Auch ein \u00d6ltanker namens Minerva Julie wird als m\u00f6glicher zentraler Akteur in der Sabotage der Nord-Stream Pipelines betrachtet.\n4. Die politische Dimension der Sabotage ist hoch, da verschiedene Staaten in Schuldzuweisungen und Mutma\u00dfungen involviert sind.\n5. Die Faktenlage ist weiterhin d\u00fcnn, aber es gibt Indizien und Motive, die auf eine proukrainische Gruppierung als m\u00f6gliche T\u00e4terschaft hinweisen. Auch eine False-Flag-Operation ist nicht ausgeschlossen.","text_davinci_api_key_07_256":"1. Der Sabotageakt an den Nord-Stream-Pipelines stellt eine ungekl\u00e4rte Faktenlage dar: Es gibt Spekulationen, die US-Regierung, eine proukrainische Gruppe oder ein Tankerschiff k\u00f6nnten dahinterstecken.\n2. Speziell bei der Segeljacht Andromeda, die m\u00f6glicherweise f\u00fcr die Operation verwendet wurde, sehen Experten nur sehr wenig Realit\u00e4tsbezug.\n3. Eines ist klar: Ein staatlicher oder quasistaatlicher Akteur k\u00f6nnte hinter der Sabotage stecken, da es sehr schwierig ist, Sprengstoff unbemerkt an die richtige Stelle in der Ostsee zu transportieren.","five_letter_word_list":["tagen","dabei","neuer","sieht","jetzt","zeigt","times","einer","jacht","wurde","spiel","nicht","zw\u00f6lf","r\u00fcgen","rolle","route","insel","haben","denen","laden","einem","klang","einen","gehen","zudem","davon","meter","tiefe","w\u00e4ren","seien","n\u00f6tig","zuvor","hatte","klein","hoher","p\u00e4sse","eines","firma","julie","unter","genau","h\u00e4fen","wof\u00fcr","ihren","david","finde","ganze","dicht","schon","hafen","daten","w\u00fcrde","these","keine","motiv","damit","armee","diese","liess","hohen","woche","sagte","macht"],"qa_list":["Was sind die verschiedenen Theorien zur Sabotage der Nord-Stream-Pipelines und wer wird daf\u00fcr verantwortlich gemacht?","Die Segeljacht Andromeda soll f\u00fcr die Sprengung verantwortlich sein, aber es gibt Zweifel, ob das Schiff gro\u00df genug f\u00fcr den Transport des ben\u00f6tigten Sprengstoffs war.","Das Tankschiff Minerva Julie wird als zentraler Akteur in der Sabotage genannt, da es zum Zeitpunkt der Explosionen in der N\u00e4he gekreuzt haben soll.","Es gibt mehrere Theorien, wer f\u00fcr die Sabotage verantwortlich sein k\u00f6nnte, darunter die USA, eine proukrainische Gruppierung oder ein staatlicher oder quasistaatlicher Akteur. Es gibt jedoch keine klaren Beweise f\u00fcr eine bestimmte Theorie."],"lead":"In den vergangenen Tagen wurden zahlreiche neue Szenarien und Indizien zur Sabotage der\u00a0Nord-Stream-Pipelines pr\u00e4sentiert. Die Faktenlage bleibt dabei aber weiterhin sehr d\u00fcnn, und vieles bleibt hypothetisch.\u00a0","originaltext":"Debatte um Nord-Stream-Sabotage. Neue Spekulationen zur Sprengung der Pipelines. In den vergangenen Tagen wurden zahlreiche neue Szenarien und Indizien zur Sabotage der Nord-Stream-Pipelines pr\u00e4sentiert. Die Faktenlage bleibt dabei aber weiterhin sehr d\u00fcnn, und vieles bleibt hypothetisch. Wer steckt dahinter? Ein neuer Erkl\u00e4rungsansatz sieht die Segeljacht Andromeda als zentralen Akteur in der Sprengung der Nord-Stream-Pipelines. Stichhaltige Beweise fehlen bis jetzt aber. Ein Container in Lubmin, Deutschland, zeigt die an die Nordsee und die Nord-Stream-Pipelines angrenzenden L\u00e4nder. In den letzten Tagen und Wochen wurden mehrere Szenarien pr\u00e4sentiert, wer hinter den Anschl\u00e4gen auf die Nord-Stream-Pipelines stehen k\u00f6nnte. Der US-Investigativjournalist Seymour Hersch behauptete Anfang Februar, die USA steckten hinter der Operation, und berief sich auf eine geheime Quelle. Anfang M\u00e4rz folgte ein Artikel der \u00abNew York Times\u00bb, der mit Verweis auf Geheimdienstinformationen von einer proukrainischen Gruppierung ausging. Drei Tage sp\u00e4ter zeichnete der \u00abSpiegel\u00bb in einer detaillierten Reportage den Weg der Jacht Andromeda nach, welche eventuell f\u00fcr die Mission verwendet wurde. Auch ein \u00d6ltanker, der vor den Explosionen am Ort der Sabotageakte gekreuzt war, wird wiederholt ins Spiel gebracht. Wir zeichnen die verschiedenen Szenarien hier nach und ordnen sie ein. Geheimoperation mit Segeljacht Am 10. M\u00e4rz ver\u00f6ffentlichte der \u00abSpiegel\u00bb eine ausf\u00fchrliche Reportage von nicht weniger als zw\u00f6lf Journalisten, in der ein detailliertes Szenario f\u00fcr die Sprengung der Nord-Stream-Pipelines pr\u00e4sentiert wurde. Dabei habe die in R\u00fcgen gemietete Segeljacht Andromeda eine entscheidende Rolle gespielt. Die Journalisten zeichneten die Route der Jacht auf der Ostsee nach, die das Schiff am 6. September von seinem Heimathafen in Rostock zun\u00e4chst zur Insel R\u00fcgen und dann zur d\u00e4nischen Insel Christians\u00f8 f\u00fchrte. Am 26. September soll es sich dann in der N\u00e4he der Orte befunden haben, an denen die Explosionen an den Pipelines stattfanden. In Wiek auf R\u00fcgen habe die Mannschaft haltgemacht, um Proviant zu laden. Laut einem Hafenmeister hat die Gruppe eine Sprache, die wie Polnisch oder Tschechisch klang, gesprochen. Mindestens ein gef\u00e4lschter bulgarischer Pass sei verwendet worden. Mit Verweis auf einen Ausbilder f\u00fcr technisches Tauchen gehen die \u00abSpiegel\u00bb-Journalisten zudem davon aus, dass auch erfahrene Freizeittaucher zu den Sabotageakten in rund 80 Meter Tiefe in der Lage gewesen w\u00e4ren. Zur Platzierung der Sprengs\u00e4tze seien wahrscheinlich vier Tauchg\u00e4nge an je drei Stunden n\u00f6tig gewesen. Die Segeljacht sei dann vom 18. bis zum 20. Januar des aktuellen Jahres von der deutschen Bundesanwaltschaft durchsucht worden. Bereits zuvor hatte der Rechercheverbund von ARD und \u00abDie Zeit\u00bb berichtet, die Crew des Segelschiffes habe aus einem Skipper, zwei Tauchern, zwei Tauchassistenten und einer \u00c4rztin bestanden. Jacht zu klein f\u00fcr eine Operation solcher Gr\u00f6sse Der \u00abGuardian\u00bb nahm die Recherche des \u00abSpiegels\u00bb noch am gleichen Tag auf und stellte mehrere der pr\u00e4sentierten Annahmen mit Berufung auf Experten infrage: Die Segeljacht sei wahrscheinlich zu klein f\u00fcr den Transport der ben\u00f6tigten mehreren Hundert Kilogramm Sprengstoff gewesen. Einige Experten gingen von bis zu 2000 Kilogramm Z\u00fcndstoff aus. Auch h\u00e4tten die Taucher f\u00fcr mehrere Tauchg\u00e4nge in 80 Meter Tiefe eine Dekompressionskammer ben\u00f6tigt. Das \u00abWall Street Journal\u00bb berichtete am Montag, dass es vergangenen Freitag beim Segelcharter Mola Yachting angerufen und best\u00e4tigt bekommen habe, dass die fragliche Jacht Gegenstand von Untersuchungen sei. Auch habe ein hoher Offizieller der deutschen Regierung, der einen Bericht zur Untersuchung eingesehen habe, best\u00e4tigt, dass einige Mitglieder der fraglichen Mannschaft ukrainische P\u00e4sse pr\u00e4sentiert h\u00e4tten. Unbekannte T\u00e4terschaft: Eines von vier Gaslecks nach dem Sabotageakt an den Nord-Stream-Gaspipelines in der Nordsee. Ein grosses Loch klafft in der Pipeline: Ein mit einem Unterwasserroboter der Firma Blueye Robotics aufgenommenes Bild zeigt eines der L\u00f6cher in der Nord-Stream 1-Gaspipeline. Das Tankschiff Minerva Julie Eine weitere, nicht best\u00e4tigte Theorie sieht das unter griechischer Flagge verkehrende Tankschiff Minerva Julie als zentralen Akteur in der Sabotage der Nord-Stream Pipelines. Das Schiff ist ab dem 5. September acht Tage lang n\u00f6rdlich von Bornholm hin- und hergekreuzt \u2013 genau an der Stelle, wo am 26. September die zwei R\u00f6hren von Nord Stream 1 gesprengt wurden \u2013, wie die finnische Zeitung \u00abVerkkouutiset\u00bb bereits Ende September berichtete. Der \u00d6ltanker lief auch nach Beginn des Ukraine-Kriegs wiederholt russische H\u00e4fen an, wof\u00fcr die griechische Betreibergesellschaft Minerva Marine Inc. von verschiedenen Seiten kritisiert wurde. Minerva Marine erkl\u00e4rte gegen\u00fcber der \u00abWelt am Sonntag\u00bb, man habe w\u00e4hrend des Kreuzens auf weitere Instruktionen gewartet. Die \u00abBerliner Zeitung\u00bb wiederum beruft sich in ihren Recherchen auf den Karlsruher Sprengstoffexperten David Domjahn. Dieser h\u00e4lt die Darstellung, wonach eine kleine Gruppe von Saboteuren vom Segelschiff Andromeda aus die Sprengladungen angebracht haben soll, f\u00fcr sehr unwahrscheinlich: \u00abBereits die Vorstellung, dass rund zwei Tonnen Sprengstoff in handlichen Einzelpaketen ohne Kran an Bord verlastet h\u00e4tten werden m\u00fcssen, finde ich abenteuerlich. Das Ganze muss dicht an dicht zu einer sogenannten geballten Ladung gepackt werden. Ein solches aus Einzelp\u00e4ckchen bestehendes 500-kg-Paket ist sowohl \u00fcber als auch unter Wasser allein schon vom Gewicht her schwer handhabbar.\u00bb Wird mit dem Sabotageakt auf die Nord-Stream-Pipelines in Verbindung gebracht: Das Tankerschiff Minerva Julie, hier beim Hafen von Rotterdam. F\u00fcr viel realistischer h\u00e4lt der Experte das Szenario, wonach f\u00fcr den Sabotageakt sogenannte Grundminen aus Milit\u00e4rbest\u00e4nden benutzt worden seien, die genau f\u00fcr solche Einsatzzwecke entwickelt wurden. Auch seismische Daten aus dem Zeitraum des Anschlags liessen auf \u00fcberdimensionierte Sprengladungen schliessen. Dies w\u00fcrde dann wiederum eher f\u00fcr eine staatlich geplante Operation sprechen. Auch der d\u00e4nische Investigativjournalist Oliver Alexander h\u00e4lt das Szenario, wonach die Installation der Sprengladungen mit dem Kreuzen des Tankerschiffs Minerva Julie zusammenh\u00e4ngen soll, f\u00fcr wahrscheinlicher. Die Segeljacht Andromeda sei vielleicht verwendet worden, um das f\u00fcr die Operation zust\u00e4ndige Team und Vorr\u00e4te zu transportieren. Alexander ver\u00f6ffentlichte zu seiner These Daten der Marine-Traffic-Positionsdatenbank, welche das Kreuzen der Minerva Julie vom 6. bis zum 13. September aufzeigen. Die politische Dimension Die Faktenlage, wer hinter dem Anschlag auf die Nord-Stream-Pipelines steckt, ist nach wie vor sehr d\u00fcnn. Derweil mangelt es nicht an Schuldzuweisungen und Mutmassungen, wer hinter der Operation stehen k\u00f6nnte. Gleich nach der Sabotage der Pipelines am 26. September begannen die gegenseitigen Verd\u00e4chtigungen der involvierten Staaten. Wirkliche Fakten wurden dabei aber keine pr\u00e4sentiert. Dann folgte Anfang Februar eine Analyse des amerikanischen Investigativjournalisten Seymour Hersch, der behauptete, die US-Regierung habe mit Unterst\u00fctzung Norwegens die Sabotageakte ver\u00fcbt. Er st\u00fctzte sich dabei auf eine anonyme Quelle, die er nicht offenlegen wollte, und auf Aussagen Joe Bidens kurz vor dem Einmarsch Russlands in die Ukraine. Am 7. M\u00e4rz folgte ein Artikel der \u00abNew York Times\u00bb, in dem mit Verweis auf Geheimdienstinformationen die These aufgestellt wurde, eine proukrainische Gruppe habe den Anschlag auf die Pipelines ver\u00fcbt, jedoch ohne Auftrag der ukrainischen Regierung. Der Artikel verwies u. a. auf das Motiv, dass die Gaslieferungen Russlands an Westeuropa f\u00fcr die Ukraine ein nationales Sicherheitsrisiko darstellten, da damit die russische Armee mitfinanziert wurde, auch wenn zum Zeitpunkt des Anschlags kein Gas mehr geliefert wurde. Beweise f\u00fcr dieses Szenario pr\u00e4sentierte aber auch dieser Artikel nicht. Die Indizien und Motive weisen allerdings in diese Richtung, wie diese Zeitung in einer Analyse aufgezeigt hat. Dass eine proukrainische Gruppierung hinter dem Sabotageakt stehen k\u00f6nnte, wurde derweil aber auch wiederholt als politisches Motiv identifiziert, um die westliche Koalition, welche die Ukraine mit Waffenlieferungen unterst\u00fctzt, zu schw\u00e4chen. Der Anschlag liess die im Herbst ohnehin schon hohen Energiepreise weiter in die H\u00f6he schnellen. Auch eine sogenannte False-Flag-Operation \u2013 bei der bewusst Indizien zur Beschuldigung eines anderen Akteurs ausgelegt wurden \u2013 ist nicht unwahrscheinlich, wie auch Konstantin von Notz, der deutsche Geheimdienstkontrolleur, letzte Woche gegen\u00fcber deutschen Medien sagte: Man habe es \u00absehr wahrscheinlich mit einem staatlichen oder quasistaatlichen Akteur zu tun, weil es sehr anspruchsvoll ist, grosse Mengen von Sprengstoff unerkannt an die richtige Stelle in der Ostsee zu transportieren, ihn in eine relevante Tiefe zu bringen, um kontrolliert mehrere Explosionen auszul\u00f6sen\u00bb. Ein solcher \u00abTerrorakt mit staatlichem Hintergrund macht es wahrscheinlicher, dass falsche beziehungsweise auch Trugspuren gelegt wurden\u00bb. ","title":"Neue Spekulationen zur Sprengung der Pipelines","titleheader":"Debatte um Nord-Stream-Sabotage","text_gpt4_api_keynotes_07_256":"- Debatte um Nord-Stream-Sabotage mit verschiedenen Szenarien und Indizien, aber keine stichhaltigen Beweise\n- Segeljacht Andromeda als m\u00f6glicher zentraler Akteur in der Sprengung der Pipelines, aber Experten zweifeln an der Umsetzbarkeit\n- Ungekl\u00e4rte T\u00e4terschaft und politische Dimension f\u00fchren zu gegenseitigen Schuldzuweisungen und Spekulationen","text_api_keynotes_07_256":"1. Neue Indizien zur Sabotage der Nord-Stream-Pipelines: In den vergangenen Tagen wurden verschiedene Theorien vorgestellt, wer hinter den Anschl\u00e4gen auf die Pipelines stecken k\u00f6nnte.\n2. Die Segeljacht Andromeda als zentraler Akteur: Einige Experten sehen die Jacht als Verbindung zwischen dem Saboteur-Team und den Sprengungen.\n3. Politische Dimension und m\u00f6gliche False-Flag-Operation: Der Anschlag auf die Nord-Stream-Pipelines hat auch politische Auswirkungen und es ist m\u00f6glich, dass falsche Spuren gelegt wurden, um einen anderen Akteur zu beschuldigen.","qa_list_gpt4":["Welche Theorien gibt es bez\u00fcglich der Sabotage der Nord-Stream-Pipelines?\n","Die Sabotage wurde von Au\u00dferirdischen durchgef\u00fchrt.","Die Explosionen waren nur ein Unfall und keine Sabotage.","M\u00f6gliche Theorien umfassen die Beteiligung der Segeljacht Andromeda, die USA als Drahtzieher oder proukrainische Gruppierungen."],"flesch":[39.55,45.55,40.15,46.3,38.15,59.4],"text_gpt4_api_normal_words_05_512":"In den letzten Tagen gab es viele Spekulationen und Indizien zur Sabotage der Nord-Stream-Pipelines, aber die Faktenlage bleibt d\u00fcnn und vieles ist hypothetisch. Ein neuer Erkl\u00e4rungsansatz sieht die Segeljacht Andromeda als zentralen Akteur in der Sprengung der Pipelines, aber stichhaltige Beweise fehlen bisher. Ein weiteres Szenario bringt einen \u00d6ltanker, der vor den Explosionen am Ort der Sabotageakte gekreuzt war, ins Spiel. Die politische Dimension der Debatte ist gro\u00df, mit gegenseitigen Schuldzuweisungen und Mutma\u00dfungen \u00fcber die m\u00f6glichen Hinterm\u00e4nner der Sabotageakte. Einige Experten halten eine sogenannte False-Flag-Operation f\u00fcr m\u00f6glich, bei der bewusst Indizien zur Beschuldigung eines anderen Akteurs ausgelegt wurden.","frage_antwort":[]},{"_id":"6429805da9d504ce92eb634d","aid":348906801975,"date":"2023-03-15T15:55:06","author":"Walter Niederberger","categoryName":"Wirtschaft","premium":false,"readingTime":240.0,"wordCount":800.0,"url":"https:\/\/www.tagesanzeiger.ch\/die-vielen-taeter-der-us-bankenkrise-348906801975","own":"Pleite der Silicon Valley Bank. Die vielen T\u00e4ter der US-Bankenkrise. Die Regierung Trump legte den Boden f\u00fcr den gr\u00f6ssten Bankenkollaps seit der Finanzkrise. Einflussreiche Demokraten und eine Revisionsfirma halfen tatkr\u00e4ftig mit. Donald Trump hat w\u00e4hrend seiner Amtszeit das Gesetz zum Schutz von Bankkunden aufgeweicht. Progressive Demokraten warnten, aber bankennahe Demokraten setzten sich durch und halfen Trump, das Gesetz aufzuweichen. Sie griffen einzelne Kollegen im Senat direkt an und warfen ihnen vor, die Lehren aus der Finanzkrise 2008 vergessen zu haben. 17 Demokraten schlossen sich den einstimmigen Republikanern im Senat an; und im Abgeordnetenhaus stimmten 33 Demokraten mit den Republikanern f\u00fcr die Deregulierung. Elizabeth Warren warnte, dass mit der Aufweichung der Boden f\u00fcr die n\u00e4chste Bankenkrise gelegt werden w\u00fcrde. Auch die Signature Bank und die Silicon-Valley-Bank. Sie mussten fortan keine gr\u00f6sseren Finanzreserven mehr bilden und keine Pl\u00e4ne f\u00fcr die Schliessung der Bank im Krisenfall vorlegen. Dabei war er einer der Architekten der Bankenregulierung der Regierung Obama gewesen. KPMG sah keine Gefahr. Die Signature Bank w\u00e4hlte ihn in den Verwaltungsrat, in dem zeitweise auch Trump-Tocher Ivanka sass. Erst 2020 sollte die Bank die letzten Trump-Konten aufl\u00f6sen, nachdem der Ex-Pr\u00e4sident den Sturm aufs Capitol angeheizt hatte. Frank bezog seit 2015 \u00fcber 2,4 Millionen Dollar, bevor er am Sonntag nach der Schliessung der Bank seinen Stuhl hastig r\u00e4umte. Schlecht sieht auch die Revisionsfirma KPMG aus. Die Revisionsfirma verteidigt sich damit, dass die Pr\u00fcfung 14 bzw. \u00abDas Timing ist eine spektakul\u00e4re Dem\u00fctigung f\u00fcr KPMG.\u00bb ","lexrank_sumy":"Die Regierung Trump legte den Boden f\u00fcr den gr\u00f6ssten Bankenkollaps seit der Finanzkrise. Donald Trump hat w\u00e4hrend seiner Amtszeit das Gesetz zum Schutz von Bankkunden aufgeweicht. Progressive Demokraten warnten, aber bankennahe Demokraten setzten sich durch und halfen Trump, das Gesetz aufzuweichen. Sie griffen einzelne Kollegen im Senat direkt an und warfen ihnen vor, die Lehren aus der Finanzkrise 2008 vergessen zu haben. Warren warnte, dass mit der Aufweichung der Boden f\u00fcr die n\u00e4chste Bankenkrise gelegt werden und erneut der Staat zur Rettung eilen m\u00fcsse. 17 Demokraten schlossen sich den einstimmigen Republikanern im Senat an; und im Abgeordnetenhaus stimmten 33 Demokraten mit den Republikanern f\u00fcr die Deregulierung. Elizabeth Warren warnte, dass mit der Aufweichung der Boden f\u00fcr die n\u00e4chste Bankenkrise gelegt werden w\u00fcrde. Konkret wurde die Schwelle f\u00fcr die versch\u00e4rfte Aufsicht der Banken von einem Verm\u00f6genswert von 50 auf 250 Milliarden Dollar angehoben, womit nur noch rund zehn Banken einen j\u00e4hrlichen Stresstest durchf\u00fchren mussten. Auch die Signature Bank und die Silicon-Valley-Bank. Beide Banken waren frei, ihre Bilanzsumme in Windeseile auf \u00fcber 100 Milliarden Dollar zu steigern. Zudem war Greg Becker, Verwaltungsratschef der Silicon-Valley-Bank, einer der F\u00fchrungskr\u00e4fte, die sich f\u00fcr die Aufweichung des Gesetzes eingesetzt hatten. Dabei war er einer der Architekten der Bankenregulierung der Regierung Obama gewesen. KPMG sah keine Gefahr. Die Liquidation, sagt er heute, sei unn\u00f6tig gewesen. Signature war eine der Schaltstellen f\u00fcr den Kryptounternehmer. Schlecht sieht auch die Revisionsfirma KPMG aus. Sie pr\u00fcfte noch wenige Tage vor dem Kollaps die B\u00fccher beider Banken und befand sie f\u00fcr solide. Auf jeden Fall wird KPMG in die staatliche Untersuchung des Bankenkollapses einbezogen. Zwar w\u00fcnscht Pr\u00e4sident Joe Biden eine rasche Vorlage, aber da die Republikaner das Abgeordnetenhaus kontrollieren und weil die Demokraten im Senat eine zu d\u00fcnne Mehrheit haben, muss dem Vorhaben wenig Chancen gegeben werden. ","text_api_simple_words_07_512":"Die Silicon Valley Bank und die Signature Bank sind zusammengebrochen, weil sie fehlerhafte Kredite vergeben haben und die Regierung Trump die Bankenaufsicht abgeschw\u00e4cht hat. Elizabeth Warren und Bernie Sanders haben versucht, die Deregulierung zu verhindern, aber viele Demokraten haben mit den Republikanern gestimmt, um die Regulierung zu lockern. Die Lockerung hat dazu gef\u00fchrt, dass viele kleine Banken keine Stresstests mehr durchf\u00fchren m\u00fcssen, was zu fehlender Aufsicht und riskantem Verhalten f\u00fchrt. Die Revisionsfirma KPMG hat die B\u00fccher der Banken gepr\u00fcft und sie f\u00fcr solide befunden, obwohl sie kurz darauf zusammengebrochen sind. Die Regierung Biden m\u00f6chte die Aufsicht wieder versch\u00e4rfen, aber es ist unklar, ob dies vor den Wahlen 2024 geschehen wird.","text_api_normal_words_05_512":"Der Artikel beschreibt den Zusammenbruch der Silicon Valley Bank und die vielen Verantwortlichen f\u00fcr die US-Bankenkrise. Die Regierung Trump hat das Gesetz zum Schutz von Bankkunden aufgeweicht, das nach der Finanzkrise von Barack Obama erlassen wurde. Progressive Demokraten wie Elizabeth Warren und Bernie Sanders haben sich gegen die Deregulierung ausgesprochen, aber bankennahe Demokraten haben Trump geholfen, das Gesetz aufzuweichen. Die Aufsicht \u00fcber mittelgro\u00dfe Banken wurde gelockert, was dazu f\u00fchrte, dass die Silicon Valley Bank und die Signature Bank keine gr\u00f6\u00dferen Finanzreserven mehr bilden mussten und keine Pl\u00e4ne f\u00fcr die Schlie\u00dfung der Bank im Krisenfall vorlegen mussten. Beide Banken waren frei, ihre Bilanzsumme in Windeseile auf \u00fcber 100 Milliarden Dollar zu steigern. Die Manager haben den elementarsten Fehler der Branche gemacht: Sie vergaben kurzfristige Kredite und unterlegten sie mit langfristigen Sicherheiten. In diesem Fall waren es US-Staatsanleihen, die wegen der steigenden Zinsen stark an Wert verloren und ein Loch in die Bilanz rissen. Auch die Revisionsfirma KPMG, die die B\u00fccher beider Banken pr\u00fcfte und sie f\u00fcr solide befand, sieht schlecht aus und wird in die staatliche Untersuchung des Bankenkollapses einbezogen. Der Kongress hat wenig Zeit, vor den Wahlen 2024 die Aufsicht f\u00fcr mittelgro\u00dfe Banken wieder zu versch\u00e4rfen.","text_api_child_09_350":"Es geht in diesem Text um eine grosse Bank in den USA, die pleite gegangen ist. Das liegt daran, dass viele Menschen in der Regierung und der Wirtschaft bei der Aufsicht der Bank versagt haben. Pr\u00e4sident Trump hat ein Gesetz aufgehoben, das Banken vor einem Kollaps sch\u00fctzen sollte. Viele Politiker haben daf\u00fcr gestimmt, weil sie glaubten, dass die Banken dadurch mehr Kredite vergeben k\u00f6nnen. Aber das hat dazu gef\u00fchrt, dass einige Banken zu gross und zu m\u00e4chtig geworden sind, was letztendlich zum Zusammenbruch der Bank gef\u00fchrt hat. Auch die Kontrolleure der Bank haben ihre Arbeit nicht gut gemacht. Es sieht so aus, als w\u00e4ren sie zu nachl\u00e4ssig gewesen. Jetzt wollen die Politiker das Gesetz wieder \u00e4ndern, um sicherzustellen, dass so etwas nicht noch einmal passiert.","text_api_keynotes_07_350":"1. Die Regierung Trump hat das Gesetz zum Schutz von Bankkunden aufgeweicht, das nach der Finanzkrise 2008 erlassen wurde, um mittelgro\u00dfe Banken genauso strikt zu \u00fcberwachen wie die Wallstreet-Banken.\n2. Progressive Demokraten wie Elizabeth Warren haben sich gegen die Deregulierung der Bankenaufsicht gewehrt, aber 17 Demokraten schlossen sich den Republikanern im Senat an und stimmten f\u00fcr die Aufweichung des Gesetzes.\n3. Die Aufweichung der Bankenaufsicht hat dazu gef\u00fchrt, dass die Signature Bank und die Silicon Valley Bank keine gr\u00f6sseren Finanzreserven mehr bilden und keine Pl\u00e4ne f\u00fcr die Schliessung der Bank im Krisenfall vorlegen mussten.\n4. Die Manager der betroffenen Banken haben den elementarsten Fehler der Branche begangen und kurzfristige Kredite mit langfristigen Sicherheiten unterlegt, die wegen steigender Zinsen stark an Wert verloren und ein Loch in die Bilanz rissen.\n5. Die Revisionsfirma KPMG hat die B\u00fccher der Banken gepr\u00fcft und sie f\u00fcr solide befunden, obwohl der Run auf die Silicon-Valley-Bank bereits letztes Jahr eingesetzt hatte und die Einlagen bis Ende Jahr um 25 Milliarden Dollar oder 13 Prozent gefallen waren.","text_davinci_api_key_07_256":"1. Der Einfluss von Demokraten und eine Revisionsfirma trugen dazu bei, dass Pr\u00e4sident Trump das Gesetz zum Schutz von Bankkunden aufweichte. \n2. Elizabeth Warren und Bernie Sanders warnten vor einer weiteren Bankenkrise, doch vergeblich. \n3. Pr\u00e4sident Joe Biden w\u00fcnscht eine rasche Versch\u00e4rfung der Aufsicht f\u00fcr die mittelgrossen Banken, jedoch stehen die Chancen schlecht, dass dies vor den Wahlen 2024 vollzogen wird.","five_letter_word_list":["t\u00e4ter","trump","legte","boden","woche","sturm","eines","obama","hatte","diese","staat","einer","durch","gegen","senat","ihnen","haben","h\u00e4tte","nicht","w\u00e4ren","eilen","m\u00fcsse","w\u00fcrde","wurde","einem","womit","einen","davon","keine","pl\u00e4ne","beide","waren","n\u00f6tig","wegen","stark","zudem","menge","sagte","frank","dabei","seine","eifer","daf\u00fcr","nacht","schon","bezog","bevor","stuhl","heute","darum","ihrer","biden","sieht","damit","jeden","exakt","stand","abzug","wenig","d\u00fcnne"],"qa_list":["Welche Banken wurden von der Aufweichung des Gesetzes zum Schutz von Bankkunden profitiert?","Deutsche Bank und UBS","JP Morgan und Goldman Sachs","Signature Bank und Silicon-Valley-Bank"],"lead":"Die Regierung Trump legte den Boden f\u00fcr den gr\u00f6ssten Bankenkollaps seit der Finanzkrise. Einflussreiche Demokraten und eine Revisionsfirma halfen tatkr\u00e4ftig mit.","originaltext":"Pleite der Silicon Valley Bank. Die vielen T\u00e4ter der US-Bankenkrise. Die Regierung Trump legte den Boden f\u00fcr den gr\u00f6ssten Bankenkollaps seit der Finanzkrise. Einflussreiche Demokraten und eine Revisionsfirma halfen tatkr\u00e4ftig mit. Donald Trump hat w\u00e4hrend seiner Amtszeit das Gesetz zum Schutz von Bankkunden aufgeweicht. Kaum eine Woche nach seinem Amtsantritt setzte Pr\u00e4sident Donald Trump zum Sturm auf eines der wirksamsten Gesetze zum Schutz von Bankkunden an. Barack Obama hatte es nach der Finanzkrise erlassen, um rund 30 mittelgrosse Banken genauso strikt zu \u00fcberwachen wie die Wallstreet-Banken, die 2008 den Kollaps ausgel\u00f6st hatten. Es sollte verhindert werden, dass diese Finanzh\u00e4user den Staat im Krisenfall zu einer Rettungsaktion zwingen w\u00fcrden. Progressive Demokraten warnten, aber bankennahe Demokraten setzten sich durch und halfen Trump, das Gesetz aufzuweichen. Elizabeth Warren und Bernie Sanders sperrten sich nach Kr\u00e4ften gegen die von der Finanzbranche hartn\u00e4ckig verlangten Deregulierung. Sie griffen einzelne Kollegen im Senat direkt an und warfen ihnen vor, die Lehren aus der Finanzkrise 2008 vergessen zu haben. Warren im Besonderen machte sich unbeliebt, erinnert sich ihr damaliger Stabschef Dan Geldon. Die interne Auseinandersetzung sei \u00abungew\u00f6hnlich geh\u00e4ssig\u00bb gewesen. Es h\u00e4tte nicht viel gefehlt, und es w\u00e4ren \u00abSt\u00fchle geflogen\u00bb. Warren warnte, dass mit der Aufweichung der Boden f\u00fcr die n\u00e4chste Bankenkrise gelegt werden und erneut der Staat zur Rettung eilen m\u00fcsse. Ihre Warnung n\u00fctzte nichts. 17 Demokraten schlossen sich den einstimmigen Republikanern im Senat an; und im Abgeordnetenhaus stimmten 33 Demokraten mit den Republikanern f\u00fcr die Deregulierung. Elizabeth Warren warnte, dass mit der Aufweichung der Boden f\u00fcr die n\u00e4chste Bankenkrise gelegt werden w\u00fcrde. Konkret wurde die Schwelle f\u00fcr die versch\u00e4rfte Aufsicht der Banken von einem Verm\u00f6genswert von 50 auf 250 Milliarden Dollar angehoben, womit nur noch rund zehn Banken einen j\u00e4hrlichen Stresstest durchf\u00fchren mussten. 30 Regionalbanken wurden davon entlastet. Auch die Signature Bank und die Silicon-Valley-Bank. Sie mussten fortan keine gr\u00f6sseren Finanzreserven mehr bilden und keine Pl\u00e4ne f\u00fcr die Schliessung der Bank im Krisenfall vorlegen. Beide Banken waren frei, ihre Bilanzsumme in Windeseile auf \u00fcber 100 Milliarden Dollar zu steigern. Da keine Stresstests n\u00f6tig waren, bildet sich eine toxische Mischung aus fehlender Aufsicht und einem Vollrisiko-Management, das die Nullzinspolitik der US-Notenbank bis zum Kollaps ausreizen sollte. Dass die Manager selber in h\u00f6chstem Mass verantwortlich sind, ist offensichtlich. Sie machten den elementarsten Fehler der Branche: Sie vergaben kurzfristige Kredite und unterlegten sie mit langfristigen Sicherheiten. In diesem Fall waren es US-Staatsanleihen, die wegen der steigenden Zinsen stark an Wert verloren und die ein Loch in die Bilanz rissen. Zudem war Greg Becker, Verwaltungsratschef der Silicon-Valley-Bank, einer der F\u00fchrungskr\u00e4fte, die sich f\u00fcr die Aufweichung des Gesetzes eingesetzt hatten. Die Lockerung \u00aberspart den kleineren Banken eine Menge Papierkram\u00bb, sagte Barney Frank. Doch \u00fcberraschend dr\u00e4ngte auch der ehemalige demokratische Kongressabgeordnete Barney Frank auf eine Lockerung der Bankenaufsicht. Ihr Argument war, dass die l\u00e4stigen Vorschriften die F\u00e4higkeit der Branche einschr\u00e4nken, kreditw\u00fcrdigen Kunden Geld zu leihen. Die Lockerung \u00aberspart den kleineren Banken eine Menge Papierkram\u00bb, sagte Frank. Dabei war er einer der Architekten der Bankenregulierung der Regierung Obama gewesen. Seine Brandreden im Kongress, sein Eifer, die Banken zu z\u00fcgeln, waren legend\u00e4r. Obama bedankte sich \u00fcberschw\u00e4nglich bei Frank und seinem Mitstreiter Senator Christopher Dodd daf\u00fcr, dass sie \u00abTag und Nacht f\u00fcr diese Reform gearbeitet haben\u00bb. KPMG sah keine Gefahr. Doch schon 2013 predigte Frank das Gegenteil, und nach seinem R\u00fcckzug aus dem Kongress wurde er belohnt. Die Signature Bank w\u00e4hlte ihn in den Verwaltungsrat, in dem zeitweise auch Trump-Tocher Ivanka sass. Erst 2020 sollte die Bank die letzten Trump-Konten aufl\u00f6sen, nachdem der Ex-Pr\u00e4sident den Sturm aufs Capitol angeheizt hatte. Frank bezog seit 2015 \u00fcber 2,4 Millionen Dollar, bevor er am Sonntag nach der Schliessung der Bank seinen Stuhl hastig r\u00e4umte. Die Liquidation, sagt er heute, sei unn\u00f6tig gewesen. Aber den Aufsehern sei es nur darum gegangen, der Krypto-Szene einen Schlag zu versetzen. Signature war eine der Schaltstellen f\u00fcr den Kryptounternehmer. Rund ein F\u00fcnftel ihrer Depots von 88 Milliarden Dollar geh\u00f6rten Krypto-Kunden. \u00abWir waren diejenigen, auf die sie schossen, um andere zu ermutigen, sich von Kryptow\u00e4hrungen fernzuhalten\u00bb, sagte Frank. Pr\u00e4sident Joe Biden w\u00fcnscht eine rasche Vorlage. Schlecht sieht auch die Revisionsfirma KPMG aus. Sie pr\u00fcfte noch wenige Tage vor dem Kollaps die B\u00fccher beider Banken und befand sie f\u00fcr solide. Die Revisionsfirma verteidigt sich damit, dass die Pr\u00fcfung 14 bzw. 10 Tage vor dem Kollaps abgeschlossen wurde. Was danach passierte, so KPMG, sei zwangsl\u00e4ufig nicht ihre Verantwortung. Ob diese Erkl\u00e4rung gen\u00fcgt, wird sich zeigen. Auf jeden Fall wird KPMG in die staatliche Untersuchung des Bankenkollapses einbezogen. \u00abDas Timing ist eine spektakul\u00e4re Dem\u00fctigung f\u00fcr KPMG.\u00bb Denn der Run auf die Silicon-Valley-Bank hatte gem\u00e4ss dem \u00abWall Street Journal\u00bb bereits letztes Jahr eingesetzt. Die Einlagen erreichten exakt vor einem Jahr den h\u00f6chsten Stand und fielen dann bis Ende Jahr um 25 Milliarden Dollar oder 13 Prozent. Der Abzug beschleunigte sich im Januar und Februar. Doch f\u00fcr KPMG war das offenbar kein Gefahrensignal, obwohl gleichzeitig die Aktiven in Form langj\u00e4hriger Staatsanleihen massiv entwertet wurden. \u00abDas Timing ist eine spektakul\u00e4re Dem\u00fctigung f\u00fcr KPMG\u00bb, sagt Wirtschaftsprofessor Erik Gordon von der Universit\u00e4t Michigan. Der Kongress hat wenig Zeit, vor den Wahlen 2024 die Aufsicht f\u00fcr die mittelgrossen Banken wieder zu versch\u00e4rfen. Zwar w\u00fcnscht Pr\u00e4sident Joe Biden eine rasche Vorlage, aber da die Republikaner das Abgeordnetenhaus kontrollieren und weil die Demokraten im Senat eine zu d\u00fcnne Mehrheit haben, muss dem Vorhaben wenig Chancen gegeben werden. ","title":"Die vielen T\u00e4ter der US-Bankenkrise","titleheader":"Pleite der Silicon Valley Bank","text_gpt4_api_keynotes_07_256":"- Trump-Regierung lockerte Bankenschutzgesetz, was zu weniger strenger \u00dcberwachung von mittelgro\u00dfen Banken f\u00fchrte.\n- Elizabeth Warren und Bernie Sanders warnten vor m\u00f6glichen negativen Folgen der Deregulierung f\u00fcr die n\u00e4chste Bankenkrise.\n- KPMG pr\u00fcfte B\u00fccher beider Banken kurz vor dem Kollaps und befand sie f\u00fcr solide, trotzdem kam es zum gr\u00f6\u00dften Bankenkollaps seit der Finanzkrise.","text_api_keynotes_07_256":"- Die Regierung Trump hat das Gesetz zum Schutz von Bankkunden aufgeweicht, was den Boden f\u00fcr den gr\u00f6ssten Bankenkollaps seit der Finanzkrise gelegt hat.\n- Progressive Demokraten wie Elizabeth Warren und Bernie Sanders haben sich gegen die Deregulierung ausgesprochen, wurden aber von bankennahen Demokraten \u00fcberstimmt.\n- Die Aufweichung des Gesetzes hat dazu gef\u00fchrt, dass die Silicon-Valley-Bank und die Signature Bank keine Stresstests mehr durchf\u00fchren mussten und dadurch in eine toxische Mischung aus fehlender Aufsicht und Risikomanagement gerieten. Die Revisionsfirma KPMG wurde daf\u00fcr kritisiert, dass sie die B\u00fccher der Banken noch wenige Tage vor dem Kollaps als solide beurteilte.","qa_list_gpt4":["Was war eine direkte Folge der Aufweichung des Gesetzes zum Schutz von Bankkunden unter der Trump-Regierung?\n","Alle Banken mussten mehr Finanzreserven bilden.","Die Anzahl der Banken, die j\u00e4hrliche Stresstests durchf\u00fchren mussten, stieg von 10 auf 30.","Die Schwelle f\u00fcr die versch\u00e4rfte Aufsicht der Banken wurde von einem Verm\u00f6genswert von 50 auf 250 Milliarden Dollar angehoben."],"flesch":[54.45,56.25,47.5,46.85,47.05,70.8],"text_gpt4_api_normal_words_05_512":"Die Trump-Regierung legte den Grundstein f\u00fcr den gr\u00f6\u00dften Bankenkollaps seit der Finanzkrise, indem sie das Gesetz zum Schutz von Bankkunden aufweichte. Trotz Warnungen von progressiven Demokraten wie Elizabeth Warren und Bernie Sanders, setzten sich bankennahe Demokraten durch und halfen Trump, das Gesetz zu lockern. Die Schwelle f\u00fcr die versch\u00e4rfte Aufsicht von Banken wurde von 50 auf 250 Milliarden Dollar angehoben, wodurch nur noch etwa zehn Banken j\u00e4hrliche Stresstests durchf\u00fchren mussten. Die Lockerung betraf auch die Signature Bank und die Silicon-Valley-Bank, die beide ihre Bilanzsumme schnell auf \u00fcber 100 Milliarden Dollar steigern konnten. Die Revisionsfirma KPMG pr\u00fcfte die B\u00fccher beider Banken kurz vor dem Kollaps und befand sie f\u00fcr solide. Der Kongress hat nun wenig Zeit, die Aufsicht f\u00fcr mittelgro\u00dfe Banken vor den Wahlen 2024 wieder zu versch\u00e4rfen.","frage_antwort":["Wer war eine der Schaltstellen f\u00fcr den Kryptounternehmer?","Signature","Bernie Sanders","Barney Frank"]},{"_id":"6429805da9d504ce92eb6357","aid":982615156510,"date":"2023-03-16T09:27:11","author":"Jacqueline B\u00fcchi","categoryName":"Schweiz","premium":false,"readingTime":300.0,"wordCount":1017.0,"url":"https:\/\/www.tagesanzeiger.ch\/wie-der-ukraine-krieg-unser-denken-veraendert-hat-982615156510","own":"ETH-Sicherheitsstudie. Eine Ann\u00e4herung an die Nato ist in der Schweiz so popul\u00e4r wie nie. Wie denkt die Schweizer Bev\u00f6lkerung in Fragen der Sicherheits- und Aussenpolitik? F\u00fcnf interessante Erkenntnisse aus der aktuellen Sicherheitsstudie der ETH. Er hat auch in der Schweiz vermeintliche Gewissheiten ins Wanken gebracht. Neue Hinweise darauf, wie die Bev\u00f6lkerung in Fragen der Sicherheit und der Neutralit\u00e4t denkt, liefert nun eine Studie des Center for Security Studies und der Milit\u00e4rakademie an der ETH Z\u00fcrich. Seit rund drei Jahrzehnten werden im Rahmen der Studienreihe \u00abSicherheit\u00bb die Einstellungen der Schweizer Stimmbev\u00f6lkerung in Fragen der Sicherheits- und Aussenpolitik vermessen. F\u00fcnf interessante Erkenntnisse der Studie \u00abSicherheit 2023\u00bb: Der Krieg hat unser Sicherheitsgef\u00fchl nicht beeintr\u00e4chtigt. Der Gedanke, dass die Schweiz eine Insel der Gl\u00fcckseligen ist, ist offenbar tief in den K\u00f6pfen verankert. Wir vertrauen Politik und Medien. Die USA geniessen mehr Sympathien. Eine Ann\u00e4herung an die Nato wird salonf\u00e4hig. Die Forderung nach einer Ann\u00e4herung an die Nato ist in der Schweizer Stimmbev\u00f6lkerung so popul\u00e4r wie noch nie. Ein Beitritt der Schweiz zur Nato wird hingegen nur von einer Minderheit von 31 Prozent unterst\u00fctzt. \u00abWas aktuell sicher auch zu den hohen Zustimmungswerten beitr\u00e4gt, ist der Umstand, dass sich FDP-Pr\u00e4sident Thierry Burkart und Mitte-Chef Gerhard Pfister f\u00fcr eine Ann\u00e4herung an die Nato ausgesprochen haben. Zweifel am Konzept der bewaffneten Neutralit\u00e4t. Gegenw\u00e4rtig stehen 91 Prozent hinter der Schweizer Neutralit\u00e4t. Kratzer bekam jedoch das Konzept der bewaffneten Neutralit\u00e4t. ","lexrank_sumy":"Eine Ann\u00e4herung an die Nato ist in der Schweiz so popul\u00e4r wie nie. Neue Hinweise darauf, wie die Bev\u00f6lkerung in Fragen der Sicherheit und der Neutralit\u00e4t denkt, liefert nun eine Studie des Center for Security Studies und der Milit\u00e4rakademie an der ETH Z\u00fcrich. Zwar gab es immer mal wieder kurzfristige Phasen der Angst \u2013 so etwa nach den Terroranschl\u00e4gen von 9\/11. Dass diese Gesetzm\u00e4ssigkeit selbst nach Ausbruch des Ukraine-Kriegs noch gilt, \u00fcberrascht selbst Szvircsev Tresch. Wir vertrauen Politik und Medien. Wie sich nun zeigt, hat das Vertrauen in diese Institutionen in der breiten Bev\u00f6lkerung jedoch nicht gelitten \u2013 im Gegenteil. Das Vertrauen in den Bundesrat und das Parlament bleibt hoch. Jenes in die politischen Parteien hat gar zugenommen, ebenso wie das Vertrauen in die Medien. Dabei vertrauen politisch links eingestellte Menschen den Medien mehr als Personen aus dem rechten Spektrum. Das zeigte sich j\u00fcngst bei den Z\u00fcrcher Kantonsratswahlen wieder, wo es lediglich zu Ver\u00e4nderungen im Promillebereich kam.\u00bb Weiter geht Szvircsev Tresch davon aus, dass sich viele Menschen gerade in Zeiten von Fake News nach verl\u00e4sslichen Informationsquellen sehnen und sich daher ihr Vertrauen in die herk\u00f6mmlichen Medien gefestigt hat. Ein Zusammenhang f\u00e4llt hier laut Szvircsev Tresch auf: Wer dem Bundesrat misstraut, hat in der Tendenz eine h\u00f6here Affinit\u00e4t zu Russland und anderen autokratisch regierten Staaten. Eine Ann\u00e4herung an die Nato wird salonf\u00e4hig. Die Forderung nach einer Ann\u00e4herung an die Nato ist in der Schweizer Stimmbev\u00f6lkerung so popul\u00e4r wie noch nie. Ein Beitritt der Schweiz zur Nato wird hingegen nur von einer Minderheit von 31 Prozent unterst\u00fctzt. \u00abWas aktuell sicher auch zu den hohen Zustimmungswerten beitr\u00e4gt, ist der Umstand, dass sich FDP-Pr\u00e4sident Thierry Burkart und Mitte-Chef Gerhard Pfister f\u00fcr eine Ann\u00e4herung an die Nato ausgesprochen haben. \u00abDer Ukraine-Krieg war gewissermassen ein Realit\u00e4tscheck: Einige Leute stellten sich zum ersten Mal \u00fcberhaupt die Frage, was Neutralit\u00e4t genau bedeutet.\u00bb Kratzer bekam jedoch das Konzept der bewaffneten Neutralit\u00e4t. Eine politische Handlungsempfehlung l\u00e4sst sich aus den Resultaten allerdings nur schwer ableiten. So stellen sich 57 Prozent der Befragten hinter ein Konzept, das die Verfasserinnen und Verfasser der Studie \u00abdifferenzielle Neutralit\u00e4t\u00bb nennen: Bei politischen Konflikten soll die Schweiz demnach klar Stellung beziehen, bei milit\u00e4rischen Konflikten hingegen neutral bleiben. Szvircsev Tresch r\u00e4umt ein, dass das langj\u00e4hrige Studiendesign hier auch an gewisse Grenzen st\u00f6sst: \u00abViele der wiederkehrenden Fragen wurden kurz nach Ende des Kalten Kriegs definiert. ","text_api_simple_words_07_512":"Die ETH hat eine Sicherheitsstudie durchgef\u00fchrt, die zeigt, dass die Schweizer Bev\u00f6lkerung trotz des Ukraine-Kriegs und der Pandemie ein hohes Sicherheitsgef\u00fchl hat. Das Vertrauen in Politik, Medien und Nachbarl\u00e4nder ist gestiegen, w\u00e4hrend das Vertrauen in autorit\u00e4r regierte Staaten gesunken ist. Eine Ann\u00e4herung an die NATO wird von einer Mehrheit unterst\u00fctzt, w\u00e4hrend die Zustimmung zum Konzept der bewaffneten Neutralit\u00e4t gesunken ist. Es gibt jedoch kein klares Bild dar\u00fcber, wie die Schweizer Neutralit\u00e4t in Zukunft gesch\u00fctzt werden sollte.","text_api_normal_words_05_512":"Eine neue Studie des Center for Security Studies und der Milit\u00e4rakademie an der ETH Z\u00fcrich zeigt, dass die Bev\u00f6lkerung in der Schweiz trotz des Ukraine-Kriegs und der Covid-Pandemie ihr Vertrauen in politische Institutionen und Medien beibehalten hat. Zudem ist das Sicherheitsempfinden der Schweizerinnen und Schweizer nachhaltig stabil geblieben, mit 94 Prozent, die sich eher oder sehr sicher f\u00fchlen. Die Studie zeigt auch, dass die USA in der Schweiz mehr Sympathien genie\u00dfen als autorit\u00e4r regierte Staaten wie China, Nordkorea, Iran und Russland. Die Forderung nach einer Ann\u00e4herung an die Nato ist in der Schweizer Stimmbev\u00f6lkerung so popul\u00e4r wie noch nie, w\u00e4hrend Zweifel am Konzept der bewaffneten Neutralit\u00e4t aufkommen. Die Zustimmung zum Neutralit\u00e4tsprinzip bleibt jedoch hoch, und 91 Prozent unterst\u00fctzen die Schweizer Neutralit\u00e4t.","text_api_child_09_350":"In der Schweiz gibt es eine Studie zur Sicherheitspolitik und Au\u00dfenpolitik. Die Studie zeigt, dass die Menschen in der Schweiz sich trotz Krieg und Krisen sicher f\u00fchlen. Sie glauben auch den Politikern und den Medien. Die Menschen in der Schweiz m\u00f6gen ihre Nachbarl\u00e4nder sehr gerne, aber sie m\u00f6gen Russland und andere L\u00e4nder mit autorit\u00e4ren Regierungen nicht so sehr. Im Moment finden viele Menschen in der Schweiz auch eine Ann\u00e4herung an die Nato gut. Aber es gibt auch Zweifel am Konzept der bewaffneten Neutralit\u00e4t. Viele Leute fragen sich, ob die Schweiz wirklich neutral bleiben kann, wenn es zu einem Krieg kommt.","text_api_keynotes_07_350":"1. Die Studie \"Sicherheit 2023\" der ETH liefert neue Erkenntnisse zur Sicherheits- und Aussenpolitik der Schweiz. \n2. Trotz des Ukraine-Kriegs bleibt das Sicherheitsempfinden der Schweizerinnen und Schweizer konstant hoch. \n3. Politik und Medien genie\u00dfen weiterhin hohes Vertrauen in der Bev\u00f6lkerung, insbesondere in politisch links eingestellten Menschen. \n4. Die USA gewinnen an Beliebtheit, w\u00e4hrend das Vertrauen in autorit\u00e4r regierte Staaten sinkt. \n5. Eine Ann\u00e4herung an die Nato wird in der Schweizer Bev\u00f6lkerung popul\u00e4rer, w\u00e4hrend das Konzept der bewaffneten Neutralit\u00e4t hinterfragt wird.","text_davinci_api_key_07_256":"1. Die Schweizer Bev\u00f6lkerung ist sich \u00fcber die Bedeutung von Neutralit\u00e4t und Sicherheit bewusst: 94 Prozent geben an, sich eher oder sehr sicher zu f\u00fchlen. \n2. Der Gedanke, dass die Schweiz eine Insel der Gl\u00fcckseligen ist, ist tief in den K\u00f6pfen verankert. \n3. Eine Ann\u00e4herung an die Nato ist in der Schweizer Bev\u00f6lkerung so popul\u00e4r wie nie: 55 Prozent unterst\u00fctzen eine solche Ann\u00e4herung, w\u00e4hrend nur 31 Prozent einen Beitritt unterst\u00fctzen.","five_letter_word_list":["denkt","armee","nicht","lange","krieg","unser","denen","tibor","schon","etwas","immer","angst","rasch","diese","gaben","h\u00e4tte","durch","insel","elite","sowie","zeigt","jenes","dabei","links","haben","hohen","weist","davon","viele","daher","ihrer","allen","voran","einer","blick","trump","biden","china","stark","f\u00e4llt","wobei","n\u00e4her","w\u00fcrde","peaks","masse","wurde","damit","blieb","stets","leute","frage","genau","bekam","geben","heute","werde","einem","minus","l\u00e4sst","seite","gegen","r\u00e4umt"],"qa_list":["Wie denkt die Schweizer Bev\u00f6lkerung in Fragen der Sicherheits- und Aussenpolitik? \n","Die Schweizer Bev\u00f6lkerung f\u00fchlt sich seit dem Ukraine-Krieg unsicherer als zuvor.","Das Vertrauen in Politik und Medien hat bei der Schweizer Bev\u00f6lkerung stark abgenommen.","Die Studie zeigt, dass das Sicherheitsempfinden der Schweizerinnen und Schweizer konstant hoch ist und das Vertrauen in Politik, Medien und Nachbarl\u00e4nder gestiegen ist."],"lead":"Wie denkt die Schweizer Bev\u00f6lkerung in Fragen der Sicherheits- und Aussenpolitik? F\u00fcnf interessante Erkenntnisse aus der aktuellen Sicherheitsstudie der ETH.","originaltext":"ETH-Sicherheitsstudie. Eine Ann\u00e4herung an die Nato ist in der Schweiz so popul\u00e4r wie nie. Wie denkt die Schweizer Bev\u00f6lkerung in Fragen der Sicherheits- und Aussenpolitik? F\u00fcnf interessante Erkenntnisse aus der aktuellen Sicherheitsstudie der ETH. Die Beziehung der Schweizerinnen und Schweizer zur Armee hat sich im letzten Jahr ver\u00e4ndert. Der Einmarsch Putins in die Ukraine war nicht nur geopolitisch ein Epochenbruch. Er hat auch in der Schweiz vermeintliche Gewissheiten ins Wanken gebracht. Neue Hinweise darauf, wie die Bev\u00f6lkerung in Fragen der Sicherheit und der Neutralit\u00e4t denkt, liefert nun eine Studie des Center for Security Studies und der Milit\u00e4rakademie an der ETH Z\u00fcrich. Seit rund drei Jahrzehnten werden im Rahmen der Studienreihe \u00abSicherheit\u00bb die Einstellungen der Schweizer Stimmbev\u00f6lkerung in Fragen der Sicherheits- und Aussenpolitik vermessen. Die lange Zeitspanne erlaubt es, zwischen Momentaufnahmen und l\u00e4ngerfristigen Trends zu unterscheiden. F\u00fcnf interessante Erkenntnisse der Studie \u00abSicherheit 2023\u00bb: Der Krieg hat unser Sicherheitsgef\u00fchl nicht beeintr\u00e4chtigt. In den vielen Jahren, in denen der Milit\u00e4rsoziologe Tibor Szvircsev Tresch schon f\u00fcr die Sicherheitsstudie verantwortlich ist, gibt es eine verbl\u00fcffende Konstante: Kaum etwas vermag das Sicherheitsempfinden der Schweizerinnen und Schweizer nachhaltig zu st\u00f6ren. Zwar gab es immer mal wieder kurzfristige Phasen der Angst \u2013 so etwa nach den Terroranschl\u00e4gen von 9\/11. Allerdings erholte sich die Stimmung jeweils rasch wieder. Dass diese Gesetzm\u00e4ssigkeit selbst nach Ausbruch des Ukraine-Kriegs noch gilt, \u00fcberrascht selbst Szvircsev Tresch. 94 Prozent der Befragten gaben im Januar 2023 an, sich eher oder sehr sicher zu f\u00fchlen. \u00abIch h\u00e4tte ehrlich gesagt erwartet, dass unser Sicherheitsempfinden durch diesen Angriffskrieg nachhaltiger gest\u00f6rt wird\u00bb, sagt der Soziologe. Der Gedanke, dass die Schweiz eine Insel der Gl\u00fcckseligen ist, ist offenbar tief in den K\u00f6pfen verankert. So \u00e4ussern sich 81 Prozent optimistisch, was die n\u00e4here Zukunft der Schweiz betrifft \u2013 aber nur 24 Prozent sind zuversichtlich, was die n\u00e4here Zukunft der Welt betrifft. Wir vertrauen Politik und Medien. Im Zuge des Ukraine-Kriegs und der Pandemie hatten Kan\u00e4le, die Desinformation verbreiten, Konjunktur. H\u00e4ufig nehmen die Absender solcher Botschaften eine sogenannte politische Elite sowie die Medien ins Visier. Wie sich nun zeigt, hat das Vertrauen in diese Institutionen in der breiten Bev\u00f6lkerung jedoch nicht gelitten \u2013 im Gegenteil. Das Vertrauen in den Bundesrat und das Parlament bleibt hoch. Jenes in die politischen Parteien hat gar zugenommen, ebenso wie das Vertrauen in die Medien. Dabei vertrauen politisch links eingestellte Menschen den Medien mehr als Personen aus dem rechten Spektrum. Szvircsev Tresch verweist darauf, dass sich die Unterschiede mit der Covid-Pandemie akzentuiert haben. Der Soziologe erkl\u00e4rt sich die generell hohen Vertrauenswerte mit der Stabilit\u00e4t des Schweizer Systems. \u00abSelbst wenn sich die Welt im Krisenmodus befindet, weist die Schweizer Politik eine hohe Kontinuit\u00e4t auf. Das zeigte sich j\u00fcngst bei den Z\u00fcrcher Kantonsratswahlen wieder, wo es lediglich zu Ver\u00e4nderungen im Promillebereich kam.\u00bb Weiter geht Szvircsev Tresch davon aus, dass sich viele Menschen gerade in Zeiten von Fake News nach verl\u00e4sslichen Informationsquellen sehnen und sich daher ihr Vertrauen in die herk\u00f6mmlichen Medien gefestigt hat. Die USA geniessen mehr Sympathien. Die Studienteilnehmer und -teilnehmerinnen wurden auch nach ihrer Einstellung zu ausgew\u00e4hlten L\u00e4ndern befragt. Es zeigt sich: Am meisten vertrauen wir unseren Nachbarl\u00e4ndern, allen voran \u00d6sterreich mit einer Rekordquote von 95 Prozent. Eine markante Ver\u00e4nderung gab es mit Blick auf die USA: Den Vereinigten Staaten wird deutlich mehr Vertrauen entgegengebracht als noch vor vier Jahren. Die Studienautorinnen und -autoren vermuten, dass dies mit dem Regierungswechsel von Donald Trump zu Joe Biden zu erkl\u00e4ren ist. Gleichzeitig ist das Vertrauen in autorit\u00e4r regierte Staaten wie China, Nordkorea, Iran und Russland stark gesunken. Ein Zusammenhang f\u00e4llt hier laut Szvircsev Tresch auf: Wer dem Bundesrat misstraut, hat in der Tendenz eine h\u00f6here Affinit\u00e4t zu Russland und anderen autokratisch regierten Staaten. Eine Ann\u00e4herung an die Nato wird salonf\u00e4hig. Die Forderung nach einer Ann\u00e4herung an die Nato ist in der Schweizer Stimmbev\u00f6lkerung so popul\u00e4r wie noch nie. 55 Prozent gaben an, eine solche Ann\u00e4herung zu unterst\u00fctzen, wobei in der Studie nicht n\u00e4her definiert ist, wie eine solche Zusammenarbeit aussehen w\u00fcrde. Ein Beitritt der Schweiz zur Nato wird hingegen nur von einer Minderheit von 31 Prozent unterst\u00fctzt. Laut Milit\u00e4rsoziologe Szvircsev Tresch war schon in der Vergangenheit zu beobachten, dass das Bed\u00fcrfnis nach Schutz gestiegen ist, sobald Krieg in Europa herrschte. So gab es w\u00e4hrend des Bosnien- und des Kosovokriegs ebenfalls Peaks in der Zustimmungskurve, in geringerem Masse auch nach der Annexion der Krim 2014. \u00abWas aktuell sicher auch zu den hohen Zustimmungswerten beitr\u00e4gt, ist der Umstand, dass sich FDP-Pr\u00e4sident Thierry Burkart und Mitte-Chef Gerhard Pfister f\u00fcr eine Ann\u00e4herung an die Nato ausgesprochen haben. Die Position wurde damit enttabuisiert\u00bb, so der Studienautor. Zweifel am Konzept der bewaffneten Neutralit\u00e4t. Auch das ist eine Konstante in der langen Geschichte der Sicherheitsstudie: Die Zustimmung zum Neutralit\u00e4tsprinzip blieb stets hoch. Gegenw\u00e4rtig stehen 91 Prozent hinter der Schweizer Neutralit\u00e4t. \u00abDer Ukraine-Krieg war gewissermassen ein Realit\u00e4tscheck: Einige Leute stellten sich zum ersten Mal \u00fcberhaupt die Frage, was Neutralit\u00e4t genau bedeutet.\u00bb Kratzer bekam jedoch das Konzept der bewaffneten Neutralit\u00e4t. 52 Prozent geben an, dass sie nicht glauben, dass die Schweizer Neutralit\u00e4t heute milit\u00e4risch noch glaubhaft gesch\u00fctzt werden kann. Gleichzeitig sind nur noch 55 Prozent der Schweizerinnen und Schweizer der Meinung, die Schweiz werde dank der Neutralit\u00e4t nicht in internationale Konflikte hineingezogen \u2013 das entspricht einem Minus von 14 Prozentpunkten gegen\u00fcber Januar 2022. \u00abDer Ukraine-Krieg war gewissermassen ein Realit\u00e4tscheck: Einige Leute stellten sich zum ersten Mal \u00fcberhaupt die Frage, was Neutralit\u00e4t genau bedeutet\u00bb, sagt Szvircsev Tresch. Eine politische Handlungsempfehlung l\u00e4sst sich aus den Resultaten allerdings nur schwer ableiten. So stellen sich 57 Prozent der Befragten hinter ein Konzept, das die Verfasserinnen und Verfasser der Studie \u00abdifferenzielle Neutralit\u00e4t\u00bb nennen: Bei politischen Konflikten soll die Schweiz demnach klar Stellung beziehen, bei milit\u00e4rischen Konflikten hingegen neutral bleiben. Nur 27 Prozent geben an, dass die Schweiz auch bei milit\u00e4rischen Konflikten klar Stellung f\u00fcr die eine oder andere Seite beziehen sollte. Gleichzeitig st\u00fctzen 75 Prozent der Befragten die Sanktionen gegen Russland, und fast ebenso viele sind der Meinung, dass die Sanktionen im Einklang mit der schweizerischen Neutralit\u00e4t stehen. Welchen Reim soll man sich darauf machen? Szvircsev Tresch r\u00e4umt ein, dass das langj\u00e4hrige Studiendesign hier auch an gewisse Grenzen st\u00f6sst: \u00abViele der wiederkehrenden Fragen wurden kurz nach Ende des Kalten Kriegs definiert. Damals konnte man es sich nur schwer vorstellen, dass die Schweiz neutralit\u00e4tspolitisch je wieder mit solchen Entscheidungen konfrontiert sein w\u00fcrde, wie sie es nun im Zuge des Ukraine-Kriegs ist.\u00bb ","title":"Eine Ann\u00e4herung an die Nato ist in der Schweiz so popul\u00e4r wie nie","titleheader":"ETH-Sicherheitsstudie","text_gpt4_api_keynotes_07_256":"- Schweizer Sicherheitsgef\u00fchl trotz Krieg in der Ukraine unbeeintr\u00e4chtigt: 94% der Befragten f\u00fchlen sich sicher.\n- Vertrauen in Politik und Medien bleibt hoch, insbesondere in Nachbarl\u00e4nder wie \u00d6sterreich.\n- Ann\u00e4herung an die NATO wird popul\u00e4rer: 55% unterst\u00fctzen eine engere Zusammenarbeit, aber nur 31% bef\u00fcrworten einen Beitritt.","text_api_keynotes_07_256":"1. Die Schweizer Bev\u00f6lkerung f\u00fchlt sich trotz globaler Krisen und Konflikte weiterhin sicher und optimistisch.\n2. Das Vertrauen in die politischen Institutionen und Medien ist hoch und hat w\u00e4hrend der Ukraine-Krise und Pandemie nicht gelitten.\n3. Eine Ann\u00e4herung an die Nato wird von einer Mehrheit unterst\u00fctzt, w\u00e4hrend das Konzept der bewaffneten Neutralit\u00e4t zunehmend in Frage gestellt wird.","qa_list_gpt4":["Was ist eine interessante Erkenntnis aus der Sicherheitsstudie der ETH bez\u00fcglich der Schweizer Bev\u00f6lkerung und ihrer Einstellung zur NATO?","81% der Schweizer Bev\u00f6lkerung unterst\u00fctzen einen NATO-Beitritt","Die Schweizer Bev\u00f6lkerung misstraut der NATO und lehnt eine Ann\u00e4herung ab","55% der Schweizer Bev\u00f6lkerung unterst\u00fctzen eine Ann\u00e4herung an die NATO"],"flesch":[45.6,49.5,50.55,44.0,38.8,66.25],"text_gpt4_api_normal_words_05_512":"Eine Studie des Center for Security Studies und der Milit\u00e4rakademie an der ETH Z\u00fcrich untersucht die Einstellung der Schweizer Bev\u00f6lkerung zu Sicherheits- und Aussenpolitik. F\u00fcnf Haupterkenntnisse sind:\n\n1. Der Krieg hat das Sicherheitsgef\u00fchl der Schweizer Bev\u00f6lkerung nicht beeintr\u00e4chtigt, wobei 94% der Befragten angaben, sich eher oder sehr sicher zu f\u00fchlen.\n2. Das Vertrauen in Politik und Medien bleibt hoch, trotz Desinformation im Zusammenhang mit dem Ukraine-Krieg und der Pandemie.\n3. Die USA genie\u00dfen mehr Sympathien, w\u00e4hrend das Vertrauen in autorit\u00e4r regierte Staaten wie China, Nordkorea, Iran und Russland stark gesunken ist.\n4. Eine Ann\u00e4herung an die NATO ist in der Schweiz so popul\u00e4r wie nie, wobei 55% der Befragten eine solche Ann\u00e4herung unterst\u00fctzen, jedoch nur 31% einen Beitritt zur NATO bef\u00fcrworten.\n5. Zweifel am Konzept der bewaffneten Neutralit\u00e4t nehmen zu, wobei 52% der Befragten angeben, dass sie nicht glauben, dass die Schweizer Neutralit\u00e4t heute milit\u00e4risch noch glaubhaft gesch\u00fctzt werden kann.","frage_antwort":["Wer war nicht nur geopolitisch ein Epochenbruch?","Putins","Joe Biden","Tibor Szvircsev Tresch"]},{"_id":"64298060a9d504ce92eb6527","aid":613522576357,"date":"2023-03-24T17:59:46","author":"Philippe Reichen","categoryName":"Schweiz","premium":false,"readingTime":180.0,"wordCount":657.0,"url":"https:\/\/www.tagesanzeiger.ch\/die-millionen-der-regierung-stimmen-das-staatspersonal-nicht-um-613522576357","own":"Streik in der Waadt. Die Millionen der Regierung stimmen das Staatspersonal nicht um. Der Konflikt zwischen der b\u00fcrgerlichen Waadtl\u00e4nder Regierung und den Kantonsangestellten spitzt sich zu. W\u00e4hrend Erstere ein letztes Angebot macht, organisieren die Gewerkschaften den n\u00e4chsten Streiktag. Tausende auf der Strasse. F\u00fcr die Gewerkschaften bedeutet der Entscheid aber auch: Sie m\u00fcssen noch mehr mobilisieren als bisher, um ihren Willen gegen\u00fcber der Regierung durchzusetzen. Auch die Gewerkschaften sp\u00fcren Druck. \u00ab10 Millionen Franken, die sie aber erst im Jahr 2024 auszahlen. Vor langem abgegebene Versprechen. Zum Thema werden jene 20 Millionen Franken, die die Regierung jetzt f\u00fcr Lohnerh\u00f6hungen f\u00fcr Angestellte in der Pflege und im Sozialsektor bereitstellen will. Auch die von der Regierung pr\u00e4sentierten mehrere Millionen schweren Massnahmen gegen sexuelle Bel\u00e4stigung und Mobbing bezeichnen Gewerkschafter als \u00abschon vor langem abgegebenes Versprechen\u00bb. \u00abDas ist unser letztes Angebot.\u00bb Das von ihrer Regierung pr\u00e4sentierte Paket sei 47 Millionen Franken wert. Doch zugreifen wollen die Gewerkschaften nicht. ","lexrank_sumy":"Die Millionen der Regierung stimmen das Staatspersonal nicht um. Das ist die Stimmung bei den rund 200 Waadtl\u00e4nder Staatsangestellten, die sich am Mittwochabend auf Einladung ihrer Gewerkschaften in der Aula eines Lausanner Schulhauses versammeln. Am Ende der Versammlung ist die Haltung klar. Die Gewerkschafter erkl\u00e4ren den 28. M\u00e4rz einstimmig zum neuen Aktions- und Streiktag, den f\u00fcnften seit Anfang Jahr. Ein anderer sagt: \u00abDer Kanton hat \u00fcber 5,5 Milliarden Franken Verm\u00f6gen und wird auch f\u00fcr 2022 einen \u00dcberschuss ausweisen.\u00bb Am Ende betont jemand: \u00abWir sind zum Streiken verdammt.\u00bb Applaus im Saal. Tausende auf der Strasse. F\u00fcr die Gewerkschaften bedeutet der Entscheid aber auch: Sie m\u00fcssen noch mehr mobilisieren als bisher, um ihren Willen gegen\u00fcber der Regierung durchzusetzen. \u00abF\u00fcnf Millionen in f\u00fcnf Minuten, daran sieht man, wie ernst sie uns nehmen.\u00bb Deren Sekret\u00e4re rapportierten an der abendlichen Zusammenkunft auch \u00fcber ihr Treffen mit einer Delegation der Kantonsregierung wenige Stunden zuvor. \u00ab10 Millionen Franken, die sie aber erst im Jahr 2024 auszahlen. F\u00fcnf Millionen in f\u00fcnf Minuten, daran sieht man, wie ernst sie uns nehmen.\u00bb Auch das 15-Millionen-Geschenk ist den Gewerkschaftern und Arbeitnehmern zu wenig, weil es sich dabei nicht um eine Lohnerh\u00f6hung, sondern um eine einmalige Pr\u00e4mie handelt, die 2024 ausbezahlt wird. \u00abWeil f\u00fcr den Kanton Waadt und in den staatsnahen Betrieben wie Spit\u00e4ler und Heime insgesamt 70\u2019000 Personen arbeiten, macht das pro Person und Monat nur 15 Franken zus\u00e4tzlich\u00bb, kalkuliert ein Gewerkschafter. Diese Lohnerh\u00f6hungen seien eine l\u00e4ngst f\u00e4llige Massnahme, um im Vergleich zum Lohnniveau der Nachbarkantone nicht noch st\u00e4rker abzufallen, heisst es an der Versammlung. Doch zugreifen wollen die Gewerkschaften nicht. Sie wollen mehr und sehen sich im Recht. ","text_api_simple_words_07_512":"Im Kanton Waadt gibt es einen Konflikt zwischen der Regierung und den Kantonsangestellten. Die Angestellten wollen eine Lohnerh\u00f6hung von 3 Prozent, w\u00e4hrend die Regierung nur 1,4 Prozent geben will. Es gab bereits mehrere Streiktage und die Gewerkschaften organisieren einen weiteren. Die Angestellten wollen, dass ihre L\u00f6hne automatisch der Teuerung angepasst werden. Die Regierung hat ein Angebot gemacht, aber die Gewerkschaften finden es nicht ausreichend. Es wird erwartet, dass Hunderte von Angestellten ihre Arbeit niederlegen und es wird auch eine Protestaktion geben. Die Regierung hat auch Lohnerh\u00f6hungen f\u00fcr Angestellte in der Pflege und im Sozialsektor angek\u00fcndigt, aber die Gewerkschaften finden dies nicht ausreichend und wollen mehr.","text_api_normal_words_05_512":"Im Kanton Waadt versch\u00e4rft sich der Konflikt zwischen der b\u00fcrgerlichen Regierung und den Kantonsangestellten. Die Gewerkschaften organisieren den f\u00fcnften Streiktag seit Anfang Jahr, um f\u00fcr einen Teuerungsausgleich von 3 Prozent zu k\u00e4mpfen, w\u00e4hrend die Regierung nur 1,4 Prozent anbietet. Auch das Personal des Universit\u00e4tsspitals in Lausanne fordert eine Lohnerh\u00f6hung und sp\u00fcrt grossen Druck, den Arbeitskampf weiterzuf\u00fchren. Die Regierung hat ein letztes Angebot von 47 Millionen Franken vorgelegt, das die Gewerkschaften jedoch ablehnen, da es sich um eine einmalige Pr\u00e4mie handelt, die erst 2024 ausbezahlt wird. Der Streiktag am 28. M\u00e4rz wird Hunderte Lehrer, Sozialarbeiter und Spitalangestellte betreffen. Die Gewerkschaften m\u00fcssen noch mehr mobilisieren als bisher, um ihren Willen gegen\u00fcber der Regierung durchzusetzen.","text_api_child_09_350":"In der Waadt gibt es einen Streik zwischen der b\u00fcrgerlichen Regierung und Kantonsangestellten. Auch am Universit\u00e4tsspital in Lausanne sind die Leute unzufrieden und fordern eine Lohnerh\u00f6hung. Die Gewerkschaften organisieren einen neuen Streiktag, weil sie f\u00fcr ihr Recht k\u00e4mpfen m\u00f6chten, dass ihre L\u00f6hne automatisch der Teuerung angepasst werden. Die Regierung hat ein Angebot gemacht, aber die Gewerkschaften haben es abgelehnt. Viele Menschen werden am Streiktag ihre Arbeit niederlegen und auf die Strasse gehen, um zu protestieren. Die Gewerkschaften wollen mehr erreichen und f\u00fchlen sich im Recht.","text_api_keynotes_07_350":"1. Der Streit zwischen der Waadtl\u00e4nder Regierung und den Kantonsangestellten spitzt sich zu.\n2. Die Gewerkschaften organisieren den n\u00e4chsten Streiktag, da das Staatspersonal mit den angebotenen L\u00f6hnen nicht zufrieden ist.\n3. Auch das Personal am Universit\u00e4tsspital in Lausanne fordert eine Lohnerh\u00f6hung und will ihren Arbeitskampf fortsetzen.\n4. Die Gewerkschaften rufen zum gr\u00f6ssten Protesttag seit Jahren auf und mobilisieren noch st\u00e4rker als zuvor.\n5. Die Regierung bietet eine einmalige Ausgleichspr\u00e4mie von 15 Millionen Franken an, die jedoch erst 2024 ausbezahlt wird, was von den Gewerkschaften als ungen\u00fcgend abgelehnt wird.","text_davinci_api_key_07_256":"1. Am 28. M\u00e4rz findet in der Waadt ein neuer Aktions- und Streiktag statt, an dem Hunderte Lehrer, Sozialarbeiter und Spitalangestellte ihre Arbeit niederlegen. \n2. Die Gewerkschaften verlangen einen Teuerungsausgleich von 3 Prozent, w\u00e4hrend die Regierung 1,4 Prozent geben will. \n3. Trotz des von der Regierung pr\u00e4sentierten Paketes mit 47 Millionen Franken, wollen die Gewerkschaften nicht zugreifen und fordern mehr Lohn.","five_letter_word_list":["waadt","nicht","macht","druck","sehen","einen","ihren","recht","l\u00f6hne","ihrer","eines","geben","neuen","dinge","abend","durch","kamen","leute","daran","sieht","ernst","deren","einer","zuvor","haben","tisch","waren","wenig","dabei","heime","monat","reden","thema","jetzt","diese","seien","gegen","schon","genau","hohem","unser","paket","liege","m\u00fcsse","mitte","werde","rasch","w\u00fcrde"],"qa_list":["Was ist der Grund f\u00fcr den Streik in der Waadt?","Die Regierung will den staatlichen Angestellten weniger Urlaub geben.","Die Regierung will den staatlichen Angestellten weniger Geld geben.","Die Regierung will den staatlichen Angestellten eine einmalige Pr\u00e4mie anbieten."],"lead":"Der Konflikt zwischen der b\u00fcrgerlichen Waadtl\u00e4nder Regierung und den Kantonsangestellten spitzt sich zu. W\u00e4hrend Erstere ein letztes Angebot macht, organisieren die Gewerkschaften den n\u00e4chsten Streiktag.","originaltext":"Streik in der Waadt. Die Millionen der Regierung stimmen das Staatspersonal nicht um. Der Konflikt zwischen der b\u00fcrgerlichen Waadtl\u00e4nder Regierung und den Kantonsangestellten spitzt sich zu. W\u00e4hrend Erstere ein letztes Angebot macht, organisieren die Gewerkschaften den n\u00e4chsten Streiktag. Auch am Universit\u00e4tsspital in Lausanne ist das Personal unzufrieden und fordert eine Lohnerh\u00f6hung. Sie sp\u00fcren grossen Druck, sehen aber nur einen Weg: ihren Arbeitskampf weiterf\u00fchren. Sie wollen f\u00fcr ihr Recht k\u00e4mpfen, dass ihre L\u00f6hne gem\u00e4ss kantonalem Recht automatisch der Teuerung angepasst werden. Das ist die Stimmung bei den rund 200 Waadtl\u00e4nder Staatsangestellten, die sich am Mittwochabend auf Einladung ihrer Gewerkschaften in der Aula eines Lausanner Schulhauses versammeln. Seit letztem Herbst verlangen sie einen Teuerungsausgleich von 3 Prozent, w\u00e4hrend die Regierung 1,4 Prozent geben will. Am Ende der Versammlung ist die Haltung klar. Die Gewerkschafter erkl\u00e4ren den 28. M\u00e4rz einstimmig zum neuen Aktions- und Streiktag, den f\u00fcnften seit Anfang Jahr. \u00abNat\u00fcrlich sind wir nach den letzten Wochen m\u00fcde und wollen lieber andere Dinge tun, aber der kommende Dienstag muss der gr\u00f6sste Protesttag werden, den die Waadt seit Jahren erlebt hat\u00bb, ruft jemand ins Mikrofon. Ein anderer sagt: \u00abDer Kanton hat \u00fcber 5,5 Milliarden Franken Verm\u00f6gen und wird auch f\u00fcr 2022 einen \u00dcberschuss ausweisen.\u00bb Am Ende betont jemand: \u00abWir sind zum Streiken verdammt.\u00bb Applaus im Saal. Tausende auf der Strasse. F\u00fcr die Waadt und ihre B\u00fcrgerinnen und B\u00fcrger bedeutet dies: Am Dienstag werden Hunderte Lehrerinnen und Lehrer, Sozialarbeiter und Spitalangestellte ihre Arbeit niederlegen. Am Abend werden Tausende Staatsangestellte, darunter auch Polizisten, ihren Protest pfeifend und l\u00e4rmend durch die Lausanner Innenstadt tragen. F\u00fcr die Gewerkschaften bedeutet der Entscheid aber auch: Sie m\u00fcssen noch mehr mobilisieren als bisher, um ihren Willen gegen\u00fcber der Regierung durchzusetzen. Am letzten Aktionstag Anfang M\u00e4rz kamen viel weniger Leute als erwartet. Auch die Gewerkschaften sp\u00fcren Druck. \u00abF\u00fcnf Millionen in f\u00fcnf Minuten, daran sieht man, wie ernst sie uns nehmen.\u00bb Deren Sekret\u00e4re rapportierten an der abendlichen Zusammenkunft auch \u00fcber ihr Treffen mit einer Delegation der Kantonsregierung wenige Stunden zuvor. \u00abSie wollten grossz\u00fcgig sein und haben uns eine einmalige Ausgleichspr\u00e4mie von 10 Millionen Franken angeboten\u00bb, sagt ein Gewerkschafter ins Mikrofon. \u00ab10 Millionen Franken, die sie aber erst im Jahr 2024 auszahlen. Da sind wir aufgestanden und haben den Verhandlungstisch verlassen. F\u00fcnf Minuten sp\u00e4ter sassen wir wieder am Tisch und es waren f\u00fcnf Millionen Franken mehr. F\u00fcnf Millionen in f\u00fcnf Minuten, daran sieht man, wie ernst sie uns nehmen.\u00bb Auch das 15-Millionen-Geschenk ist den Gewerkschaftern und Arbeitnehmern zu wenig, weil es sich dabei nicht um eine Lohnerh\u00f6hung, sondern um eine einmalige Pr\u00e4mie handelt, die 2024 ausbezahlt wird. \u00abWeil f\u00fcr den Kanton Waadt und in den staatsnahen Betrieben wie Spit\u00e4ler und Heime insgesamt 70\u2019000 Personen arbeiten, macht das pro Person und Monat nur 15 Franken zus\u00e4tzlich\u00bb, kalkuliert ein Gewerkschafter. Vor langem abgegebene Versprechen. \u00dcber den von der Kantonsregierung l\u00e4ngst beschlossenen Teuerungsausgleich von 1,4 Prozent f\u00fcrs aktuelle Jahr will an diesem Abend niemand mehr reden. Zum Thema werden jene 20 Millionen Franken, die die Regierung jetzt f\u00fcr Lohnerh\u00f6hungen f\u00fcr Angestellte in der Pflege und im Sozialsektor bereitstellen will. Diese Lohnerh\u00f6hungen seien eine l\u00e4ngst f\u00e4llige Massnahme, um im Vergleich zum Lohnniveau der Nachbarkantone nicht noch st\u00e4rker abzufallen, heisst es an der Versammlung. Auch die von der Regierung pr\u00e4sentierten mehrere Millionen schweren Massnahmen gegen sexuelle Bel\u00e4stigung und Mobbing bezeichnen Gewerkschafter als \u00abschon vor langem abgegebenes Versprechen\u00bb. Genau gleich wie jene zus\u00e4tzlichen 80 Stellen f\u00fcr schulische Hilfskr\u00e4fte, die den Lehrerinnen und Lehrern helfen sollen, den Umgang mit Kindern mit hohem Betreuungsaufwand zu meistern. \u00abDas ist unser letztes Angebot.\u00bb \u00abDas ist unser letztes Angebot\u00bb, stellt Regierungspr\u00e4sidentin Christelle Luisier (FDP) an einer Medienkonferenz am Mittwochnachmittag klar. Das von ihrer Regierung pr\u00e4sentierte Paket sei 47 Millionen Franken wert. Dass die Regierung die Einmalpr\u00e4mien erst 2024 auszahlen will, liege daran, dass man beim diesj\u00e4hrigen Budget keinen Spielraum habe, sondern es rigoros einhalten m\u00fcsse, so Luisier. Finanzdirektorin Val\u00e9rie Dittli (Die Mitte) betont, dem Kanton br\u00e4chen konjunkturbedingt Einnahmen weg und daran werde sich so rasch auch nichts \u00e4ndern. \u00abWenn vor mir 47 Millionen Franken auf dem Tisch liegen, w\u00fcrde ich sofort zugreifen\u00bb, sagt der freisinnige Bildungsdirektor Fr\u00e9d\u00e9ric Borloz an die Adresse der Gewerkschaften. Doch zugreifen wollen die Gewerkschaften nicht. Sie geben sich unbeeindruckt. Sie wollen mehr und sehen sich im Recht. ","title":"Die Millionen der Regierung stimmen das Staatspersonal nicht\u00a0um","titleheader":"Streik in der Waadt","text_gpt4_api_keynotes_07_256":"- Streik in der Waadt: Kantonsangestellte und Gewerkschaften fordern h\u00f6here L\u00f6hne und Teuerungsausgleich\n- Regierung bietet einmalige Ausgleichspr\u00e4mie von 15 Millionen Franken, Gewerkschaften lehnen ab\n- Neuer Aktions- und Streiktag am 28. M\u00e4rz geplant","text_api_keynotes_07_256":"- Konflikt zwischen b\u00fcrgerlicher Waadtl\u00e4nder Regierung und Kantonsangestellten spitzt sich zu\n- Gewerkschaften organisieren n\u00e4chsten Streiktag f\u00fcr h\u00f6here L\u00f6hne und automatische Teuerungsanpassungen\n- Regierung macht letztes Angebot von 47 Millionen Franken, Gewerkschaften fordern jedoch mehr und sehen sich im Recht","qa_list_gpt4":["Was fordern die Waadtl\u00e4nder Staatsangestellten in Bezug auf Lohnerh\u00f6hungen und Teuerungsausgleich?","Sie fordern einen Teuerungsausgleich von 1,4 Prozent und eine Lohnerh\u00f6hung von 5 Millionen Franken.","Sie verlangen einen Teuerungsausgleich von 2 Prozent und eine Lohnerh\u00f6hung von 10 Millionen Franken.","Sie verlangen einen Teuerungsausgleich von 3 Prozent, w\u00e4hrend die Regierung 1,4 Prozent geben will."],"flesch":[53.75,52.1,60.6,48.0,41.15,48.8],"text_gpt4_api_normal_words_05_512":"Streik in der Waadt: Die Regierung bietet den Staatsangestellten eine einmalige Ausgleichspr\u00e4mie von 15 Millionen Franken an, die jedoch erst 2024 ausgezahlt wird. Die Gewerkschaften lehnen das Angebot ab und fordern eine Lohnerh\u00f6hung sowie die automatische Anpassung der L\u00f6hne an die Teuerung. Seit letztem Herbst verlangen sie einen Teuerungsausgleich von 3 Prozent, w\u00e4hrend die Regierung 1,4 Prozent geben will. Am 28. M\u00e4rz findet der f\u00fcnfte Streiktag seit Anfang des Jahres statt. Die Regierung betont, dass das aktuelle Angebot das letzte ist und insgesamt 47 Millionen Franken wert ist. Die Gewerkschaften bleiben jedoch unbeeindruckt und fordern weiterhin mehr.","frage_antwort":[]},{"_id":"64298062a9d504ce92eb6663","aid":139638275722,"date":"2023-03-30T14:26:39","author":"SDA","categoryName":"Schweiz","premium":false,"readingTime":180.0,"wordCount":691.0,"url":"https:\/\/www.tagesanzeiger.ch\/vier-angestellte-der-gazprombank-schweiz-verurteilt-139638275722","own":"Putins Geldspur in die Schweiz. Vier Angestellte der Gazprombank Schweiz verurteilt. Das Z\u00fcrcher Bezirksgericht hat vier Bankangestellte wegen mangelnder Sorgfalt in Finanzgesch\u00e4ften verurteilt. Sie verwalteten Millionenbetr\u00e4ge eines Putin-Freundes. Das Z\u00fcrcher Bezirksgericht hat den Chef der russischen Gazprombank in Z\u00fcrich und drei weitere teils hohe Kaderleute verurteilt. Die vier Beschuldigten wurden zu bedingten Geldstrafen verurteilt. Daten zeigten, dass auf dem Papier Sergei Roldugin Besitzer der Z\u00fcrcher Konten war. Doch die Medien enth\u00fcllten, dass Roldugin seit seiner Jugend zu den engsten Familienfreunden Putins geh\u00f6rte. Er wurde sogar Patenonkel von Putins Tochter. Bei der Gazprombank und der Gazprombank Schweiz handelt es sich um Finanzableger des staatlich kontrollierten russischen Energie- und Rohstoffkonzerns Gazprom. Erfolg f\u00fcr die Schweizer Justiz. Das zeichne f\u00fcr einmal ein positives Bild der Schweiz. \u00abBis heute war es so, dass die Schweizer Justiz den Finanzplatz kaum sch\u00fctzen konnte\u00bb, sagt er weiter. Der Chef der Bank wurde zu einer Geldstrafe von 180 Tagess\u00e4tzen \u00e0 3000 Franken verurteilt. Die beiden weiteren Gesch\u00e4ftsleitungsmitglieder wurden ebenfalls zu 180 Tagess\u00e4tzen \u00e0 350 Franken beziehungsweise 500 Franken verurteilt. Das Urteil sei ein wichtiges Signal zur Einhaltung von Sorgfaltspflichten in Finanzgesch\u00e4ften. ","lexrank_sumy":"Putins Geldspur in die Schweiz. Vier Angestellte der Gazprombank Schweiz verurteilt. Sie sollen im Umgang mit Konten eines Putin-Vertrauten ihre Sorgfaltspflichten verletzt haben. Die vier Beschuldigten wurden zu bedingten Geldstrafen verurteilt. Den Bankern wurde vorgeworfen, von 2014 bis 2016 eine Gesch\u00e4ftsbeziehung mit dem russischen Cellisten und Dirigenten Sergei Roldugin gef\u00fchrt zu haben, obwohl sie gewusst haben oder zumindest h\u00e4tten merken m\u00fcssen, dass dieser unm\u00f6glich tats\u00e4chlich der wirtschaftlich Berechtigte an den Verm\u00f6genswerten von gegen 50 Millionen Franken gewesen sein konnte. Roldugin gilt als Vertrauter des russischen Pr\u00e4sidenten Wladimir Putin. Den Fall ins Rollen gebracht hatte die investigative Recherche zu den Panama Papers. Wenige Tage nach den Enth\u00fcllungen leitete die Eidgen\u00f6ssische Finanzmarktaufsicht Ermittlungen ein. Bei der Gazprombank und der Gazprombank Schweiz handelt es sich um Finanzableger des staatlich kontrollierten russischen Energie- und Rohstoffkonzerns Gazprom. \u00abDas Bezirksgericht Z\u00fcrich hat gezeigt, dass man selbst gegen die engste Entourage des russischen Pr\u00e4sidenten erfolgreich juristisch vorgehen kann\u00bb, sagt Mark Pieth, fr\u00fcherer Strafrechtsprofessor und Spezialist f\u00fcr das Geldw\u00e4schereigesetz zum Urteil. Sie hat kaum je einen Russland-Fall erfolgreich zum Abschluss gebracht.\u00bb Urspr\u00fcnglich habe man auch fahrl\u00e4ssige Geldw\u00e4scherei per Gesetz strafbar erkl\u00e4ren wollen, doch die H\u00fcrden daf\u00fcr seien zu hoch gewesen. \u00abEr ist genau f\u00fcr F\u00e4lle wie den des Cellisten Roldugin gedacht, wo die Banker ihren Kunden offensichtlich zu wenig genau gepr\u00fcft haben.\u00bb Der Chef der Bank wurde zu einer Geldstrafe von 180 Tagess\u00e4tzen \u00e0 3000 Franken verurteilt. Vor Gericht verantworten mussten sich neben dem CEO der Bank zwei weitere Gesch\u00e4ftsleitungsmitglieder sowie ein Kundenberater. Das Urteil des Bezirksgerichts Z\u00fcrich ist noch nicht rechtskr\u00e4ftig. Die Anw\u00e4lte der Bankangestellten meldeten noch im Gerichtssaal Berufung an. Das Urteil sei ein wichtiges Signal zur Einhaltung von Sorgfaltspflichten in Finanzgesch\u00e4ften. ","text_api_simple_words_07_512":"Vier Angestellte der Gazprombank Schweiz wurden vom Z\u00fcrcher Bezirksgericht wegen mangelnder Sorgfalt in Finanzgesch\u00e4ften verurteilt. Sie hatten Millionenbetr\u00e4ge eines Putin-Freundes verwaltet, der als wirtschaftlich Berechtigter an den Verm\u00f6genswerten von gegen 50 Millionen Franken auftrat. Die investigative Recherche zu den Panama Papers hatte den Fall ins Rollen gebracht. Die Bankangestellten wurden zu bedingten Geldstrafen verurteilt. Die Schweizer Justiz hat damit gezeigt, dass man selbst gegen die engste Entourage des russischen Pr\u00e4sidenten erfolgreich juristisch vorgehen kann. Das Urteil ist noch nicht rechtskr\u00e4ftig.","text_api_normal_words_05_512":"Vier Angestellte der Gazprombank Schweiz wurden vom Z\u00fcrcher Bezirksgericht wegen mangelnder Sorgfalt in Finanzgesch\u00e4ften verurteilt. Sie sollen Millionenbetr\u00e4ge eines Putin-Vertrauten verwaltet haben, obwohl sie gewusst haben oder zumindest h\u00e4tten merken m\u00fcssen, dass dieser unm\u00f6glich tats\u00e4chlich der wirtschaftlich Berechtigte an den Verm\u00f6genswerten von gegen 50 Millionen Franken gewesen sein konnte. Roldugin gilt als Vertrauter des russischen Pr\u00e4sidenten Wladimir Putin. Den Fall ins Rollen gebracht hatte die investigative Recherche zu den Panama Papers. Die Eidgen\u00f6ssische Finanzmarktaufsicht kam zum Schluss, die Bank habe \u201eschwer gegen die Sorgfaltspflichten des Geldw\u00e4schereigesetzes verstossen\u201c. Die vier Beschuldigten wurden zu bedingten Geldstrafen verurteilt. Der Chef der Bank wurde zu einer Geldstrafe von 180 Tagess\u00e4tzen \u00e0 3000 Franken verurteilt. Die Bank hat ihre Gesch\u00e4ftst\u00e4tigkeit im Herbst vergangenen Jahres eingestellt und befindet sich in Aufl\u00f6sung.","text_api_child_09_350":"Vier Angestellte der Schweizer Gazprombank wurden vom Z\u00fcrcher Bezirksgericht verurteilt, weil sie bei Finanzgesch\u00e4ften fehlerhaft waren und Millionenbetr\u00e4ge eines Putin-Freundes verwalteten. Medien berichten weltweit \u00fcber den Prozess in Z\u00fcrich. Der Chef der russischen Gazprombank in Z\u00fcrich und drei weitere Kaderleute wurden von den Beschuldigten zu bedingten Geldstrafen verurteilt, weil sie von 2014 bis 2016 eine Gesch\u00e4ftsbeziehung mit dem russischen Cellisten und Dirigenten Sergei Roldugin hatten, obwohl sie wussten oder zumindest h\u00e4tten merken m\u00fcssen, dass dieser unm\u00f6glich der wirtschaftlich Berechtigte an den Verm\u00f6genswerten von gegen 50 Millionen Franken gewesen sein konnte. Roldugin gilt als Vertrauter des russischen Pr\u00e4sidenten Wladimir Putin. Die Geldsummen wurden m\u00f6glicherweise vom Kremlchef verschoben. Warnsignale gab es mehr als genug. Das Urteil ist noch nicht rechtskr\u00e4ftig und kann an das Obergericht weitergezogen werden.","text_api_keynotes_07_350":"1. Vier Bankangestellte der Gazprombank Schweiz wurden wegen mangelnder Sorgfalt in Finanzgesch\u00e4ften verurteilt, nachdem sie Millionenbetr\u00e4ge eines Putin-Freundes verwaltet hatten.\n2. Die investigative Recherche der Panama Papers brachte den Fall ins Rollen, als Daten zeigten, dass der Musiker Sergei Roldugin der Besitzer der Z\u00fcrcher Konten war, obwohl er als enger Familienfreund Putins und Patenonkel von Putins Tochter gilt.\n3. Das Z\u00fcrcher Bezirksgericht hat den Chef der russischen Gazprombank in Z\u00fcrich und drei weitere teils hohe Kaderleute verurteilt, da sie im Umgang mit Konten des Putin-Vertrauten ihre Sorgfaltspflichten verletzt haben.\n4. Die Bankangestellten wurden zu bedingten Geldstrafen verurteilt, da sie trotz Warnsignalen und Ungereimtheiten in der Gesch\u00e4ftsbeziehung nicht weiter nachgegangen waren.\n5. Das Urteil des Bezirksgerichts Z\u00fcrich ist noch nicht rechtskr\u00e4ftig, aber ein Vertreter der Staatsanwaltschaft begr\u00fc\u00dfte die Schuldspr\u00fcche als wichtiges Signal zur Einhaltung von Sorgfaltspflichten in Finanzgesch\u00e4ften.","text_davinci_api_key_07_256":"1. Vier Bankangestellte der Gazprombank Schweiz wurden vom Z\u00fcrcher Bezirksgericht wegen mangelnder Sorgfaltspflicht bei Finanzgesch\u00e4ften verurteilt. \n2. Die Verurteilten m\u00fcssen bedingte Geldstrafen zahlen und das Urteil kann an das Obergericht weitergezogen werden. \n3. Mit dem Urteil des Z\u00fcrcher Bezirksgerichts wird ein wichtiges Signal zur Einhaltung von Sorgfaltspflichten in Finanzgesch\u00e4ften gesetzt.","five_letter_word_list":["wegen","eines","teils","haben","wurde","gegen","putin","hatte","daten","sogar","stand","nicht","ihrer","l\u00e4sst","sagte","k\u00f6nne","indem","trotz","frage","seien","genug","neben","unter","einem","h\u00e4tte","jeden","seine","pieth","heute","einen","daf\u00fcr","genau","f\u00e4lle","ihren","wenig","einer","falls","sowie"],"qa_list":["Was wird den vier Bankangestellten der Gazprombank Schweiz vorgeworfen?","Sie haben Millionenbetr\u00e4ge von einem russischen Musiker verwaltet.","Sie haben gegen die Sorgfaltspflichten des Steuerrechts versto\u00dfen.","Sie haben im Umgang mit Konten eines Putin-Vertrauten ihre Sorgfaltspflichten verletzt."],"lead":"Das Z\u00fcrcher Bezirksgericht hat vier Bankangestellte wegen mangelnder Sorgfalt in Finanzgesch\u00e4ften verurteilt. Sie verwalteten Millionenbetr\u00e4ge eines Putin-Freundes.","originaltext":"Putins Geldspur in die Schweiz. Vier Angestellte der Gazprombank Schweiz verurteilt. Das Z\u00fcrcher Bezirksgericht hat vier Bankangestellte wegen mangelnder Sorgfalt in Finanzgesch\u00e4ften verurteilt. Sie verwalteten Millionenbetr\u00e4ge eines Putin-Freundes. Medien aus der ganzen Welt berichten vom Prozess in Z\u00fcrich. Das Z\u00fcrcher Bezirksgericht hat den Chef der russischen Gazprombank in Z\u00fcrich und drei weitere teils hohe Kaderleute verurteilt. Sie sollen im Umgang mit Konten eines Putin-Vertrauten ihre Sorgfaltspflichten verletzt haben. Die vier Beschuldigten wurden zu bedingten Geldstrafen verurteilt. Den Bankern wurde vorgeworfen, von 2014 bis 2016 eine Gesch\u00e4ftsbeziehung mit dem russischen Cellisten und Dirigenten Sergei Roldugin gef\u00fchrt zu haben, obwohl sie gewusst haben oder zumindest h\u00e4tten merken m\u00fcssen, dass dieser unm\u00f6glich tats\u00e4chlich der wirtschaftlich Berechtigte an den Verm\u00f6genswerten von gegen 50 Millionen Franken gewesen sein konnte. Roldugin gilt als Vertrauter des russischen Pr\u00e4sidenten Wladimir Putin. Den Fall ins Rollen gebracht hatte die investigative Recherche zu den Panama Papers. Daten zeigten, dass auf dem Papier Sergei Roldugin Besitzer der Z\u00fcrcher Konten war. Doch die Medien enth\u00fcllten, dass Roldugin seit seiner Jugend zu den engsten Familienfreunden Putins geh\u00f6rte. Er wurde sogar Patenonkel von Putins Tochter. Der Verdacht stand im Raum, dass die Geldsummen in Z\u00fcrich nicht von dem Musiker verschoben wurden, sondern vom Kremlchef. Wenige Tage nach den Enth\u00fcllungen leitete die Eidgen\u00f6ssische Finanzmarktaufsicht Ermittlungen ein. Sie kam zum Schluss, die Bank habe \u00abschwer gegen die Sorgfaltspflichten des Geldw\u00e4schereigesetzes verstossen\u00bb und reichte eine Strafanzeige bei der Staatsanwaltschaft Z\u00fcrich ein. Enge Freunde seit ihrer fr\u00fchen Jugend: Russlands Pr\u00e4sident Wladimir Putin und der Musiker Sergei Roldugin. \u00abEs l\u00e4sst sich nicht feststellen, wer der tats\u00e4chlich wirtschaftlich Berechtigte war\u00bb, sagte der vorsitzende Richter bei der Urteilser\u00f6ffnung. F\u00fcr das Gericht sei aber klar, dass dies nicht Roldugin sein k\u00f6nne. Indem die Bankangestellten trotz Ungereimtheiten der Frage nicht weiter nachgegangen seien, h\u00e4tten sie ihre Sorgfaltspflicht verletzt. Warnsignale gab es mehr als genug \u2013 neben der allgemeinen politischen Situation in Russland verwies das Gericht unter anderem auf Medienberichte \u00fcber Roldugin. Dieser hatte beispielsweise in einem Interview ge\u00e4ussert, er sei \u00abkein Million\u00e4r\u00bb. Sp\u00e4testens im November 2015 h\u00e4tte die Gesch\u00e4ftsbeziehung nach Ansicht des Gerichts auf jeden Fall beendet werden m\u00fcssen. Stattdessen wurde sie noch rund ein Jahr fortgef\u00fchrt. Laut Staatsanwaltschaft gilt als allgemein bekannt, dass Putin offiziell lediglich ein geringes Verm\u00f6gen und geringe Eink\u00fcnfte deklariere, w\u00e4hrend seine tats\u00e4chlichen Verm\u00f6genswerte von Gew\u00e4hrsleuten verwaltet w\u00fcrden. Bei der Gazprombank und der Gazprombank Schweiz handelt es sich um Finanzableger des staatlich kontrollierten russischen Energie- und Rohstoffkonzerns Gazprom. Erfolg f\u00fcr die Schweizer Justiz. \u00abDas Bezirksgericht Z\u00fcrich hat gezeigt, dass man selbst gegen die engste Entourage des russischen Pr\u00e4sidenten erfolgreich juristisch vorgehen kann\u00bb, sagt Mark Pieth, fr\u00fcherer Strafrechtsprofessor und Spezialist f\u00fcr das Geldw\u00e4schereigesetz zum Urteil. Das zeichne f\u00fcr einmal ein positives Bild der Schweiz. \u00abBis heute war es so, dass die Schweizer Justiz den Finanzplatz kaum sch\u00fctzen konnte\u00bb, sagt er weiter. Die Beh\u00f6rden seien den Banken, Treuh\u00e4ndern und Anw\u00e4lten, die heikle Gelder betreuen, kaum gewachsen gewesen. \u00abWir konnten das bei der Bundesanwaltschaft jahrelang verfolgen. Sie hat kaum je einen Russland-Fall erfolgreich zum Abschluss gebracht.\u00bb Urspr\u00fcnglich habe man auch fahrl\u00e4ssige Geldw\u00e4scherei per Gesetz strafbar erkl\u00e4ren wollen, doch die H\u00fcrden daf\u00fcr seien zu hoch gewesen. \u00abAlso hat man den Tatbestand der Sorgfaltspflichtverletzung eingef\u00fchrt, um den es hier geht\u00bb, so Pieth. \u00abEr ist genau f\u00fcr F\u00e4lle wie den des Cellisten Roldugin gedacht, wo die Banker ihren Kunden offensichtlich zu wenig genau gepr\u00fcft haben.\u00bb Der Chef der Bank wurde zu einer Geldstrafe von 180 Tagess\u00e4tzen \u00e0 3000 Franken verurteilt. Die beiden weiteren Gesch\u00e4ftsleitungsmitglieder wurden ebenfalls zu 180 Tagess\u00e4tzen \u00e0 350 Franken beziehungsweise 500 Franken verurteilt. Der Kundenberater erhielt 120 Tagess\u00e4tze \u00e0 400 Franken. Die Geldstrafen wurden auf Bew\u00e4hrung ausgesprochen. Sie m\u00fcssen nur bezahlt werden, falls die Verurteilten innerhalb der Probezeit von zwei Jahren erneut straff\u00e4llig werden. Die Bank hat ihre Gesch\u00e4ftst\u00e4tigkeit im Herbst vergangenen Jahres eingestellt und befindet sich in Aufl\u00f6sung. Die Beschuldigten hatten in der Verhandlung, die bereits am 8. M\u00e4rz stattfand, Freispr\u00fcche gefordert. Vor Gericht verantworten mussten sich neben dem CEO der Bank zwei weitere Gesch\u00e4ftsleitungsmitglieder sowie ein Kundenberater. Das Urteil des Bezirksgerichts Z\u00fcrich ist noch nicht rechtskr\u00e4ftig. Es kann an das Obergericht weitergezogen werden. Die Anw\u00e4lte der Bankangestellten meldeten noch im Gerichtssaal Berufung an. Ein Vertreter der Staatsanwaltschaft begr\u00fcsste gegen\u00fcber Medienschaffenden die Schuldspr\u00fcche des Gerichts. Das Urteil sei ein wichtiges Signal zur Einhaltung von Sorgfaltspflichten in Finanzgesch\u00e4ften. ","title":"Vier Angestellte der Gazprombank Schweiz verurteilt","titleheader":"Putins Geldspur in die Schweiz","text_gpt4_api_keynotes_07_256":"- Vier Mitarbeiter der Gazprombank Schweiz wegen mangelnder Sorgfalt in Finanzgesch\u00e4ften verurteilt\n- Geldw\u00e4sche-Skandal im Zusammenhang mit Putins Freund, dem russischen Cellisten Sergei Roldugin\n- Die Verurteilten erhielten bedingte Geldstrafen, das Urteil ist noch nicht rechtskr\u00e4ftig","text_api_keynotes_07_256":"- Vier Bankangestellte der Gazprombank Schweiz wurden wegen mangelnder Sorgfalt in Finanzgesch\u00e4ften verurteilt.\n- Sie verwalteten Millionenbetr\u00e4ge eines Putin-Freundes, dem Cellisten und Dirigenten Sergei Roldugin.\n- Die Urteilsverk\u00fcndung des Z\u00fcrcher Bezirksgerichts sorgte weltweit f\u00fcr Aufsehen und zeigt, dass auch die engste Entourage des russischen Pr\u00e4sidenten erfolgreich juristisch belangt werden kann.","qa_list_gpt4":["Wann h\u00e4tten die Bankangestellten laut Gericht ihre Gesch\u00e4ftsbeziehung mit Sergei Roldugin beenden m\u00fcssen?","Im Jahr 2014","Im Sommer 2016","Sp\u00e4testens im November 2015"],"flesch":[49.2,51.6,41.85,38.0,35.7,39.25],"text_gpt4_api_normal_words_05_512":"Das Z\u00fcrcher Bezirksgericht hat vier Angestellte der Gazprombank Schweiz wegen mangelnder Sorgfalt in Finanzgesch\u00e4ften verurteilt. Die Bankangestellten verwalteten Millionenbetr\u00e4ge eines Freundes von Pr\u00e4sident Putin, dem russischen Cellisten und Dirigenten Sergei Roldugin. Die vier Beschuldigten wurden zu bedingten Geldstrafen verurteilt. Die Eidgen\u00f6ssische Finanzmarktaufsicht hatte Ermittlungen eingeleitet und kam zum Schluss, dass die Bank \"schwer gegen die Sorgfaltspflichten des Geldw\u00e4schereigesetzes versto\u00dfen\" hatte. Das Urteil ist noch nicht rechtskr\u00e4ftig und kann an das Obergericht weitergezogen werden.","frage_antwort":["Wer Geldspur in die Schweiz?","Putins","Mark Pieth","Wladimir Putin"]},{"_id":"64298062a9d504ce92eb6675","aid":409271542784,"date":"2023-03-30T06:52:24","author":"Markus Brotschi","categoryName":"Schweiz","premium":false,"readingTime":180.0,"wordCount":536.0,"url":"https:\/\/www.tagesanzeiger.ch\/bundesrat-schaltet-strafanzeige-wegen-ahv-leak-409271542784","own":"Sparplan vorab publik. Bundesrat erstattet Strafanzeige wegen AHV-Leak. Die Regierung beschliesst ein Sparprogramm, sieht aber von einer umstrittenen K\u00fcrzung bei der AHV ab. Dass der Plan an die \u00d6ffentlichkeit gelangte, hat nun allerdings Folgen. Der Plan l\u00f6ste in der \u00d6ffentlichkeit und den sozialen Medien ein grosses Echo und vor allem viel Kritik aus. Auff\u00e4llig allerdings: Die 190-Millionen-K\u00fcrzung bei der AHV ist darin nicht enthalten. Ob Keller-Sutter im Bundesrat eine Niederlage erlitt oder ob sie von dem Antrag absah, ist nicht bekannt. Abstriche bei Witwenrente. Daf\u00fcr will der Bundesrat gegen die ihm unbekannten Urheber des Informationslecks vorgehen, das den AHV-Plan vorab publik werden liess. Wie Bundesratssprecher Andr\u00e9 Simonazzi auf Anfrage best\u00e4tigt, hat die Regierung entschieden, Strafanzeige zu erstatten. Von der AHV abgesehen, setzt der Bundesrat aber bei einer ganzen Reihe weiterer Bereiche den Rotstift an. Neben der Witwenrente will der Bundesrat noch weitere gesetzlich gebundene Ausgaben reduzieren. ","lexrank_sumy":"Sparplan vorab publik. Bundesrat erstattet Strafanzeige wegen AHV-Leak. Dass der Plan an die \u00d6ffentlichkeit gelangte, hat nun allerdings Folgen. Das ist die Ansicht des Bundesrats und insbesondere von FDP-Finanzministerin Karin Keller-Sutter, die auf breiter Front sparen will. Auch die AHV sollte davon nicht verschont bleiben: Wie diese Zeitung publik machte, plante Keller-Sutter, den Bundesbeitrag an das Altersvorsorgewerk tempor\u00e4r zu reduzieren. Auff\u00e4llig allerdings: Die 190-Millionen-K\u00fcrzung bei der AHV ist darin nicht enthalten. Sie schaden dem Ansehen des Bundesrats als Kollegium.\u00bb Die Bundesratssitzungen und alle damit verbundenen Antr\u00e4ge und Unterlagen sind vertraulich; auf Indiskretionen reagierten die Beh\u00f6rden in Bern j\u00fcngst wiederholt mit juristischen Schritten. So soll der Bundesbeitrag an die Arbeitslosenversicherung (ALV) w\u00e4hrend f\u00fcnf Jahren um j\u00e4hrlich 250 Millionen Franken gek\u00fcrzt werden. Auch der AHV-Fonds soll entlastet werden, und zwar mit einer Reform der Witwenrente, die bei der AHV j\u00e4hrliche Einsparungen von 500 Millionen und beim Bund solche von 100 Millionen Franken bringt. Neben der Witwenrente will der Bundesrat noch weitere gesetzlich gebundene Ausgaben reduzieren. So soll der Anteil der Kantone an der direkten Bundessteuer um 200 Millionen Franken pro Jahr reduziert werden. Der Bundesrat begr\u00fcndet dies mit der im Parlament diskutierten Krippenfinanzierung von j\u00e4hrlich 800 Millionen Franken. ","text_api_simple_words_07_512":"Die Regierung m\u00f6chte Geld sparen, aber hat beschlossen, nicht bei der AHV zu k\u00fcrzen. Ein geheimer Plan zur K\u00fcrzung der AHV wurde jedoch geleakt und der Bundesrat hat deshalb eine Strafanzeige erstattet. Stattdessen wird bei anderen Bereichen gespart, wie der Arbeitslosenversicherung und der Witwenrente. Der Bund plant auch, den Anteil der Kantone an der direkten Bundessteuer zu reduzieren und den Beitrag in den Bahninfrastrukturfonds zu k\u00fcrzen. Weitere Einschnitte werden in Zukunft notwendig sein, um Defizite zu beseitigen.","text_api_normal_words_05_512":"Die Schweizer Regierung plant ein Sparprogramm, um mehrere Milliarden Franken im Bundeshaushalt einzusparen. Allerdings wird eine umstrittene K\u00fcrzung bei der AHV nicht durchgesetzt, nachdem der Plan an die \u00d6ffentlichkeit gelangt ist und viel Kritik ausgel\u00f6st hat. Stattdessen setzt der Bundesrat bei anderen Bereichen den Rotstift an, darunter die Arbeitslosenversicherung, die Witwenrente und die direkte Bundessteuer der Kantone. Der Bundesrat hat beschlossen, Strafanzeige zu erstatten gegen die Urheber des Informationslecks, das den AHV-Plan vorab publik gemacht hat. Weitere Einschnitte werden in den n\u00e4chsten Jahren erwartet, um die Bundesfinanzen zu stabilisieren.","text_api_child_09_350":"Die Regierung m\u00f6chte viel Geld sparen, weil das Geld knapp wird. Eine Person wollte die Sparpl\u00e4ne der Regierung ver\u00f6ffentlichen und hat deshalb \u00c4rger bekommen. Die Regierung will gegen diese Person klagen. Die Regierung will aber nicht bei der Altersvorsorge sparen, obwohl das geplant war. Stattdessen sollen bei anderen Dingen gespart werden, zum Beispiel bei der Witwenrente. Witwer sollen in Zukunft genauso behandelt werden wie Witwen. Die Regierung plant noch weitere Einsparungen, doch es wird trotzdem in Zukunft nicht genug Geld geben.","text_api_keynotes_07_350":"1. Die Schweizer Regierung beschlie\u00dft ein umfangreiches Sparprogramm, um die Bundesfinanzen zu verbessern.\n2. Finanzministerin Karin Keller-Sutter plant, den Bundesbeitrag an die AHV tempor\u00e4r zu reduzieren und dadurch j\u00e4hrlich 190 Millionen Franken einzusparen.\n3. Die Pl\u00e4ne l\u00f6sen jedoch viel Kritik aus und der Bundesrat beschlie\u00dft letztendlich, die K\u00fcrzung bei der AHV nicht durchzuf\u00fchren.\n4. Stattdessen will der Bundesrat in anderen Bereichen sparen, unter anderem durch eine Reform der Witwenrente.\n5. Um das AHV-Leak zu verfolgen, hat der Bundesrat eine Strafanzeige gegen die unbekannten Urheber erstattet und verurteilt die Indiskretion in aller Deutlichkeit.","text_davinci_api_key_07_256":". Der Bundesrat hat ein umfangreiches Sparprogramm beschlossen, das die AHV-K\u00fcrzung nicht enth\u00e4lt:\n- der Bundesbeitrag an die Arbeitslosenversicherung wird w\u00e4hrend f\u00fcnf Jahren um 250 Millionen Franken gek\u00fcrzt\n- der Anteil der Kantone an der direkten Bundessteuer wird um 200 Millionen Franken pro Jahr reduziert\n- der Beitrag in den Bahninfrastrukturfonds wird f\u00fcr drei Jahre um mindestens 150 Millionen pro Jahr verringert\n2. Der Bundesrat verurteilt die Indiskretion, die den AHV-Plan vorab publik werden liess, \u00abin aller Deutlichkeit\u00bb und reagiert mit einer Strafanzeige.\n3. Die Reform der Witwenrente w\u00fcrde die Ungleichbehandlung von Witwern beseitigen und j\u00e4hrliche Einsparungen von 500 Millionen bei der AHV und 100 Millionen","five_letter_word_list":["vorab","wegen","sieht","einer","karin","steht","front","davon","nicht","diese","jahre","w\u00e4ren","damit","l\u00f6ste","allem","darin","absah","waren","keine","daf\u00fcr","gegen","liess","andr\u00e9","aller","meist","regel","setzt","reihe","denen","plant","w\u00fcrde","r\u00fcgte","lange","rente","heute","haben","neben","offen"],"qa_list":["Was plant die FDP-Finanzministerin Karin Keller-Sutter in Bezug auf die AHV?","Sie plant eine dauerhafte K\u00fcrzung des Bundesbeitrags um 190 Millionen Franken pro Jahr.","Sie plant eine tempor\u00e4re K\u00fcrzung des Bundesbeitrags um 500 Millionen Franken pro Jahr.","Sie plant eine tempor\u00e4re K\u00fcrzung des Bundesbeitrags um 190 Millionen Franken pro Jahr."],"lead":"Die Regierung beschliesst ein Sparprogramm, sieht aber von einer umstrittenen K\u00fcrzung bei der AHV ab. Dass der Plan an die \u00d6ffentlichkeit gelangte, hat nun allerdings Folgen.","originaltext":"Sparplan vorab publik Bundesrat erstattet Strafanzeige wegen AHV-Leak. Die Regierung beschliesst ein Sparprogramm, sieht aber von einer umstrittenen K\u00fcrzung bei der AHV ab. Dass der Plan an die \u00d6ffentlichkeit gelangte, hat nun allerdings Folgen. Finanzministerin Karin Keller-Sutter will im Bundeshaushalt j\u00e4hrlich mehrere Milliarden Franken einsparen. Um die Bundesfinanzen steht es schlecht. Das ist die Ansicht des Bundesrats und insbesondere von FDP-Finanzministerin Karin Keller-Sutter, die auf breiter Front sparen will. Auch die AHV sollte davon nicht verschont bleiben: Wie diese Zeitung publik machte, plante Keller-Sutter, den Bundesbeitrag an das Altersvorsorgewerk tempor\u00e4r zu reduzieren. F\u00fcnf Jahre lang w\u00e4ren damit je 190 Millionen Franken eingespart worden. Der Plan l\u00f6ste in der \u00d6ffentlichkeit und den sozialen Medien ein grosses Echo und vor allem viel Kritik aus. Am Mittwochnachmittag nun hat sich der Gesamtbundesrat mit dem Sparplan befasst und ein umfangreiches Massnahmenpaket verabschiedet. Auff\u00e4llig allerdings: Die 190-Millionen-K\u00fcrzung bei der AHV ist darin nicht enthalten. Ob Keller-Sutter im Bundesrat eine Niederlage erlitt oder ob sie von dem Antrag absah, ist nicht bekannt. Beim Bund waren dazu keine Informationen erh\u00e4ltlich. Abstriche bei Witwenrente. Daf\u00fcr will der Bundesrat gegen die ihm unbekannten Urheber des Informationslecks vorgehen, das den AHV-Plan vorab publik werden liess. Wie Bundesratssprecher Andr\u00e9 Simonazzi auf Anfrage best\u00e4tigt, hat die Regierung entschieden, Strafanzeige zu erstatten. Man verurteile die Indiskretion \u00abin aller Deutlichkeit\u00bb, betont Simonazzi. \u00abIndiskretionen sind meist l\u00fcckenhaft, teilweise falsch und in der Regel manipulativ. Sie schaden dem Ansehen des Bundesrats als Kollegium.\u00bb Die Bundesratssitzungen und alle damit verbundenen Antr\u00e4ge und Unterlagen sind vertraulich; auf Indiskretionen reagierten die Beh\u00f6rden in Bern j\u00fcngst wiederholt mit juristischen Schritten. Von der AHV abgesehen, setzt der Bundesrat aber bei einer ganzen Reihe weiterer Bereiche den Rotstift an. Einerseits hat er lineare K\u00fcrzungen bei nicht gesetzlich festgelegten Ausgabenposten beschlossen, mit denen der Haushalt um bis zu 2 Milliarden pro Jahr entlastet wird. Weil dies aber nicht reicht, plant der Bundesrat mehrere Ausgabenk\u00fcrzungen, f\u00fcr die Gesetzes\u00e4nderungen notwendig sind. So soll der Bundesbeitrag an die Arbeitslosenversicherung (ALV) w\u00e4hrend f\u00fcnf Jahren um j\u00e4hrlich 250 Millionen Franken gek\u00fcrzt werden. Dies ist laut Bundesrat m\u00f6glich, ohne Leistungen bei der ALV abzubauen, da der ALV-Fonds gut ge\u00e4ufnet ist. Die Reform w\u00fcrde die Ungleichbehandlung von Witwern beseitigen, die der Gerichtshof f\u00fcr Menschenrechte r\u00fcgte. Auch der AHV-Fonds soll entlastet werden, und zwar mit einer Reform der Witwenrente, die bei der AHV j\u00e4hrliche Einsparungen von 500 Millionen und beim Bund solche von 100 Millionen Franken bringt. Grunds\u00e4tzlich sollen k\u00fcnftig Witwen und Witwer nur noch so lange eine Rente erhalten, bis das j\u00fcngste Kind 25 Jahre alt ist. Mit einer solchen Reform w\u00fcrde gleichzeitig die Ungleichbehandlung von Witwern gegen\u00fcber Witwen zu beseitigt, die der Gerichtshof f\u00fcr Menschenrechte in Strassburg r\u00fcgte. Heute bekommen auch kinderlose Witwen eine Rente, Witwer jedoch nur, solange sie minderj\u00e4hrige Kinder haben. Neben der Witwenrente will der Bundesrat noch weitere gesetzlich gebundene Ausgaben reduzieren. So soll der Anteil der Kantone an der direkten Bundessteuer um 200 Millionen Franken pro Jahr reduziert werden. Der Bundesrat begr\u00fcndet dies mit der im Parlament diskutierten Krippenfinanzierung von j\u00e4hrlich 800 Millionen Franken. Denn familienexterne Kinderbetreuung sei eigentlich eine Aufgabe der Kantone. Ebenfalls befristet soll der Beitrag in den Bahninfrastrukturfonds f\u00fcr drei Jahre um mindestens 150 Millionen pro Jahr reduziert werden. Die vorgeschlagenen Sparmassnahmen reichen jedoch laut Bundesrat nicht aus, um die in den n\u00e4chsten Jahren erwarteten Defizite zu beseitigen. Sp\u00e4testens ab 2025 d\u00fcrften deshalb weitere Einschnitte notwendig sein. Ob davon auch die AHV-Finanzierung betroffen ist, bleibt offen. ","title":"Bundesrat erstattet Strafanzeige wegen AHV-Leak","titleheader":"Sparplan vorab publik\u00a0\u00a0","text_gpt4_api_keynotes_07_256":"- Bundesrat beschlie\u00dft Sparprogramm, verzichtet jedoch auf umstrittene K\u00fcrzung bei der AHV.\n- Finanzministerin Karin Keller-Sutter plant, j\u00e4hrlich mehrere Milliarden Franken im Bundeshaushalt einzusparen.\n- Regierung erstattet Strafanzeige wegen Informationsleck, das den AHV-Plan vorab ver\u00f6ffentlichte.","text_api_keynotes_07_256":"- Bundesrat beschliesst Sparprogramm, aber umstrittene K\u00fcrzung bei AHV wird nicht durchgef\u00fchrt\n- Finanzministerin Keller-Sutter will j\u00e4hrlich Milliarden einsparen, um Bundesfinanzen zu verbessern\n- Bundesrat erstattet Strafanzeige wegen AHV-Leak und setzt bei verschiedenen Bereichen den Rotstift an","qa_list_gpt4":["Was hat der Bundesrat bez\u00fcglich der K\u00fcrzung des Bundesbeitrags an die AHV entschieden?","Der Bundesrat hat die K\u00fcrzung um 190 Millionen Franken beschlossen.","Der Bundesrat plant, den Bundesbeitrag an die AHV komplett zu streichen.","Der Bundesrat hat von der umstrittenen K\u00fcrzung von 190 Millionen Franken bei der AHV abgesehen."],"flesch":[42.35,50.8,42.05,53.45,39.35,63.1],"text_gpt4_api_normal_words_05_512":"Der Bundesrat hat ein umfangreiches Sparpaket beschlossen, verzichtet jedoch auf die umstrittene K\u00fcrzung des Bundesbeitrags f\u00fcr die AHV. Finanzministerin Karin Keller-Sutter plant, j\u00e4hrlich mehrere Milliarden Franken im Bundeshaushalt einzusparen. Trotz der Kritik an dem vorab ver\u00f6ffentlichten Plan, den Bundesbeitrag zur AHV tempor\u00e4r zu reduzieren, hat der Bundesrat in anderen Bereichen K\u00fcrzungen vorgenommen. Dazu geh\u00f6rt eine Reduzierung des Bundesbeitrags zur Arbeitslosenversicherung (ALV) um j\u00e4hrlich 250 Millionen Franken f\u00fcr f\u00fcnf Jahre und eine Reform der Witwenrente, die bei der AHV j\u00e4hrliche Einsparungen von 500 Millionen und beim Bund von 100 Millionen Franken bringt. Der Bundesrat hat zudem Strafanzeige gegen die unbekannten Urheber des Informationslecks erstattet, das den AHV-Plan vorab \u00f6ffentlich gemacht hat.","frage_antwort":[]},{"_id":"64298062a9d504ce92eb6698","aid":129220958410,"date":"2023-03-30T19:24:19","author":"Thomas Kirchner","categoryName":"International","premium":false,"readingTime":180.0,"wordCount":565.0,"url":"https:\/\/www.tagesanzeiger.ch\/bolsonaro-kommt-heim-und-verunsichert-brasilien-129220958410","own":"R\u00fcckkehr des Ex-Pr\u00e4sidenten. Bolsonaro kommt heim \u2013 und verunsichert Brasilien. Nach 89 Tagen in Florida, USA, landet der umstrittene und nicht wiedergew\u00e4hlte Staatschef in der Hauptstadt Bras\u00edlia. Was er nun plant, ist unklar. Vor der Zeremonie geflohen. Politische Gewalt verherrlicht. Bolsonaro will mit dem Aufruhr nicht direkt etwas zu tun gehabt haben. Immer wieder hatte der rechtsradikale Politiker ausserdem politische Gewalt verherrlicht. Von Anh\u00e4ngern ihres Ehemanns empfangen: Michelle Bolsonaro, die Ehefrau von Ex-Pr\u00e4sident Jair Bolsonaro. Dass Bolsonaro dann Ende Dezember in die USA flog, war ebenfalls kein Zufall: Er floh damit gewissermassen vor der Ernennungszeremonie seines Nachfolgers Lula Anfang Januar. Oppositionsf\u00fchrer wolle er nicht werden, hatte er in einem Interview vor seiner Abreise aus den USA versichert. Viel h\u00e4ngt davon ab, wie die Ermittlungen gegen Bolsonaro verlaufen und die Justiz schliesslich \u00fcber ihn urteilt. ","lexrank_sumy":"R\u00fcckkehr des Ex-Pr\u00e4sidenten. Bolsonaro kommt heim \u2013 und verunsichert Brasilien. Nach 89 Tagen in Florida, USA, landet der umstrittene und nicht wiedergew\u00e4hlte Staatschef in der Hauptstadt Bras\u00edlia. Der Mann, der das Land kurz vor dem grossen Chaos verlassen hatte, ist nun also wieder zur\u00fcck. Um 6.38 Uhr am Donnerstagmorgen landete ein Flugzeug aus dem US-amerikanischen Orlando in Bras\u00edlia \u2013 und der Maschine entstieg tats\u00e4chlich ebenjener Jair Bolsonaro, der seine R\u00fcckkehr aus dem amerikanischen Exil schon mehrmals angek\u00fcndigt und immer wieder verschoben hatte. Auf den Bildern, die von der R\u00fcckkehr verbreitet wurden, zeigt sich der 68 Jahre alte Ex-Pr\u00e4sident sichtlich entspannt; noch im Flugzeug sitzend, wischt er auf seinem Smartphone herum, klatscht in einer Tiefgarage mit ein paar Getreuen ab, winkt den Anh\u00e4ngern sp\u00e4ter aus einem Fenster grinsend zu. Die Polizei hatte sich gegen Schlimmstes gewappnet, doch vorerst blieb es am Flughafen und in der Stadt weitgehend ruhig. Ob Bolsonaros Lachen echt ist oder seine wahre Gem\u00fctslage nur verdeckt, weiss er am besten selbst; wahrscheinlicher ist Letzteres. Es war kein Zufall, dass das Datum nur kurz hinter dem 6. Januar lag, dem zweiten Jahrestag des Sturms auf das Capitol in den USA. Sicher ist jedoch, dass er die Gewalt durch sein Verhalten angefacht hat. \u00abNat\u00fcrlich \u00fcbernimmt er die Rolle des Oppositionsf\u00fchrers.\u00bb Dazu hat er sich, typisch f\u00fcr ihn, nicht ganz eindeutig ge\u00e4ussert. Der Abgeordnete Eduardo Bolsonaro wiederum sagte \u00fcber seinen Vater: \u00abNat\u00fcrlich \u00fcbernimmt er die Rolle des Oppositionsf\u00fchrers.\u00bb Worin das alles m\u00fcndet, ob Bolsonaro langfristig nicht doch wieder in offene Konkurrenz zu Lula treten und ihn an der Staatsspitze abl\u00f6sen will, l\u00e4sst sich noch nicht sagen. ","text_api_simple_words_07_512":"Der ehemalige Pr\u00e4sident Brasiliens, Jair Bolsonaro, ist nach 89 Tagen in den USA zur\u00fcck in Bras\u00edlia gelandet. Es ist unklar, was er als n\u00e4chstes plant, aber er muss sich verschiedenen juristischen und politischen Ermittlungsverfahren stellen, einschlie\u00dflich Korruptionsvorw\u00fcrfen. Vor seiner Abreise hatte er die Pr\u00e4sidentschaftsstichwahl verloren, aber er hatte Wahlbetrug behauptet und politische Gewalt verherrlicht. Seine R\u00fcckkehr k\u00f6nnte den Bolsonaristen, die seine Anh\u00e4nger sind, neuen Auftrieb geben.","text_api_normal_words_05_512":"Der ehemalige brasilianische Pr\u00e4sident Jair Bolsonaro ist nach 89 Tagen in Florida, USA, nach Brasilien zur\u00fcckgekehrt und hat damit Verunsicherung im Land ausgel\u00f6st. Es ist unklar, was er nun plant, da er sich einer Reihe von juristischen und politischen Ermittlungsverfahren stellen muss, unter anderem wegen Korruptionsvorw\u00fcrfen. Insbesondere geht es um einen Vorfall am 8. Januar, als ein Mob von Bolsonaro-Anh\u00e4ngern in mehrere Staatsgeb\u00e4ude in Bras\u00edlia eindrang und Teile des obersten Gerichtshofs, des Parlamentsgeb\u00e4udes und des Regierungspalasts verw\u00fcstete. Bolsonaro hatte die Gewalt durch sein Verhalten angefacht und politische Gewalt verherrlicht. Es bleibt abzuwarten, wie die Ermittlungen gegen ihn verlaufen und wie die Justiz schlie\u00dflich \u00fcber ihn urteilt. Die R\u00fcckkehr von Bolsonaro auf brasilianischen Boden wird den Bolsonaristen, deren Stimme eine Weile leiser geworden war, neuen Auftrieb verleihen.","text_api_child_09_350":"Jair Bolsonaro, der ehemalige Pr\u00e4sident von Brasilien, ist nach 89 Tagen im amerikanischen Exil zur\u00fcck in Brasilien. Seine R\u00fcckkehr hat viele Anh\u00e4nger, aber auch Gegner. Es gibt viele Vorw\u00fcrfe gegen ihn, unter anderem wegen Korruption. Auch wird ihm vorgeworfen, politische Gewalt zu unterst\u00fctzen. Bolsonaro wird sich bald vor Gericht verantworten m\u00fcssen. Es ist unklar, ob er weiterhin politisch aktiv sein wird und ob er versuchen wird, erneut Pr\u00e4sident zu werden. Die R\u00fcckkehr von Bolsonaro gibt seinen Anh\u00e4ngern jedoch neuen Auftrieb.","text_api_keynotes_07_350":"Keynotes mit Aufz\u00e4hlungszeichen:\n\n- Der ehemalige brasilianische Pr\u00e4sident Jair Bolsonaro ist nach 89 Tagen Exil in Florida zur\u00fcckgekehrt und hat damit Unruhe in Brasilien ausgel\u00f6st.\n- Es ist unklar, was Bolsonaro nun plant, da er sich einer Reihe von juristischen und politischen Ermittlungsverfahren stellen muss, unter anderem wegen Korruption.\n- Bolsonaro hat politische Gewalt verherrlicht und wird verd\u00e4chtigt, den symboltr\u00e4chtigen Angriff auf die Demokratie im Januar angefacht zu haben.\n- Es bleibt abzuwarten, ob Bolsonaro langfristig wieder in offene Konkurrenz zu seinem Nachfolger Lula treten und ihn abl\u00f6sen wird.\n- Die R\u00fcckkehr des umstrittenen Ex-Pr\u00e4sidenten verleiht seinen Anh\u00e4ngern neuen Auftrieb und k\u00f6nnte die politische Landschaft in Brasilien weiter destabilisieren.","text_davinci_api_key_07_256":"1. Der umstrittene Ex-Pr\u00e4sident Jair Bolsonaro ist nach 89 Tagen in den USA wieder in Brasilien gelandet und wurde von seinen Anh\u00e4ngerinnen und Anh\u00e4ngern begr\u00fc\u00dft. \n2. Bolsonaro muss sich in Brasilien vor Gericht verantworten und hat m\u00f6glicherweise politische Gewalt angefacht. \n3. Seine R\u00fcckkehr verleiht den Bolsonaristen neuen Auftrieb und es ist unklar, was Bolsonaro nun plant.","five_letter_word_list":["kommt","tagen","nicht","plant","winkt","chaos","hatte","seine","schon","immer","zeigt","jahre","herum","einer","einem","gegen","blieb","stadt","ruhig","wahre","weiss","reihe","haben","darum","jenem","drang","teile","einen","datum","etwas","durch","silva","knapp","daf\u00fcr","heute","keine","ihres","damit","h\u00e4tte","rolle","wolle","werde","kraft","sagte","vater","worin","alles","l\u00e4sst","sagen","h\u00e4ngt","davon","boden","deren","weile","neuen"],"qa_list":["Was ist der Grund f\u00fcr Bolsonaros R\u00fcckkehr nach Brasilien?","Bolsonaro wollte einfach nur seine Anh\u00e4nger begr\u00fc\u00dfen.","Bolsonaro wollte sich vor den juristischen Verfahren in den USA verstecken.","Der Grund f\u00fcr Bolsonaros R\u00fcckkehr nach Brasilien ist unklar."],"lead":"Nach 89 Tagen in Florida, USA, landet der umstrittene und nicht wiedergew\u00e4hlte Staatschef in der Hauptstadt Bras\u00edlia. Was er nun plant, ist unklar. ","originaltext":"R\u00fcckkehr des Ex-Pr\u00e4sidenten. Bolsonaro kommt heim \u2013 und verunsichert Brasilien. Nach 89 Tagen in Florida, USA, landet der umstrittene und nicht wiedergew\u00e4hlte Staatschef in der Hauptstadt Bras\u00edlia. Was er nun plant, ist unklar. Zur\u00fcck in der Heimat: Der ehemalige Pr\u00e4sident Jair Bolsonaro winkt seinen Anh\u00e4ngerinnen und Anh\u00e4nger zu, nachdem der in Brasilia gelandet ist. Der Mann, der das Land kurz vor dem grossen Chaos verlassen hatte, ist nun also wieder zur\u00fcck. Um 6.38 Uhr am Donnerstagmorgen landete ein Flugzeug aus dem US-amerikanischen Orlando in Bras\u00edlia \u2013 und der Maschine entstieg tats\u00e4chlich ebenjener Jair Bolsonaro, der seine R\u00fcckkehr aus dem amerikanischen Exil schon mehrmals angek\u00fcndigt und immer wieder verschoben hatte. Auf den Bildern, die von der R\u00fcckkehr verbreitet wurden, zeigt sich der 68 Jahre alte Ex-Pr\u00e4sident sichtlich entspannt; noch im Flugzeug sitzend, wischt er auf seinem Smartphone herum, klatscht in einer Tiefgarage mit ein paar Getreuen ab, winkt den Anh\u00e4ngern sp\u00e4ter aus einem Fenster grinsend zu. Die Polizei hatte sich gegen Schlimmstes gewappnet, doch vorerst blieb es am Flughafen und in der Stadt weitgehend ruhig. Vor der Zeremonie geflohen. Ob Bolsonaros Lachen echt ist oder seine wahre Gem\u00fctslage nur verdeckt, weiss er am besten selbst; wahrscheinlicher ist Letzteres. Der Ex-Pr\u00e4sident muss sich in Brasilien einer Reihe juristischer und politischer Ermittlungsverfahren stellen, es geht um Korruption, etwa um ein Juwelengeschenk der saudiarabischen Regierung im Wert von drei Millionen Dollar, das er zu Unrecht ins Land gebracht und in die eigene Tasche gesteckt haben soll. Zu diesem Fall und zu weiteren \u00e4hnlichen Vorw\u00fcrfen wird er in wenigen Tagen eine Aussage machen m\u00fcssen. Zuallererst aber geht es darum, was am 8. Januar geschah. An jenem Sonntag drang ein Mob von Bolsonaro-Anh\u00e4ngern in mehrere Staatsgeb\u00e4ude in Bras\u00edlia ein. Sie verw\u00fcsteten Teile des obersten Gerichtshofs, des Parlamentsgeb\u00e4udes und des Regierungspalasts und f\u00fchrten so einen symboltr\u00e4chtigen Angriff gegen die Demokratie. Mehr als 1500 Menschen wurden verhaftet. Es war kein Zufall, dass das Datum nur kurz hinter dem 6. Januar lag, dem zweiten Jahrestag des Sturms auf das Capitol in den USA. Politische Gewalt verherrlicht. Bolsonaro will mit dem Aufruhr nicht direkt etwas zu tun gehabt haben. Ob das stimmt, ist Gegenstand der Untersuchungen, die l\u00e4ngst angelaufen sind. Sicher ist jedoch, dass er die Gewalt durch sein Verhalten angefacht hat. Nachdem sein Widersacher, der Ex-Pr\u00e4sident Lula da Silva, die Pr\u00e4sidentschaftsstichwahl im Herbst knapp gewonnen hatte, raunte Bolsonaro vielfach von Wahlbetrug, obwohl es daf\u00fcr bis heute keine Anhaltspunkte gibt. Immer wieder hatte der rechtsradikale Politiker ausserdem politische Gewalt verherrlicht. Von Anh\u00e4ngern ihres Ehemanns empfangen: Michelle Bolsonaro, die Ehefrau von Ex-Pr\u00e4sident Jair Bolsonaro. Dass Bolsonaro dann Ende Dezember in die USA flog, war ebenfalls kein Zufall: Er floh damit gewissermassen vor der Ernennungszeremonie seines Nachfolgers Lula Anfang Januar. Der Tradition zufolge h\u00e4tte er ihm eigentlich die Pr\u00e4sidentensch\u00e4rpe \u00fcbergeben m\u00fcssen \u2013 doch damit h\u00e4tte Bolsonaro auch ein Bild geschaffen, das so gewirkt h\u00e4tte, als legitimierte er seinen Nachfolger. \u00abNat\u00fcrlich \u00fcbernimmt er die Rolle des Oppositionsf\u00fchrers.\u00bb Dazu hat er sich, typisch f\u00fcr ihn, nicht ganz eindeutig ge\u00e4ussert. Oppositionsf\u00fchrer wolle er nicht werden, hatte er in einem Interview vor seiner Abreise aus den USA versichert. Er werde aber mit seiner Liberalen Partei zusammenarbeiten und sich f\u00fcr sie engagieren, werde durch das Land reisen und mit Anh\u00e4ngern sprechen. Der Chef der Liberalen Partei begr\u00fcsste das eilfertig. Mit 99 von 513 Mandaten ist die Partei st\u00e4rkste Kraft im Parlament. Der Abgeordnete Eduardo Bolsonaro wiederum sagte \u00fcber seinen Vater: \u00abNat\u00fcrlich \u00fcbernimmt er die Rolle des Oppositionsf\u00fchrers.\u00bb Worin das alles m\u00fcndet, ob Bolsonaro langfristig nicht doch wieder in offene Konkurrenz zu Lula treten und ihn an der Staatsspitze abl\u00f6sen will, l\u00e4sst sich noch nicht sagen. Viel h\u00e4ngt davon ab, wie die Ermittlungen gegen Bolsonaro verlaufen und die Justiz schliesslich \u00fcber ihn urteilt. M\u00f6glich w\u00e4re, dass die Gerichte ihn f\u00fcr einige Jahre von der Teilnahme an Wahlen ausschliessen. Sicher ist, dass die R\u00fcckkehr ihres Helden auf brasilianischen Boden den Bolsonaristen, deren Stimme eine Weile leiser geworden war, neuen Auftrieb verleihen wird. ","title":"Bolsonaro kommt heim \u2013 und verunsichert Brasilien","titleheader":"R\u00fcckkehr des Ex-Pr\u00e4sidenten","text_gpt4_api_keynotes_07_256":"- Ex-Pr\u00e4sident Jair Bolsonaro kehrt nach 89 Tagen in den USA nach Brasilien zur\u00fcck und sorgt f\u00fcr Unsicherheit.\n- Bolsonaro muss sich in Brasilien juristischen und politischen Ermittlungsverfahren stellen, darunter Korruptionsvorw\u00fcrfe.\n- Die Rolle Bolsonaros in der Opposition und seine zuk\u00fcnftigen politischen Ambitionen bleiben unklar.","text_api_keynotes_07_256":"- Der umstrittene und nicht wiedergew\u00e4hlte Ex-Pr\u00e4sident Bolsonaro ist nach 89 Tagen in Florida wieder in Brasilien gelandet und verunsichert damit das Land.\n- Bolsonaro muss sich einer Reihe von juristischen und politischen Ermittlungsverfahren stellen, darunter Korruptionsvorw\u00fcrfe und die Anstiftung zum symboltr\u00e4chtigen Angriff gegen die Demokratie am 8. Januar.\n- Es bleibt unklar, ob Bolsonaro langfristig wieder in offene Konkurrenz zu seinem Widersacher Lula treten und ihn an der Staatsspitze abl\u00f6sen will, da viel von den Ermittlungsergebnissen und Urteilen der Gerichte abh\u00e4ngt.","qa_list_gpt4":["Wie lange war Jair Bolsonaro in Florida, USA, bevor er nach Brasilien zur\u00fcckkehrte?","68 Tage","120 Tage","89 Tage"],"flesch":[52.15,46.05,57.2,34.8,39.15,51.6],"text_gpt4_api_normal_words_05_512":"Der ehemalige brasilianische Pr\u00e4sident Jair Bolsonaro ist nach 89 Tagen in den USA nach Brasilien zur\u00fcckgekehrt und sorgt f\u00fcr Unsicherheit im Land. Seine Pl\u00e4ne sind unklar, aber er muss sich mehreren juristischen und politischen Ermittlungsverfahren stellen, unter anderem wegen Korruptionsvorw\u00fcrfen. Bolsonaro hat seine R\u00fcckkehr aus dem Exil mehrmals angek\u00fcndigt und verschoben. Seine Anh\u00e4nger empfingen ihn begeistert, w\u00e4hrend die Polizei auf m\u00f6gliche Unruhen vorbereitet war. Bolsonaro wird vorgeworfen, politische Gewalt angefacht zu haben, und es bleibt abzuwarten, welche Rolle er in der Opposition spielen wird. Die R\u00fcckkehr des ehemaligen Pr\u00e4sidenten d\u00fcrfte seinen Anh\u00e4ngern neuen Auftrieb geben.","frage_antwort":["Wer will mit dem Aufruhr nicht direkt etwas zu tun gehabt haben?","Bolsonaro","Lula","Jair"]},{"_id":"64313257fc3e38046ad1792f","aid":471932878022,"date":"2023-04-03T06:40:34","author":"Philippe Reichen","categoryName":"Schweiz","premium":false,"readingTime":240.0,"wordCount":830.0,"url":"https:\/\/www.tagesanzeiger.ch\/die-genfer-erteilen-ihrem-gefallenen-politstar-die-absolution-471932878022","own":"Das Comeback von Pierre Maudet. Die Genfer erteilen ihrem gefallenen Politstar die Absolution. Pierre Maudet darf in Genf pl\u00f6tzlich wieder von einer R\u00fcckkehr in die Regierung tr\u00e4umen. Sein Coup bringt vor allem seine Ex-Partei, die FDP, in eine ungem\u00fctliche Lage. Seine Anh\u00e4nger tragen Pierre Maudet am Wahltag auf ihren Schultern ins Genfer Wahlzentrum in der Universit\u00e9 Mail. Auf ihren Schultern und unter Jubelschreien tragen die Anh\u00e4nger Pierre Maudet am Sonntagnachmittag ins Genfer Wahlzentrum. Pierre Maudet feiert bei den Parlaments- und Regierungswahlen eine Art politisches Auferstehungsfest. Und Maudet selber darf sogar davon tr\u00e4umen, am 30. Maudets Projekte. \u00abWir m\u00fcssen an den Alltag der Genferinnen und Genfer denken\u00bb, ruft Maudet jetzt ins Mikrofon des Lokalsenders L\u00e9man Bleu. Genf sei tr\u00e4ge geworden und brauche Projekte. Reich weiss: Die FDP ist auch allein auf bestem Weg, den ehemaligen Regierungssitz von Maudet zur\u00fcckzuerobern. Z\u00fcndstoff f\u00fcr die FDP. Die FDP hat also faktisch alle Macht \u00fcber Maudet. \u00abDas Volk hat Maudet die Absolution erteilt\u00bb, sagt der langj\u00e4hrige Genfer SP-Stadtpr\u00e4sident Manuel Tornare. Auch habe den Genferinnen und Genfern eines niemand gesagt: \u00abIn Bundesbern wundert man sich, dass Pierre Maudet in der Genfer Politik \u00fcberhaupt noch eine Rolle spielt.\u00bb ","lexrank_sumy":"Das Comeback von Pierre Maudet. Pierre Maudet darf in Genf pl\u00f6tzlich wieder von einer R\u00fcckkehr in die Regierung tr\u00e4umen. Jenen Mann, der die \u00d6ffentlichkeit \u00fcber die Finanzierung der Reise belogen hatte und den die FDP deshalb aus der Partei ausschloss. Jenen Mann, der am Ende aus dem Genfer Staatsrat zur\u00fccktrat, um im M\u00e4rz 2021 gleich zu seiner eigenen Wiederwahl anzutreten, wobei er das Plebiszit gegen die Gr\u00fcne Fabienne Fischer dann aber verlor. Doch heute ist ein anderer Tag. Maudets Projekte. Er und seine Bewegung h\u00e4tten im Wahlkampf 24 Projekte vorgeschlagen. \u00abWenn die FDP genug intelligent und nicht zu arrogant ist, kommt es zu einer b\u00fcrgerlichen Allianz mit der Mitte, der SVP und dem MCG.\u00bb Im Moment, in dem Maudet seinen Triumph feiert, \u00abeine gewisse Rehabilitation\u00bb beschw\u00f6rt und sagt, man \u00absolle nicht in den R\u00fcckspiegel schauen\u00bb, steht der Genfer FDP-Pr\u00e4sident Bertrand Reich einsam und allein in einem Nebenraum des Restaurants \u00abLucha libre\u00bb, zu Deutsch: Freier Kampf. Auch eine Allianz mit Maudets Bewegung ist vorstellbar.\u00bb Ist sie auch f\u00fcr FDP-Pr\u00e4sident Bertrand Reich vorstellbar? \u00abKein Kommentar!\u00bb, sagt er. F\u00fcr Maudet wiederum ist \u2013 trotz seines guten Abschneidens im ersten Wahlgang \u2013 seine Wiederwahl in die Regierung ohne b\u00fcrgerliche Allianz schwierig bis unerreichbar. Vincent Subilia, FDP-Kantonsrat und Chef der Genfer Handelskammer, sagt: \u00abIch pers\u00f6nlich bin f\u00fcr eine Allianz mit Pierre Maudet, und auch die Handelskammer ist daf\u00fcr.\u00bb Das Volk wolle Maudet, und auch im Parlament sei seine Bewegung gut vertreten, so Subilia. Dass die FDP mit ihrem Ex-Mitglied Maudet in den zweiten Wahlgang gehe, sei ausgeschlossen, ja unvorstellbar, betont derweil ein anderer FDP-Wortf\u00fchrer. \u00abIn den \u00f6ffentlichen Debatten sprach niemand Maudets Verurteilung an.\u00bb Ausser der Frage, wie die FDP mit Maudet umgeht, bleibt eine weitere Frage offen: Wie kann ein wegen Korruption verurteilter Politiker, der die \u00d6ffentlichkeit und seine Partei belog und bei dem F\u00fchrungsm\u00e4ngel festgestellt wurden, wieder auf eine R\u00fcckkehr in eine Kantonsregierung hoffen? Die gr\u00fcne St\u00e4nder\u00e4tin Lisa Mazzone hat vor allem eines beunruhigt: \u00abIn den \u00f6ffentlichen Debatten sprach niemand Maudets Verurteilung an.\u00bb Das Thema sei von den anderen Parteien einfach verschwiegen worden. Auch habe den Genferinnen und Genfern eines niemand gesagt: \u00abIn Bundesbern wundert man sich, dass Pierre Maudet in der Genfer Politik \u00fcberhaupt noch eine Rolle spielt.\u00bb ","text_api_simple_words_07_512":"Pierre Maudet, ein Politiker aus Genf, der wegen Korruption verurteilt wurde und aus seiner Partei ausgeschlossen wurde, hat \u00fcberraschend bei den Parlaments- und Regierungswahlen in Genf Erfolg gehabt und wurde zusammen mit neun anderen Mitgliedern seiner neuen Bewegung ins Genfer Kantonsparlament gew\u00e4hlt. Maudet k\u00f6nnte sogar in den Staatsrat zur\u00fcckkehren, wenn er im zweiten Wahlgang gew\u00e4hlt wird. Seine Anh\u00e4nger feiern ihn als politischen Star, w\u00e4hrend seine Ex-Partei, die FDP, in einer ungem\u00fctlichen Lage ist und sich zwischen einer Allianz mit Maudets Bewegung oder einer alleinigen Kandidatur entscheiden muss. Das Volk hat Maudet die Absolution erteilt, aber es gibt immer noch Bedenken \u00fcber seine Verurteilung wegen Korruption und seine F\u00fchrungsm\u00e4ngel.","text_api_normal_words_05_512":"Pierre Maudet, ein ehemaliger Politstar in Genf, der wegen Vorteilsannahme verurteilt wurde und seine Partei, die FDP, verlassen musste, hat bei den Parlaments- und Regierungswahlen eine Art politisches Auferstehungsfest gefeiert. Seine neu gegr\u00fcndete Bewegung \"Libert\u00e9s und Justice sociale\" hat auf Anhieb mehrere Parlamentssitze erobert und Maudet selbst darf sogar davon tr\u00e4umen, am 30. April im zweiten Wahlgang zur\u00fcck in den Staatsrat gew\u00e4hlt zu werden. Seine Projekte beinhalten unter anderem eine Steuerreduktion f\u00fcr alle Steuerzahler und eine staatliche Einheitskrankenkasse. Sein Comeback bringt vor allem die FDP in eine ungem\u00fctliche Lage, da sie nun entscheiden muss, ob sie eine b\u00fcrgerliche Allianz mit Maudets Bewegung eingehen will oder nicht. Obwohl Maudet wegen Korruption verurteilt wurde und seine F\u00fchrungsf\u00e4higkeiten in Frage gestellt wurden, hat das Volk ihm die Absolution erteilt und ihn gew\u00e4hlt.","text_api_child_09_350":"Pierre Maudet, ein Politiker aus Genf, der wegen Bestechung verurteilt wurde und aus seiner Partei ausgeschlossen wurde, hat bei den Wahlen \u00fcberraschenderweise viele Stimmen bekommen und kann nun von einer R\u00fcckkehr in die Regierung tr\u00e4umen. Er hat eine neue Bewegung gegr\u00fcndet und seine Anh\u00e4nger haben ihn am Wahltag auf Schultern ins Wahlzentrum getragen. Seine Pl\u00e4ne umfassen Projekte wie eine Steuerreduktion f\u00fcr alle und eine staatliche Einheitskrankenkasse. Das Ergebnis hat seine ehemalige Partei, die FDP, in eine unangenehme Lage gebracht, da sie sich entscheiden muss, ob sie eine Allianz mit Maudet eingehen will. Einige Mitglieder der FDP sind daf\u00fcr, w\u00e4hrend andere dagegen sind. Es bleibt die Frage, wie ein verurteilter Politiker, der belogen und seine F\u00fchrungskompetenz angezweifelt hat, wieder in die Regierung zur\u00fcckkehren kann. Trotzdem hat Maudet die Unterst\u00fctzung vieler W\u00e4hler gewonnen und seine Verurteilung wurde in den \u00f6ffentlichen Debatten kaum erw\u00e4hnt.","text_api_keynotes_07_350":"1. Der gefallene Politstar Pierre Maudet darf in Genf wieder von einer R\u00fcckkehr in die Regierung tr\u00e4umen und seine neu gegr\u00fcndete Bewegung erobert auf Anhieb mehrere Parlamentssitze.\n2. Seine Ex-Partei, die FDP, befindet sich aufgrund seiner politischen Erfolge in einer ungem\u00fctlichen Lage und muss nun entscheiden, ob sie eine b\u00fcrgerliche Allianz mit Maudets Bewegung eingehen m\u00f6chte.\n3. Maudet selbst spricht von einer \"sch\u00f6nen demokratischen Feier\" und k\u00fcndigt Projekte an, die den Alltag der Genferinnen und Genfer verbessern sollen.\n4. Trotz seiner Verurteilung wegen Vorteilsannahme und F\u00fchrungsm\u00e4ngeln hat Maudet das Vertrauen der W\u00e4hlerinnen und W\u00e4hler zur\u00fcckgewonnen und erh\u00e4lt die Absolution vom Volk.\n5. Die Personalie Maudet entzweit jedoch die FDP-Spitze und k\u00f6nnte die Partei erneut spalten in Maudet-Freunde und Maudet-Feinde. Die Frage bleibt offen, wie ein verurteilter Politiker wieder auf eine R\u00fcckkehr in eine Kantonsregierung hoffen kann.","text_davinci_api_key_07_256":"1. Mit seinem Comeback bei den Parlaments- und Regierungswahlen erlebt Pierre Maudet eine Art politisches Auferstehungsfest: Das Volk erteilt ihm die Absolution und w\u00e4hlt ihn in das Genfer Kantonsparlament. \n2. Die FDP ist entscheidend f\u00fcr eine m\u00f6gliche R\u00fcckkehr Maudets in den Staatsrat: Eine b\u00fcrgerliche Allianz mit der Mitte, der SVP und dem MCG ist vorstellbar. \n3. Maudets Projekte, wie eine 2000 Franken Steuerreduktion f\u00fcr alle Steuerzahler und eine staatliche Einheitskrankenkasse, machen ihn popul\u00e4r bei den Genferinnen und Genfern.","five_letter_word_list":["ihrem","einer","allem","seine","ihren","unter","jenen","wegen","dhabi","liess","einem","druck","hatte","reise","wobei","gegen","gr\u00fcne","heute","feier","sogar","davon","april","jetzt","l\u00e9man","tr\u00e4ge","genug","nicht","kommt","mitte","solle","steht","reich","lucha","libre","kampf","weiss","sehen","linke","mauro","bangt","keine","roten","trotz","guten","macht","wolle","frage","offen","belog","k\u00f6nne","etwas","ihnen","ideen","alles","eines","thema","rolle"],"qa_list":["Was sind zwei Projekte, die Pierre Maudet vorschl\u00e4gt? ","Eine staatliche Einheitskrankenkasse und eine staatliche kostenlose Bildung f\u00fcr alle.","Eine Steuererh\u00f6hung f\u00fcr Besserverdienende und eine staatliche Kontrolle der Medien.","Eine Steuerreduktion f\u00fcr alle Steuerzahler und eine staatliche Einheitskrankenkasse."],"lead":"Pierre Maudet darf in Genf pl\u00f6tzlich wieder von einer R\u00fcckkehr in die Regierung tr\u00e4umen. Sein Coup bringt vor allem seine Ex-Partei, die FDP, in eine ungem\u00fctliche Lage.","originaltext":"Das Comeback von Pierre Maudet. Die Genfer erteilen ihrem gefallenen Politstar die Absolution. Pierre Maudet darf in Genf pl\u00f6tzlich wieder von einer R\u00fcckkehr in die Regierung tr\u00e4umen. Sein Coup bringt vor allem seine Ex-Partei, die FDP, in eine ungem\u00fctliche Lage. Seine Anh\u00e4nger tragen Pierre Maudet am Wahltag auf ihren Schultern ins Genfer Wahlzentrum in der Universit\u00e9 Mail. Auf ihren Schultern und unter Jubelschreien tragen die Anh\u00e4nger Pierre Maudet am Sonntagnachmittag ins Genfer Wahlzentrum. Jenen Mann, den das Bundesgericht im November 2022 wegen Vorteilsannahme verurteilt hat, weil er sich und seine Familie von der K\u00f6nigsfamilie nach Abu Dhabi einladen liess. Jenen Mann, der als Departementschef seine Mitarbeiterinnen und Mitarbeiter gem\u00e4ss einem Gutachten derart unter Druck gesetzt hatte, dass ihm die Regierung im Oktober 2020 s\u00e4mtliche Amtsgesch\u00e4fte entzog. Jenen Mann, der die \u00d6ffentlichkeit \u00fcber die Finanzierung der Reise belogen hatte und den die FDP deshalb aus der Partei ausschloss. Jenen Mann, der am Ende aus dem Genfer Staatsrat zur\u00fccktrat, um im M\u00e4rz 2021 gleich zu seiner eigenen Wiederwahl anzutreten, wobei er das Plebiszit gegen die Gr\u00fcne Fabienne Fischer dann aber verlor. Doch heute ist ein anderer Tag. Ein Jubeltag f\u00fcr den 45-j\u00e4hrigen Pierre Maudet und seine neu gegr\u00fcndete Bewegung \u00abLibert\u00e9s und Justice sociale\u00bb (Freiheiten und soziale Gerechtigkeit). Pierre Maudet feiert bei den Parlaments- und Regierungswahlen eine Art politisches Auferstehungsfest. Er spricht von einer \u00absch\u00f6nen demokratischen Feier\u00bb. Das Volk hat ihn und neun weitere Mitglieder seiner Bewegung ins Genfer Kantonsparlament gew\u00e4hlt. Maudets Bewegung erobert auf Anhieb mehrere Parlamentssitze. Und Maudet selber darf sogar davon tr\u00e4umen, am 30. April im zweiten Wahlgang zur\u00fcck in den Staatsrat gew\u00e4hlt zu werden. Im ersten Wahlgang ist Maudet Sechstplatzierter \u2013 nur wenige Stimmen hinter Fabienne Fischer, die ihn vor zwei Jahren noch klar geschlagen hat. Maudets Projekte. \u00abWir m\u00fcssen an den Alltag der Genferinnen und Genfer denken\u00bb, ruft Maudet jetzt ins Mikrofon des Lokalsenders L\u00e9man Bleu. Genf sei tr\u00e4ge geworden und brauche Projekte. Er und seine Bewegung h\u00e4tten im Wahlkampf 24 Projekte vorgeschlagen. Maudet erw\u00e4hnt zwei davon: 2000 Franken Steuerreduktion f\u00fcr alle Steuerzahler und eine staatliche Einheitskrankenkasse. \u00abWenn die FDP genug intelligent und nicht zu arrogant ist, kommt es zu einer b\u00fcrgerlichen Allianz mit der Mitte, der SVP und dem MCG.\u00bb Im Moment, in dem Maudet seinen Triumph feiert, \u00abeine gewisse Rehabilitation\u00bb beschw\u00f6rt und sagt, man \u00absolle nicht in den R\u00fcckspiegel schauen\u00bb, steht der Genfer FDP-Pr\u00e4sident Bertrand Reich einsam und allein in einem Nebenraum des Restaurants \u00abLucha libre\u00bb, zu Deutsch: Freier Kampf. Reich weiss, was auf ihn zukommt. Die anderen b\u00fcrgerlichen Parteien wollen f\u00fcr den zweiten Wahlgang den grossen b\u00fcrgerlichen Schulterschluss. B\u00fcrgerliche Exponenten sehen die Chance, eine b\u00fcrgerliche Regierungsmehrheit zu erobern. Bisher hatte in Genf die Linke die Mehrheit, mit je zwei Sitzen f\u00fcr SP und Gr\u00fcne. \u00abWenn die FDP genug intelligent und nicht zu arrogant ist, kommt es zu einer b\u00fcrgerlichen Allianz mit der Mitte, der SVP und dem MCG\u00bb, sagt der abtretende Regierungsrat Mauro Poggia von der rechten Protestbewegung Mouvement Citoyens Genevois (MCG). Der Genfer Mitte-Pr\u00e4sident Jacques Blondin, der um den einzigen Regierungssitz seiner Partei bangt, sagt sogar: \u00abEs gibt keine roten Linien. Auch eine Allianz mit Maudets Bewegung ist vorstellbar.\u00bb Ist sie auch f\u00fcr FDP-Pr\u00e4sident Bertrand Reich vorstellbar? \u00abKein Kommentar!\u00bb, sagt er. Und gleich nochmals: \u00abKein Kommentar!\u00bb Am Montagmorgen um sieben Uhr treffe man sich zu einer Parteileitungssitzung, um 19 Uhr dann zur freisinnigen Delegiertenversammlung. Reich weiss: Die FDP ist auch allein auf bestem Weg, den ehemaligen Regierungssitz von Maudet zur\u00fcckzuerobern. F\u00fcr Maudet wiederum ist \u2013 trotz seines guten Abschneidens im ersten Wahlgang \u2013 seine Wiederwahl in die Regierung ohne b\u00fcrgerliche Allianz schwierig bis unerreichbar. Z\u00fcndstoff f\u00fcr die FDP Die FDP hat also faktisch alle Macht \u00fcber Maudet. Doch die Personalie Maudet entzweit die FDP-Spitze \u2013 ein weiteres Mal. Vincent Subilia, FDP-Kantonsrat und Chef der Genfer Handelskammer, sagt: \u00abIch pers\u00f6nlich bin f\u00fcr eine Allianz mit Pierre Maudet, und auch die Handelskammer ist daf\u00fcr.\u00bb Das Volk wolle Maudet, und auch im Parlament sei seine Bewegung gut vertreten, so Subilia. Dass die FDP mit ihrem Ex-Mitglied Maudet in den zweiten Wahlgang gehe, sei ausgeschlossen, ja unvorstellbar, betont derweil ein anderer FDP-Wortf\u00fchrer. Er, der der FDP so viel schlechte Presse eingebracht hat, k\u00f6nnte die Partei in den n\u00e4chsten Wochen erneut spalten in Maudet-Freunde und Maudet-Feinde. \u00abIn den \u00f6ffentlichen Debatten sprach niemand Maudets Verurteilung an.\u00bb Ausser der Frage, wie die FDP mit Maudet umgeht, bleibt eine weitere Frage offen: Wie kann ein wegen Korruption verurteilter Politiker, der die \u00d6ffentlichkeit und seine Partei belog und bei dem F\u00fchrungsm\u00e4ngel festgestellt wurden, wieder auf eine R\u00fcckkehr in eine Kantonsregierung hoffen? \u00abDas Volk hat Maudet die Absolution erteilt\u00bb, sagt der langj\u00e4hrige Genfer SP-Stadtpr\u00e4sident Manuel Tornare. Man k\u00f6nne sich strafrechtlich etwas zu Schulden kommen lassen, aber als Politiker dennoch \u00fcberzeugen. Maudet sei in den letzten Monaten st\u00e4ndig unterwegs gewesen, habe zu den Leuten gesprochen und ihnen seine Ideen pr\u00e4sentiert. W\u00e4hrend andere Parteien glaubten, alles \u00fcber die sozialen Medien machen zu k\u00f6nnen und Maudets Kampagne als \u00abaltv\u00e4terlich\u00bb bel\u00e4chelten, sei Maudet zu den W\u00e4hlerinnen und W\u00e4hlern vorgedrungen. Die gr\u00fcne St\u00e4nder\u00e4tin Lisa Mazzone hat vor allem eines beunruhigt: \u00abIn den \u00f6ffentlichen Debatten sprach niemand Maudets Verurteilung an.\u00bb Das Thema sei von den anderen Parteien einfach verschwiegen worden. Das sei falsch gewesen, so Mazzone. Auch habe den Genferinnen und Genfern eines niemand gesagt: \u00abIn Bundesbern wundert man sich, dass Pierre Maudet in der Genfer Politik \u00fcberhaupt noch eine Rolle spielt.\u00bb ","title":"Die Genfer erteilen ihrem gefallenen Politstar die Absolution","titleheader":"Das Comeback von Pierre Maudet","text_gpt4_api_keynotes_07_256":"- Pierre Maudet feiert politisches Comeback und seine Bewegung \u00abLibert\u00e9s und Justice sociale\u00bb gewinnt Sitze im Genfer Kantonsparlament.\n- Maudet darf von einer R\u00fcckkehr in die Regierung tr\u00e4umen, befindet sich aber in einer schwierigen Lage ohne b\u00fcrgerliche Allianz.\n- Die Personalie Maudet entzweit die FDP-Spitze und k\u00f6nnte die Partei in den n\u00e4chsten Wochen erneut spalten.","text_api_keynotes_07_256":"- Pierre Maudet feiert politisches Comeback und erobert mit seiner Bewegung mehrere Parlamentssitze in Genf.\n- Maudet tr\u00e4umt von R\u00fcckkehr in die Regierung, doch eine b\u00fcrgerliche Allianz ist daf\u00fcr n\u00f6tig.\n- Die FDP steht vor einer schwierigen Entscheidung, da die Personalie Maudet die Partei erneut entzweit.","qa_list_gpt4":["Welche politische Bewegung hat Pierre Maudet gegr\u00fcndet und wie viele Mitglieder dieser Bewegung wurden ins Genfer Kantonsparlament gew\u00e4hlt?\n","Maudet gr\u00fcndete die Bewegung \"Gerechtigkeit und Freiheit\" und f\u00fcnf Mitglieder wurden ins Kantonsparlament gew\u00e4hlt.","Maudet gr\u00fcndete die Bewegung \"Freiheit und Gleichheit\" und sieben Mitglieder wurden ins Kantonsparlament gew\u00e4hlt.","Maudet gr\u00fcndete die Bewegung \"Libert\u00e9s und Justice sociale\" (Freiheiten und soziale Gerechtigkeit) und neun Mitglieder wurden ins Kantonsparlament gew\u00e4hlt."],"flesch":[52.25,56.15,49.75,36.0,35.65,42.9],"text_gpt4_api_normal_words_05_512":"Pierre Maudet, ein ehemaliger Genfer Politiker, der wegen Vorteilsannahme verurteilt wurde, feiert mit seiner neu gegr\u00fcndeten Bewegung \"Libert\u00e9s und Justice sociale\" (Freiheiten und soziale Gerechtigkeit) ein politisches Comeback. Bei den Parlaments- und Regierungswahlen wurde Maudet zusammen mit neun weiteren Mitgliedern seiner Bewegung ins Genfer Kantonsparlament gew\u00e4hlt. Seine Bewegung eroberte auf Anhieb mehrere Parlamentssitze, und Maudet darf sogar davon tr\u00e4umen, am 30. April im zweiten Wahlgang zur\u00fcck in den Staatsrat gew\u00e4hlt zu werden. Dieses Comeback bringt seine ehemalige Partei, die FDP, in eine schwierige Lage, da die Personalie Maudet die Partei in Maudet-Freunde und Maudet-Feinde spalten k\u00f6nnte.","frage_antwort":["Wer weiss, was auf ihn zukommt?","Reich","Mauro Poggia","Pierre Maudet"]},{"_id":"64313257fc3e38046ad1799f","aid":394828034824,"date":"2023-04-05T09:49:39","author":"SDA","categoryName":"Wirtschaft","premium":false,"readingTime":180.0,"wordCount":529.0,"url":"https:\/\/www.tagesanzeiger.ch\/finma-moechte-bussenkompetenz-und-klarere-verantwortlichkeiten-394828034824","own":"Medienkonferenz zum CS-Debakel. Finma m\u00f6chte Bussenkompetenz und klarere Verantwortlichkeiten. Die Pr\u00e4sidentin der Finanzmarktaufsicht verteidigte die Fusion der Credit Suisse und der UBS als \u00abbeste L\u00f6sung\u00bb. Konkurs und Sanierung nach \u00abtoo big to fail\u00bb-Regeln h\u00e4tten einen Domino-Effekt ausl\u00f6sen k\u00f6nnen. Die Aufsicht ver\u00f6ffentlichte sechs Durchsetzungsverfahren gegen die Credit Suisse. Als Folge der notfallm\u00e4ssigen \u00dcbernahme der Krisenbank CS durch die UBS w\u00fcnscht sich die Finanzmarktaufsicht (Finma) eine Bussenkompetenz und genauer definierte Verantwortlichkeiten auf Bank-Chefetagen. Im \u00fcbrigen verteidigte sie die \u00dcbernahme als beste L\u00f6sung. Sechs Verfahren gegen CS. Dass die Finma \u00fcber sechs solcher Verfahren gegen die CS informierte, ist gem\u00e4ss Amstad aussergew\u00f6hnlich. Domino-Effekt bef\u00fcrchtet. Konkurs und Sanierung des Schweizer Gesch\u00e4fts nach \u00abtoo big to fail\u00bb-Regeln h\u00e4tten einen Domino-Effekt ausl\u00f6sen k\u00f6nnen. Finma-Direktor Urban Angehrn erkl\u00e4rte, ein Konkurs nach den \u00abtoo big to fail\u00bb-Regeln sei der letzte Ausweg. Solide Mega-Bank UBS. ","lexrank_sumy":"Konkurs und Sanierung nach \u00abtoo big to fail\u00bb-Regeln h\u00e4tten einen Domino-Effekt ausl\u00f6sen k\u00f6nnen. Die Aufsicht ver\u00f6ffentlichte sechs Durchsetzungsverfahren gegen die Credit Suisse. Als Folge der notfallm\u00e4ssigen \u00dcbernahme der Krisenbank CS durch die UBS w\u00fcnscht sich die Finanzmarktaufsicht (Finma) eine Bussenkompetenz und genauer definierte Verantwortlichkeiten auf Bank-Chefetagen. Im \u00fcbrigen verteidigte sie die \u00dcbernahme als beste L\u00f6sung. Die Verantwortlichkeiten innerhalb einer Bank m\u00f6chte die Finma im vorneherein den einzelnen Entscheidungstr\u00e4ger zuweisen k\u00f6nnen, sagte Finma-Verwaltungsratspr\u00e4sidentin Marlene Amstad am Mittwoch vor den Medien in Bern. Ein solches \u00abSenior-Manager-System\u00bb \u00fcberwinde die hohe H\u00fcrde bei der Kl\u00e4rung, wer letztlich f\u00fcr Entscheide zust\u00e4ndig war. Dass die Finma \u00fcber sechs solcher Verfahren gegen die CS informierte, ist gem\u00e4ss Amstad aussergew\u00f6hnlich. Als zus\u00e4tzliche Lehre aus dem CS-Debakel will die Finma-Pr\u00e4sidentin auch das Problem eines Vertrauensverlustes in k\u00fcnftige \u00abtoo big to fail\u00bb-Regelungen f\u00fcr systemrelevante Banken einfliessen lassen. Konkurs und Sanierung des Schweizer Gesch\u00e4fts nach \u00abtoo big to fail\u00bb-Regeln h\u00e4tten einen Domino-Effekt ausl\u00f6sen k\u00f6nnen. Der systemrelevante Schweizer Teil der CS w\u00e4re zwar gerettet gewesen, wegen der fragilen Lage am Finanzmark h\u00e4tten durch den Konkurs des internationalen CS-Gesch\u00e4fts aber ein Fl\u00e4chenbrand und eine globale Finanzkrise gedroht, sagte Amstad. Finma-Direktor Urban Angehrn erkl\u00e4rte, ein Konkurs nach den \u00abtoo big to fail\u00bb-Regeln sei der letzte Ausweg. Mit der \u00dcbernahme durch die UBS seien die systemrelevanten Funktionen der CS garantiert. Die UBS sei eine solide Bank und k\u00f6nne wieder Vertrauen schaffen, sagte Angehrn. ","text_api_simple_words_07_512":"Die Finanzmarktaufsicht (Finma) hat nach dem Debakel bei der Credit Suisse (CS) eine Medienkonferenz abgehalten. Die Finma fordert klare Verantwortlichkeiten auf Bank-Chefetagen und die M\u00f6glichkeit, Bussen zu verh\u00e4ngen. Die Pr\u00e4sidentin der Finma verteidigte die Fusion von CS und UBS als beste L\u00f6sung, da ein Konkurs und eine Sanierung nach \"too big to fail\"-Regeln einen Domino-Effekt ausl\u00f6sen k\u00f6nnten. Die Finma hat sechs Durchsetzungsverfahren gegen die CS ver\u00f6ffentlicht. Die Finma m\u00f6chte auch offener \u00fcber ihre Enforcement-Verfahren informieren. Die CS stand schon l\u00e4nger im Visier der Finma und die \u00dcbernahme durch die UBS garantiert die systemrelevanten Funktionen der CS.","text_api_normal_words_05_512":"Die Finanzmarktaufsicht (Finma) m\u00f6chte nach dem Debakel der Credit Suisse (CS) eine Bussenkompetenz und klarere Verantwortlichkeiten auf Bank-Chefetagen einf\u00fchren. Die Pr\u00e4sidentin der Finma verteidigte die Fusion der CS und der UBS als beste L\u00f6sung, um einen Domino-Effekt auszul\u00f6sen. Die Finma ver\u00f6ffentlichte sechs Durchsetzungsverfahren gegen die CS und w\u00fcnscht sich ein Senior-Manager-System, um Verantwortlichkeiten innerhalb einer Bank im Vorfeld zu kl\u00e4ren. Die Finma m\u00f6chte auch offener \u00fcber ihre Enforcement-Verfahren informieren und das Problem des Vertrauensverlustes in k\u00fcnftige \"too big to fail\"-Regelungen f\u00fcr systemrelevante Banken ber\u00fccksichtigen. Die tempor\u00e4re \u00dcbernahme der CS durch die UBS wurde als beste L\u00f6sung angesehen, um die systemrelevanten Funktionen der CS zu garantieren. Die Finma wird ihre Aufsichtspflicht bei der UBS intensiv wahrnehmen.","text_api_child_09_350":"Die Finanzmarktaufsicht (Finma) hat auf einer Medienkonferenz \u00fcber das Debakel der Credit Suisse (CS) gesprochen und m\u00f6chte bessere Strafen und klarere Verantwortlichkeiten auf Chefetage von Banken einf\u00fchren. Eine Fusion der CS und der UBS war die beste L\u00f6sung, um eine Krise zu verhindern. Die Finma hat sechs Verfahren gegen die CS angek\u00fcndigt und will offen \u00fcber Durchsetzungsverfahren informieren. Die Finma m\u00f6chte auch das Problem des Vertrauensverlustes in k\u00fcnftige Regelungen f\u00fcr systemrelevante Banken beachten. Ein Konkurs und Sanierung nach \"too big to fail\"-Regeln h\u00e4tten einen Domino-Effekt ausl\u00f6sen k\u00f6nnen. Die UBS soll eine solide Bank sein und das \u00fcbernommene CS-Gesch\u00e4ft rasch abwickeln.","text_api_keynotes_07_350":"1. Die Finanzmarktaufsicht (Finma) fordert nach dem CS-Debakel eine Bussenkompetenz und klarere Verantwortlichkeiten auf Bank-Chefetagen.\n2. Finma-Verwaltungsratspr\u00e4sidentin Marlene Amstad verteidigte die Fusion der Credit Suisse und der UBS als \"beste L\u00f6sung\".\n3. Konkurs und Sanierung nach \"too big to fail\"-Regeln h\u00e4tten einen Domino-Effekt ausl\u00f6sen k\u00f6nnen.\n4. Die Finma ver\u00f6ffentlichte sechs Durchsetzungsverfahren gegen die Credit Suisse und m\u00f6chte zuk\u00fcnftig offener \u00fcber ihre Enforcement- oder Durchsetzungsverfahren informieren.\n5. Die UBS als neue Eigent\u00fcmerin der CS garantiert die systemrelevanten Funktionen und die Finma wird ihre Aufsichtspflicht bei der UBS intensiv wahrnehmen.","text_davinci_api_key_07_256":"1. Die Finma m\u00f6chte eine klarere Verantwortlichkeit und Bussenkompetenz auf Bank-Chefetagen. \n2. Sechs Durchsetzungsverfahren gegen die Credit Suisse wurden ver\u00f6ffentlicht und die Finma w\u00fcnscht sich mehr Offenheit \u00fcber ihre Enforcement-Verfahren. \n3. Die Finma will das Problem eines Vertrauensverlustes in \u201etoo big to fail\u201c-Regelungen sowie die Lehre aus dem CS-Debakel einfliessen lassen.","five_letter_word_list":["finma","beste","einen","sechs","gegen","folge","durch","einer","sagte","h\u00fcrde","w\u00fcrde","f\u00fchrt","diese","f\u00e4lle","lehre","eines","seien","keine","stand","einem","liess","frage","wegen","sonst","urban","h\u00e4tte","k\u00f6nne","rasch","werde","zudem","lasse"],"qa_list":["Was w\u00fcnscht sich die Finma als Folge der \u00dcbernahme der Krisenbank CS durch die UBS?","Eine h\u00f6here Liquidit\u00e4t der Banken in der Schweiz.","Eine Verstaatlichung der CS.","Eine Bussenkompetenz und klarere Verantwortlichkeiten auf Bank-Chefetagen."],"lead":"Die Pr\u00e4sidentin der Finanzmarktaufsicht verteidigte die Fusion der Credit Suisse und der UBS als \u00abbeste L\u00f6sung\u00bb.\u00a0Konkurs und Sanierung nach \u00abtoo big to fail\u00bb-Regeln h\u00e4tten einen Domino-Effekt ausl\u00f6sen k\u00f6nnen.","originaltext":"Medienkonferenz zum CS-Debakel. Finma m\u00f6chte Bussenkompetenz und klarere Verantwortlichkeiten. Die Pr\u00e4sidentin der Finanzmarktaufsicht verteidigte die Fusion der Credit Suisse und der UBS als \u00abbeste L\u00f6sung\u00bb. Konkurs und Sanierung nach \u00abtoo big to fail\u00bb-Regeln h\u00e4tten einen Domino-Effekt ausl\u00f6sen k\u00f6nnen. Die Aufsicht ver\u00f6ffentlichte sechs Durchsetzungsverfahren gegen die Credit Suisse. Finma-Verwaltungsratspr\u00e4sidentin Marlene Amstad w\u00e4hrend der Medienkonferenz. Als Folge der notfallm\u00e4ssigen \u00dcbernahme der Krisenbank CS durch die UBS w\u00fcnscht sich die Finanzmarktaufsicht (Finma) eine Bussenkompetenz und genauer definierte Verantwortlichkeiten auf Bank-Chefetagen. Im \u00fcbrigen verteidigte sie die \u00dcbernahme als beste L\u00f6sung. Die Verantwortlichkeiten innerhalb einer Bank m\u00f6chte die Finma im vorneherein den einzelnen Entscheidungstr\u00e4ger zuweisen k\u00f6nnen, sagte Finma-Verwaltungsratspr\u00e4sidentin Marlene Amstad am Mittwoch vor den Medien in Bern. Ein solches \u00abSenior-Manager-System\u00bb \u00fcberwinde die hohe H\u00fcrde bei der Kl\u00e4rung, wer letztlich f\u00fcr Entscheide zust\u00e4ndig war. Mit der Kompetenz, Bussen zu verh\u00e4ngen, w\u00fcrde die Finma mit den Aufsichtsbeh\u00f6rden im Ausland gleichziehen. Daneben m\u00f6chte sie offener \u00fcber ihre Enforcement- oder Durchsetzungsverfahren informieren. Aktuell erf\u00e4hrt die \u00d6ffentlichkeit nur von ausgew\u00e4hlten Verfahren, da die Finma gesetzlich zur Verschwiegenheit angehalten ist. Sechs Verfahren gegen CS. Dass die Finma \u00fcber sechs solcher Verfahren gegen die CS informierte, ist gem\u00e4ss Amstad aussergew\u00f6hnlich. Ihre Beh\u00f6rde f\u00fchrt durchschnittlich 40 Enforcement-Verfahren und 600 Vorabkl\u00e4rungen im Jahr durch. Diese zeigen demnach in 90 Prozent der F\u00e4lle Wirkung. Als zus\u00e4tzliche Lehre aus dem CS-Debakel will die Finma-Pr\u00e4sidentin auch das Problem eines Vertrauensverlustes in k\u00fcnftige \u00abtoo big to fail\u00bb-Regelungen f\u00fcr systemrelevante Banken einfliessen lassen. Strategische Fehler und das Scheitern von Management und Verwaltungsrat seien indessen keine Themen f\u00fcr die Aufsicht. \u00dcber neue Kompetenzen und Informationsm\u00f6glichkeiten der Finma muss der Gesetzgeber entscheiden. Die CS stand gem\u00e4ss Amstad seit l\u00e4ngerem im Visier der Finma. Im vierten Quartal 2022 versch\u00e4rfte sich die Situation des von Skandalen, Negativschlagzeilen und Bussen gebeutelten Instituts durch einen beispiellosen Bankenrun mit einem Geldabfluss von 138 Milliarden Franken. Der Zusammenbruch zweier US-Regionalbanken liess die Lage im M\u00e4rz eskalieren. Domino-Effekt bef\u00fcrchtet. Am 19. M\u00e4rz kam dann nichts anderes mehr in Frage als die \u00dcbernahme durch die UBS, sagte Amstad. Konkurs und Sanierung des Schweizer Gesch\u00e4fts nach \u00abtoo big to fail\u00bb-Regeln h\u00e4tten einen Domino-Effekt ausl\u00f6sen k\u00f6nnen. Der systemrelevante Schweizer Teil der CS w\u00e4re zwar gerettet gewesen, wegen der fragilen Lage am Finanzmark h\u00e4tten durch den Konkurs des internationalen CS-Gesch\u00e4fts aber ein Fl\u00e4chenbrand und eine globale Finanzkrise gedroht, sagte Amstad. Im \u00fcbrigen seien die \u00abtoo big to fail\u00bb-Regeln gerade bei den Liquidid\u00e4tspuffern zur Anwendung gekommen, sonst w\u00e4re die CS bereits im Oktober untergegangen. Finma-Direktor Urban Angehrn erkl\u00e4rte, ein Konkurs nach den \u00abtoo big to fail\u00bb-Regeln sei der letzte Ausweg. Bei der CS h\u00e4tte ein entsprechender Plan vorgelegen. Der Schritt sei aber nur bei einer globalen Finanzkrise in einem widerstandsf\u00e4higen einheimischen Bankenumfeld machbar. Die tempor\u00e4re Verstaatlichung der CS sei aus staatspolitischen und rechtlichen Gr\u00fcnden ebenso dahingefallen wie eine Sanierung. Solide Mega-Bank UBS. Mit der \u00dcbernahme durch die UBS seien die systemrelevanten Funktionen der CS garantiert. Die UBS sei eine solide Bank und k\u00f6nne wieder Vertrauen schaffen, sagte Angehrn. Klar entstehe ein sehr grosses Institut. Da die Investment-Bank nur einen Viertel des UBS-Gesch\u00e4fts ausmache und das kritische CS-Gesch\u00e4ft rasch abgewickelt werde, sollte das Risiko aber \u00fcberschaubar sein. Zudem w\u00fcrden f\u00fcr die UBS und die anderen systemrelevanten Banken in der Schweiz die Liquidit\u00e4tsanforderungen ab dem 1. Januar 2024 steigen. Die entsprechende neue Verordnung lasse massangefertigte L\u00f6sungen zu. Die Finma werde ihre Aufsichtspflicht bei der UBS intensiv wahrnehmen, erkl\u00e4rte Angehrn. ","title":"Finma m\u00f6chte Bussenkompetenz und klarere Verantwortlichkeiten","titleheader":"Medienkonferenz zum CS-Debakel","text_gpt4_api_keynotes_07_256":"- Finma w\u00fcnscht sich Bussenkompetenz und klarere Verantwortlichkeiten nach CS-Debakel\n- Fusion von Credit Suisse und UBS als \"beste L\u00f6sung\" verteidigt, um Domino-Effekt zu vermeiden\n- Sechs Durchsetzungsverfahren gegen Credit Suisse ver\u00f6ffentlicht","text_api_keynotes_07_256":"1. Die Finma fordert Bussenkompetenz und klarere Verantwortlichkeiten auf Bank-Chefetagen als Lehre aus dem CS-Debakel.\n2. Die Fusion der Credit Suisse und der UBS wird von der Finma-Pr\u00e4sidentin als beste L\u00f6sung verteidigt, um einen Domino-Effekt auszuschlie\u00dfen.\n3. Die Finma informiert \u00fcber sechs Durchsetzungsverfahren gegen die Credit Suisse und m\u00f6chte offener \u00fcber ihre Enforcement-Verfahren informieren.","qa_list_gpt4":["Was sind die Hauptziele der Finma nach der \u00dcbernahme der Credit Suisse durch die UBS?","Die Finma m\u00f6chte die Fusion r\u00fcckg\u00e4ngig machen und die beiden Banken wieder trennen.","Die Finma m\u00f6chte die Verantwortlichen f\u00fcr das Scheitern der Credit Suisse bestrafen und entlassen.","Die Finma m\u00f6chte eine Bussenkompetenz und klarere Verantwortlichkeiten in Bank-Chefetagen erreichen."],"flesch":[37.4,40.0,39.65,47.0,32.1,46.3],"text_gpt4_api_normal_words_05_512":"Die Finanzmarktaufsicht (Finma) m\u00f6chte nach der \u00dcbernahme der Credit Suisse (CS) durch die UBS ihre Bussenkompetenz erweitern und klarere Verantwortlichkeiten f\u00fcr Banken einf\u00fchren. Finma-Verwaltungsratspr\u00e4sidentin Marlene Amstad verteidigte die Fusion als beste L\u00f6sung, um einen Domino-Effekt und eine globale Finanzkrise zu verhindern. Die Finma hat sechs Durchsetzungsverfahren gegen die CS ver\u00f6ffentlicht und m\u00f6chte in Zukunft offener \u00fcber solche Verfahren informieren. Amstad betonte, dass die UBS als solide Bank Vertrauen schaffen k\u00f6nne und das Risiko durch die \u00dcbernahme \u00fcberschaubar sei. Die Liquidit\u00e4tsanforderungen f\u00fcr systemrelevante Banken in der Schweiz werden ab dem 1. Januar 2024 steigen.","frage_antwort":[]}]